작성자,내용,별점,작성일
양미숙,경의선숲길공원은 봄꽃이 활짝피었고 초록 숲이 우거져 걷기 명상 산책하기 좋아요,별표 4개,3달 전
James,사람이 많아서 비좁지만 그래도 도시 한 가운데 공원이 있다는 것에 대해서 긍정적인 마음입니다. 사진은 지나가는 사람들 초상권 때문에 자연부분만 찍었지만 거닐기 좋습니다.,별표 4개,1년 전
SunMo Yang,철길의 변신이 무죄이고 변화무쌍하다. 철길 변 아파트와 분위기가 마치 뉴욕의 센트럴파크 주변처럼 새롭게 단장 중이다. 외국관광객이나 내국인 산책자들이 나날이 늘어가고 주변 먹거리 음식점도 다양해지고 있다.,별표 5개,1년 전
최민석,"☆☆☆ 공덕~연남까지는 자전거 통행 안 되므로 주의. 말해주는 사람이 없어서 타고 들어갔다가 통행금지 표지판 보고 조용히 끌고 갔습니다;; 공덕에서 연남, 어쩌면 홍제나 상암까지 길게 길게 산책 즐기시는 분들이라면 추천합니다. 마포시민 워크온 깔아서 누가누가 더 많이 걷나 경쟁하는 것도 재밌고 가끔 날 좋을 때 하천길에서 자전거 타면 그날은 유산소 끝입니다. 저도 신나게 달리다가 ""벌써 여기까지 왔어?"" 맨날 이럽니다.",별표 5개,2달 전
조영진,"날씨 좋은 오후에 산책하기에 딱 좋은 것 같습니다. 주변에 먹을거리, 쇼핑, 볼거리가 있어서 좋습니다. 숲길 공원이 있어서 여유롭게 앉아 쉴 수도 있고 좋네요.",별표 4개,3달 전
Sangeon Byun,"어제 처음으로 경의선숲길 여러구간중 홍대입구역에서 홍제천까지의 연남동구간을 갔었는데, 휴일이라 수많은 사람들이 공원에서 휴식과 산책을 즐기고 있던데 아주 좋네요.",별표 5개,수정일: 6년 전
rowheart c,길고 걷기 좋은 공원. 특색있다기보다는 인파많은 홍대에서 유유히 쉴 수 있다는 점이 베스트입니다. 겨울이라서 그렇다 쳐도 주변을 둘러싼 식물들도 조성이 잘 되어있는 것 같습니다. 화장실 중간에 화장실 가는 표지판이 나옴,별표 5개,1년 전
넷워커,"근처 직장인들의 심신을 잠깐이라도 달래줄 수 있는 아주 고마운 공간. 나무와 잔디, 산책로가 잘 어우러져 있고 주변에 카페가 많아서 인테리어 구경하는 재미도 있다. 특히 봄이되면 만개하는 벚꽃으로 운치가 절정이 됨.",별표 5개,6년 전
김정완,주택가 사이로 난 철길을 숲으로 조성한 결정에 있어서 이곳만큼 눈부신 곳이 있을까 싶습니다. 정겹게 걸을 수 있는 길이 많지 않은 도심에 보석과 같은 세례라는 생각이 자주 듭니다. 최근에 숲길이 끝나는 지점에 특색있는 가게들이 들어서면서 운치를 더하고 있는데요. 작은 서점이 들어오면서 가을을 더 풍요롭게 해주고 있어 무착 반갑더군요. 기회가 되면 한 번 더 가 보시라고 권헤 드립니다.,별표 5개,1년 전
YJ JUNG,도시에 철길을 따라 꾸며진 공원이 색다른 분위기고 양옆으로 이쁜카페도 있어 여유 있다면 커피한잔 하며 시간보내기 좋을 것 같습니다. 화장실 중간에 공중화장실 있습니다.,별표 5개,2년 전
여행백수,서울 하늘 아래 이렇게 여유로운 곳이 있는 줄 오늘 처음 알았다. 유럽의 한적한 도시가 생각나는 곳 이었다.,별표 5개,9달 전
DanHalang,산책하기 좋은 곳입니다. 옆에 물길이 있어 시원한 느낌도 주고 길을 따라서 개성있거나 예쁜 상점들이 많아서 걸어갔다 오기도 좋았습니다.,별표 5개,10달 전
박세원,"산보하기 좋은곳! 옛날 철길이 숲길로 새롭게 탄생한이곳 효창공원역에서 가좌역까지 산보하기 너무 좋아요 각종 조형물도 훌륭하고 다양한 볼거리(책거리, 수변공원, 정자, 간이역, 조형물 등)가 많이 조성되어 멋진곳입니다. 봄에 벚꽃이 만발할 때면 또다른 장관을 연출합니다. 정말 좋더라구요! 그래서 저는 개인적으로 산보를 자주 아니 거의 매일 합니다.",별표 4개,5년 전
becky kim,"밤 늦게도 정말 많은 사람들이 숲 길을 즐겨요, 운동하는사람, 산책하는사람, 즐기는사람., 모두 편안하고 즐거워보여요 :) 밤늦도록 잔디밭에 모여 앉아서 이야기도 하고, 맥주도 마시고, 모두의 안전하고, 즐거운 숲!  아, 이곳은 귀요미 강아지들도 산책을 많이 나와 있어요♡",별표 5개,5년 전
김효진,아주 사랑스런 장소예요~~~ 여유와 바쁨과 즐거움이 동시에 공존한다고 할까요?^^ 실시간으로 변하는 서울의 따뜻한공간이 아닌가 생각되어요~~  따뜻한 햇살이 있는 날~~ 책구경가기도 좋고 나만의 책만들기샵도 정겹고  멀리지방에서 1박2일이나2박3일와도 내짐을 보관해주는 짐보관소도 보이고  전철역에서 내리면 바로 꽃향기가 가득한 꽃가게에~~ 소녀가 되어가는느낌이 들어요^^  가까이살면 꽃다발 사가고 싶었어요^^★ 또 놀러가고 싶어요^^★,별표 5개,수정일: 6년 전
카리스마,공원이 너무나 아름답네요. 일명 연트럴파크라고 하죠. 주변의자에 앉아서 커피나 맥주한잔해도 좋구요. 주변환경이 너무 좋은거 같아요. 맛집 등 음식점도 많고. 구경거리도 많아서 좋네요. 풀과 나무도 많구요. 4계절 모두 좋은거 같아요.,별표 5개,6년 전
TY,크지 않지만 인근에 산책할 수 있는 이런 공원이 있으면 무척 좋을 듯하다. 중앙로도 걷기 좋지만 한 블럭 안쪽으로 가도 걷기 좋다.,별표 4개,수정일: 6년 전
홍성란,매일 산책하는 길 입니다 도심속에있는 공원이 아주좋아요 길옆으로 예쁜 거피숍 등 도 있는 아주 재미있는 장소랍니다,별표 5개,2년 전
Rosa Kim,"-길게 늘어진 공원으로 구경하기도 좋은 상점과 카페, 식당 들이 곳곳에 있다. -평지라 러닝하기도 좋다. -봄에는 벚꽃, 가을에는 은행과 단풍을 보기에도 좋다 그러나 요즘은 사람이 더 많아짐.",별표 5개,4년 전
시진,용산역에서  가좌역까지 이어지는6.3KM의 용산선이 지하화되면서 옛 철길에 숲길이 조성되었다. 이  숲길을 따라서 사람들이  모여들고 주변에 다시 예쁜찻집과 음식점이  생겨나서 더욱 유명해졌다. 요즘 젊은이들의 데이트 코스로 많은 각광을받고있다.,별표 4개,수정일: 6년 전
ILGI BAEK,"경의선은 서울과 신의주를 잇는 길이 513,5km이다. 1996년 3일에 완전히 개통되었다. 경의선 철도는 프랑스가 최초로 러일전쟁의 숫자 수송을 위한 군용 철도로 사용하기 위해 경의선 추진하였다. 1903년에는 신의주 부산 2 구간이 개통되었으며, 전국 철도 운수 교통량이 가장 많은 국내 교통의 대동맥이 이루었다 그후 개성공단이 열리면서 일부구간이 개통되기도 했으나 개성공단이 폐쇄되고 남북연락사무소가 폭파되면서 수난이 시작되었다. 일제가 만주국을 만들고 한민족 수탈의 수단으로 건설한 경의선이 한국전쟁으로 끊어지고 말았다. 이제 다시 동족이 하나가 되어 옛날처럼 대륙을 누비는 당당한 경의선이 되었으면 한다. 현재 대흥역 주변이 이 경의선 구간은 공원으로 조성되어 업무에 시달린 서울시민들의 안식처가 되고 있다.",별표 4개,2년 전
비단,"경의선 책거리 ㅡ 구경하기에도 좋고 책방 서점도 있고 갤러리에서 전시 관람도 무료 ~ 체험, 강연 프로그램도 있어요 디지털북, 종이책도 있는 고품격 문화공원 문화 거리 입니다 자세한 정보는 경의선 책거리 홈페이지를 통해 확인하세요",별표 5개,수정일: 6년 전
려산의여행일기,"카페 꼼마&얀 쿠브레 동교점, 연남동 경의선 숲길에 있는 카페예요, 이국적인 건물의 카페에서 경의선 숲길을 보면서 차한잔 마시는 여유 시간 가는줄 모른답니다.",별표 5개,2년 전
hwaseok lee,"길 양옆으로 핫플레이스가 많고 많은 사람들이 산책을 하거나 쉬기도 하고, 모임도 하는곳이였어요. 휴식이 필요하시다면 잠시 들렸다 가시는건 어떨까요:)",별표 5개,수정일: 3년 전
허진하,산책하기도 좋고 여기저기 맛집 볼거리가 다양하고 가볍게 걷기 좋은길,별표 4개,1년 전
이윤성,"이곳을 공원으로 만들어 놓아서 상당히 좋네요. 도심속 알맞은 곳에 적당한 공원이 사람들의 따듯한 휴식처가 되고 있네요. 주변에 많은 상가들이 들어서고 있는데, 너무 상업적이지 않았으면 좋겠네요..",별표 4개,5년 전
여행구리,홍대와 가까운 연남동 센트럴파크 연트럴파크! 바쁘고 역동적인 도심속에서 느릿느릿 여유를 느낄 수 있는 공간입니다.☺️,별표 5개,5년 전
정정종혁,걷기좋은 평지코스 옛 경의선 서울역에서 문산까지 옛 기차길을 지하에 그리고 그위에  옛 경의선 기찾길을 공원 으로~ 책거리 홍대거리 볼거리 맛집이 넘쳐나는 경의선 숲길 함께하시여 즐겁고 행복한 시간되시길~,별표 5개,수정일: 4년 전
남진경,도심의 조용하고 한적한 숲길을 목표로 조성된 공간 작은 실개천과 오솔길 같은 분위기가 있고 인근에 다양한 카페와 식당이 있어서 좋다 잔디밭에 돗자리 펴고 소소한 시간을 보내는 것도 좋다 어쩐지  젊음과 낭만이 가득한 것 같다 전에는 버스킹도 많았는데 지금은 8시 전까지만 버스킹이 있는것 같다,별표 5개,6년 전
김정숙,공원 옆으로 작은 카페와 음식점들이 있어 산책하기 좋으며 야외에서 다양한 콘서트나 행사가 있으며 뷰가 좋은곳에서 차와 음식을 먹을 수 있어 좋다.,별표 5개,3년 전
Andy Kim,"과거 철길이었던 곳을 옮기며 공원화 하였다. 길이가 1km 정도, 폭은 30~50m 쯤 되어 좁고 긴 공원. 잔디와 도보로, 나무들이 듬성듬성 있다. 주변에는 카페와 음식점들이 있고 외국인 포함 젊은이들이 많은편이다. 폭이 좁은 게 좀 아쉽지만, 공원 역할은 충분히 한다. 버스킹 공연도 간혹 있고..",별표 3개,2년 전
바람소리,서울 도심 한가운데 홍대와 신촌이 만나는 곳에 찬디밭과 어울어진 자연 풍경. 연인도 가족도 함께 할뿐만 아니라 주변인들의 산책과 더불어 건강을 위한 친환경적 운동 코스로 참 좋내요.,별표 4개,4년 전
Billy S Joe,"도심 속에 신선한 공기, 나무와 풀밭 가운데 벤치와 화장실, 추억의 기찻길옆 각종 기록물 등 역사적인 자료들과 산책 운동하기 좋은 곳",별표 4개,2년 전
ssosso,코로나 전후로 많이 달라진 곳 중 하나인 장소 예상과 다르게 다양한 연령과 인종들이 분포되어 있어서 놀러온 사람 산책하는 사람 등이 있어서 편하게 있을 수 있음,별표 4개,1년 전
Ilhyun Kim,홍대입구역부터 연남동까지... 도심내에 걸을 수 있는 공원으로 적당한 한적함과 복잡함이 공존합니다. 양 옆으로 커피숍도 많아서 산책하면서 쉬기 좋아요.,별표 4개,수정일: 6년 전
Kyu-Tae Hwang,"연세대에서 걸어서 20분, 홍익대에서 걸어서 15분. 낮에도 밤에도 산책하기 참 좋은 쉼터 같은 공간!🙌 지하철 이용시 홍대입구역 3번 출구로 나오면 바로 경의선 숲길이 뻗어있다.  Beautiful street to walk & drink beer !  Subway (Metro) LINE 2 & Airport Railroad.  HongDae Ip-gu Station. Exit 3.",별표 4개,수정일: 6년 전
J.Y Lee,"크지는 않지만, 도심속에서 지하철역 나오자마자 이런 길을 만날수 있는게 좋네요. 지하철역과 가까운 곳은 인파가 많지만 뒤로 갈수록 사람도 적고 산책하기 좋습니다.",별표 5개,5년 전
김재경,서울 도심 속 걷기 좋은 길입니다. 홍대 쪽에는 사람이 많고 효창공원 쪽에는 아직 사람이 그다지 많지 않습니다.,별표 4개,수정일: 6년 전
Susie Seo,Great to take a stroll or go on a picnic. But too much crowded on weekends. Public restroom is across from the Yeon-nam police office. Rocommend you to visit somewhere a bit far from Hongdae Univ. Stn. to avoid bunch of people. 보통 사람이 많긴 하지만 돗자리 깔고 놀기 좋아요☺ 홍대입구역쪽 말고 신촌쪽이나 연남동쪽으로 가면 더 한적하고 좋은듯!,별표 5개,수정일: 6년 전
jaeyoun shin,관광지처럼 맛있는 음식점도 많고 너무 아름답게 자연과 거리를 꾸면서 아이도 신나게 놀았습니다.,별표 5개,3년 전
Yeongdae Park,"마포에서 산책하면서 여유로움을 느끼고 싶다면 좋아요. 도시락을 준비해서 돗자리를 들고 가족, 연인과 함께 한다면, 한국에서도 잔디밭과 여유로움을 한껏 만끽할 수 있는 장소예요. 주인과 산책나온 개도 자주 만날 수 있으니 간식을 챙겨가서 줘도 좋아요!",별표 4개,5년 전
감성카르텔 (감성카르텔),풍경좋고 운동하기좋고 분위기도 나쁘지 않고 분수와 잘 꾸며논 조경이 인상적이였어요,별표 5개,3년 전
Hyung Ju Kim,이런 공원이 생겼다는건 참 좋습니다. 북적대도 도심 속에서 나름의 여유를 즐길 수 있습니다. 맛있는 식당이나 분위기 좋은 곳도 많습니다. 다만 쓰레기 투기나 소음 문제가 조금 아쉬운데 시민의식이 좋아져야겠죠.,별표 5개,수정일: 6년 전
웅나랑놀자,놀거리 볼거리가 가득한 경의선숲길 앉아서 쉴수 있는 공간도 있고 가을을 느끼기 좋아요,별표 5개,1년 전
김우현,젊은 이들의 낭만과 사랑이 가득한 곳으로 얼핏보면 외국의 어디쯤인 것처럼 보일 정도. 예쁜 카페와 이색적인 술집들이 줄지어 있는 매력적인 곳.,별표 4개,3년 전
youngju Hong,사람들이 아주많아요 예쁜분들도 많고 돗자리 가지고 휴식하고 벤치가 아주 많아 젊고 예쁜분들 많아 기분좋은 장소입니다~^)♡♡,별표 5개,5년 전
한동란,시야 넓고 이쁜 카페도 많고 평인인데도 사람들 진짜 많아요,별표 4개,1년 전
ramazzotti,도심 한 가운데 이런 공원이 있어서 참 좋습니다. 먹을 거리 볼거리가 풍부해서 더 좋아요.,별표 4개,수정일: 6년 전
최상희,도심속 경의선 숲길. 쉬어갈 수도 산책할 수도 있는 곳이어서 너무 좋음.,별표 4개,3년 전
Hyo c.,신촌에서 홍대로 넘어가는 길에 있는 경의선책거리. 공원으로 조성해놔서 쉬다가기 좋고 산책 하기도 좋다. 경의선책거리 거닐기만하다가 다리위에선 처음봐서 찍어 봄. 😊 🎶👍…,별표 5개,수정일: 1달 전
마이클밀리,"연남동숲길...서울의 핫플레이스...한경변이 여기로 이사온듯한 자유분방함이 가득합니다..대학가라 남녀 내, 외국인들이 삼삼오오 길거리를 활보합니다...언듯 이태원인줄...ㅎ",별표 4개,3년 전
Hyo Sik Choi (Afei),"홍익대학교 출신으로 입학 후 20여년 가까이 대학과 대학원 석,박사 기간을 다니는 동안의 변화보다 요 몇년간의 변모는 놀라움. 멋진 곳이 되었으나, 내게는 예전의 기찻길이 왠지 더 푸근한 듯한 기억으로 남아있음",별표 4개,6년 전
장미,토박이 라서 숲길이 되기 전 기찻길이었을 때을 추억하고 한다. 공사가 꽤 오래 걸려서 오픈 되기까지 불편했는데 오픈 하고나니 너무 이쁘고 좋다! 개인적으로 이상한 연트럴 파크가 아닌 경의선숲길 이라는 이쁜 공원 명칭으로 불렸으면 하는 바램입니다. 한 동안 저녁에 술 판이 벌여지고 버스킹에 동네 주민으로써 너무 불편했지만 사람들이 몰이기 전 시간에 가면 너무 평화로운 경의선 숲길 이다. 토박이기도 하지만 내가 이곳을 좋아하는 이유이기로 하다~^^ 연트럴파크란 촌스러운 이름 말고 경의선숲길 이라 불리길^^,별표 5개,6년 전
김종섭,날씨 좋은날 근처 카페나 맥주집에서 메뉴를 테이크아웃하서 잔디위에 돗자리 펴놓고 놀면 좋아요. 댕댕이 산책을 많이 해서 보는 재미도 솔솔,별표 5개,5년 전
박은비,공원으로 주변에 맛집들도 있고 관광지로 외국인도 많음,별표 5개,1달 전
S.H PARK (oxaries),사계절 다 예쁜 곳입니다. 특히 벚꽃 피는 봄은 더더욱 최고예요!!,별표 5개,2년 전
Yoonki Yi,물색깔이 너무 예쁘고 깨끗해요~!! 한여름에 정말 시원하게 놀 수 있는 곳 !!!다만 깊어서 조심해야 해요,별표 5개,6년 전
여행자Dewey,최고의 동네 스팟! 너무 좋습니다!!! 산책하기 너무 좋은 곳! 댕댕이들도 많아요~!,별표 5개,4년 전
JIN DAVID (LUCY),홍대 근처에서 제일 좋은 산책로에요  항상 사람이 넘쳐나는 곳  왕복해서 걷기 좋습니다.,별표 5개,4년 전
trip camper78 (Riu J),오랜만에 나간 홍대거리. 공원에 그늘진곳이 더 있으면 좋겠다. 땡볕이네요ㅜ.ㅜ,별표 3개,4년 전
로로,걷기 참 좋은 곳입니다. 나무가 많아서 시원하기도 하고 잠시나마 도시에서 벗어난 기분도 들게해줍니다.,별표 5개,2년 전
siro75,완전 좋음. 벚꽃비가 내리는 도심 속 옛길,별표 5개,1년 전
Jaehong jeong,산책하면서 이쁜 카페와 다양한 맛집 투어하기 돟은곳,별표 4개,2년 전
창고지기,"사람이 정말 많아요 고망고는 엄청 사람이 많고 서쪽은 연남, 동쪽은 성수군요",별표 3개,2년 전
YOOSOON YIM,걷기는 좋으나 지하철역에서 그리고 중간에 숲길이 끊어지는곳에서 안내판 찾기가 어렵네요,별표 4개,1년 전
양선주,오란만에 댕댕이랑 댕겨왔는데 역시 명불허전!!! 푸르름에 넋을 잃고 말았지요~ 반려견 동반 환경 마포구청장님~ 선거 공약으로 공원 한켠에 반려견 운동장 만들어주신댔는데 은제 되남요~? 기다리고 이씀다~~~!!!,별표 5개,3년 전
JW RYU,석양에 쭉 한번 걸어보면 진짜 좋은곳,별표 5개,1년 전
SUMIN JO (Jofree_Life),연남동 연희동에서 맛있는거 먹고 쉬면서  소화시킬겸 산책 및 걷기 좋은 장소.  서울에 이런 곳이 많아졌으면 .,별표 5개,수정일: 1년 전
seunghyun cho,서울에 이런 곳이 있는지 몰랐는데 길도 너무 이쁘고 좋네요,별표 5개,3년 전
movie this,"여름에 물가에서 장난치는 아이들, 잔디밭에 앉아서 술게임하는 사람들, 방치된 개똥과 쓰레기들 등 예전엔 여간 문제가 많은 길이 아니였다. 요즘은 많이 나아졌지만, 고성방가 등의 문제는 아직도 나오기에 동네 주민으로선 애증이 많은 길이다. 사람은 많지만 산책하기는 좋다.",별표 5개,6년 전
정앤김슈리화니,산책하기 넘 좋음. 힐링은 보너스. 기린과 놀이터는 근처.,별표 5개,6년 전
이창조,가을하늘도 맑고 숲길도 도심속에 공원같은 숲길과 양옆으로 이쁘고 아기자기한 상가들이 마치 여행온느낌과 서울에 이런 경의선숲길이 있다는건 감사하고 축복받은것 같아요^^,별표 5개,4년 전
이채민,북적거리는 도심한가운대 조용히 한적하게 걸을수 있는 장소이다. 자그마하게 잔디밭이 쭉~ 길따라 조성이 되어 있어 한가로이 삼삼오오 모여 잔디밭에서 휴식을 취할수 있고 애완견과의 산책을 즐길수도 있다. 옆길에 숲길이 있어 흙을 밟으며 걸을수도 있다,별표 3개,5년 전
ks shin,오늘은 비도 오고있어 더욱 깨끛한 숲길을 걷게 해주었어요,별표 5개,2년 전
심류연,우리가 아는 기차길 주변에 먹을곳 많음,별표 3개,8달 전
감성적사색에 잠기다 (천천히 걷기),활기차고   젊음이  넘치는 거리  비가 내려 많은곳은 보지 못했지만  화창한 날  다시 방문하고픈곳,별표 5개,2년 전
김계화 (가현),비온뒤라 벚꽃이 다 떨어져 아쉬웠지만 조카들과 가볍게 나들이 좋았어요,별표 5개,4년 전
YMK WEBFEST,서울의 공원중 길게 늘어진 공원으로 주위에 상가들이 발전해 지역 경제에 도움을 줄뿐만 아니라 이 공원이 길게 늘려져 있기때문에 더욱더 많은 시민들이 이 공원에 접근할 수 있기 때문에 여러측면에서 이상적인 공원이라고 생각된다.,별표 5개,3년 전
전Grace,칭구랑 소바 먹으러공원뒤쪽 정소바가는길 오래된동네라 그런지에기저기 걸을때마다 하수구냄새가.. .ㅠ 정소바맛은굿,별표 4개,2년 전
SJ Park,"일년에 두 번(설, 추석 명절때만) 전후에 발송되는 재미있는 우체통. 친구나 연인들끼리 타임캡슐처럼 즐겨도 재미있을 듯 싶네요 :)",별표 4개,6년 전
Jaewoo Choe,언제나 와도 치유되는 숲길 공원. 최근에는 사람들이 많아 북적거리지만 공원이 점점 초록으로 물들어가는 것 같아 좋다. 놀이터 공원이 놀이터 화장실 있음 반려견 동반 환경 가능함,별표 5개,1년 전
나지숙,홍대입구역 3번출구에서 바로 보여요. 남아있는 철길을 보려면 좀 걸어야합니다. 왜 연트럴파크라고 하는지 알겠더라구요. 초록초록한 잔디와 파란 하늘이 어우러져 있고 돗자리펴고 놀러온 가족들 연인들도 보이고. 근처의 아파트때문에 그늘도 크게 지더라구요. 미세먼지 없는날 가서인지 더더 예뻤어요. 근처에 맛집에 디저트카페도 많으니 데이트 코스로도 좋아요. 단 노키즈존도 상당하니 가게 들어갈때 자동으로 묻게 되더라구요ㅠ.ㅠ 가벼운 마음으로 다녀와보시길 추천드려요^^,별표 4개,5년 전
노시경 TRAVEL,원효로1동의 경의선숲길공원 시작점에서 효창공원앞역을 거쳐 공덕역까지 20분이 걸립니다. 4월 초에 공덕역 북쪽 구간에 벚꽃이 아름답게 핍니다.,별표 4개,수정일: 10달 전
jay Kim,"주말에는 항상 버스킹과 수많은 관광객.근처주민들까지..정말 많은 사람들이 나와서 즐기는 그런 장소에요.잔디밭에서는 음주를 못하게 되어있는데도 여전히 음주를 즐기시는 분들이 많은거같아요,분명 푯말엔 안된다고 되어있더군요.근데 차분히  친구들과 먹는 음주는 관찮아보였답니다. 이국적인 풍경같았어요.버스킹은 참고로 오전 11시부터 저녁 8시까지밖에 허용을 안합니다.따라서 버스킹 이 보고싶으신분들은 미리 시간을 맞춰서 가시면 좋아요.오늘은 젊은 남자분 두분이서 연주하는 기타연주가 아주 좋았어요.",별표 4개,6년 전
고민근,사람들고많고 볼것도많고 먹을것도많고 아이와도함께 올수있는거리,별표 4개,수정일: 6년 전
Sun Chul Kim,퇴근길 매일 걷는 길 새로운 가게가 생기고 또 사라지고,별표 5개,2년 전
고민서,숲길이라기엔 좀 화단같지만ㅎ 한가롭게 산책하기 좋네요.,별표 4개,6년 전
sb j,홍대에 가면 꼭 가봐야하는 랜드마크 공원 지상으로 다니던 철길을 공원화시켜 멋진 산책로로 만들었다 주변에 맛집과 까페 즐길거리가 많다,별표 5개,수정일: 6년 전
sue,생각보다 큰 숲길. 도란도란 이야기하며 걷는데 날씨도 좋고 귀여운 댕댕이들도 많고 참 좋았던곳;),별표 5개,6년 전
김민,아이들과 산책이나 작은 돗자리 깔고 즐기기에 최적한 장소~~!! 물도 맑고 공기좋고 가족단위 연인들 다 가기 좋아요^^,별표 5개,6년 전
아우랑,홍대 3번츨구에 위치하고 있으며 사람 많이 있고 주변 맛집도 많이 있습니다.산책하기 너무 좋은 곳,별표 5개,2년 전
Jude Kwon,"혼자서도 좋고 가족, 친구, 연인 또는 강아지와도 함께 산책하기 좋은 곳이에요",별표 5개,4년 전
앵무새,대박. 모임.데이트. 가족산책.강쥐산책.맛집탐방.건물탐방 모두모두 ㅇㅋ!!,별표 5개,6년 전
sangchan han,젠트리피케이션 진행된 연남동. 예전에는 철길옆. 저평가였을터인디. 수십년만에 가봐서 깜놀,별표 5개,수정일: 6년 전
Lonely JB,연남동 걷기 좋은 공원입니다,별표 4개,1년 전
jeongtae lee,"비오는 날의 경의선 숲길, 공덕에서 가좌까지.",별표 4개,3년 전
신현중,비오거나 밤에도 산책하기 넘 넘 좋은곳,별표 5개,3년 전
Daniel Yoo,좋다.. 말해뭐함.. 이 동네에서 살면 얼마나 좋을까..😢…,별표 5개,4년 전
이일로,도심속에 물길따라 숲길 너무 아름다운 것들 과 많은 사람들도 한가롭게 보였어요,별표 5개,수정일: 4년 전
Darin,산책하기 좋습니다. 숲길이 생긴지 얼마안되어 조용하고 깨끗합니다. 앞으로도 깨끗하게 유지되면 좋겠습니다.,별표 3개,수정일: 6년 전
Dongho Lee,날씨가 좋아서 그런지 사람들이 많이 산책을 즐기네요,별표 5개,3년 전
소시민A,같은 홍대지만 연인들이 매우 많고 좋아요,별표 5개,1년 전
팡도라네,저녁 일몰시간에 건물들이 멋져요,별표 5개,2년 전
