작성자,내용,별점,작성일
T.B All,"독립공원은 1945년 8월 15일 광복이 될 때까지 수많은 애국지사와 1960년대 정치적 변동을 겪으면서 많은 시국사범들이 수감되었던 서울구치소가 있었던 곳이다. 서울구치소가 1987년 11월 경기도 의왕시로 옮겨감에 따라 감옥 7동, 사형장, 지하여자감옥 등을 복원하고, 탑골공원에서 3·1운동기념탑을 이전하였으며, 1992년 영은문 주초와 연계하여 1992년 8월 15일 독립공원으로 조성하였다. 독립협회에서 건립(1895년)한 독립문(사적)이 있으며 조선시대 중국사신들을 영접하던 독립관(당시는 모화관이라 하였음)을 복원(1996년)하여 그 내부에 순국선열위패 2,327위가 봉안되어 있고, 독립문 바로 앞에는 영은문주초(사적 제33호)가 자리하고 있다. 그 외 순국선열추념탑, 3·1독립선언기념탑, 서재필박사 동상 등이 있다. 또한 일제의 침략에 맞서 빼앗긴 나라를 되찾기 위해 독립운동을 하다 순국하신 애국지사들의 고귀한 넋을 기리고자 서대문구에서 서대문형무소역사관을 별도로 관리·운영하고 있다.(참조, 지식백과)",별표 4개,11달 전
김영은,매번 마음이 아플 것 같아 발길을 선뜻 내딛지 못하던 장소 큰 맘 먹고 가족들을 이끌고 찾아간 곳 입구에서의 엄청난 혼잡함에 놀라기도 했던 이 곳 맞은 편에 임시정부기념관이 있구나 하며 간신히 안내원의 안내에 버스 주차장에 슬쩍 주차  주위를 둘러보다 수많은 수형표가 있는 공간에선 눈시울이 뜨겁더라는 ....  바른 어른이 되고 싶으나 여전히 아직도 철부지 같아지는 공간이다 이곳은.....,별표 5개,1년 전
이득준,독립문과 참배할수 있는 독립관 서대문형무소 유관순 동상 서재필동상 순국선열추념탑등과 주민이 쉴 수 있는 녹지공간 뒤로는 안산자락길이라는 산이있어서 한 번 쯤 가 볼만합니다,별표 5개,1년 전
namyounglee,"역사적인 곳이고, 안산과 인왕산을 같이 하고 있어서 산책 혹은 트레킹도 좋은 곳이라 생각되요!",별표 4개,3년 전
박기철,서대문형무소 가는길에 잠시 들리거나 독립문역에 오는길에 잠시 들렀던 공원 입니다.. 그런데 분양소가 있는건 오늘 처음 알았습니다. 순국선열분들의 위페가 모셔져 잇더군요. 경건한 마음으로 향 하나 정중히 올리고 왔습니다.,별표 5개,6년 전
Photowriter (Photowriter),"서대문형무소, 독립문과 함께 방문하기 좋다  산책길로도 훌륭하고  한국사람들에게는 의미있는 공원이다. 화장실 무료 공중화장실이 있다.",별표 5개,1년 전
Kevin Ko,"서울구치소가 1987년 의왕시로 옮겨감에 따라 1992년 8월 15일 독립공원으로 조성하였습니다. 연중무휴로 개방하고 있습니다. 독립마당, 독립문, 서재필 동상, 3.1운동기념탑, 독립관, 순국선열추념탑, 이진아기념도서관 등이 있으며, 일제에 맞서 독립운동을 하다 순국한 애국지사들의 넋을 기리고자 서대문형무소역사관을 운영하고 있습니다. 독립문과 서대문독립공원을 지나 안산자락길은 가족들과 함께 할 수 있는 좋은 산책 코스입니다.",별표 5개,7년 전
신해기,촬영차 방문. 공연하러 간 이후로 10년만. 계속해서 발전하고 방문객도 많아지는게 보입니다. 역사적인 장소로서 아직 보여줄수 있는게 더 많기에 프로그램이 다양해질거라 생각됩니다.,별표 5개,1년 전
shinjohnss,일제 강점기를  다시 한번 생각해  볼수 있는~~~~  서대문 형무소가  있는  곳이다~~~  형무소를  중심으로  공원이 조성 되어 있다~~~~~~~  산책 할수 있고~~~~ 역사를  돌이켜 볼수 있는 ~~~  유일한  동네  공원 인거  같다~~~~  독립문의  우아한  자태가 아주 인상 적이며~~~~~  간혹  영화  촬영도  하는  공원 이다~  여백의 풍요!!!!!!!  앞으로도  이런 공원이  많이  생겼으면 좋겠다~~~~~  사진  올리니  함들  보셔요^^,별표 5개,4년 전
June “어리버리” H,"서대문 독립 공원은 우리 나라 독립운동의  상징적인 곳으로 서대문구 현저동에 있다.  1987년 서대문 형무소의 이전 이 후 옥사와 담장 망루 등을 철거하고 독립공원을 조성, 1992년 광복 제47주년에 서대문 독립공원으로 개원하였다.  오래 전 아이들과 처음 왔을 땐 독립문 주변에 꽤배기 공장과 떡 공장 등 허름한 집들이 얽혀있었는데 독립 공원 조성 후 다시 와 보곤 많은 변화에 깜짝 놀랐다.  현재의 독립공원은 2008년 현상 공모를 통해 선정된 작품을 바탕으로 새롭게 조성한 것이라 한다.  서대문 독립공원 관람은 독립문에서 시작하여 동선을 따라 좌우로 배치된 독립관 기념탑 추념탑 형무소역사관의 순서로 관람하면 좋을 것 같다.  독립문 마주보고 왼쪽에 화장실과 방문자 센터가 있고 서대문 형무소 역사관 입구 바로 전 오른쪽에 편의점이 있다.  ★독립문 독립협회가 세운 독립문은 독립협회가 전국민을 상대로 모금운동을 벌여 1897년에 완공하였다.  청나라 사신을 영접하던 영은문 자리에 한국의 영구적인 독립을 선언하기 위하여 만들었으며 서재필님이 프랑스의 개선문을 본떴다고 한다.  독립문은 원래 종로구 교북동에 있던 것을 1979년 이곳 서대문구 현저동으로 옮겨왔다.  ★영은문 초석 조선시대 때 명나라 사신을 맞이하기 위한 영은문과 모화관이 서대문 근처에 있었다. 이것이 명나라가 청나라로  바뀐 이 후 까지 이어져 왔었는데 서재필님은 이 영은문과 모화관을 헐고 그 자리에 독립문과 독립관 건설을 주장하였다. 현재 독립문 앞에 남아 있는 두 개의 돌기둥이 남아 있는 영은문 주초석이다.  ★서재필님 동상 독립협회를 창설한 서재필님을 기리기 위해 세워졌다. 서재필님은 한국 최초 민간 신문인 독립신문을 발간하였고 중국 사신을 영접하던 영은문을 헐고 독립을 상징하는 독립문을 건립하였다. 또한 만민공동회를 조직하여 우리나라의 독립과 개혁을 위한 공동 토론회를 여는 등 국민의 민권 신장과 개화운동에 앞장섰으며 임시정부의 워싱턴 구미위원회의 위원장을 맡아 평생을 조국의 독립을 위하여 헌신하였다.  ★독립관 중국 사신을 영접하던 모화관을 고쳐서 독립관이라 이름을 바꾸고 독립협회의 사무실로 사용하였다. 지금은 독립선열들의 추모관으로 사용하고 있다. 현재 독립관은 1997년에 새로 지은 것이다.  ★3.1 독립선언 기념탑 1919년 태화관에 모인 민족 대표들은 독립 선언식을 거행하고 독립만세를 삼창함으로써 전 민족적인 3.1독립만세운동의 불을지폈다.  1963년 국민의 성금으로 탑골공원에 건립되었던 것을 1992년 독립공원 안으로 옮겨왔다.  ★순국선열추념탑 국내외 각처에서 조국 광복을 위하여 일제에 항거하다 순국하신 선열들의 얼을  되새기며 원혼을 추모하고자 1992년에 건립하였다.  ★서대문 형무소 역사관 일제가 1908년에 만든 경성감옥이 시초이다. 1923년  서대문 형무소 1961년 서울교도소 1967년 서울 구치소로 이름이 변경되었다.  이 곳에서 1945년 해방까지 수많은 독립운동가들이 수감되어 고초를 당했으며 1987년까지도 서울 구치소로 이용되면서 민주화 운동 관련인사들이 옥고를 치룬 곳이다.  이에 서대문 형무소의 역사적 의의를 밝히고 독립과 민주의 이 현장을 대 국민 교육의 장으로 만들고자 옥사 원형 전시 및 서대문 형무소에 투옥되었던 독립운동가들의 각종 자료와 유물을 전시하여 서대문 형무소 역사관으로 재 탄생하였다...고 역사관 소개에 소개되어 있다.  독립공원내 유일한 유료 관람 시설이다. 각종 할인 혜택도 있으니 참고 하시길~  관람료 비싸지 않으니 절대 아깝다 생각 마시고 자주 자주 그리고 오래오래 마음으로 머물렀다 가시길..",별표 5개,6년 전
ks shin,오늘아침 출근길은 서대문 연희숲속쉼터 에서 서대문독립공원을 거쳐 종로3가 낙원동 도착코스중에...,별표 4개,2년 전
BONG,버스 주차장 말고 일반 차량 주차장은 따로 어딨는지 매번 못 찾겠다.  공원 경계를 따라 산책로가 마련되어있어서 빙글빙글 돌며 경사로와 평지를 반복하여 산책하기 좋다. 도로 소리가 좀 시끄러운 편이나 산책 하고 운동하기엔 불편함이 있는 정도는 아니다.,별표 5개,1년 전
김상범,새롭게 바꿔 광장처럼 넓고 께끗하게 봐뀌고 독립운동가에 대한 형무소도 독립관도 있어 배울점이 많습니다  위로 한바퀴 돌다보면 도서관이 나오고 계단 으로도 네려오면 다른곳으로 둘러 볼수도 있고 지하철 타고 갈수도 있읍니다  위치 : 3호선 독립문역,별표 5개,6년 전
Hakgyu Lee,역사적인 장소.... 월요일은 휴관~~ '닥터룸' 이라는 드라마촬영을 하고 있네요~~,별표 5개,6년 전
SA P,독립문도 좋지만 조금 더 올라가면 서대문형무소가 있음. 혼란스런 격정기에 나라의 안위를 위해 죽음을 두려워 하지않고 싸우다  감옥에 갇혀 옥고를 치른 선열들을 다시 생각하고 숭고한 정신을 고취하게 하는 장소,별표 5개,6년 전
Hyun Chul Kim,서울 도심의 쉼표같은 공원. 일제시대에 서대문형무소였던 이곳이 과거에는 순국선열의 피로 물들었던 곳.,별표 5개,2년 전
TOMMY HAN,사대문 내 산책하기 좋은 곳이고 이진아 도사관은 꼭 들러보세요.,별표 5개,4년 전
정창욱,어려운 시기를 이겨낸 선조들의 의기를 기리기 위한 곳. 비극의 장소이자 희망의 장소,별표 5개,8년 전
JY CHUNG,역사적인 장소. 일본의 악행이 얼마나 잔인했는지.. 우리 선조들의 투쟁의 역사가 있는 곳.,별표 5개,6년 전
Chulhee Park,밤 산책 또는 데이트 코스로도 좋은 곳. 여기서 와인을 즐겨먹는다는 그녀가 생각난다.,별표 5개,4년 전
이젬마,역사적인 독립문이 위치해 있고 연계하여 서대문형무소도 인접해있으며 찻길을 건너면 다양한 먹걸이가 있습니다,별표 3개,5년 전
Jong-mi Anna Park,이곳을 다닐때마다 조국을 위해 몸 바친 젊은 넋들에 대한 묵념을 합니다,별표 4개,1년 전
무천,"일제강점기에 의병투쟁, 3·1독립만세운동, 항일투쟁 등으로 투옥되어 옥고를 치르다 순국한 선열들을 기리기 위하여 조성되었다. 이곳의 옥사는 1908년 일제가 침략을 본격화하기 위하여 지은 근대식 감옥으로, 경성감옥이라는 명칭으로 문을 열었는데 항일투사들이 늘어나자 일제가 마포구 공덕동에 새로 감옥을 지어 1912년에 서대문감옥으로 명칭을 바꾸었다. 그후 1923년에는 서대문형무소로, 1946년에는 경성형무소로, 1950년에는 서울형무소로 바뀌었고 1961년에는 서울교도소로 개칭되었다가 1967년 7월에 서울구치소로 바뀌는 등 여러 차례 그 명칭이 바뀌었다.  건립 당시에는 감방 480평, 청사 및 부속건물 80평으로, 500명 정도를 수용할 수 있었다. 당시 전국에 있는 8개 감옥의 총수용인원이 300명이었는데 그에 비하면 엄청난 규모였다. 4·19혁명, 5·16군사정변 등 정치적 변동을 겪으면서 많은 시국사범들이 수감되어 있던 이곳은 도시의 발달로 인하여 구치소 위치로는 적당하지 않아 1987년 11월 15일 경기도 의왕시로 옮겨갔다. 이때 서울시가 법무부로부터 이곳을 매입하여 1988년 조성공사를 시작하였고, 1992년 8월 15일 광복절 제47주년을 맞이하여 독립공원으로 개원하였다.",별표 4개,수정일: 6년 전
sunghee kang,우리나라의 독립운동사를 알 수 있는 역사 적인 곳,별표 5개,5년 전
김병우,잘보존 되어 있고 선조들에 얼이 깃든 장소 다시 한번더 생각들게 하는곳,별표 5개,5년 전
나야나,대한민국 국민이면 꼭 가봐야 할 곳 가족과 함께라면 더욱더... 친일파 후손은 제외...,별표 5개,6년 전
jeongtae lee,서대문 형무소 옆에는 또 무언가를 짓는(복원) 중이었다,별표 4개,3년 전
한경훈,도심 속에 이런 친환경 공간이 있다니 귀한 곳 입니다.,별표 5개,5년 전
송일범,서대문 형무소가 있는곳. 공원 잘 구성되었고 역사교육에도 좋아요,별표 5개,6년 전
한석주,아이들과 함께하기 좋아요.,별표 3개,4년 전
박효숙 (수기박),남녀노소 가리지않고 운동과 산책을 즐길수 있는곳이며 역사공부를 할수있는 곳이다.,별표 5개,4년 전
신미영,공간도 넓고 바로 옆에 서대문 형무소 가 있어서 관람하기 편했어요 화장실 조금 멀었어요,별표 5개,10달 전
김헤레나MY,천천히 산책하기 좋아요^^,별표 5개,2년 전
햇살쨍 (햇살쨍),산책하기 좋눈 공원 이진아 도서관도 좋아요,별표 5개,4년 전
J Doya,"서대문독립공원은 외부에서 멀리 찾아오는 사람들이 있다보기는 동네 주민들이 즐겨 이용하는 장소입니다. 그래서 낮 시간엔 '독립문'을 보러온 사람들이 있고, 저녁 시간엔 공원에서 운동을 즐기는 사람들이 많습니다. 최근엔 안산 자락길 조성에 따라 초입으로서 등산객들이 많이 찾고 있기도 합니다. 일부러 방문하지 않더라도 형무소역사관과 함께 둘러보면 아주 좋은 장소입니다.",별표 5개,4년 전
K글라라,오랫만에 친구들과 만나 점심먹고 산책하기 참좋은장소 복잡한 찻집보다는 한두시간 산책하며 돌기좋은것같해요. 도심속에 이런 공원 있다는것도좋고 조금 여유를 가지고 ᆢ,별표 5개,5년 전
Gregory P.,역사적 의미도 있고 시설도 좋아요.,별표 5개,4년 전
푸드북TV,활엽수가 울창하고 북향이어서 여름인데도 땀을 흘리지 않을 정도로 시원했습니다. 데크가 잘 조성돼 있어서 산책길로 최고예요.,별표 5개,5년 전
WY Han,"우리나라 근대사의 살아있는 현장으로 독립문, 서대문형무소(경성감옥) 등이 있던 자리이며 형무소가 이전 한 후(1992년) 서대문독립공원으로 조성되었다.  특히 학생들에게 우리나라의 힘겨웠던 역사를 되돌아보는데 좋은 장소이다.   인근 안산자락길을 따라 산책로가 조성되어 가족과 함께 부담없는 야외활동을 할 수 있다.",별표 5개,5년 전
Richard Lee,역사적 의미가 있으나..조금더 규모를 키우고 스토리텔링을  잘해야,별표 4개,3년 전
Jisu Jeong,안산으로 가는 길이 잘 정돈되어있습니다. 초록 풀밭이 펼쳐져 있고 나무가 많아서 그늘도 많습니다. 가벼운 산책으로 좋습니다,별표 5개,6년 전
박종서,산책하기 좋아요. 편의점 1개 있고 서대문형무소 교육차 관람하면 좋습니다. 31절 815에는 무료입장 화장실 깨긋 반려견 동반 환경 편하게 산책가능,별표 5개,2년 전
온누리(온누리),최고의 역사문화공원입니다.,별표 5개,5년 전
Heehwan Roh,"옛 서대문형무소와 뒤로는 안산, 옆으로는 영천시장이 있습니다. 산책로도 좋고 트랙킹코스로도 좋습니다. 영천시장엔 간단한 먹거리도 있습니다.",별표 5개,4년 전
HoSoo “Lake Yoon” Yoon,특별히 싫은 이유가 없음,별표 5개,4년 전
김규민,한국의 슬픈역사를 간직한 곳이기도 하고 독립운동 열사들이 끝까지 일제에 저항했던 곳. 오전에 가는 걸 추천드림. 그리고 현금은 물론이고 카드도 결제가 가능함. 한국역사를 알고자 하는 분들은 꼭 찾아가보길,별표 5개,6년 전
Jong Min Park,독립문과 구 서대문형무소가 있어서 중국 제국주의에 대한 경각심과 일제강점기 시절 독립운동가 선생님들의 투철한 애국심을 느낄 수 있어서 좋았다,별표 5개,2년 전
gyuan lee,대한민국의 역사를 배울수 있다.,별표 5개,5년 전
홍홍찌,펄럭 애국 🇰🇷🇰🇷🇰🇷…,별표 5개,1달 전
김시현,꽤 만족했음. 경치도 좋았고.,별표 3개,6년 전
Hyeongki Hahm,일요일 아침 일찍 갔다왔어요. 일단 사람이 적으니 고즈녁하고요. 아침 바람은 상쾌했어요. 깨끗하구요. 혼자 돌아보기에 좋은 시간이었어요,별표 4개,5년 전
해결자,한국사람이라면 가보시고 선현의 거룩한 뜻을 새기시길... 덤으로 영천시장에 들러 꽈배기도 드시면 좋겠지요.,별표 5개,4년 전
이영순,안산 둘레길 입구에  독립공원  있다 많은 인파가  몰리는곳  참좋은경험  할것 확신한다 안산 둘레길 정말  멋있게  해 놓았다♡♡♡,별표 5개,6년 전
권세진,"한국의 역사에 관심이 많은 여행객이라면, 이곳을 놓치지 않는 것을 추천합니다. 이곳은 한국의 역사에 있어 굉장히 유서깊은 장소이기 때문입니다. 공원의 이름에서도 알 수 있듯이, 서대문 독립공원은 과거 일제강점기 시절 수많은 한국인들이 착취당하고 고문당하였으며, 사형당하였던 슬픈 장소입니다. 대표적인 독립운동가인 유관순또한 이곳에서 형장의 이슬이 되었습니다. 잠시 그녀에 대해 묵념하는 시간을 갖도록하겠습니다. 개인적으로 이곳은 제가 나온 고등학교 바로 옆에 있는 장소여서 추억이 많은 곳입니다. 고등학교 때 만난 첫사랑과 행복한 시간을 보냈던 곳이며, 지금은 비록 떨어져있지만 그 시간은 항상 제 기억속에 행복한 모습으로 자리잡아 있을 것입니다.",별표 4개,7년 전
배상길,영천시장 떡집으로 유명하다..,별표 4개,5년 전
백경기,"근대 대한민국의 태동과 아픈 역사를 오롯이 느낄 수 있는 곳. 서울 지하철 3호선 독립문역. 아베와 쥐어봐야 한줌도 안되는 일본 우익들이 야스쿠니 위령소에 갈 때, 우리는 이곳 독립공원 내, 독립관에서 독립운동가와 호국 영령을 기린다. 대한국인 누구라도 이곳에 오면 애국심 뿜뿜.",별표 5개,6년 전
한CO,산책하기 좋은 공원이며 운동기기가 설치되어 있어 체력단련에도 도움이 되고 도시속 공원으론 👍…,별표 5개,4년 전
김종석,코로나 때문에 조용하답니다.,별표 4개,5년 전
고미영 (밍밍),으스스한 기운이 감도는 이곳...그래도 한번은 꼭 와야할 이곳...이곳엔 먹먹함이 남아있다..우연히 앉아본 이자리에선 세곳의 방향이 한눈에 보인다..대단한 설계에 놀라지 않을 수 없다.,별표 4개,5년 전
Byeongjae Kim,"역사적인 의미도 있지만, 산책하기에 좋은 곳 광복절과 현충일에는 서대문형무소 견학 인파가 몰려서 사람이 많음",별표 5개,6년 전
Esther Park,"가족 나들이, 데이트, 반려동물 산책 등 다양한 시민들을 만날 수 있는 곳! 날씨까지 좋다면 금상첨화!",별표 5개,5년 전
Eric Kim,어정대는 비둘기와 똥 썩은물이 고인 분수 길가를 지나는 차들이 일으키는 분진  그럼에도 불구하고 열심히 뛰노는 아이들 그 아이들을 웃으며 바라보시는 느릿한 노인들  과거 현재 미래의 공존을 편하게 바라볼 수 있는  곳,별표 5개,6년 전
Juntaek Cho,역사를 잊으면 안됩니다,별표 5개,8년 전
Nakwon Kim,여기를 기억하지 않으면 우리나라 사람이 아니죠~,별표 3개,5년 전
유진오,민족의 아푼 역사이지만 살아있는 역사의 유물이기도 함 도서관도 있어서 가족 역사여행지로 추천,별표 4개,6년 전
기발한침대,독립투사분들의 자취를 느낄수가 있었습니다,별표 5개,5년 전
HAN YUN,"공원은 넓고 산책하기 좋음. 주차공간이 멀고, 어느때는 주차불가인 경우가 많음.",별표 3개,6년 전
치르치르,많은 사람들이 찾아왔으면 좋겠다,별표 5개,3년 전
김주영,아이에게 광복의 의미와 얼마나 많은 독립운동가 들이  희생과 업적을 한눈에 볼수 있는 좋은기회,별표 4개,4년 전
Smee,점점 방문객이 늘어가는 곳. 호젓한 한때를 보낼 수 있은 곳이었지만 여러 단체 관람객들과 도슨트들의 안내 멘트로 쉴 곳이 많이 줄어들어 우울해짐.,별표 5개,수정일: 5년 전
이우근,도심에있고 주변에 서대문 형무소등 역사적 가치가 있는 곳이 같은장소에 있어 관람하면서 가족과 함께하는 시간을 보내기 좋은곳,별표 4개,6년 전
이진병,서대문형무소가앞에있고 공원경치도좋고자연과더불어있는모습이너무좋은곳,별표 5개,5년 전
현재호,"시내한복판에 위치한 역사공원이죠, 한적한주말  가족과함께하는 시간을보내기 좋은곳이죠",별표 5개,5년 전
김희영,산책하기좋아요. 형무소도 보존잘되어있어서 뜻깊습니다,별표 5개,4년 전
Test Dna,예전 형무소 자리. 유서깊은 곳입니다. 시내에서 산책및 운동하기도 좋아요,별표 4개,9년 전
Hyunmi Kim,역사를 좀더깊이알게되었습니다,별표 5개,6년 전
SY J,교차로에 있는 공원으로 독립문이 있습니다.,별표 5개,6년 전
전지훈,깔끔하고 크고 공원인데 볼것도 많아욤 화장실도 세개 ㅎㅎ,별표 5개,1년 전
Bong Dae,쾌적하고 넓어서 좋아요~~,별표 4개,4년 전
이혜숙,훌륭한 장소.2년전 갔을때 꼭 가봐야 할 곳이라 생각했음. 코로나로 들어가지 못 함,별표 5개,5년 전
오세욱,독립문이 대장처럼 멀리서 이웃하고 있으며 3호선으로 독립문역 4번 출구에서 우회전시 접근성이 좋습니다.,별표 4개,5년 전
우형준,서대문형무소도 볼 수  있고 안산 둘레길 성곽둘레길도 갈 수 있어서 좋아요,별표 5개,6년 전
작은구름,아이들과 함께 대한민국 독립을 기념하는 뜻깊은 장소가 되었습니다.,별표 5개,수정일: 6년 전
잡고기명인,잠시 쉬어가기 넘 좋아요. 근처에 영천시장 먹거리 좋네요,별표 4개,5년 전
윤수연,나무가 우거져서  풍경이 넘예뻐요 가족들 나들이 하기  좋은 장소입니다,별표 5개,4년 전
Sunghoon Choi (최성훈),기대보다 좋았음,별표 4개,5년 전
이동건,역시적인 장소 경건한 마음으로 꼭 한번 방문해보세요,별표 5개,수정일: 5년 전
Red Milan,독립문이 바로 옆에 있다. 작은 공원 서쪽 터널 지나면 연대 동쪽으로는 광화문 북쪽으로는 연신내 남쪽 으로는 서울역 위치,별표 3개,9년 전
2두구든뜬,독립문 사진스팟/ 걷기좋은 둘레길/ 서대문형무소/ 넓고 잘조성된 공원,별표 5개,5년 전
최수영,데이트하기 딱 좋은 분위기에 의자도 많고 넓직해서 놀기 좋음,별표 5개,5년 전
moongyeom kim,도시에서 누리는 행복,별표 5개,5년 전
David Kwon,주변에 산책하기 좋습니다. 안산 자락길도 가까워서 안산자락길 들어가기 좋은 공원,별표 4개,8년 전
이도환,86년생임.. 어렸을때 무료로 가고 지금은 형무소를 마음대로 못간다에서 가슴 아픔 옛날이 나..,별표 2개,6년 전
shineui mo,과거 어두운 역사 를 보면서 .. 나라와 겨례에 대한 소중함과 자유와 민주정신을 같이 지켜야 할것임,별표 4개,5년 전
Sunny. K.,일본의 만행을 조금이나마 알게해주는 곳. 한국인이라면 꼭 한번 와봐야겠다.,별표 5개,8년 전
박영민,잊지못할 감사함을 느끼며 푸르름의 편안함을 함께 주는 공간입니다,별표 5개,6년 전
Inho Sung,도심속 공원이지만 나무많고 잠시 가족쉼테에 좋음,별표 4개,5년 전
백산,잊지못할 수용시설  잘 보존해서 후손에게..,별표 5개,6년 전
임영준,독립운동 관련 공원인데 좀은 미흡하다는 생각.,별표 3개,1년 전
IS c,늘 좋은 곳입니다.,별표 5개,5년 전
막걸Lee,공원인데 여기저기 구석구석 잘해놨네요 구경거리가 많아요,별표 4개,5년 전
김태우,임시정부 기념관과 함께 독립의 의미를 새로이 할 것입니다,별표 4개,5년 전
SCOTT HowToView,존재 자체로 의미가 있지만 주변이 어수선하고 시설물 관리에 조금만 신경을 더 써 주길...,별표 5개,6년 전
박석주,민족의 역사의 일부분을 체험하며 좋은 시간 보내고 왔어요,별표 5개,5년 전
추성웅,서대문형무소 관람과 함께 방문하기 참 좋습니다.,별표 4개,5년 전
미스터굴착기,오래된 공원이라 나무가 울창해서 산책하기 좋아요,별표 5개,4년 전
Mario J,"안산자락길을 오를수 있고, 독립문을 볼수 있으며, 서대문 형무소를 둘러볼수 있고 이진아 도서관도 갈수 있지.",별표 5개,5년 전
양준영,걷기좋고 반련견 운동시키기도아주좋습니다,별표 5개,4년 전
