작성자,내용,별점,작성일
HARLEY KIM,밤낮 관계없이 방문하기 조앙용 낮엔 자전거나 킥보드 등 여러가지를 빌려줍니다,별표 5개,5년 전
김승,산책하기 좋아요.,별표 5개,2년 전
가ga을eul,그곳에 아주 유명한 냉면집이 있어 가보았으나 내 입맛에는 별루었다,별표 3개,5년 전
이기철,산책하기에 넘 좋음  가끔식 행사구경도 쏠솔,별표 5개,6년 전
taehun kim,산책하기 좋아요,별표 4개,5년 전
장도례,한가믜 바람이 많이불어와 시원하고 환경이 깨끗합니다.,별표 5개,3년 전
Sung Park,산책하기 좋은 길과 나무들. 그리고 겨울엔 스케이트장도 있어요,별표 5개,9년 전
김규현,숲이 울창. 산책하기에 좋은 장소. 사색하기에도 좋은 장소. 휴식을 취하기에좋은 장소.,별표 5개,5년 전
vivianna,아이들놀기참좋았어요.근데 돗자리깔구 누워있는 연인들은좀 보기가그렇네요~~~~,별표 4개,6년 전
원송연,2019 서울하프하라톤 피니쉬때문에 어쩔수 없이 방문. 휴~,별표 5개,6년 전
깡으로 살자,산책하기 좋아요. 자전거 타기도 좋구요,별표 5개,5년 전
sybil bang,좋아요!,별표 5개,1달 전
김주희,화단이 잘 정리되어 있어 산책하기에 무척 좋습니다.,별표 5개,6년 전
바람따라서,"여의도공원은 60,70년대에 비행장이었으며, 국군의날 기념식을 하던 장소임, 80년대 현재의 공원을 조성하였음",별표 5개,8년 전
U Think,산책하기 좋습니다. Kbs쪽 공원은 조그만 숲 같이 느껴지니다,별표 4개,7년 전
장원철 (바라는만큼),아침에 산책하기좋은 장소 한강도 구경 광장도 구경,별표 5개,4년 전
박채영,스케이트장도 있어서 재미있고 그 옆에 매점이 있어서 좋다,별표 5개,8년 전
Koh Jason,날씨 좋은 주말은 한적하여 자전거렌탈하여 타기 좋음.,별표 4개,6년 전
김건수,시민의  휴식처로  너무좋아요 .도심속에숨쉬는숲,별표 4개,5년 전
따릉이소년,서울 명소. 농구하기 좋고 마라토너들을 흔히 볼 수 있다.,별표 5개,5년 전
정주열,코로나로 집에만 있기엔 답답한데 여기가서 좀둘러보고 코로남선별진료소도 있으니 검사도 한번하면 좋을듯!,별표 4개,3년 전
D KING,코로나 이겨냅시다 대한민국 화이팅!!!!,별표 5개,5년 전
남영희,산책로 좋구 자전거 타기도 좋은 공원입니다.,별표 5개,4년 전
최수연,늦은밤 잠시 멈춘곳이라 낮에 다시 방문할께요.,별표 4개,2년 전
이태호,JTBC 마라톤 때문에 왔어요. 사람도 엄청 많고 풍경도 예뻐요.,별표 4개,5년 전
YounSook SHIN,자전거 대여소 6반출구 앞에 있어요. 시간당 3천원/1인,별표 5개,7년 전
가로등,산책하기 좋아요. 여의도 한강 공원과 연결되어 있어요.,별표 5개,3년 전
표지우,경찰이 착하고 시위가 평화로워요,별표 4개,1년 전
Lisa M Lee,넓은 잔디밭..나무그늘도 많아서 참 좋아요,별표 5개,8년 전
윤대원,직장인들이 점심후 산책하기 좋은 장소 입니다.,별표 5개,7년 전
Yeon Im Lee,운동하기 좋고 밤에도 위험하지않아요,별표 5개,5년 전
jonan Kwon (maktItfull),2월중순까지 여의도공원에서 아이스링크장을 오픈합니다. 대여료포함 2천원입니다.,별표 4개,8년 전
Test Dna,서울 한복판에서 느낄수있는 자연과 근처  강변까지 좋습니다,별표 4개,9년 전
얼음2,우연히 들어갔다 놀람.. 많이 변하고. 좋아졌음..자주가고픈 곳이 됨,별표 5개,4년 전
Sugyong Kim,도심속에 산책할 수 있고 광장은 운동도 가능해요,별표 5개,5년 전
최윤정,가족과시간보내기좋아요,별표 4개,1년 전
ByungYoung You,가족끼리 놀러나가서 자전거도 타고 산책도 하기 좋음,별표 5개,5년 전
현씨,조깅하기에도 좋고 회사근처라 낮에가도 좋아요,별표 5개,6년 전
MinHo Jung,최고의 공원입니다 저녁에 러닝 하면 더욱 좋습니다,별표 5개,5년 전
YOO KWAN WON,항상 편하게 즐기는 서울의 허파!!! 항상 잘 이용하고 있습니다 더 푸르렀으면 좋겠어요!!!,별표 4개,4년 전
Hyo Hwang,봄 바람 불고 벚꽃이 피면~ 소풍 가기 좋은 곳,별표 5개,6년 전
이현복,깨끗한 시설이 좋음 가끔 레인 정비가 거시기 할때가 있음,별표 4개,6년 전
b a,강바람은 싫고 해쬐며 돗자리깔고 누워있고 싶을때 좋다.,별표 5개,6년 전
John H. Kim,경관이 매우 좋아요. 하지만 사람도 엄청 많지요,별표 5개,6년 전
Y.E. Song,정원박람회 등 시민들을 위한 행사가 열려서 좋습니다,별표 4개,7년 전
조영택,사람도 없고 자전거 타고 놀기 좋아요~,별표 5개,5년 전
하얀나무,오랜 시간 운동한 곳이어서 전 많이 좋은데,별표 5개,수정일: 7년 전
MJ KIM,자전거 타기 너무 좋은 곳. 탁 트여있어서 기분이 좋아집니다,별표 5개,8년 전
김재욱,서울 한복판에 자연울 만끽할 수 있는 몇 안되는 곳,별표 4개,6년 전
최현정,쉴수있는 공간이 많아서 좋다 한강 공원도 가깝고,별표 5개,5년 전
이경주,"농구도 할수 있고 산책, 운동하기 좋은곳",별표 4개,수정일: 5년 전
왕기쁨이,공원도 널직하고 화장실도 깨끗합니다!,별표 5개,1년 전
James Lee,스케이트장 나름 싸고 좋은 시간을 보낼수 있었던것 같아요~~~,별표 4개,7년 전
심은실 (라),갈때마다 많은집회로 번잡하지만  매번 가슴 뭉클하고 뜨거운투쟁의  열정이  끓어오릅니다,별표 5개,5년 전
박선영,도심속에서 자연을 즐길수있어 좋다,별표 4개,6년 전
Min Huh,운동하기 좋은장소이나 행사가 주말에는 많은것같다,별표 4개,6년 전
최문영,기븐앤레이스 마라톤 다녀왔습니다♡,별표 5개,6년 전
SUMIN JO (Jofree_Life),가끔 산책하며 운동 하기 좋은 곳  특히 날쌔 좋은날 !!,별표 5개,5년 전
방성자,새해엔 좋은소식 즐거운일만 안내도잘해주면 좋겟음,별표 4개,7년 전
노기석,코로나 여파로 매우춥고 썰렁합니다. 사람이 저녁에는 없어요.   ㅜ ㅜ한적함.,별표 1개,4년 전
신혜숙,너무예뻐요 꼭 알리게 습니다 인천시 연수구 싸이클 선수,별표 5개,5년 전
김정,"벚꽃축제, 짱!",별표 5개,6년 전
이각범,여의도공원은 시민의 입장에서 매우 좋은 곳입니다.,별표 5개,5년 전
Hyunsuk Sung,벛꽃이 많아 좋은데 그 만큼 사람도 많아서 너무 복잡함,별표 4개,6년 전
chang sub Shin,여의도 공원 행사를 위해 사람들의 접근성 안좋음,별표 3개,6년 전
그래 사랑은 늙지 않는다,산책과 가벼운 레포츠를 즐길수 있는 도심의 쉼터,별표 5개,7년 전
Black Rainbow,여의도특성상 주말에 한적해서 쉬기좋은 공원입니다,별표 4개,수정일: 6년 전
Hyunghwan Kwak,날씨 좋은 날 야외활동에 적합한 장소,별표 5개,8년 전
phony Eu,달리기나 산책이나 데이트에도 좋은 만능 공원.,별표 5개,7년 전
이경미,직장인들의 쉼터. 해마다 조금씩 예뻐지고 있는거 같아요. 음악회도 열리고.,별표 5개,6년 전
최민규,점심 식사 후 산책하기 딱 좋지요. 한 여름에는 말고..^^,별표 4개,7년 전
Jeongki Park,서울 여의도공원 국민안전문화캠페인 전국 소방대 행사장,별표 5개,7년 전
마이스토리(마이스토리),세븐일레븐 편의점은 가지마세요. 바가지가 아주 그냥,별표 3개,2년 전
Jinuk Byun,한강이랑 가깝고 활동적인 공원이 되서 좋네요...,별표 3개,7년 전
김종우,많은 사람들이 가족과 함께 휴식과 운동으로 정겨운곳,별표 4개,4년 전
코지,너무 이쁘고 짱임💗💗가을에 가도 짱임!!! 대신에 겨울에 가면 추울 수 있음ㅠㅠ…,별표 5개,3년 전
천창민,넓은공간으로 산책하기 좋은장소입니다~^,별표 4개,수정일: 6년 전
뽀빠이,좋은곳입니다 도심에서쉬기도좋고데이트하기도좋고,별표 4개,9년 전
힛재미있게살댜,좋아 넓어 놀거리가 자전거 밖에 없음,별표 4개,5년 전
유영현,어제는 여의도초불문화제 참석했습니다 여의도공원에서 했어요 매주토요일마다 한다네요,별표 4개,5년 전
제갈봉두,마라톤 골인 지점으로 다녀왔지요. 멋진 공원이예요.,별표 5개,6년 전
김용철,도심에서..잠깐의 쉼을 원하시면..정말 잠깐의 쉼은 좋다고 생각합니다..,별표 4개,5년 전
Woo Ki Son (SAM SON),넓고 시원한 광장. 아스팔트만 걷으면 더 바랄 것 없겠는데요.,별표 4개,8년 전
머내사진,금년벚꽃 축제없습니다,별표 5개,4년 전
NewZeus,어릴적부터 완소 장소... 이제는 아이들과 함께하는 최적의 장소,별표 5개,6년 전
bitna yoo,출근할때마다 걷게되는 이야기 길이 너무 좋은것같아요 매일 출근길 힐링합니당,별표 5개,6년 전
김광종,깨끗한 공원 산책 하기도 좋고 가벼운  하기도 아주 좋습니다,별표 4개,6년 전
Hanbin Kwak,벚꽃이 만개함,별표 5개,6년 전
Seolhwa Hwang,시설이 낡았지만 자전거나 스케이트타기 좋아요,별표 3개,5년 전
이주민루하,자전거타기에도 걷기에도 가족나들이 하기에좋은곳,별표 4개,7년 전
알스,도심한복판의 훌륭한 산책로. 언제가도 좋다.,별표 4개,6년 전
박희헌,벚꽃축제 마지막날 아름답게 활짝 핀 꽃  즐거웠습니다,별표 5개,6년 전
Jeongjoo Shim,훤하니 좋아요,별표 4개,3년 전
한중김,도시속의 휴식공간~ 산책하기 좋음.,별표 4개,5년 전
김정희,탁트인 공간에서 자전거 타고 좋아요~~^^,별표 4개,6년 전
이학수,점심 식사 후 직장인들이 도보운동하기엔 좋음.,별표 4개,9년 전
김종태,공원을 가기위해 먼곳에 차를 두고 걷지않아도 되네요,별표 4개,8년 전
여자박경자,아주 좋았어 요즘   벗꽃이더욱   예쁘게 피었네요,별표 5개,6년 전
진형숙,어린 아이들의 웃음 소리가 드높아 바라보는 나도 함께 즐거웠다,별표 5개,7년 전
배상길,옛날에나 공원으로 순기능이었지요.. 지금 시위대 아지트가 다됐네요.,별표 3개,7년 전
김연주,가족들과 강아지 산책하는 사람들이 많아 왁자지껄합니다. 에너지가 넘쳐요,별표 4개,6년 전
churlyong jang,자한당 해체를 부르짓기 아주 좋은 장소로 적극 추천합니다,별표 5개,5년 전
유니스,가까운곳에 여의도공원이있어 좋아요,별표 5개,3년 전
김주원,평소 친구들 가족과 같이 산책하고 논다면 모였던곳.,별표 5개,7년 전
김현진,산책 운동하기 좋음 포켓몬고 하기도 좋은 곳,별표 4개,6년 전
이명주,자전거 맘껏타고 뛰고 놀고 쇼핑하고 밥먹기 좋음,별표 5개,7년 전
최Hyeon h,벚꽃피었네요,별표 5개,1년 전
영글영글,넓고 깨끗해서 운동하기 좋어요~,별표 4개,3년 전
행복한제이브,산림욕  느낌이 좋았어요,별표 5개,1년 전
Yesir!!! n,19년5월9일~11일서울안전한마당체험,별표 4개,6년 전
임꼬막,롱보드를 타기 시작하면서 주말에 운동하러 가는데.. 너무 좋네용,별표 5개,7년 전
yangsook kwon,여의도서 시간남을때 산보하기 딱좋은 사이즈.,별표 3개,6년 전
임성준 (림즈),적당히 산책하기엔 더할나위 없이 좋은곳.,별표 4개,6년 전
밍밍댕,봄에 벚꽃필때 가면 정말 예뻐요 넓어서 힘들다 뿐 ㅎㅎㅎ,별표 4개,9년 전
Jaehong Kim,"좋은 휴식 공간, 자전거, 롤러스케이트 타기도 좋고...",별표 4개,7년 전
Sharon Choi,한강도 있고 봄이면 벚꽃놀이도 하고 좋다.,별표 5개,6년 전
Beretta SKY,여의도에서 잠시 여유를 즐길 수 있는 곳입니다.,별표 5개,6년 전
김동욱,너무 즐거웠던곳~,별표 5개,1년 전
정대경,도심속 여유 휴식 할 수 있는 정말 좋은 곳...,별표 5개,5년 전
흑백그림,공원은 넓고 좋으나 햇볕을 피할 장소가 부족.,별표 4개,7년 전
제임스딘,산책하기 좋습니다 여유로움을 만끽하세요,별표 5개,4년 전
YOUNG SOO CHOI,전에는 자전거 타려고도 가고 롤러스케이트 타러 다니던 곳이였는대 추억의 장소네요 ㅎㅎ,별표 5개,6년 전
박세련,꽃구경 너무좋았어요 교통은혼잡하니 지하철이좋겠어요^.^,별표 5개,6년 전
Jeeho Park,산책하기참좋은곳이에요,별표 5개,6년 전
김기승,4계절 모두 좋지만 봄이 가장 아름다운 곳,별표 5개,6년 전
최승운,공원이 넓어서 산책하기도 좋아요♡!^^,별표 5개,5년 전
불타는구루마,주변 건물 숲속에 잠시 쉴수있는 휴식공간,별표 3개,6년 전
원종필,서울에서 가족과 함께 힐링할 수 있는 곳입니다!,별표 5개,7년 전
강상섭,"서울에서의 대표 휴식처.. 전철역 가깝고, 주차장도 있고..",별표 4개,수정일: 2년 전
JinChul Kim,공기좋네요,별표 5개,6년 전
Jihyun Yoon,"좋아요. 공원이 왜 이렇게 길쭉하게 생겼나했더니, 공항이 있던 자리였군요.",별표 5개,9년 전
scott kim,생각보다 넓고 숲도 잘 가꾸어져 있습니다,별표 5개,4년 전
최경식 (비류),가족  연인들이 함께 하기 좋은곳이요,별표 4개,4년 전
Dong Seok Lee,점심 저녁 시간 가벼운 운동 또는 산책하기 좋습니다.,별표 5개,6년 전
DuckWon Kang,예전에는 그늘이 너무 없어서 황량하였는데... 지금은 좋아요.,별표 4개,6년 전
steve choi,산책에  좋씀니다,별표 4개,4년 전
Anthony Oak,도심에 있는 특급공원!! 항상 남녀노소 많은 사람들이 즐기고 있습니다...,별표 5개,4년 전
SungWoo Chung,서울달 강츄,별표 5개,10달 전
양만진,1945년 임시정부 요인들이 처음 대한민국 에 도착한 장소임니다,별표 5개,6년 전
이파,자전거타고 놀기 좋아요. 주차는 좀 어렵네요..,별표 4개,7년 전
최경은,휴일/주말 산책과 운동하기 좋은 곳,별표 4개,5년 전
리트래비스,"그늘도 있고, 산책하기 좋아요.",별표 4개,6년 전
임성봉,겨울에아이스링크좋네요 조금추울수도,별표 4개,7년 전
김종운,점심식사 후 산책하기 좋아요.,별표 5개,5년 전
김은심,가족나들이로 연인들의데이트코스로도 추천합니다,별표 5개,6년 전
Kyoungsu KIM,11월30일 수요일 밤 7시반에 10만함성을 기대해봅니다^^,별표 5개,13년 전
이형규 (하늘아래),도심 한 가운데 넓은공원 좋아요..,별표 5개,5년 전
Yong Hoon Sung,그냥그냥. 시설 유지보수 좀 잘 했으면 좋겠다,별표 3개,6년 전
Jiwoong Yoon,여의도 직장인들의 산책 겸 휴식하기 좋은 공원 ^^,별표 5개,8년 전
Jam Peach,공원 중심부의 작은 숲을 빼고는 썰렁하다. 쳇바퀴 특화 공원,별표 3개,5년 전
HW S,이만한 공원이 없다. 장마로 침수만 안된다면 좀 더 좋아질텐데.,별표 4개,6년 전
Soon Wook Kwon,산책하기좋아요.한강공원과 연결되요.,별표 5개,6년 전
Donghyeon Lee,여가 활동하기 좋은곳,별표 5개,수정일: 1년 전
은하수,야외 활동 하기 좋은 장소 입니다.,별표 5개,6년 전
윤동진,경사 없이 넓고 쾌적한 도심내 산책 장소,별표 4개,6년 전
안무현,자전거타기도 좋고 런닝하기도 좋습니다.,별표 5개,수정일: 4년 전
김지훈,자전거 경로와 막타는데가 따로 있어서 좋았어욧!!!!,별표 5개,6년 전
HJ Gil,점심시간에 산책하기 좋아요,별표 5개,3년 전
김선욱,아이들과 놀기 좋으나 주차 공간이 부족합니다.,별표 3개,6년 전
김선호,여의도공원 광장  좋은데요,별표 2개,1년 전
Wonyong Lee,"걷기 운동, 가족과 간단힌 피크닉에 최적의 장소",별표 5개,4년 전
문시아,가족함께와서 편하게 힐링할수 있는장소~♡,별표 5개,7년 전
HAPPY SUNG,퇴근후 방문해서 족발과 치킨을 시켜서 먹는 곳. 돗자리를 준비하자,별표 4개,6년 전
이관섭,서울 도심에서 자연을 느낄수 있는 몇 안되는 장소,별표 4개,7년 전
Young Jin Kim,접근불편. 애매한 산책길. 공간사장. 차라리 옛날 여의도 광장의 자전거 타던 광활함이 그리움.,별표 3개,6년 전
Billy Kebi,벗꽃의 성지에요,별표 5개,3년 전
chohanchung조한충,풍광이 아름다움,별표 5개,5년 전
Brooks,좋아요...,별표 5개,4년 전
Pakdy,밤에 특히 야경이 멋져요,별표 5개,수정일: 2년 전
Younjoo Kang,도심속 산책하기에 적당한 곳이예요.,별표 5개,3년 전
윤정웅,다 좋은데 전투기는 왜 있는걸까요???,별표 4개,2년 전
Hyung-Joo Kim,여의도의 보물.. 일년 사계절의 변화를 생생히 느낄 수 있는 곳~,별표 5개,8년 전
이재홍,날씨만 좋으면 산책하기 좋아요,별표 3개,7년 전
Jade Yun,시원하고 편의시설이 좋았다.,별표 5개,수정일: 2년 전
정유석,"어쩌다 금융의 메카가 진보,보수의 집회가 열리는 장소가 되다 보니  씁쓸하다.",별표 4개,5년 전
오마리아,주말에는 주차하기 힘들지만 도심 속에 이만한 공원이 또 있을까,별표 5개,7년 전
김용중,가볍게 산책하기 좋은 곳. 마스크는 필 수 ^^,별표 5개,4년 전
김재원,자전거 타기 좋음. 여름에는 많이 더움.,별표 4개,8년 전
Joon,편하게 걷고 산책 할수 있어요.,별표 5개,6년 전
김혜진,봄엔 역시 여의도,별표 5개,6년 전
Skye “World Wide Guider” Jeong,조경이 멋있는 공원이에요 비밀공간도 있음,별표 5개,4년 전
HH C,산책하기 좋아요~엄청 넓어요~,별표 4개,5년 전
Heejun kim,간단하게 산책정도 좋음 근처 한강공원 추천,별표 3개,8년 전
EJ K (Jasmin),도심속에서 자연을 만끽할수있는 곳입니다,별표 5개,4년 전
BK Kim,산책하기 운동하기 놀기등 좋아요,별표 4개,5년 전
이은경,봄이라 이뿐 꽃들을 심오놓았네요.,별표 5개,4년 전
Ch K,넓고 아이들 놀기에 딱좋아요,별표 5개,수정일: 4년 전
뭐하는거임,좋아요 지금 이맘때가 가장 좋아요 단풍도 이쁘고,별표 5개,6년 전
Tae-Nam Kwon,좋은 장소입니다. 자전거도 탈 수 있었는데...,별표 4개,8년 전
Kijoon Choi,"산책길과 연못, 운동장이 있어 나들이에 좋음",별표 4개,6년 전
hobin yun,점심시간에 산책하기에 좋은 도심 공원,별표 5개,8년 전
이경재,카포스전문정비업생존권사수결의대회집회에참석,별표 4개,7년 전
정필용,근처에 사무실이 있다는게 또하나의 축복,별표 5개,6년 전
오씨가문,넓고 쾌적함!,별표 4개,3달 전
wonshik woo,도심에 산책하기 좋은 공원입니다,별표 5개,7년 전
b22n sooo,넓다. 행사도 하는데 사람이 너무 많다.,별표 4개,5년 전
김희정,항상좋은일많았으면좋겠읍니다요.....건강하세요,별표 5개,5년 전
신뢰성연구소,사무실에서 가까워서 좋고 넓고 깨끗해서 좋습니다.,별표 5개,8년 전
나눔함께,사람 많은 곳은 갈 데가 못된다. 여자친구랑 헤어질 뻔,별표 1개,7년 전
찌니,공원도 넓고 아늑하며 먹거리도 있네요,별표 5개,6년 전
김은성,신관옆 김가네 정말 맛있어요~^^ 김가네중 최고!,별표 5개,6년 전
세오녀,여의도 산책은 한강변보다 이쪽이 더 좋을지도,별표 5개,5년 전
Korea조,최근 갔더니 해먹느낌의 의자들 아주 좋았습니다,별표 5개,수정일: 1년 전
jong hwan Park,여의도 직장인들에게 포근한 쿠션 같은 곳,별표 5개,2년 전
심효섭,도심에 이정도 규모에 공원은 축복임,별표 4개,7년 전
youngway7 KIM,점심먹고 산책하기 아주 좋아요,별표 5개,5년 전
양희순 (Jeffrey Yang),주말에는 사람이 너무 많아서 번잡하지만 쉬기에는 좋은 곳,별표 5개,5년 전
방싸미,오랜만에 가니까 옛날에 자전거 타다가 벽에 박아서 엉엉 울었던 기억이 나네요 ㅋㅋㅋ,별표 5개,6년 전
ARRAY JACOB,깨끗하고 좋네요 산책하기 쥬아,별표 4개,6년 전
c.u park,운동 또는 산책하기에 좋은 장소~^^,별표 4개,3년 전
김써니,도시속의공원이있어서좋았어요,별표 5개,4년 전
김형진,생각보다 괜찮았음 운동하거나 산책하기 좋아요,별표 4개,6년 전
이이정훈,도심 중심에  공원숲이 있어 좋아요,별표 4개,5년 전
Y Knutmaneric,"가족,연인과 가볍게 산책하기 좋은 곳",별표 3개,수정일: 8년 전
이청하,둘러보기 좋은곳. 와이파이도 돼 좋았다.,별표 5개,7년 전
김태윤,"잘 가꾸어진 도심 속 공원, 밤 늦게도 걱정이 안되는 치안",별표 5개,8년 전
김대양 (Daeyang Kim),여의도공원이 있어서 그나마 삭막한 빌딩숲이 생명을 얻는다.,별표 5개,6년 전
미월,서울에서젊음과건강함을느낄수있는곳,별표 5개,5년 전
타이거 최고경영자,명실상부 대한민국 최고의 실용적 공원.,별표 5개,5년 전
하정오,저렴하고 일정 수준이상의 맛을 보장해여,별표 4개,6년 전
김인철,아이들과 산책하기 좋아요^^,별표 4개,5년 전
videom,여의도에서 걷기 좋은곳.  봄꽃 환상적,별표 4개,6년 전
조한웅,항상 즐겁죠~,별표 5개,4년 전
김경동,80년대 이후 오랜만에 가봤는데 공원조경이 괜찮았어요,별표 4개,6년 전
유병욱,편안하게 산책하기 좋아요,별표 3개,5년 전
김Chin-Y,봄 낮에 벚꽃이 좋아요,별표 4개,6년 전
sangmi park,자전거 타기 적합한곳!,별표 5개,1년 전
윤대용,이용하는데 불편함이 없습니다,별표 3개,2년 전
이영섭,공기가 시원하고 좋은곳 입니다.,별표 5개,6년 전
신중선,공원 조경이 좋고한바귀 운동하기 좋습니다.,별표 5개,5년 전
Michael Lim,여의도 공원의 자전거 타기는 정말 꿀잼인거 같아요,별표 5개,수정일: 4년 전
강건,엄청 넓다 길 옆에 나무 많음,별표 5개,6년 전
Seo Eric,"걷기, 운동, 데이트,  애기들 놀아주기 좋은 곳",별표 5개,6년 전
Singclare McGreen,뉴욕센트럴파크 못지 않은 잘 관리된 도심공원,별표 5개,4년 전
Oscar Lee,드넓은 공원 화장실 있음 걷기에 좋음,별표 4개,6년 전
견민,도심속의 숲 편안한 쉼터 아름다운 정원,별표 4개,6년 전
원원,"자잔거 , 인라인 스케이트장이있어 편하게 놀수있는 공원",별표 4개,7년 전
오택호,아이와 함께 신나게 뛰어놀수 있는곳~~~!!,별표 5개,7년 전
김명근,맛집이 많고  연예인도  볼수있음,별표 5개,6년 전
1탄초코초코_zepeto,여의도공원 자전거 탔어요,별표 5개,5년 전
Suho Park,코시국이라 그런지 농구 골대를 다 빼놨더라구요..ㅠ,별표 3개,4년 전
san sijo,도심속의 허파로 간단한 운동에 좋음,별표 3개,7년 전
Kim Hyuntae,4계절  항상  산책하기 좋은곳,별표 5개,수정일: 4년 전
Daniel Kim,맥주외치맥의 공간 배달존도 있어요~,별표 5개,4년 전
"Hoya Shin (ChulHo,호냥이)",사람이 너무 많은게 흠이에요 워낙 갈때가 없어서 그런지 에혀 너무 많이와,별표 3개,8년 전
Kerbong Kim,한강 공원보다 덜 북적이고 차분해서 좋았어요!,별표 5개,6년 전
최규바라,도심속 산책을 위한 최적의 선택,별표 4개,6년 전
김광수,여의도 한가운데있어 직장인들 점심먹고 산책코스로 이용한다,별표 5개,7년 전
욱준정,"주말 밤, 가족과 여유 있는 산책",별표 5개,7년 전
정선웅,날씨좋아서 데이트 역시 굿 입니다,별표 4개,6년 전
hwan,나른한 오후에 사색하기 좋은 장소입니다,별표 5개,5년 전
ki-young sim,아이들과 즐거운시간보내기 딱 좋은장소,별표 4개,6년 전
윤영선,주말엔 사람이 많아 그다지 추천하고싶지않다 그러나 한번가볼만함,별표 4개,8년 전
김창균,동절기에 2000원에 종일 스케이트를 즐길 수 있다.,별표 3개,7년 전
sangseuk yoon,힐링이 가능한 도심의 숲,별표 5개,4년 전
이한선,나들이 산책 가기 가장좋은곳,별표 5개,5년 전
심재철,여의도역이랑 가까우면서도 한강이랑도 가까움! 러닝 스타트 지점!!,별표 4개,5년 전
이동운,수시로왔다리갔다리 하는곳이고 전국민이 다알고있는 고원이 죠!,별표 5개,수정일: 5년 전
B yo,특별하지 않지만 소소하게 보낼 수 있어요,별표 4개,4년 전
hyerim jin,여름가을엔 산책하는 직장인이 많은곳,별표 4개,6년 전
JUO,언제 가도 항상 기분좋은곳입니다.,별표 4개,수정일: 4년 전
이정웅,혼자  운동하고 놀고 가기 좋은 곳,별표 4개,4년 전
김형길,여의도 직장인들 식후 산책코스로 최고!,별표 5개,4년 전
현욱이의 이것저것,좋아요,별표 4개,7년 전
최한복,최고의날씨,별표 5개,3년 전
4LEAF DICE,넓고 주말엔 볼거리도 많음.,별표 5개,6년 전
신두철,그늘도 많고 도심 한복판에서 괜찮은 곳,별표 5개,수정일: 6년 전
권기범,점심시간에 산책하기 좋음,별표 5개,8년 전
정훈,직장인들이 주로 점심시간에 쉬고 걷는곳,별표 4개,수정일: 4년 전
miyang kim,아이와 자전거 타고 . 한강과도 가깝다,별표 5개,6년 전
