작성자,내용,별점,작성일
최연묵,강바람 맛이 달달한 계절...돗자리 펼때 강아지 배설물 주위..정말...ㅠㅠ,별표 4개,4년 전
BOGSEOP SIM,너무 낭만적이야 라면국물 음식물쓰레기냄새만 빼면,별표 5개,5년 전
Byung Chan CHO,좋다 서울에선 이만한데가 없음 먹을껀 사오세요,별표 4개,7년 전
홍성현,라이딩하면 잠실라이딩!  편의점이 있어 좋으나 한강에 있는 편의점은 행사상품 없음!,별표 5개,7년 전
최재근,잔디밭에서 운동 맘대로 할수있어요,별표 4개,8년 전
아리안트라,갔다가 왜가리 넘어진거 봄,별표 5개,수정일: 3년 전
앙팡,저녁 먹고 산책하거나 간단히 운동하기 좋아요,별표 4개,5년 전
김혜영,시원한 바람과 야경이 끝내줘요,별표 5개,4년 전
김태옥,시원한 강바람 맞으며 자전거타기 좋은곳,별표 4개,6년 전
나성호,시민이 편안하게 쉴수있는 공간입니다.,별표 5개,4년 전
10X베거,한강 바로앞 계단 개꿀 -돌계단이니까 매트나 깔개 필수,별표 5개,4년 전
서율,전국체전 100주년 기념,별표 5개,5년 전
김동욱,정리가 잘 되어있고 힐링장소임,별표 4개,6년 전
kevin jung,일요일 오전인데 자전거타는 사람 엄청 많습니다,별표 5개,5년 전
Simon (먼저미소),운동하기 좋아요,별표 5개,1년 전
BOK,한적하고 가족과 오기에 좋아요,별표 5개,5년 전
Kyoungtae Kim,유람선 좋았습니다 무료공연도 좋네요,별표 5개,5년 전
최은성 (건설사업관리),오랜만에 주말 아들과함께 한강시민공원 자전거타기,별표 5개,4년 전
곽지연,자전거나 .수영 .배드민턴  .걷기..커피등 즐길거리가 많음,별표 4개,7년 전
이성호,가족과 양재천을 통해 걷기 좋아요.,별표 5개,7년 전
고고,요즘 공사중이라 먼지 많아요,별표 5개,수정일: 3년 전
merry jang,헬강 사람 너무 많고 사람들 자전거도로 인도에대한 개념이 없어요,별표 2개,6년 전
Dongwon Moon,주차장 진입이 매우 위험해요. 공원은 좋습니다~,별표 3개,6년 전
MinShik Kim,생각 정리가 필요하거나 운동할때 최고,별표 5개,수정일: 5년 전
teo lee,배달음식 거의다 됩니다. 가락시장 회도 배달됨,별표 5개,4년 전
김민경,잠실 한강 공원에 간것이 아니 였습니다 한강공원 가기전 신청중학교에 갔었습니다,별표 1개,7년 전
이정환,다 좋은데 오늘 바람이 너무 분다,별표 4개,4년 전
woo channel,놀기 너무 좋은데 사람이 너무 많았어요~,별표 4개,4년 전
수숫,사람이 없어요 벌레가 더 많아요,별표 3개,5년 전
토룡이,놀고 쓰레기좀 치우고 가세요 너무 지져분해,별표 5개,2년 전
Sai Rand,편의시설이 잘 되어 있어요,별표 5개,6년 전
그린투데이,장기주차 1만원입니다 좋습니다,별표 4개,3년 전
jang-wook lee,"봄날, 가을날 가족과 함께 즐거운 공원.",별표 5개,6년 전
성현준,주변에 치킨먹으면서 연 날리면 진짜 재밌어요♡,별표 4개,7년 전
Hello Universe,잔차타고 가서 경치구경하면 아주 좋음,별표 5개,6년 전
MJ S,주차정산 헬. 일요일 밤 11시에 출차하는데 40분 걸림.,별표 1개,8년 전
Q lee,달리기 최고 자전거 타기 최고의 장소 입니다,별표 5개,수정일: 4년 전
hyun-jung chang,비온뒤라 물이 많았어요,별표 5개,2년 전
Redstone68,마음이 넉넉해지는 풍경을 가진 산책로,별표 5개,5년 전
이남준,화장실도 겨울에 따뜻하고 좋아요,별표 5개,6년 전
목수,물가에 내려가서 발을 담글수있는 장소가 없다.,별표 1개,3년 전
김종명,주말엔 엄청 밀린다. 차가지고 오는거 비추입니다,별표 3개,6년 전
ck lee,운동하기 정말 좋은 장소 입니다.,별표 5개,3년 전
또잉오잉,한강공원 중에서 제일 좋아하는 곳입니다,별표 5개,7년 전
gil sun kim,가족단위 그늘막 잔디밭 유람선도 타고 나무가많아 그늘이많아 좋왔다,별표 5개,7년 전
Jc Park,3주차장 이용이 편리해요,별표 4개,5년 전
An아니,요즘은 미세먼지 땜에 거의 못 가요,별표 3개,6년 전
위드,한강공원 자체는 좋지만 주차비와 무분별한 배달전단지가 짜증..,별표 1개,5년 전
조동현,말이 필요 없다 놀고싶을 때 쉬고싶을 때…,별표 5개,6년 전
허영규,탁트인게 좋았지만 편의점 가격이 비싼거 같아요,별표 4개,5년 전
je j,한강은 언제나 시원하고 산책하기 좋은 곳,별표 5개,5년 전
이하현,동에서 서까지 가장 넓게 볼 수 있는 한강 공원,별표 5개,6년 전
김성환,많이  좋아졌으나 화장실은 냄새나고 관리가 아직 부족,별표 4개,6년 전
김성선,춥지만 좋은 추억으로 남을 수 있을 것 같아요 ~,별표 4개,6년 전
이상범,항상마음을편안하게해주는곳이다,별표 4개,4년 전
WonJun Cho,라이딩하며 바람쐬기 좋은 장소 입니다.,별표 5개,6년 전
홍종만,한강 수중보 아래 제일깨끗한 물에서 물 놀이합니다^^,별표 5개,6년 전
Ent. J,15키로 정도 걸었음. 해 떨어지는 시간대에 가면 좋음,별표 5개,4년 전
Steve Kim,"물 반, 사람 반.",별표 4개,6년 전
김제임스,"한국을 대표하는 휴식과 힐링, 운동, 가족 공간",별표 5개,6년 전
dajeong,언제나 휴식을주는곳 항상 감사한곳,별표 5개,3년 전
장원석,날씨도좋고 돗자리가져가면최고,별표 5개,6년 전
황병훈,멋진 야경과 함께 맥주 한잔~,별표 5개,7년 전
박성균,강아지랑 산책하기 좋아요.,별표 5개,3년 전
김동명,한강은 쉬기 좋고 운동하기도 좋습니다.,별표 4개,5년 전
Sean An,산책하기에 좋은 도심공원  정도,별표 3개,5년 전
Bluechzz,주말에 바람쐬기 좋습니다,별표 5개,3년 전
준서아빠,러닝하기 딱 좋아요,별표 5개,2년 전
Jun-chul Lee,여름에도 밤에는 걷기 좋아~,별표 5개,4년 전
은성혜,현재 공사중이라 한강보긴 아쉬어요,별표 5개,2년 전
Lim Byungkyu,공사가 끝나서 주변환경이 좋아졌습니다,별표 5개,7년 전
장현성,나들이 하기에 딱 좋아요,별표 4개,6년 전
락키,이래저래 좋은 장소ㅋ,별표 5개,3년 전
정영도,시원한 한강을보며 치맥한잔 짜릿합니다.,별표 5개,4년 전
이정수,편의점이 다른 지역 보다 엄청 불친절 하나 한강은 시원하고 좋습니다.,별표 4개,8년 전
박인성 (재미니사랑),칼바람 불때 창문 조금 열어놓고 따뚯한커피 한잔 마시고....,별표 5개,4년 전
윤혜정,돗자리털때 너무 탈탈좀 안털면좋겠네요,별표 5개,4년 전
Willy Lee,답답하고 꽉 막힌 마음을 터놓고 얘기하며  쉴 수있는 곳,별표 5개,6년 전
Jae Hoon Kim,비오는 늦은밤 혼자 생각정리하며 걷기 좋음,별표 4개,7년 전
Jay Chung,좋아요 ㅎㅎ 네 감사합니다,별표 5개,2년 전
Junghwan Choi,새벽에 자전거타고지나왔는데 너무멋있더라고요 ㅎㅎ,별표 4개,5년 전
bell sage,산책하기 좋은 곳,별표 5개,1년 전
JSHONG “JUSTIN”,아주 좋음 뻥 뚫리고 시원한 느낌,별표 5개,4년 전
고석재,가슴이 활짝 펴지는 시원한 곳,별표 4개,5년 전
Edgar,간편하게 바람쐬기 좋인요. 😃…,별표 5개,3년 전
바움나자바리옴마니,매점 물품 종류가 다양하면 좋겠다,별표 4개,7년 전
donghyun Na,갈때마다 항상 여유와 평화를 느끼고 온다,별표 5개,7년 전
김지안,종합운동장까지 걸어갔다오면 넘나 운동 됨,별표 5개,4년 전
이강순,한적하고 좋네요 텐트 있으면 금상첨화,별표 5개,5년 전
Sangmin Lee,굳이 말로 안해도.. 좋아요~,별표 5개,4년 전
김수연,요즘 한강공원은 어딜가나 사람많고 너저분,별표 4개,7년 전
jaewon jeong,자전거 타기에는 사람이 너무 많음,별표 3개,수정일: 5년 전
Sungyeon Lee,해가 지니까 너무추워요 아직은 이른가봐요,별표 4개,4년 전
JS Jung,한번쯤은 돗자리깔고 치킨에 맥주 마실만한곳,별표 5개,7년 전
김동준,모처럼 한강에 가서 나드리,별표 5개,7년 전
더드림TV,라면이 맛있고 주차가 편함,별표 5개,6년 전
정찬호,간단히 바람쐐러  가기좋아요,별표 5개,4년 전
서혁준,잠실한강공원 저녁에 산보하기 좋은 곳,별표 5개,4년 전
Byung Gwon KOH,"한강유람선 타고, 추석 보름달 경치 좋았습니다.",별표 5개,5년 전
권호일,겨울에 한강 방향으로 차대놓고 분위기 즐기기 딱 좋더라,별표 5개,수정일: 7년 전
Jaeseok Kim (Tyholic),탄천합수부에서  가장 가까운ᆢ 팔당방향 편의점ᆢ,별표 5개,7년 전
汝昄 조성도,팔당대교 지나서부터 잠지까지는 보급할 데가~,별표 5개,3년 전
모리소바Morisoba,트레킹하기 좋고 노을이 멋진장소,별표 5개,5년 전
SU BO KIM (아빠마법사),편의점 앞에 벤치가 시원해요.,별표 5개,7년 전
허영주,계절인지라 바람이 차요. 따뜻하게 입고 나오세요,별표 4개,4년 전
김효준,한강에서 배달좀시키지마 벌금이 더나와 ㅅㅂㄹ,별표 5개,4년 전
정연민님,텐트 설치는 지정된 장소에서만 가능...,별표 4개,6년 전
이상우,이제 다시 그늘막 텐트 이용가능 해요!,별표 5개,4년 전
반짝반짝현정,선선한 가을바람,별표 5개,6년 전
천재원,날이 좋아서 날이좋지않아서 그 모든날들이..,별표 5개,3년 전
SANTA CLASS,"한강 공원 중에 반포, 잠실 공원이 제일 좋아여 자전거 타고 놀러가기",별표 5개,6년 전
권혁천,운동하고 바람쐬기 좋은곳,별표 5개,6년 전
이윤석,서울의 자랑,별표 5개,4년 전
jaejun KIM (쭈미데디),강북쪽 보다 풍경이 훨씬 좋아요!🇰🇷🇰🇷…,별표 5개,4년 전
윤윤인숙,주차도 좋고 ㆍ 휴식도 좋다ㆍ,별표 4개,3년 전
한영수,언제나 와도 좋은곳 입니다,별표 5개,3년 전
이재명,나들이 하기 좋은곳이예요,별표 5개,수정일: 6년 전
백승화,자전거 타는 사람이 너무 많아서 위험함,별표 3개,4년 전
Wonjun Cha,라이딩하기 좋아요,별표 5개,8년 전
구름,깨끗하게 잘 조성해두었어요,별표 5개,3년 전
임장미,계단에서 맥주마셨는데 좋았어요,별표 4개,6년 전
마린시티,갈만한 서울의 한강공원. 선착장도 갖춤,별표 4개,4년 전
윤덕기,롯데월드타워와 한강 조망을 동시에.,별표 4개,6년 전
CW N,편의점에 화장실 주차장 다 편함,별표 5개,3년 전
iron Sheep,사람이매우많다 날씨가좋거나 여름에 조심해야한다.,별표 3개,8년 전
유나래,또또갈거에요,별표 5개,4년 전
최명화,한강 너무 덥거나 너무 추울때 빼고는 정말 너무 좋다.,별표 5개,6년 전
채준,"괜춘, 커피,  가격은 허리위",별표 3개,1년 전
김규리,갈수록정비도잘되고 많은이들이찾게되는곳,별표 4개,4년 전
Andrew Kwon,구리한강공원 한가해서 좋아요,별표 5개,3년 전
alvis lee,산책하기 좋은 명소에요,별표 5개,7년 전
이영민,아주 좋아요 라면도 맛있고,별표 5개,4년 전
young gyun Kwon,생각하기 좋은곳,별표 5개,3년 전
유병훈,하늘과 강이 시원해요,별표 4개,5년 전
강산,한강유람선타고 야경보면 되게이쁨!,별표 5개,6년 전
김영님,하이킹으로 도착..가을에 딱인장소...강추장소,별표 5개,5년 전
Simon Says (Magnum),멋진풍경을 보여주는 서울안에 공원,별표 5개,4년 전
레류,한강은 언제나 옳다,별표 5개,5년 전
youngsun choi,이래서 다들 한강변에 살고싶어 하는구나...,별표 5개,3년 전
김진호,돗자리 깔고 간단히 음식먹기 너무좋음,별표 5개,7년 전
Joongmin Lee (왈왈충),평일에 가니 여유롭고 좋음,별표 5개,6년 전
Warren SHIN,미세먼지만 없으면 한강은 언제나 굳,별표 5개,6년 전
윤영돈,나무그늘밑에 누워,별표 5개,6년 전
장정용,잠실 선착장   편의점  이용하기에 편리함,별표 4개,6년 전
남자이승헌,모두가 공평하게 사용가능함.,별표 5개,5년 전
Tae Su Kim,오세이던 시장님 그늘막 설치하게 해주세요..,별표 5개,2년 전
kichung ban,기분도 상쾌해지고 좋아요,별표 5개,3년 전
Peter Hong,우거진 숲과 한강조망이 좋습니다.,별표 4개,3년 전
고옥자,시원하네요 밤  분위기 좋은,별표 5개,5년 전
굿모닝실버,하남 체인점중 고기맛 좋아서요,별표 5개,4년 전
IC YANG,편의점 2개있고 주차장많아서 좋음,별표 4개,6년 전
서민찬,운동도 할수 있고 좋아요,별표 5개,수정일: 5년 전
유동조,아침공기가참좋았어요,별표 5개,5년 전
주윤구,굿,별표 5개,4년 전
Park낙타,한강은 모터보트지,별표 5개,6년 전
변영주,쓰레기도 없고 깨끗하고 좋아요,별표 4개,6년 전
m jung,수영장옆에 임시주차장이 넓어서 좋았음,별표 5개,6년 전
이규원,좋아요,별표 5개,4년 전
조정래,아리수의 흐름에서 삶을 음미하게 함,별표 5개,6년 전
Byoung Kim,저녁 야경 정말 멋진 곳,별표 4개,7년 전
한재환,63빌딩앞,별표 4개,6년 전
jh jh,수상스키타러간다 물이너무더럽다 가까우니까 어쩔수없지...,별표 3개,5년 전
개초보,잠실한강공원 좋음,별표 4개,5년 전
가왕tv가성비king 맛집,자주가는데 산책하기좋음,별표 4개,6년 전
황슨생돌돌돌감자,한강공원은 언제든 좋습니다ㅎㅎ,별표 5개,수정일: 3년 전
박범창,운동.산책하기 좋은곳입니다.,별표 5개,5년 전
김동호,확 트인 공간이 도시사람들의 마음을 열어준다,별표 4개,6년 전
Prince toad,한강 바라보며 먹는 라면의 맛을 느끼고 싶다면,별표 5개,수정일: 6년 전
Young Sun Park,한강공원하면 떠오르던게 잠실이지만 막상 가보면 다른 데 갈 걸 싶다,별표 3개,9년 전
채성용,춘천라이딩으로 소양강 처녀를 만남을 기념,별표 5개,4년 전
Jang Oksoon,그냥그럼,별표 5개,4달 전
jangsooo Ha,한강공원중 여의도 다음으로 많이 방문하는 잠실공원,별표 5개,수정일: 6년 전
권예림,입구가 애매한 곳에 있지만 깨끗하고 좋습니다!,별표 5개,5년 전
Lee이경숙,멋진 한강뷰 넓직한 공간 good,별표 4개,4년 전
정진섭,편의점이 없어짐.,별표 1개,4년 전
정기용,운동하기정말좋아요♡♡♡,별표 5개,수정일: 3년 전
Mag Park,평범한 공원입니다. 제2롯데월드가 아주 크게보입니다.,별표 4개,7년 전
eunzi kim,한강 자체는 좋지만 편의점과 화장실이 더러움,별표 4개,5년 전
쩡쩡Movie,한강 유람선타고 야간 뷰가 아름다운 곳,별표 4개,5년 전
john Choi,정돈이 잘되있다 ㅡ,별표 3개,8년 전
jenny yun,환경이 좋아서 아주 만족^~^,별표 5개,3년 전
DA nanuri,환상적인 뷰가 압권이여요,별표 5개,5년 전
DK L,다른 한강 공원만큼 북적이지 않아서 좋은 공원,별표 5개,5년 전
김민희,술마실곳이 있어서 좋음.,별표 4개,5년 전
Chi Oh Lee,최고의 힐링장소지요.,별표 5개,4년 전
jeong cheon her,가벼운 산책 운동 하기에 최적임,별표 5개,7년 전
이용희,자전거타고가서 라면먹고오는곳.,별표 4개,6년 전
민영호,라면  끓여먹고 한강을  보면  가슴이  뻥,별표 5개,6년 전
최지원,시원하고 공기도 좋아요,별표 4개,5년 전
심창오,애들 데리고 놀기에는 좋네요,별표 5개,4년 전
마루한,한강공원은 운동하러 가기에 좋죠,별표 4개,6년 전
승락장 (SW.J Channel),아기들과 휴식,별표 5개,6년 전
dORRIE MIN,강아지와 함께하기 너무좋은곳,별표 5개,5년 전
Yoon Ha,맛있는 치킨 ^^,별표 5개,7년 전
KyungYun Roo,너무 복잡해요,별표 3개,4년 전
곰돌이푸우,자전거 인빠가 너무 많아요,별표 2개,4년 전
류동우,시원하게 바람쐬고 좋아요.,별표 5개,7년 전
Tommy yim,자전거 타기에 정말좋어요,별표 5개,4년 전
안류,송파둘레길 7시간 걸려 완주했어요,별표 5개,3년 전
황뽀,운동 나가기 참 좋습니다,별표 5개,수정일: 2년 전
Charles Lee,"자전거, 달리기, 산책 모두 좋음.",별표 5개,5년 전
seungyoon kang,평지로 공기좋고 걷기좋음,별표 4개,수정일: 2년 전
Hyejeong Yeo,"운동하러, 산책하러 가기 좋아요",별표 4개,4년 전
하하재민,자전거 타고 자주가요~,별표 5개,6년 전
Star Yoon,자전거 타기 한강 구경  좋아요,별표 4개,5년 전
정부자,쉬는대는참시원합니다 ᆢㅋ,별표 4개,4년 전
yeonjin kim,또 가고싶네요!! 너무 좋아요,별표 5개,3년 전
박병수,좋아요ㅎㅎ 편의점이 가까워요,별표 5개,6년 전
나지윤,조아요 여름이라 벌레많음 주의,별표 4개,4년 전
Jae hyun Park (cutal),항상 가도 좋은 곳입니다,별표 4개,4년 전
폴라리스,퇴근후 운동하기 편한곳~,별표 5개,5년 전
Chun won Lim,코로나 시국에 자제하는 것이 좋을듯....,별표 1개,4년 전
고강준,낮이도 밤에도 좋음,별표 4개,6년 전
김동준,쉬기에 좋은 곳입니다,별표 4개,6년 전
김도영,자전거를 타고 싶을땐 한강으로 고고고,별표 5개,5년 전
이형모,가족과 함께하면 좋은곳,별표 5개,수정일: 5년 전
전범길,늘 사람많지만 술먹기 좋은.,별표 5개,4년 전
James Kim,자전거 타고 자주 이용합니다,별표 5개,5년 전
김천배,좋다... 마음이 편해지는곳,별표 4개,8년 전
Siho Kim,"스트레스 해소, 휴식과 힐링의 장소",별표 5개,8년 전
임진성,현재는 강변 공사중이라 비추천,별표 4개,2년 전
서재경,코로나 때문에  매점언영중단  물 싸가세요,별표 2개,5년 전
강강태현,"날씨 좋고 런하려고 갔어유,",별표 5개,4년 전
Rip Baek,코로나를 피한 여유만끽. 즐겨라,별표 4개,4년 전
김은기,뻔한 장소지만 하한선이 있어요,별표 3개,수정일: 6년 전
김수남,산책하기 좋은곳입니다.,별표 4개,8년 전
Eunpyo Hong,나트륨많은 라면먹기 좋은곳,별표 5개,5년 전
SOONMIN LEE (BESTBIMENG),텐트치고 놀기좋아요,별표 4개,7년 전
최진영,언제나 상타 사람도 다른곳보다 별로없다,별표 4개,6년 전
일송정,가족 및 연인과 데이트하기 적당,별표 4개,수정일: 6년 전
정인성,말 그대로 공원 느낌이 나서 무난,별표 4개,4년 전
Jim K,신선한 바람 그러나  물냄새가 남,별표 4개,4년 전
유진,겨울에도 운동하는 사람 있네요,별표 4개,5년 전
오써니,여유를 찾을수 있어 좋아요,별표 5개,4년 전
김창식,밤에는 사람들이 많아요..,별표 4개,5년 전
헌짱구,여름밤.. 느긋하게 시간보내기 딱,별표 5개,3년 전
sanggan Nam,바람이 불면 연을 날려요.,별표 4개,4년 전
GS Kim,그늘이 많으면 얼마나 좋을까요,별표 4개,3년 전
김종성,여름 바람 쐬기좋은 장소,별표 5개,7년 전
지둥이아빠 (문래동지둥이),너무 좋아~~♡,별표 5개,5년 전
Jongho Lee,서울이 가장 부러운점이 이런부분인것 같아요.,별표 4개,6년 전
이준호,너무 자전거 도로 포장 상테 굿,별표 5개,7년 전
Jude Han,여기 라면 왜이렇게 맛있노 (진라면매운맛강추),별표 5개,5년 전
Hyunho Lim,수상레저 할만함 . 재미남~,별표 4개,6년 전
Lee이은복,낮에는 덥고 밤에는 시원,별표 3개,6년 전
WOOTAK CHO,가족끼리 바람쐬기 좋아요^^,별표 5개,6년 전
Ms J,꽃이이쁘고 진짜너무더ㅜㅇㅁ,별표 5개,3년 전
김현수,벌레빼곤 좋았음,별표 4개,6년 전
Dongsu Kim,언제나와도 행복한 한강 나들이,별표 5개,7년 전
선풀피리,물안개와 비 그리고 한강조망 좋읍니다,별표 4개,6년 전
haesungc,자전거 운동하기 좋아요,별표 4개,7년 전
5weeks,기온이 높아지니 사람이 많아졌어요,별표 4개,4년 전
Seungsu Han,휴직공간 라면맛 좋음,별표 4개,3년 전
김대균,좋아요. 술꾼들이 시끄러워요.,별표 4개,5년 전
김우종,주차요금 을 받는데 너무 시간이 걸림,별표 5개,7년 전
Fil,자전거출근 할때면 항상 지나는 곳.,별표 5개,8년 전
Human&Robot,야간에 타는 유람선 최고!,별표 5개,5년 전
Jong-Woo Kim,산책하기 좋고 운동하기도 좋고,별표 5개,4년 전
Daniel Cho,아이들과 나들이하기 좋습니다.,별표 5개,4년 전
문성우,좋은 쉼터,별표 5개,6년 전
404 Not found,시원한 바람이 필요할땐,별표 4개,6년 전
Jess K,한강 둔치는 언제나 좋아요,별표 5개,5년 전
안필현,야경이 외국보다 멋져요!,별표 5개,7년 전
임종혁,좋잖아요..다들 아시잖아요,별표 4개,4년 전
최동근,시원한강바람이 좋았어요,별표 4개,7년 전
이동근,한강은 언제나 옳다,별표 4개,6년 전
인릉산소맥,요즘은 바람불어 좋다,별표 5개,6년 전
김아름,모래놀이가 좋아요^^,별표 5개,7년 전
썬람쥐의 아쿠아TV,자전거 타기 최고의 장소,별표 3개,7년 전
seongsu SB,괘적하고.,별표 5개,4년 전
싸우나,한강공원이 다른게 있나요... ㅋ,별표 5개,4년 전
손철군,운동공간 있어서 너무 좋습니다,별표 5개,4년 전
김용득,새벽 운동하는 사람이 많다.,별표 4개,7년 전
J MAKER,자전거 타고 즐기기 좋음,별표 4개,7년 전
kami w (wkami),주차연습하기 좋아요~,별표 5개,5년 전
안기석,다른 한강공원보다 나을건 없음,별표 3개,5년 전
keunmo Koo,주차요금도싸고 굿굿,별표 5개,7년 전
Hyunjun Cho,잠실한강공원 가는 길은 햇빛을 피하는 오전에!!,별표 5개,7년 전
"김,",편의시설 좋고 주변 깨끗함,별표 4개,5년 전
JuSUK Yoon,비오기전 좋아요 자전거타기,별표 5개,5년 전
써니,친구들과 피크닉가기 좋습니다.,별표 5개,4년 전
장자방,24시간 영업하는 편의점이 없습니다.,별표 2개,7년 전
장석록,시원하고 상괘함니다ㅡ,별표 4개,5년 전
손무현,운동 중에 휴식도 최고,별표 5개,5년 전
JAMES CHUNG,아침운동하기 좋아요,별표 4개,4년 전
달나라,짱좋음 사람적당히없음,별표 5개,4년 전
나릇나릇,23년 초까지 공사예정,별표 3개,2년 전
한byul,따릉이끌고고고,별표 5개,4년 전
만평,탁 트여 보기 좋아요,별표 4개,4년 전
Roman HONG,기분이 절로 좋아지는  곳이죠,별표 5개,8년 전
황원석,여름에 돗자리 하나면 최고,별표 5개,8년 전
Allen Lee (SHYAYR),간단하게 소풍가기좋습니다,별표 5개,6년 전
촤노쓰,밤에 한강보기 좋음!!,별표 4개,4년 전
다운정,걷기 조성 잘해놨네요,별표 5개,5년 전
밥형tv,언제와도 산뜻한곳,별표 5개,3년 전
아무무,수상스포츠를 즐길 수 있습니다.,별표 5개,수정일: 5년 전
묘연,자전거 불륜 동호회 집합소 느낌,별표 1개,수정일: 6년 전
박해규,언제나 힐링할 수 있는 공간,별표 4개,4년 전
keeyong Jang,시원한 한강전경 ㆍ젊음의 공간,별표 5개,7년 전
JW Hur,사람적은편 잠깐 걷기좋음,별표 3개,9년 전
HJ KKang,잠실한강공원  돗자리자리만있어서 좋아용~^^,별표 4개,6년 전
야인마,4월24일 모기가 있다..,별표 4개,6년 전
한동호,가족 나들이로 좋습니다!,별표 5개,4년 전
유동국,가족 연인 누구나 가기 좋은 명소,별표 5개,4년 전
기영,많은 사람들이 넘치는 이곳 부러워요,별표 3개,7년 전
Han DH (kayakstory),데이트하기 좋아요,별표 5개,3년 전
김남균 (ryan9kim),한강공원 데이트는 언제나 즐거워요 :-),별표 5개,7년 전
han,자전거타기 딱좋다,별표 5개,6년 전
김수민,사회적거리두기 일환으로 김밥 사들고 한강으로,별표 4개,4년 전
Misong Sung (치코),공사빨리끝났으면 ㅠ,별표 5개,2년 전
그렇다면,사람들이 되게 행복해보였다,별표 5개,3년 전
Byungho Yu,강바람을 느끼고 싶은 사람 가세요,별표 3개,6년 전
윤형준,사람이 많은데 좋아요,별표 3개,5년 전
D.S L,자전거타기 좋네요 ~,별표 5개,4년 전
몽방긋 방긋,좋아요,별표 5개,3년 전
서준호,자전거로 통과하는 정도.,별표 5개,4년 전
김우성,편의점 라면 맛있네요,별표 4개,7년 전
김김기찬,자전거를타고  라면을 먹었다.,별표 5개,3년 전
주말론_JOOMALONE,해질녘에 가면 이뻐요~,별표 5개,5년 전
최영옥,걸을수 있고 좋아요~~,별표 4개,6년 전
문준혁,그더러워ㅇ더럽고 냄새나요,별표 2개,5년 전
JINQ,아이들과 가기 좋아요,별표 5개,4년 전
강상철,태푸의 흔적,별표 5개,수정일: 5년 전
최경렬,힐링과 자유,별표 5개,4년 전
이기명,자전거도로 좋아요,별표 4개,4년 전
푸들 수컷리닝,매운짜장이 아조 맛나고 좋읍니다.,별표 5개,4년 전
냠냠,분위기 좋은 곳이에요,별표 5개,4년 전
이재호,시원한 바람 맞기좋은 곳,별표 3개,7년 전
ᆞᆞᆞ,오고 가고 자주 지나가는 공원.,별표 5개,4년 전
Ken Brave,쓰레기통이 있어서 더 좋았,별표 5개,3년 전
조미자,#구름#바람#짱짱 좋아요~~,별표 5개,5년 전
Sungryul Moon,도심속 여유를 찾을수있는곳.,별표 4개,수정일: 6년 전
Kyeong-Jin Seong,죠깅이나 산책하기 좋음,별표 5개,5년 전
