작성자,내용,별점,작성일
byungyub ahn,이 곳은 깔끔해서 좋지만 잠실대교 밑은 라이딩할 때 수영하는 팀과 겹치는 부분과 자전거 도로에 조깅하는 사람들과 겹쳐서 좀 어수선한 분위기가 있어 조심하십시오,별표 4개,6년 전
joo,공휴일도 주차료 받는 한강시민공원 이렇게 푼돈까지 꼬박챙긴 돈으로 서울시는 뭘하나,별표 1개,5년 전
aeran hwang,운동삼아 걷다가 한강을 배경으로 편의점에서 라면먹고 맥주 한 잔 하기 좋습니다.,별표 3개,5년 전
go Kim,한강은 언제나 좋다. 잠실지구는 그늘막금지구역이많아서 한산한편이다,별표 4개,6년 전
김학수,많은 주차장 가까운 편의점과 화장실 어린아이들이 놀수있는 흙 놀이터가 정말 좋았으며…,별표 4개,6년 전
강지언,자전거 타기 좋고 저녁 먹고 다~산책하러 나오는것같음~~,별표 5개,3년 전
송희선,경관은좋은데시설이열악합니다 그리고편의시설도화장실역시필요합니다?,별표 3개,2년 전
Tina Suh,연인들끼리 강바람을 만나며 데이트를 할수 있는데 편의점에 따뜻한 술을 안파니 아쉽다.,별표 4개,5년 전
심연수,말이 필요없는 야경 뷰,별표 5개,4년 전
어쩌라고어모달라고모,운동 하러 자주갑니다.넓고 시원하고 조김하기 넘 좋와요,별표 5개,5년 전
조seong joon jo,토요일은 피하시고  출차하는데  소요시간 30분이상…,별표 1개,6년 전
HS Shin,"여름에 풀밭에서 쉬기 좋고, 자전거 타기 좋은 곳입니다.",별표 3개,4년 전
황용국,5월에 선선하게 산책을 즐기기에 딱 좋은곳이죠,별표 5개,6년 전
황하슬린,강아지와 산책하기 좋고. 운동하기. 라면먹기 좋음. 깨끗한 편,별표 4개,4년 전
가야,주차 편리하고 여유로운 시간을 보낼 수 있는 좋은 장소입니다.,별표 5개,4년 전
보타쿠,좀 붐빌때도 있고 주차장이 불편할때도 있지만 가면 너무 시원하고 즐기기 좋은 곳,별표 5개,4년 전
김현직,시원한강바람 맑은뭉게구름하늘 넘치는에너지를가진운동하는사람들 좋다~,별표 5개,3년 전
예삐장미,한강변 계단에 앉아서 도심에서 보는  강뷰가 탁트여서 시원하고  좋았어요,별표 5개,4년 전
법무법인바를정(기업회생 전문),"한강 유역에서 전망, 라이딩, 휴식하기 좋은 공원입니다.",별표 5개,2년 전
닥터신,그늘이 없다. 일부 장소에 그늘막을 허용했다. 타프는  금지인데 왜들 설치합니까.,별표 5개,5년 전
k k,주차비 싸서 커피마시러감 사람들 미친듯 개많음 코로나 풀렸으니 자유를 만끽하고싶은 사람들 ㅎ,별표 5개,3년 전
임효순,밤에 한강보기좋은곳 여름엔 시원하고 겨울엔 한적해 걷기좋다,별표 5개,6년 전
윤은지,건대 자주 갔었는데. 건대보다 훨씬 사람이 적고 깔끔해서 좋아요,별표 5개,4년 전
bada LEE,"해돋이 보러 갔는데, 작년과 마찬가지로 구름으로 인해 빠알간 해를 보진 못했네요.. ㅠㅠ",별표 4개,6년 전
sung leo,한강공원 가기전에 잠실역 지하 롯데마트 및 상가에서 장봐가면 좋아요,별표 5개,6년 전
ji-sun Kim,가족들이 놀기에 좋음. 다만 쉬는 날엔 사람이 많아 잔디밭에 자리 잡기 어려울 정도.,별표 3개,7년 전
S J,여기 캠핑장 이용하지 마세요. 햇빛 너무 심하고 비위생적이고 덥고 습해요. 차라리 좀 더 외곽으로 나가세요.,별표 1개,7년 전
서옥련,가까운 김영모 가도 될듯요..브런치 먹을려면 괜잖은데 ..빵 사러갈 필요까진.,별표 3개,4년 전
이철,태풍 왔다고 사람이 없었네요. 화장실이 멀어서 별 하나 깎았어요. 화장실 좀 하나만더 만들어주세요,별표 4개,6년 전
다정파파snb,"운동하기에, 가족 화합하기 최고의 장소. 우리나라가 선진국이 될 수 있다 느끼게 해 주는 곳.",별표 5개,7년 전
한영수,늘 좋습니다 수영장 공사되면 더좋아지겠네요.,별표 5개,3년 전
김정훈,공기좋고 뷰좋고 아이들이 놀기좋고 단지 자전거들이 너무 빨리 달려요...ㅠㅠ,별표 5개,7년 전
Sungwoo Kim,한강 자전거 타고 돌기 좋습니다. This place is one of cool site in seoul for working or riding.,별표 5개,6년 전
Jeonguk Seo,"그늘막텐트와 돗자리, 캠핑용 의자와 테이블 치맥과 사랑하는 사람들과 함께면 이곳이 지상낙원",별표 4개,8년 전
주상길,잠원지구 보다 한가하고 좋음ᆢ 자전거 라이딩 하다 쉬기 좋은 장소ᆢ,별표 4개,수정일: 7년 전
오경호,오랜만에  애들 데리고 한강공원 갔더니 넘 시원하고  애들도 넘 좋아하네요~,별표 4개,5년 전
Young Lee,가족과 여유롭게 한강변에서 시간을 보낼수 있어 좋아요,별표 5개,6년 전
Augustin J,가족 친구끼리 나와서 휴식즐기기에 좋음 소형텐트나 돗자리필요,별표 5개,6년 전
HJ S,편의점 너무 비쌈. 양주는 안팜. 술마실거면 신천역 근처에서 미리 사가자,별표 4개,6년 전
백승진,한가한 금요일 오후 날씨도 좋고 맥주한캔 좋아요,별표 5개,5년 전
최상엽,날씨 좋은날엔 멀리까지 잘 보여서 좋습니다.,별표 5개,4년 전
정동식,라면이 봉지라면 ᆢ3천원 날계란 1개 5백원 비싸다 거져돈버네 ᆢ,별표 2개,4년 전
JH yoon,접근성이 좋고 편리합니다 날좋은날 돗자리펴고 한숨자면 개꿀!!👍…,별표 5개,수정일: 5년 전
vsvk iwikis,아파트나빌딩은고만짓고이런넓고좋은공원이많이생기길바랍니다.,별표 5개,6년 전
Gihyoun Gwon,서울의 명물 저녁에 산책하면 기분이 좋아지는 곳이다,별표 5개,6년 전
emong dora,야경좋아요~,별표 5개,4년 전
태군,봄가을에 좋아요. 라면도 맛있고 맥주도 맛있어요,별표 4개,6년 전
C. H. Seo,강 기슭에 계단대신 바위등을 설치해서 강물 엽ㅇ까지 접근가능.,별표 4개,수정일: 2년 전
이훈희,큰나무가 더많이  있었으면 좋겠네요 그늘이 많지 않아요,별표 2개,6년 전
Jay Lee,사람이 많긴하지만 방역으로 가게도 다 비닐하우스지만 여전히 좋은곳,별표 4개,5년 전
변선영 (labean),도시한가운데 이렇게 크고 멋진강이 흐르는곳이  또 어디에 있을까?,별표 4개,5년 전
Elijah Moon,자전거 를 타고 힘들어서 쉬고싶을 때쯤 잠시 목도 축이고 배도 채울수 있는 한강.,별표 5개,7년 전
JT N,"야경도 예쁘고, 특히 요맘때는 바람도 시원합니다:)",별표 5개,5년 전
Ted Yun,사이클링 하는 사람이 많네요. 주말 운동 산챡 최적의 장소.,별표 4개,3년 전
이상민,자전거 라이딩 도중 쉬어가거나 만남의 장소로 좋은 곳입니다!,별표 5개,5년 전
은기아빠,물이 있다. 사람이 있다.…,별표 4개,수정일: 8년 전
Hwang황병섭,휴일에 잠깐 돗자리챙겨 나간곳이네요 정말 좋은곳이네요,별표 5개,5년 전
정동희,기분좋고 여유로운 장소,별표 4개,8년 전
R Koffee,시원했다 다만 어린 조카가 물에빠질가봐 계속 좇아다님 난간이 너무 띄엄띄엄,별표 4개,6년 전
허억준,시원한 잔듸밭에서 초여름을 즐기면서,별표 3개,1년 전
yul choi,멋진 야경 시원한 바람  물멍 때리기 좋아요,별표 5개,4년 전
조영태,"코로나때문에 마스크로 인하여 더웠지만, 쉬기 좋은 장소입니다",별표 5개,5년 전
오기모,탁트인 전망과 강가에서 불어오는 시원한 바람이 좋아요,별표 4개,7년 전
Elsinn Lee,물냄새 맡을 수 있고 사람 구경하기 좋고 좋은 사람과 함께 걸을 수 있는 한강공원,별표 5개,6년 전
민준파파,할아버지가 금연 공공장소에서 담배를 피는데 어의가 없어서 27개월 아들 데리고 자리를 피했습니다,별표 1개,5년 전
정동민,멍때리기좋아요,별표 5개,5년 전
Young Sung Kim,라이딩하면서 항상 스쳐 지나가듯이 합니다. 주말엔 인파가 너무 많아요.,별표 5개,4년 전
Jay Chung,서울시민의 완소플레이스. 깨끗하고 편의시설도 잘돼있음,별표 5개,6년 전
Susie Y,주차하기 편하고 좋아요 주변에 편의점있어서 편리해요,별표 5개,5년 전
kim jc,잘 가꾸어진 최상의 공원 자전거 길도 최고. 단지 식당등이 부족.,별표 5개,5년 전
jihun Baek,술마시고 깽판치고 담배 아무데서나 피고 쓰레기 막버리는 사람들만 피하면 좋습니다.,별표 5개,5년 전
Ring star,언제나 좋은곳 라면을 가장 맛있게 먹을수 있는 곳.,별표 5개,3년 전
Joongho Park (박중호),사람들 많음 커피한잔 라면 등 산책으로 추천,별표 5개,3년 전
Hyun-jae Park,사람들 많이 나와 있네요. 휴식하기 좋게되 있구요.,별표 5개,3년 전
손성호,잠실선착장 편의점에서 라면 먹기는 라이딩의 또다른 즐거움,별표 5개,6년 전
Jiyoon Um,사람이 많아 당황스러웠지만 모래밭도 조성되어 있어 아이가 신나게 뛰어 놀 수 있음.,별표 5개,4년 전
신연섭,닐씨는 선선했지만 자전거타기는 좋은날씨였답니다,별표 4개,5년 전
SK,넓고 산책하기 좋음 봄가을 날씨 좋으면 주차하기 힘듬,별표 5개,6년 전
송혜영,진입도 좋고 공영주차장도 비교적 싼가격 한강은 서울의 젖줄,별표 5개,6년 전
앙쿰걸,…. 하루살이와.. 앞에 공사하규 있어서 한강 1도 못 봄여 ..^^ 그냥 추억으로 생각하고있어용,별표 2개,2년 전
막둥이막둥이,비올때 차에서 커피먹으면서 음악들으면 분위기 너무 좋아요~~!!^^,별표 5개,5년 전
하수호,"시원한 한강변은 물이 있어 좋지만, 그늘이 적어 불편하고, 바닥이 아스팔트라 걷고나면 발바닥이 아파요",별표 4개,6년 전
서훈,광활한 한강풍경이 도시풍경과 어우러진 곳입니다. 멋진곳이죠.,별표 5개,3년 전
우주대스타,"자전거 타기도 정말 좋고, 한강도 너무 이쁜 장소❤️",별표 5개,3년 전
지철규,한강과 맑은 하늘의 조화 여유롭게 운동하는 시민들의 행복한 모습,별표 5개,3년 전
연호수,흐린 날 시원한 강바람 맞으면서 걷기 좋아요,별표 5개,3년 전
Joo-Hwa Song,"친환경차 50% 주차감면, 다둥이카드 자전거대여 할인.",별표 4개,6년 전
최재연,저녁 노을이 아름답고 한강을 따라 걸을수 있어 아주 좋습니다,별표 5개,3년 전
캐스피,야경이 진짜끝내주네요,별표 5개,5년 전
MJ K,좋아요~새벽에 편의점에서 라면 끓여먹기 좋음~,별표 3개,5년 전
HYO YOUNG LEE,운동하기 좋아요~^^,별표 5개,1년 전
sso k,요즘 사람 많을 것 같았는데 별로 없음 당연한거지만 모기밥됬음ㅜㅜ화장실좀 깨끗했음 좋겟당,별표 4개,6년 전
이명성,중국집인것 같은데 궁금하네요,별표 3개,6년 전
JH K,넓고 탁 트임. 간간히 물고기들과 갈매기?를 관찰할 수 있음. 좋음,별표 4개,5년 전
이은영,가을이 왔음을 느낄수있는 행복할수있는곳이예요,별표 5개,3년 전
김정호,시원한  강바람과 탁트인 강변풍경을 구경하며 피크니장소로  최적,별표 4개,6년 전
윤영선,평일 낮에 방문한다면 좋을것! 사람도없고 한적하다,별표 4개,6년 전
심정은,늘 기분좋은 쾌적한곳 근데 편의점들이 문닫았네요,별표 5개,5년 전
Hung Sun Park,사람이생각보다없어요. 하지만 명상하기좋은곳,별표 3개,3년 전
lee hyuk,"배구를 즐길수있는 모래사장, 맛난음식이 많은 편의점",별표 5개,4년 전
강상우,피크닉 장소로 추천. 11시 전에 가야지 좋은 자리 선점가능,별표 4개,6년 전
유마리아,갈때마다신선하고맘이향내나는듯 좋습니다,별표 5개,4년 전
SUNAH KIM,산책하기 좋은곳. 자전거는 항상 조심할것,별표 5개,6년 전
Nama Kim,한강 범람으로 도로청소는 마무리 되었으나 물 빠지면서 썩는 냄새는 아직 진동함.,별표 5개,4년 전
이명길,청소하시는분들이 친절해요,별표 3개,2년 전
chae hyung lim,20년07월 기준 날파리 조금 있어요 배달음식은 대체로 맛있습니다,별표 4개,5년 전
곽미경,개나리와 봄을 알리는 꽃과 멋진 강. 좋아요,별표 5개,5년 전
Silver Boy Woong Ah,한강 공원 은  항상 좋다. 날씨가  쭈워서  썰하지만 차안에서   있음ᆢ,별표 4개,6년 전
miran kang,한강은 라면이죠.날도 많이 춥지않고  산책하기 좋았네요,별표 5개,4년 전
이기준,차가 막히지만 돋자리깔고 치킨먹으면 맛있어요,별표 5개,8년 전
Biglight Kim,탄천따라 자전거 페달을 힘껏 밟아 도착한 곳. 시원한 느낌이 드는 곳 입니다.,별표 4개,5년 전
빛나는 너,"코로나없는것 같은 바람부는 힐링지역, 여전히 사회적거리두기~ 덕분에 고맙습니다~",별표 5개,5년 전
황희정,정원도 있고 쓰레기통도 많고 편의점도 중간중간 있어요!,별표 5개,6년 전
김건종,집근처라산책이나운동하기좋아요,별표 3개,3년 전
임재훈,날두 맑고 좋아서 가봤는데 역시 가길 잘했어요!,별표 5개,4년 전
김나연,한강은 역시 👍👍👍👍👍…,별표 5개,3년 전
아낌없이 줍는나무,분당쪽에서 채 20키로가 안되는 거리에 있고 생각보다 사람이 많지 않아 좋았습니다,별표 4개,5년 전
우혁진,예쁘고 좋은데 사람많은 주말엔 약간비추 사진찍기 힘듦,별표 4개,수정일: 4년 전
윤지영,굿,별표 5개,4년 전
Erena Kim,가족단위가 많은 한강,별표 5개,5년 전
김썸머,관리가 잘되고있는 한강공원 쾌적하고 상쾌했어요~,별표 5개,6년 전
김경태,언제나 활기 넘치는...^^,별표 5개,수정일: 6년 전
일상여행 (Triptube),잠실 수중보 롯데월드 타워와 한강이 어우러져 심심하지 않은 풍경의 쉼터,별표 5개,6년 전
noexcuse1982 hehe,나의 최애플레이스,별표 5개,6년 전
olympickorea,언제나 최고의 안식처 그러나 장소별 규제문구가 너무 많음,별표 5개,7년 전
K KAKA,잠시 여유를 즐길 수 있는 좋은 곳입니다,별표 5개,4년 전
신동호,좋네요. 이런 공원이 집옆에 있으니 강변 아파트가 비싸군요,별표 5개,7년 전
이현,매우만족 별다섯개,별표 5개,4년 전
Sung Hoon Park,산책 라이딩 간단한 먹거리까지 한강을 따라 휴식하기 좋은 장소,별표 5개,6년 전
양성우,새벽 2시 까지 주차비 받는거 빼곤 좋네요,별표 1개,6년 전
이재혁,큰 도시에 이만한 공원있다는건 좋은 일이죠,별표 4개,7년 전
이동원,일주일전에 가서 라면끓여먹고 치킨먹었어요 날이 추워서..,별표 5개,7년 전
연미김,라면맛집 ㅎ 탁트인곳에서 돗자리펴놓고 캔맥에 누워서 하늘바라기 굳,별표 5개,4년 전
Jiyoun Park,저녁에 선선해요,별표 5개,5년 전
안현신,화창한 날씨에 한강변 산책은 최고죠👍…,별표 5개,5년 전
홍홍,애견이랑 같이 산책하고 편하게 쉬기 좋아요,별표 5개,4년 전
DooHyun Hwang,여름 밤에는 바람을 쐬러 나온 사람이나 자전거를 타는 사람이 굉장히 많아요.,별표 4개,9년 전
JW J,잠실쪽은 역시 가족 분위기. 잠원지구와 완전 다른 느낌이다.,별표 3개,7년 전
Chulyoung Kim,"넓고 다양한 시설(백사장, 자전거 대여)이 장점",별표 4개,9년 전
성남국빈관나이트WT류현진OIO.4848.0669,밤에 갔는데 비오고 바람부니깐 비바람 피할곳이 차밖에 없네요,별표 2개,6년 전
Jerry Kim,요즘 더 좋아요 가을 하늘이 너무 높고 파랗네요,별표 4개,4년 전
쓴민,역시 한강인가...,별표 5개,5년 전
오세영,오랫만에 한강 야간라이딩~,별표 3개,6년 전
김해영,화창하고 시원하고 봄기운을 느낄 수 있었습니다.,별표 4개,4년 전
서정호,여러가지 꽃을 잘 가꾸었네요,별표 1개,2년 전
권명숙,응.. 있다면 자전거가 너무 낡아서 힘들었어요 😭 다른것은 다좋아요👍👍👍…,별표 4개,6년 전
jane J,여름끝의 건강을 위해 걷기.자전거 라이딩.산책가족과,별표 5개,6년 전
PARK SOON DAE,날씨 좋고 배구하는사람 서핑하는 사람 많았네요,별표 5개,5년 전
최태훈,한강뷰을 보면서 먹는 라면은 언제나 좋습니다,별표 5개,4년 전
윤승혁,시원한 한강에서 펼쳐지는 아름다운 풍경 속에 많은 힐링을 얻고 있습니다.,별표 5개,5년 전
김경선,자전거 타기 너무 좋아요,별표 4개,1년 전
Justin Joe,최근 코로나사태 때문에 편의점이 일찍 문을 닫네요.,별표 4개,3년 전
Hannah .L,여유롭고 좋네요. 가족끼리 오는거 추천,별표 4개,6년 전
최익준,반포공원이 조금 더 예쁘지만 롯데월드가 가까워 좋다,별표 5개,7년 전
이한주,"한강 뷰 ! 인공 모래 사장, 편의점, 편안한 오두막 등등 좋아요",별표 5개,7년 전
polar B,모두에게 누구나 가지고 있을 추억이 깃든 장소지요.,별표 5개,5년 전
김준수,좋습니다. 날씨만 좋다면 맘껏 걷고싶은곳,별표 5개,6년 전
정병조,여름에 최고입니다. 수영장도 개장합니다.~,별표 5개,5년 전
이제민,좋아요 아무 생각 없이 멍때리기 최고의 장소,별표 5개,5년 전
임진우,가격이 아주 좋아요. 주차장과 입구는 좀 멉니다.,별표 4개,7년 전
양종석양종석,오랫만에 아내하고 라이딩 좋았지요.잠수대교건너 잠실대교한바퀴49km엄지척,별표 5개,6년 전
김용태,어두운 곳들이 좀 있는데 위험할 수 있으니 개선이 필요합니다,별표 4개,2년 전
HanJoo Lee,6월말 잠실한강공원~ 선선하니 좋네요~~ 잘 놀았어요 ㅎㅎㅎ,별표 5개,6년 전
김진민,요새 미세먼지도 없어서 걷기에 너무 좋아요.,별표 5개,4년 전
최현숙,선선한바람과탁트인곳,별표 4개,8년 전
변태처럼운동하자,교통은 뚝섬보다 안좋지만 훨씬 조용하긴하다,별표 3개,5년 전
최관순,"걷기, 달리기, 자전거 가족 친구 누구나 휴식공간",별표 5개,3년 전
Hjwb lee,놀이터놀고 피크닉하고 운동도하고.,별표 5개,1년 전
차승준,한강볼수있는 잠실한강공원 경치도좋고 분위기도좋고 다 좋았습니다,별표 5개,6년 전
아무도모르게,모든 풍경이 감상적이게 보이는 좋은곳,별표 5개,6년 전
남동현,저녁 노을이 이쁘곳...,별표 5개,3년 전
kwanbo lee,한적해서 좋아요 잔디도 강이랑 가까워서 좋아요,별표 5개,수정일: 3년 전
최성호 (나나성),경치도좋고  시원해요  유람선도아주좋와요,별표 4개,6년 전
박영미,미세먼지없을때 시원한 강바람 맞으며 산책하기좋음,별표 5개,6년 전
유수상,나무아래 돗자리깔고 누워있으면 천국이 따로없음,별표 5개,4년 전
HW Kim (Billy),운동하기 좋은곳,별표 5개,8년 전
jin blue,조용하게 쉴만한 공간임,별표 4개,1년 전
young Shin,간단한 피크닉하기 좋아요.,별표 5개,1년 전
J,말하면 입아픔.  화장실만 관리 잘되면 여름엔 따봉~♬,별표 5개,7년 전
바우뫼,비온뒤 의 상큼함 이 너무 .좋았어요,별표 4개,6년 전
DK KIM,넓은 우리집 앞마당,별표 4개,3년 전
박찬열,좋은위치에 쉴수 있는 공간이에요~,별표 4개,4년 전
손정모,한강에서 물놀이 체험을 해보는 것도 좋아보임,별표 5개,3년 전
조성하,가족끼리또는연인끼리 바람쐬기조은곳같아요 그런데 아직은 좀추워요,별표 3개,6년 전
이충근,오래된 정비 잘 된 한강 공원. CU 및 치킨집을 들르는 맛이 있다.,별표 4개,8년 전
전기배,강변을 산책하기 좋은 서울의 아름다운 한강과 잠실,별표 5개,4년 전
윤석원,한강변을 따라서 산책을 하면 마음에 여유,별표 4개,7년 전
고은서,완전 재미있어요! 다만 벌레가 많아요~,별표 5개,4년 전
조한표,자전거타기 좋고 산책 및 운동하기 좋아요,별표 5개,수정일: 5년 전
Playlist My,잠실 가깝고 가기 좋음 그냥 편함,별표 5개,2년 전
김창인 (하의도),손녀와 2인용자전거를 넘 재미있게 탔시유,별표 5개,5년 전
Jae-Nam Kim,삶의여유를 느낄수 있는 낭만이 있는 곳,별표 5개,9년 전
Min Min,편의시설도 많고 자전거타기도 좋음,별표 5개,6년 전
경구,롯데타워가 잘 보이는 곳 입니다. 강준치가 많습니다.,별표 5개,6년 전
김명숙,날씨도 좋고 재미있는 산책을 했어요,별표 5개,4년 전
James Kim,주차장이 널널하여 데이트하기 좋은 장소입니다,별표 5개,6년 전
강한묵,라이딩하는 사람들이 쉬어가기에 좋은 장소입니다.,별표 4개,5년 전
몽실콩당,"잠실1,2,3호점25시편의점~ 한강이 예쁜곳^^",별표 5개,6년 전
김민수,낮이고밤이고 걷기좋고 탁트인 상쾌한 장소.,별표 5개,7년 전
liz,야경은 역시최고 그치만 편의점이 공사중이라 가건물인게 아쉬움,별표 4개,4년 전
꼬막이,봄 가을 산책하기 좋습니다. 여름에는 더워서 산책하기가..,별표 3개,5년 전
최설화,바람이 좀 차가운데도 넘 좋았어요^^,별표 5개,5년 전
teacherpak티처박,저녁에 가면 한가함. 치킨과 맥주를 먹을 수 있는 곳.,별표 5개,6년 전
myungrok lee,잔디 위에서 아이들 뛰어놀기 좋은 장소입니다,별표 2개,5년 전
ᆞ햄순이,가도 가도 질리지 않음,별표 5개,6년 전
Bryan Seok,아이들과 무엇을해도 좋은 쉼터이자 공원이다,별표 5개,5년 전
희나비,"날씨 좋은 날 캠핑, 걷기, 자전거 타기 좋다",별표 4개,5년 전
Sumin Ha,주차장도 넓어서 다른 한강공원보다 쾌적합니다,별표 5개,5년 전
윤호신,확트인 장소 답답한 마음일때 가볍게 가면 좋음,별표 5개,6년 전
조아름,역시!@ 잠실한강~ 풍경 굿~ 일몰도 야경도 멋져요~,별표 5개,6년 전
예뿌이,내가 엄청 좋아하고 의지하는 혁재오빠야랑 ㅎㅎ 나달래준다고 힐링시켜주심 ㅠㅠ 넘나 감사해여,별표 5개,5년 전
홍소희,자전거를  빌려서   탈수있는  새로운기회였다!,별표 5개,5년 전
K숭경,한강변 최고의공간,별표 4개,5년 전
won bok Son,언제든지 갈 수 있지만 사람이 너무 많다,별표 5개,5년 전
Hamster fairy,늘 좋아요 자전거 타고 다니기 좋죠,별표 5개,4년 전
손계문,유람선도 타고 한강 구경도하고 경치도 멋있는곳,별표 4개,6년 전
Dongwoo Kim (야르),좋긴한데 주차장이 너무 협소합니다 자리 찾으러 돌다가 그냥 나옴,별표 3개,3년 전
골드롯데캐슬,그냥 뭐 해운대사는사람이 해운대보는느낌,별표 2개,3년 전
BS,아이들과 바람쐬고 뛰어놀기 좋은 곳,별표 4개,6년 전
"JeongGeun Park (RightRoot, 박정근)",강좋고 자라펴고 앉을데도 많음 자전거도로가 좀 좁은게 흠~~,별표 4개,8년 전
정한신,이제 자전거 이용자가 너무너무 많아서 조심해야겠어요...,별표 3개,4년 전
정현철,가족과 함께 즐거운 시간 보내기 좋아요,별표 4개,6년 전
김경진,한강과 롯데타워가 보이는 멋진 풍경을 가졌습니다,별표 4개,5년 전
방랑캠퍼머쉰,주차편하고 시원한 강바람 맞으며 산책하기좋음,별표 5개,수정일: 1년 전
HONG JOSHUA,서울에서 강과 멋진 풍경을 볼수 있다.,별표 5개,4년 전
심윤열,밤에 가니까 괜찮고 야경도 예뻐요.,별표 4개,5년 전
전기배,강과 어우러진 숲길이 바람과  함게 시원한 여름이 춤춘다,별표 4개,8년 전
Bradley Kwon,아름답고 편안한 곳,별표 5개,7년 전
차영우,피크닉 가즈아~,별표 5개,6년 전
Hyun jin Kim,밤공기와 경치가 좋고 걷기에 좋다,별표 5개,5년 전
김구이TV,말해뭐합니까 날좋을때가서 드러누우면 개꿀,별표 5개,4년 전
백재현,잠실종합운동장이 위치하고 롯데월드타워가 보입니다,별표 5개,4년 전
ILJIN KIM,석양을 한강과 함께~치맥은 사이드! 자전거는 조심해야함,별표 4개,6년 전
윤영남,수영장 처음 가봤는데 너무 좋습니다 완젼 강추~~!,별표 5개,6년 전
하진산,크게 좋은 점 없읍니다 그늘막 부족하고  편의시설 부족해서 좀불편함,별표 3개,8년 전
Eun Yu,앉아서 놀기좋아요 화장실이 깨끗해요,별표 5개,3년 전
Jw Jw,로멘틱한 한강크루즈를 기대했는데 야밤에 트로트라뇨ㅜㅜ 그래도 여러모로 재밌었습니다 ㅋㅋㅋㅋㅋㅋ,별표 4개,7년 전
랄바,경치좋고 사람냄새나고 좋았네요,별표 4개,5년 전
june kim,가끔 자전거 런닝하는곳이라 좋습니다,별표 5개,수정일: 3년 전
DM K,여름 덥고 겨울춥고 봄가을이 좋음.~,별표 4개,3년 전
김우둔스,좋았는데 넘 추워서 여름에 가는 것을 추천합니다!,별표 5개,6년 전
엘지,무더운 여름날 탁트인 한강이 너무 시원 합니다,별표 3개,5년 전
문혜인,날씨가 좋아서 걷기 너무 좋네요.,별표 5개,4년 전
황명선,굿,별표 5개,4년 전
Subin Oh,깨끗.. 반포보다는 사람이적어서 조아요,별표 5개,7년 전
