작성자,내용,별점,작성일
Ya Hoo,전망고 좋고 분위기도 좋고 데이트 장소로 한반른 가보길..,별표 5개,5년 전
양기홍,서울에서 멀리 둘레길 떠나는 사람들이 많은데 낮선곳의 설레임과 즐거움을 느끼고 싶은 이유도 많겠지요. 하지만 때로는 익숙함이 주는 편안함과 바쁘지 않을 걸음에서 오는 잔잔한 감동을 길가의 작은 풀잎과 꽃잎에서도 누릴 수 있습니다,별표 4개,6년 전
이현정,우리나라의 다른면을 볼수 있는 기회,별표 5개,1년 전
이가원,야경이 보기에 참 좋습니다. 올라가기도 그리 어렵지 않고 가는 길에 음식점과 카페들이 충분히 있습니다. 혜화역에서 걸어서 15분 이내로 도착할 수 있을 만큼 접근성도 뛰어납니다. 다만 산인지라 계절에 따라 모기가 많을 수 있으니 대책을 준비해 가시는 것을 추천합니다.,별표 4개,7년 전
이지영,사람이 많아요 그래도 밤바람 시원하고 달도 크게 뜬 날이라 좋았네요,별표 5개,6년 전
신정화,좋아요...다음에는 밤에 가볼까해요..,별표 4개,4년 전
안지혜,봄이 오는 길에 하기 좋은 나들이 장소였다. 동대문부터 대학로까지 걸어가며 서울의 구도심을 보는 것도 좋았고 중간중간 예쁜 카페도 많았다. 물론 사람도 많아 들어가진 않았지만 봄이 더 다가오면 한 번 더 가려고 한다,별표 5개,4년 전
묵교Mookgyo,한양도성길중 가장 예쁜구간 이라고....,별표 5개,4년 전
yeong bae Lim,필수 데이트 코스! 야경이 죽여주는 도심 속의 전망대!,별표 5개,5년 전
이요한,서울 북한산 바라보기 멋진곳,별표 4개,수정일: 4년 전
SS Kym,복잡한 도심 속 역사탐방길로 전망 좋고 조용한 쉼터~,별표 4개,4년 전
JiHwan Lim,혜화역에서 10분거리 낙산에 위치한 작은 공원 혜화서 문화공연 관람 및 식사 후 잠시 들러 서울 전망 구경하기 좋다. 강남과는 다른 과거와 현재가 공존하는 강북의 오묘한 경치를 구경하는 맛이 있어 일품이라 인근을 지나갈일이 있다면 꼭 들리는것을 추천한다. 공원으로 올라가는 길 경사가 심하니 본인 또는 일행이 힐을 신었다면 가지 않는것이 좋을듯 하다.,별표 5개,4년 전
이영학,서울에 좋은 공원이  있다는것이  너무 좋았고  산책하기에  좋아 다음에  기회가 된다면 다시 가고  싶습니다.,별표 5개,1년 전
이기연,멀리 가지 않고 서울을 둘러볼 수 있는 곳입니다,별표 5개,4년 전
Sung-kuk Jo,야경이 좋은 명소  높은 구두를 신은 여자친구를 데려오지 말 것,별표 4개,4년 전
조주한,뷰도 끝내주고 경치도 좋은 게 아름다워요.다만 무릎 관절이 안 좋거나 허리가 아프신 분들은 쥐약이에요.경사진 길이 많습니다.ㅠㅠ낙산공원 정상에서 보는 전경이란 말로 표현 할수 없을 만큼 경치가 빼어납니다.👍…,별표 5개,5년 전
S.데니스,"날씨가 좋지 않을 때 갔지만 너무 좋았습니다. 낙산공원주차장이 요동네에서 그나마 주차비가 저렴한 편입니다. 성곽따라 동대문 방향으로 걷다보면 두타몰이랑 DDP, 흥인지문이 한 눈에 들어오는데 너무 멋집니다. 날씨 좋을 때 다시 오고 싶네요.",별표 5개,5년 전
게임게임이좋은TV,"이화 벽화마을의 정상. 요즘들어 많은 사람들이 오고감. 주차 어려우니 일찍 오시던지, 혜화역에서 대학로 지나 쉬엄쉬엄 오세요. 이곳에서 보이는 야경은 남산타워에서 보는 야경과 다른 멋이 있음. 여름밤에는 연인,가족,친구들 방문객이 많음. 동묘역에서 마을버스 타면 금방  도착함.",별표 5개,수정일: 5년 전
BOSUN KIM,저의 첫 서울 생활지였던 대학로에서 산 자락이지만 언덕 같이 오르내렸던 공원입니다. 지금은 이화동도 유명해져서 가보면 관광객도 많아졌더군요. 기분 좋은 날에는 꼭 가서 더 기분 좋은 풍경과 샵 그리고 정겨운 이화동 풍경도 함께 보고 오시기를 추천합니다.,별표 5개,6년 전
한상기,볼거리가 많지는 않지만 위에서 내려다보면 서울의 경치가 좋습니다. 그리고 바람도 아주 시원하니 좋습니다. 그리고 밤보단 아침에 오는게 더 좋으실듯합니다.,별표 4개,4년 전
박명숙,돌담길 ~ 서울에도 이런곳이 있었군요 ~좋네요 야경 ^^,별표 5개,5년 전
이희태,야경이 넘 멋지네요,별표 5개,6년 전
송철환,점심 산책로로 좋아요,별표 5개,5년 전
unicode,"도심속에 한적한 공원을 찾기 힘들지만, 낙산공원은 도심지 근처에 꽤나 한적하고 좋은 산책로가 조성되어있다. 특히 날씨좋은 봄가을에 야경보러 가기 특히 좋음.",별표 5개,6년 전
막살자,밤에 분위기 좋아요 연인들이 참 많아요 그래도 괜찮았지만 지금은 추워요,별표 5개,수정일: 6년 전
DH K (HelloTi),"밤에 방문하면 도시의 빛들을 볼 수 있는 장소이다. 연인들의 데이트 코스로 자주 이용되고 있다. 산책하기 좋고 운동기구도 몇가지 있다. 공연, 뮤지컬 등을 보고 저녁 식사후 산책하기 좋다.   주변에 비해서 지대가 높다보니 방문할때는 편한 신발을 신는것을 권장한다.  If you visit at night, you can see the lights of the city.  It is often used as a dating course for lovers. It is good for walking and some exercise equipment. It's a great place to take a walk after dinner after watching a performance or musical.  The area is high compared to the surrounding area, so it is recommended to wear comfortable shoes when visiting.",별표 5개,5년 전
정원주,낮에는 산책길로.. 밤에는 야경 맛집~,별표 4개,2년 전
JJ Kim,서울 야경하면 항상 남산타워를 떠올렸는데 낙산공원을 방문한 이후 바뀔 정도로 너무 좋다. 흥인지문근처에소 3번 마을버스를 타고 올라가서 야경을 보면서 미리 준비한 캔맥주에 빨대를 꽂아서 먹었던 그 맛고 운치를 잊을수 없다. 멀리서 보이는 남산타워의 미세먼지수치 불빛과 어느 누군가의 집들과 빌딩의 불빛들~~ 너무 멋있다. 가끔 센치해졌을때 캔맥주 하나 사들고 올라가서 야경보고 오면 딱 좋을 곳이다,별표 5개,6년 전
HY K,언제가도 좋은 곳. 서울의 최고 힐링장소가 아닐까,별표 5개,5년 전
GJ Sim,"적당한 경사로가 운동하기 딱 좋은 곳이네요. 경치도 좋아요. 단, 아침 일찍이나 어두울때, 사람없는 곳에. 여자 혼자 다니실때 조심하세요. 친구가 가끔 운동하는데 이상한 분들을 만난다네요...",별표 5개,수정일: 4년 전
이안,"성북동, 동대문, 대학로, 남산, 날 좋으면 더 멀리도 잘 보이는 곳 성곽과 도심 전망이 잘 어우러지는 멋진 장소 낮의 풍광도 밤의 야경도 모두 좋다. 이젠 너무 유명해져서 예전 사람이 드물었던 그때가 그립다.",별표 5개,3년 전
Pinkdaejang핑크대장,고지대에서 바라보는 서울 도시 풍경 너무 이쁘지만 너무 경사가 높은 고지대네요 ㅠ 낙산공원주차장 차로 가는 길도 급경사.. 바로 옆 이화벽화마을도 이뻐요. 데이트하기 굿,별표 3개,수정일: 5년 전
Jh P,날 좋고 풀렸을때 산책삼아 가기 추천합니다. 야경도 좋고 썸 탈때 가도 좋지요. 산책 후 내려가서 한성대 앞 먹자골목에서 술 한잔하면 더할 나위 없습니다. 주차는 공영 주차장이 있으나 운동삼아 걸어가길 추천합니다.,별표 4개,5년 전
윤석진,한양성과길 1~2코스 걷기,별표 4개,3년 전
T채널,대학로에서 산챡하며 데이트하기 좋은곳. 성곽에서 서울 시내를 배경으로 찍는 사진도 인상 깊다. 공원 바로 앞까지 차를 갖고 올라가면 주차장이 있긴한데 몇대 세우지 못하는게 아쉽다,별표 4개,4년 전
Jay Lee,"경사가 급격하지 않습니다. 인근 주민들의 주요 산책로입니다. 고양이가 많습니다만, 중성화되지 않은 개체가 없는 것으로 보아 관리가 잘 되고 있는 것으로 보입니다.",별표 4개,3년 전
김명옥,서울시내를  빙둘러 다 볼수있는 중심지의 낙산공원 처음 가봤는데  올라가는길이  시골같은 느낌과  마운틴하우스의 특권같아 약간불편하지만  벗꽃의 아름다음이  반올림이되네요. 휴식공간이 많아 너무 좋았어요.^^,별표 4개,4년 전
lala Kim,음..티비에서 보는것과 달랐어요. 화장실 공사중이라 임시화장실 사용해야해서 불편했는데..지금은 완공했겠죠. 그래도 올라가니 시내가 보이고 좋았어요.,별표 5개,2년 전
JONG CHAN HONG,차로 가기엔 골목이 꽤 비좁고 주차 공간이 넓지 않은 편. 공원은 성벽을 따라 수직적으로 연결되어 있으므로 가볍게 등산하는 마음으로 가도록 합시다,별표 4개,3년 전
나무,밤에 가는 낙산공원은 항상 좋은듯,별표 5개,6년 전
박카스(치질엔박카스),서울 종로 시내가 한눈에 보여요 낮보다는 밤에 더 이쁘고요 앞쪽에 주택을 까페로 바꾼데 가도 야경이 좋아요,별표 5개,2년 전
프링글쎄?,"한성대쪽과 혜화역쪽에서 올라갈수있습니다.  내려다보는 뷰는 대학로와 성북동쪽이 좋고,  한양도성길을 따라 동대문까지 걸어보는 것도 좋습니다. 성곽안쪽은 따사로운 햇살이 비치지만 밑에는 그늘져서 온도차이가 있습니다. 야경이 좋고 이화동벽화마을이있습니다.",별표 5개,6년 전
김태현,서울 도심안에 성곽을 둘러싼 산책길로 높진않으니 서울시내가 한 눈에 이쁜야경과 이쁜 찻집도 즐비.한 시간 거리로도 충분히 느낄 수 있는  둘레길,별표 5개,3년 전
GWANG NATM,"오르막길이 가파르고, 차를 가져가기에는 주차장이 좁고 길도 좁아 불편하지만, 옆에 이화벽화마을에는 이쁘고 뷰가 좋은 카페들이 많고 길도 이뻐서 날씨 좋을때 가면 정말 좋습니다!",별표 4개,6년 전
푸른하늘,동대문역 10번 출구에서 나와서 큰 길 건너면 낙산공원으로 올라가는 초입이 보입니다. 갈대밭이 우거진 성곽길따라 걸었더니 스트레스도 풀리고 좋네요. 유명 카페도 있고 좋습니다.,별표 5개,5년 전
강지영,"대학로 뒷쪽으로 식사하고 산책로로 좋은곳, 이화벽화마을도 지나고 남자친구 등 드라마 촬영지기도 함. 아이스크림 맛집도 있음. 윗쪽에는 맛집은 별로 없으므로 식사는 대학로에서 하고 차나 아이스크림 후식을 경치 좋은 낙산공원에서 하세요. 생각보다 계단도 경사도 있으므로    몸이 불편한 분은 고려 하세요.",별표 4개,5년 전
top jeon,너무 좋음 ㅋ,별표 5개,1년 전
K Fury,"낙산공원은 일몰 부근의 시간에 가시는 걸 추천드립니다. 공원 자체가 언덕에 있어서 차량을 많이 이용하시는데, 공원 자체의 주차장에 수용 가능 차량이 약 20대 남짓이라, 비추합니다. 가능하면 대학로 근처의 공영을 이용하시고 중앙 광장 쪽으로 올라오는 길로 걸어가심을 추천드립니다",별표 5개,5년 전
아리송삼,산책하기 아주 좋고 관광객들도 많음,별표 5개,5년 전
Andy Yang,가보고 싶었던 곳이였는데 너무 좋았어요 추천!,별표 5개,4년 전
이은령,도심 한가운데 성곽길.여유.조용함.탁 트인 전경. 시원한 바람. 볼거리.까페들,별표 5개,6년 전
한주영,"C 산책하기 아주 좋은 공원이며, 잘 관리되고 있는 곳. 천천히 한번 산책하기 좋은 공원. 성벽을 따라 걷는 코스와 맨 위에서의 전경이 좋음.",별표 4개,4년 전
의사가 바라보는 따뜻한 세상,서울안에서 성벽을 거닐 수 있어서 좋았어요,별표 5개,5년 전
아이아이,서울 야경이 멋진 곳입니다..,별표 5개,4년 전
Hooni,야경 보고 산책하기 아주 좋네요,별표 4개,6년 전
Nicholas Ph. Park,"미국에서 지인이 오랫만에 고국방문했는데 가이드는 그분이 하셨어요, 나보다 아는곳이 많아서요, 혜화동은 고등학교 졸업때까지 살던 곳이고, 동숭동은 친구들이 살던 동네인데 세월이 흘러 모두 떠나고 그 자리에는 낙산공원이란 훌륭한 명소가 생겼네요. 낙성대 옛성터 시간내서 방문해보세요, 강추할께요!",별표 5개,3년 전
Kihong Kim,오랫만에 서울구경 다녀왔습니다. 날씨가 그런대로 화창해서 서울 전경을 보기에 더없이 좋았던거 같습니다. 주변에 작은 가게들도 있어 예쁜 간식거리도 사들고 왔습니다.,별표 4개,4년 전
이용석,많은 분들이 차로 가시면 낙산공원 주차장 찍고 가실거에요.찍고 가시되 거의 다 도착했을 때는 차를 밑에다가 주차하시고 걸어서 올라가시길.  주차장이 좁아서 대부분 길가에 그냥 주차하는 사람이 많음. 진입하는 차 나오는 차 때문에 막혀서 오도가도 못하는 경우가 많음.,별표 4개,5년 전
이석호,성북구에서 오래살았는데 이곳이 이렇게 변했을줄이야.. 화장실 공용화장실 있습니다.,별표 5개,1년 전
김나연,야경 너무 이쁘고 낙산공원 올라가는 동네도 이쁨이쁨,별표 5개,3년 전
대한민국작업치료 달인,대학로에서 밥 먹고 산책하기 좋네요.,별표 5개,3년 전
김주안,"공원 자체는 좋습니다. 성곽길이 주는 운치가 나름 멋져요. 단, 공원 전체를 점령한 모기떼가.. 오후 7시 이후부터 나타나기 시작해요.",별표 5개,5년 전
Geon Woo Choi,서울에서 이만한 공원 찾기 힘들죠,별표 4개,5년 전
JY Bae,가까운 곳에서 벚꽃구경을 제대로 할 수 있는 곳...,별표 5개,5년 전
샬랄라,도심 속 이런 공원이 있다니~참 좋네여^^,별표 5개,4년 전
남영숙,여름에 가면 좀 더워요 오르막이랑 계단이 많아서 더한 것 같아요,별표 5개,11달 전
da Lee,공원 자체는 아름답지만 공원 초입의 좁고 가파른 골목길에 불법주차 차량이 너무 많다. 다음에 가게 된다면 불법주차를 모두 신고할 것... 혜화역에서 걸어서 가면 가장 쾌적한 공간이 된다.,별표 2개,6년 전
Sunkug Caleb Jung,"청명한 하늘, 시원한 바람, 다정한 가족과 함께, 그리고 어고집 밥.",별표 5개,2년 전
moon kiss,산책하기 조아요^.~,별표 5개,5년 전
법광거사,"성곽을 따라 걸으면 역사를 거슬러 여행하는 기분입니다. 계절 따라 색이 다르며, 길모퉁이 마다 만나는 고양이는 동화책을 뚫고 나온 듯 합니다. 서울의 밤야경과 옛정취 모두 느낄 수 있는 최고의 명소입니다.",별표 5개,6년 전
이정민,밤에 가면 경치 좋고 시원해요,별표 5개,5년 전
Redstone68,천천히 서울의 경관을 완상하기 좋은 도심 공원,별표 5개,수정일: 5년 전
寓林,산책하고 한성성곽의 미를 느끼기 좋음,별표 4개,4년 전
Sangwon Ahn,개인적으로는 전 여자친구와의 추억이 담긴 곳. 예전에는 사람이 없었는데 방송으로 유명세를 타서 그런지 사람이 많아진게 흠이다. 아름다운 야경과 운치가 있어 데이트 하기 좋다.,별표 5개,7년 전
스테고마그마,서울 전경이 훤히 보여서 확 트여요.,별표 5개,2년 전
Jong-Woo Kim,주차불편 야경좋음 산책하기좋은곳,별표 5개,4년 전
남효선,산책과 야경 모두 즐길 수 있어요^^,별표 4개,5년 전
채왕표,높지않아 부담없이 올라가 둘러보기 좋습니다. 경치는 탁트인게 아주 좋네요.추울때 말고 따뜻할때 오는걸 추천합니다.,별표 4개,4년 전
정내영,저녁에 다녀올만합니다,별표 5개,1년 전
keywan lew,"젊은 커플 산책 필수 코스. 야경이 일품이다. 가끔 토끼도 보인다. 주변 거주민들 저녁 운동하러 많이들 오심. 배드민턴 정답게 치는 모습이 보기 좋다.  성벽 위에 올라앉으면 조망이 아주 좋고, 둘만의 얘기도 할 수 있고, 옛 유적지 느낌이 물씬 나지만,  안전상의 이유와 성벽 손상 우려로 보안요원이 돌아다니며 제재하곤 한다. (웬만하면 올라가지 않는 것이 좋겠습니다.)  성벽 위에서 보이는 서울이 너무너무너무너무 예뻐서 차라리 관리측에서 돈을 들여서 비슷한 구조물을 만들어줬으면 하는 소망이 있다.  나무가 많아 공기도 맑다.  유일한 단점은 경사가 좀 있어서 굽 높은 신은 힘들 수 있다는 것.",별표 5개,8년 전
수요Suyo,말해뭐해 아주 좋아요! 일몰명소 야경명소 ㅎ,별표 4개,6년 전
황현이,오르막길은 부담스럽지만 모처럼 맑은 하늘,별표 4개,6년 전
뚜뚜,"여름엔 모기가 많아요. 정말. 엄청 그래도 나들이가기엔 도심속에 괜찮은 편이고, 강아지들 산책하러 오기에도 좋아요! 사람이 너무 많아졌고 여름엔 모기때문에 비추요!!",별표 3개,5년 전
이멋진인생,산책하기 좋아요~~~,별표 5개,4년 전
sangmin lee,"조선시대 수도 한양은 풍수지리의 명당이였고, 그 한양 동쪽에 있는 산이 낙산이였다. 고도가 높지 않아서 가볍게 오를수 있고, 마을버스가 있어서 버스를타고 공원까지 가기 좋음(종로03번 버스/종로5가역, 동대문역, 동묘앞역, 창신역에서 탈수있음) 전망대들이 서울시내를 보기 좋았고 한양도성성곽길이 있어서 복원된 성벽을 따라 걷기에도 좋음. 특히 야경이 멋있음. 낙산공원 근처에는 이화동벽화마을이 있고, 따라서 내려가면 대학로가 나와서 서울여행시 방문하기 좋은곳.",별표 5개,수정일: 5년 전
dlfma,"날씨 좋은 날, 석양이 아름다운 날은 늘 이곳으로 가고 싶다 생각하게 합니다. 아름다운 서울의 풍경을 한 눈에 볼 수 있는 곳입니다.",별표 5개,7년 전
김숙현,"친 환경을 간직하고 한양도성을 품고있고 높은곳에 위치하여 강북을 한눈에 볼수있는 곳입니다. 특히 밤 야경이 너무 아름답습니다. 동대문,창신동, 혜화동, 성북동, 삼선동,보문동 등등 매우 근접거리에 있습니다. 오셔서 여름 밤풍경 한번 보고 가시기를....",별표 5개,6년 전
박태성,"등산코스라 살짝 힘들지만, 야경과 성벽을 본다면 이야기가 달라지는 곳. 겨울철에는 4시쯤 가서 일몰 보고, 카페에 있다가 6시쯤 올라가는거 추천!!",별표 4개,4년 전
Asol,공원올라가는 길이 심심치않다는것이 가장큰 장점  꽃이 그려진 계단과 뭔가 이야기하는듯한 조각상..  그리고 DSLR을 가진 사람들이 좋아할만한 장노출이 예쁜곳 등등  데이트코스로도 좋은곳,별표 4개,9년 전
박현준,서울  최고의 야경을 볼수있다.강추,별표 5개,5년 전
홍지원,서울에서 보는 뷰중에 좋아하는곳,별표 5개,6년 전
대충잘살자,토요일 밤에 갈곳없나 검색하다 드라이브겸 찾아갔습니다. 성벽을 따라 산책하고 서울야경을 감상할수있어 매우 행복하였으나 주차장이 방문객 수에 비해 협소하고 빠져나가는 길이 불법주차 차량때문에 매우좁아 후진하다 휠이 긁이는등 멘붕이 올뻔했습니다. 후진에 자신없는 분은 걸어가는것을 추천드립니다.,별표 4개,5년 전
Austin Yoon,서울을 조망할 수 있는 휴식공간으로서 이화동의 벽화골목과 함께 어울어져 한 번 쯤 방문해볼만한 곳입니다. 특히 서울의 성벽을 따라 걸으며 야경을 즐기기에 좋은 곳입니다.,별표 4개,7년 전
kh Lee,"좋다.시원하다.약간의 운동도 된다.성곽 안팍으로 다녀볼 수 있어서 더 좋다. 창신동,삼선동,혜화동,충신동에서 다 올라갈 수 있다. 낙산정상에서 바라보는 인수봉,수락산,불암산의 모습도 좋다. 경복궁의 4대 주산인 인왕산,낙산,목멱산,북악산을 모두 볼 수 있는 점도 낙산만이 가진 매력이다. 좀 더 시간을 갖고 느리게 다녀보고 싶다.",별표 5개,4년 전
karina,북악 스카이웨이와 세트로 묶어서 가시면 됩니다 역시 별 5개에요. 산책하기 넘나 좋은것. 특히 야경 모야모야 역시 서울의 야경을 담당하는 낙산공원 산책로다~ 이 말 입니다,별표 5개,6년 전
mikael yeom,"한국의 공원들은 정리나 관리 등에서 볼때 단연코 세계 최고 입니다. 낙산공원도 그 중 하나이구요. 코스만으로 볼때는 남산보다는 짧고 용이해서 산책으로 좋구요, 서울 야경 보기로는 최고의 코스입니다.",별표 5개,3년 전
Jaeho Shin,높다  입장료없이 갈 수 있는 4~5성급 경치. 그런데 진입하는 마을버스의 노선이 돌고 돈다. 나머지는 대부분 좋고 대학로 쪽 내려오다 마시는 맥주가 맛있고 이지역은 오래전 고교얄개의 촬영지이기도 했던 낙산아파트가 있었다.,별표 4개,수정일: 6년 전
HDK,높지는 않아도 서울을 전체적으로 전망할 수 있는 도심 공간. 바로 옆 대학로등 메이저 번화가에서 즐가다 조용히 다정한 사람과 여유롭게  산책하기도 좋고,별표 5개,6년 전
GM Lim,"잘 다듬어진 길, 잘 다듬어진 공원, 사람들이 사는 한적한 길도 걷고, 바람도 시원하고. 혜화역에 내려 공원으로 올라가 성곽을 따라 걷다보면 동대문으로 내려올수 있는 좋은 데이트 길",별표 5개,6년 전
_ Haechi,"산책하기 좋은 공원. 대학로 바로 뒷편에 위치하고 있어서 접근성도 용이함. 낙산공원 올라가는 길에 있는 마을의 골목에 다양한 그림이 그려져 있고, 인근의 표지판도 재미있게 꾸며져 있음. 주차장이 있기 때문에 차량을 이용해서 올라가도 됨.",별표 4개,4년 전
종이빨대시러욥,좋습니다. 밤에가면 특히 이쁘네요 ㅎㅎ,별표 5개,4년 전
이정아,대학로 바로옆에 이렇게 근사한 공원이 있는지 몰랐어요 지도로 볼때는 운동장이 있나 했었는데 실제로가보니 산등성이 언덕을 잘가꾸어서 멋진 산책로를 만들었더라구요~ 나무가 많아서 공기도 달랐어요,별표 4개,7년 전
안희원,"저는 낮에 다녀 왔는데 밤이 훨씬 예쁠 것 같아요. 연인과 함께 걸으면 여행 온 느낌도 나고, 도심에서 이런 기분 느낄 수 있어서 좋았어요!",별표 5개,4년 전
Younghoon Yang,혜화동에 놀러오신분들은 꼭 한번 방문하시길 추천 합니다. 가파른 계단이나 산책길이 몇개 있기는 하지만 길지 않고 등산복이나 등산화가 굳이 필요없는 가벼운 산책로 입니다.,별표 4개,4년 전
피자,이뻐요 새벽인데 사람도 없고 좋네요,별표 5개,4년 전
바간미,아들과의 데이트  서로  소통하는 시간 ㅋㅋ 주차가  넘 힘듬  ㅠㅠ   그리고  좁은 길에  주차한  외제차들  진정  짜증났어용^^,별표 5개,4년 전
비바람 (비바람),좋아요. 시원하고. 편안하고...,별표 5개,3년 전
김시은,강아지산책하기좋음 주차장은 없음 야경은 예쁨,별표 4개,4년 전
뚱전,도심속 쉼터 해돋이와 해넘이를 함께즐길수 있고 가벼운산책코스로도 좋다 북한산과 남산의 단풍도 즐길수있고 저녁 도심야경또한 일품인곳 연인들의 데이트장소로도 좋은곳,별표 5개,4년 전
김인식,매일 운동삼아 오르는 낙산공원 날마다 반기는 길냥이들이 있어 더 재미를 더 해주네요. 내가가는 그 길이 힘들고 고돼도 매일 함께하는 아내가 있어 행복합니다.,별표 4개,5년 전
DH Lee (DH Lee),서울에 사람 없는 몇 안 되는 공원. 벽화마을등이 가깝다,별표 5개,11달 전
Changkeel Lee,산책하기 좋습니다,별표 5개,6년 전
이비니,"사랑하는 사람과 같은 별을 바라보며 데이트할 수 있는 장소. 다만 너무 많은 커플이 있어 조용하지는 않고, 언덕길을 올라가다보니 여자친구의 구두를 걱정해주어야 하는 장소. 다시 또 오고 싶다 그녀와",별표 5개,5년 전
가드닝,4월중순 봄꽃들이 혜화문쪽으로 가는 성곽길을 따라 넘 이쁘게 피어있고 틈틈이 라일락향기가 솔솔~ 서울한복판에 이렇게 이쁜 산책로가 있을줄이야 힐링산책길이에요,별표 5개,6년 전
이현숙,평일 만추를 느끼며 좋은 걸음했음,별표 5개,수정일: 3년 전
모나리자,서울에 이런곳이 있었내요. 밤에 가니 더 좋아요. 남산타워도 보이고 전망좋고 성구경도 좋고 걷기도 좋고 운좋아 공연도 덤으로 봤어요.,별표 5개,6년 전
고영진,성곽도 예쁘고 야경도 멋져서 좋아요,별표 5개,3년 전
최종선,낙산공원 좋아요 ! 주차장도 싸요 !,별표 5개,6년 전
