작성자,내용,별점,작성일
소지현,"해돋이 보러가기 좋은장소, 드라마 ""파리의연인"" 촬영지로도 유명하며, 데이트장소로 굿~  입니다",별표 5개,7년 전
Sohee Lim,산책하기 참 좋은 장소입니다!,별표 5개,1년 전
전쟁의신,"좋은 경치, 멋있는 경치",별표 4개,6년 전
S삿쨩,입구쪽 모기 많아요오 ㅠㅠ 그런데 사진은 예뻐서 좋아요 9월인데 한...6시반쯤 불켜지네요,별표 4개,5년 전
블루보넷,낙산공원 연인끼리 산책하기 좋은 코스이고 야경이 엄청 멋있어요.,별표 5개,4년 전
sungsik park,동네 근처고 시간이 되면 자주 방문하는 곳이네요 산책겸 야경보기 좋아요,별표 4개,5년 전
Subin Ahn,야경 예뻐요 환절기에 가세요!!,별표 4개,5년 전
잉뵤,좋아용 드디어 가봤다😉…,별표 5개,4년 전
김무문,낙산공원 산책하기 좋음,별표 5개,6년 전
DJ,성곽과 내려다보이는 서울 도심의 풍경이 좋아요. 너무 붐비지도 않구요,별표 5개,9년 전
모태환,"사람이 많습니다ㅎ 사진찍으실려면 9시 넘어서 가시길,,",별표 5개,1년 전
김소영,"매점에서 고양이간식 팔면 무지 잘팔릴듯.. 길고양이들이 개냥이 수준,너무 귀여워요",별표 4개,5년 전
SH YOON,해질녘 올라가면 너무 좋아요,별표 5개,6년 전
s모닝플라워,주차 저렴하고  화장실도  있고 근처에 구경할상점이  많아서  좋았어요~^^♥,별표 5개,6년 전
Young-ho Ahn,어렸을 적에 살던 곳이 너무 많이 변했다 창신동꼭대기 오형제우물가에서 아카시아꽃 따 먹던 때가 엇그제 같은데!,별표 5개,3년 전
김민지,대학로의 번잡함에 질릴 때 조금만 올라가면 서울 시내가 한눈에 보이는 풍광에 감동하게 됩니다.,별표 5개,5년 전
Jijung Kim,도심내에서 미처 몰랐던. ...   이화마을과 같이보면  다닐만한 귀여운공원,별표 4개,2년 전
Seung pil Choi,성곽길 걷다가 공원에서 쉬고 좋습니다. 서울에 참 볼게 많네요,별표 4개,4년 전
Avengers Ironman,서울시내를 내려다 볼수있고 대학로 이화마을하고 연결되어 있어 데이트 코스로 좋다.,별표 5개,8년 전
김희보,흥인지문 옆 성곽으로 거닐면서 남산 서울시일원등이 조망되어 휴식을 가질수 있는 장소이기도 합니다,별표 4개,6년 전
전홍열,한가롭게 산책하기 좋고 대학로 동대문등 하고 연계해서 돌아다니기 좋은 곳,별표 4개,2년 전
Leo Lee,대학로에서 올라가면 좋아요.. 능선따라서 내려가면 동대문이 나옴.. 산책길로 좋아요,별표 5개,4년 전
Tree,산책하기 좋고 조금만 올라가도 풍경이 다 보여요,별표 5개,4년 전
우주인,서울 시내가 한눈에...,별표 5개,7년 전
Oh Kwangjoo,비오는 날 낙산공원...서울의 좌청룡에 올라타다...,별표 5개,5년 전
ssemissi _33,"성곽따라 걷기좋은곳. 야경도 좋고, 낮에 운동하기도 좋아요",별표 4개,6년 전
Y hk,아담하지만 정말 운치있고 아름다운 공원이에요 공원과 연결된 이화동벽화마을도 재밌어요,별표 5개,6년 전
구충일,왜 여기로 데이트오는지 알겠음 적당한 등산 적당한 산책 적절한 조명으로 썸타는사람들은 이곳가면 좋아질꺼같음,별표 5개,5년 전
Enoch Seo,"서울 시내가 보이는, 이곳만의 낭만이 있는.. 사계절 언제나 매력적인 곳.",별표 4개,5년 전
문슬기,"운동, 산책하기에 좋은 곳이에요. 대학로로 걸어서 다닐 수 있어서 좋아요.",별표 4개,수정일: 6년 전
임승영,강아지 산책하기 좋아요^^~ 보호자가 오르막을 손쉽게 다닐수 있다면😅😄…,별표 4개,4년 전
Jay Chung,남한산성 느낌이고 서울 도시를 한 눈에 볼 수 있어서..좋습니다,별표 4개,4년 전
김상호,한양도성 낙산공원은 수많은 볼거리와 서울시내를 한눈에 두루볼 수 있습니다.,별표 4개,6년 전
j 62,생각보다 오르긴 쉽지않지만 성곽길과 멋진 야경이 있다.,별표 4개,2년 전
노재용,더운 날씨에 올라가면 땀 쏟아짐 벚꽃 날릴 때가 최고,별표 5개,1년 전
빈츠_Rod breaker,이화마을가 가까워 함께 들리면 좋고 일몰과 조형물들이 예쁘고 성곽도 좋고 방문도 편함,별표 5개,8년 전
복길복길,펑트이는 시야와 줄줄이 늘어선 벽을 따라 걷는 산책로의 맛... 애인과 함께 산책하기 좋은 길.,별표 4개,7년 전
우당탕,좋긴한데 성벽에 기대면 혼나요ㅋ,별표 5개,5년 전
카프리,"숲이우거지고경사가좀있으나걷기에좋고,전망대에서의서울시내경치도좋았으나벤취등쉴곳이적어아쉬웠습니다.",별표 4개,3년 전
이명재,전망과 조경상태가 좋습니다 가족과 또는 연인과의 좋은 추억의 장소로 좋와요,별표 4개,6년 전
류아연,자연스런 새소리 바람소리 산들거리는 숨소리 어린 아이의 웃음 소리 기분 좋은 소리들을 만날 수 있어요.,별표 5개,수정일: 6년 전
S K,생각보다 좀 가파르긴 하지만 정취가 있는 좋은 산책로이자 야경감상할 수 있는 데이트 코스다,별표 4개,6년 전
성천재,주차장도 있다 하지만 꽤 기다려야만 했다 저렴한 가격으로 여유로운 휴일을 보낼 수있는 곳,별표 3개,7년 전
two sa (이사),"성곽길도 운치있고 산책하기에도 좋은곳, 누구에게나 부담없이 추천할수 있는 코스임",별표 5개,8년 전
seongil kim,산책하기 좋아요,별표 5개,7년 전
해랑공예창작소,산책.운동.쉼터로 좋음,별표 4개,수정일: 4년 전
현승정,수직으로 올라간후 3방향의 바리에이션 야경좋고 성벽의 질감이 좋다 메직컬캣츠,별표 5개,4년 전
비텐펠트,너무 너무 예뻐요. 데이트 코스인 이유가 있어요. 근데 차 가지고 오기에는 조금 불편해요 ㅠ,별표 5개,4년 전
꼴뚜기왕자,산책하기도 좋고 날씨 좋을때 낮에 뷰도 아주 좋음,별표 4개,4년 전
Audrey,힐링하고 왔어요,별표 5개,2년 전
신승환,언제가도 좋은곳 오늘처럼 날씨가 좋은날에는 정말 좋아요,별표 5개,3년 전
배준혁,풍경이 참 아름답습니다. 늠름하게 생긴 고양이도 있구요. 한번 놀러가보세요.,별표 5개,4년 전
양진아,야경이 정말 예쁜장소,별표 5개,6년 전
정용호,낙산공원에는 벌개미취가 한창.가을이익어가고 잌씀.가을바람이 한결 시원한 느낌이 든다.,별표 4개,2년 전
한솔,좋지만 여름에 모기가 조금 많습니다! 하지만 야경이 이뻐서 추천드립니다~,별표 5개,7년 전
Yujin Lee,성곽길을 따라 걷기좋고 벚꽃 개나리꽃이 피어있어 서울경치와 어우러져 멋짐,별표 4개,6년 전
노미애,성곽으로 걸으니 너무 좋네요,별표 5개,1년 전
woody,야경이 좋은곳. 근처 절벽마을도 다녀오세요~,별표 5개,2년 전
용석정,산책하기 좋은곳,별표 5개,3년 전
ASMR치유 번역,생각보다는 가파르지만 야경을 생각하면 좋았네요. 연인이랑 사진찍기 좋아요!,별표 4개,5년 전
박수동,오르막길이 가파르긴한데 분위기는 괜찮네요 야간에 가는것을 추천,별표 4개,6년 전
白正賢,서울에 30년 넘도록 살아도 한번 안가봤는데 벚꽃이 흐드러지는 모습이 정말 감동있었다.,별표 5개,8년 전
안녕,오르는 길이 은근히 힘들지만 그만큼 전망이 좋고 특히 서울성곽이 그 정취를 더해준다,별표 4개,6년 전
안인숙,사대문안에  서울구경하면서 감성에도젖고 저녁노을까지 데이트 코스 최고,별표 4개,4년 전
소금안친곰국,좋아요! 저는 성곽길 좋아해요 오랜만에 오니 감회가 새롭네요 날씨는 쫌 더웠지만!,별표 5개,5년 전
호랑이,나는 여친이랑 와서 좋았지만 너희는 아니지,별표 5개,6년 전
이름성,야경이쁜건 알겟는데 너도나도 성벽에 다닥달라붙어서 사진찍어서 보기좋그래요,별표 5개,5년 전
SeungHyun Lee,산책하기 너무 좋음,별표 5개,4년 전
아담한아담스미스,밤에 가면 화려한 야경과 조명켜진 예쁜 성벽이 당신을 반겨줄거에요.,별표 4개,5년 전
Seonhyeong kan,날씨 좋은날 올라오면 풍경정말 좋습니다~ 산책하기도 좋습니다,별표 5개,수정일: 6년 전
Bike Gill,대학로 연극보러갔다 낙산공원공영주차장이용하였음  6시간 주차 주차비 저렴하고 좋았음,별표 5개,5년 전
권남식,옛날 성외곽과 서울의 경치와 한곳에 섞이 야경 최고예요,별표 5개,5년 전
김경미,주차장이 협소하고 걷기는 힘들어요 불법주정차해야해요 주변에 쉽게 들어갈만한 사설주차장도 없어요,별표 3개,5년 전
Cho Grace,서울성곽 일부를 볼 수 있는 공원입니다. 주차시설은 좁습니다.,별표 4개,5년 전
J M Lee,갈때마다 좋아지네요.. 한바퀴돌고 대학로로 나와서 구경하니 좋네요,별표 5개,4년 전
HJ Park,마로니에 공원 뒤의 낙산공원,별표 4개,5년 전
전성호,서울 전체가 볼수있는 아름다운 역사 내요.아들과 데이트 코스.파주원주민,별표 4개,5년 전
choco mani,언제가도 존좋,별표 5개,3년 전
Amy Kim,딱히 힘들게 올라가서 볼게없음ㅋㅋ 인증샷이 전부..,별표 3개,6년 전
노영준,야경이 멋지네요~근데 주차가 어려워서 차가지고 가는건 완전 비추입니다,별표 5개,5년 전
김진협,지금 코로나때문에 낙산전시관이 닫은게 아쉬웠음. 근데 야경이나 길거리가 매우 좋음,별표 3개,5년 전
문경민,올라가긴힘들었지만 경치가 너무 이뻤어요,별표 5개,5년 전
김일훈,데이트하며 산책하기 좋아요. 연인이 없는 관계로 별 1개 차감 ㅠㅜ,별표 4개,5년 전
김재민,서울의 경치를 한 눈에 볼 수 있는 곳. 올라가는 게 조금 힘듦.,별표 4개,3년 전
cg han,야경이 이뻐요,별표 5개,2년 전
Maya,밤경치도 좋아요 성곽과 산책길이 멋진곳,별표 5개,6년 전
주지태,서울 도심을 감싸는 산의 전경과 건축물 그리고 이화동 벽화마을이 함께 어우러진 휴식장소입니다.,별표 5개,6년 전
진국인 남자,주차 시설이 불편하고 풍경은 생각보다 와~~~이정도는 아니네요~~^^ 그래도 한번은 가볼만합니다!,별표 3개,4년 전
홍재영,서울 경치 보러가기 좋아요 하지만 버스타고가세요 주차하고 올라가기 겁나힘드네요,별표 5개,5년 전
윤윤윤,밤에 갔는데도 주차난  심지어 길은 더럽게좁음 초보운전은 안가는게 나을듯,별표 4개,3년 전
Na Na,밤에 걷고 데이트하기 좋은 곳이다. 사진찍기도 좋고 멋있다.,별표 4개,7년 전
Yj Kim,야경이 너무 좋네요~ 이쁘게 꾸민 카페들도 많이 있어요,별표 4개,8년 전
신상화,야경이 대단히 훌륭합니다.,별표 5개,4년 전
김충국,서울 야경 구경하기 좋아요~~~ 데이트 코스로 무조건 추천입니다^^,별표 5개,6년 전
로버트,대학로 주차장 중에서 가장 싼곳임 대학로 차몰고 갈일 있으면 여기나 방송통신대학에 주차하세요 제일 쌉니다,별표 4개,6년 전
Jihye Park,산책하기좋고한눈에내려다보이는탁트인전망도좋아요,별표 5개,5년 전
전종호,성곽을 잘 보존해 놓았어요. 서울시내가 훤히 보입니다.,별표 5개,3년 전
Eonya Seo,산책 데이트로 좋은 장소 좋아요 제가간날은 미세먼지가 너무 많았지만,별표 4개,7년 전
J.K LEE,밤에 산책하기 좋아요. 야경이 굳 단점은 커플 오지게 많음,별표 5개,수정일: 6년 전
이학철,"동대문,성북지역이 내려다 보이는 한양성곽에 위치하여 인근 주민들에게 인기있는 공간",별표 5개,3년 전
김린,밤에 술먹고 친구랑 산책하기 딱 좋음. 성곽에는 올라가지 맙시다..,별표 5개,5년 전
장시욱,차량을 이용하면 많이 걷지 않고도 서울 야경을 감상할 수 있습니다.,별표 4개,7년 전
DH,가볍게 산책하거나 데이트 장소로 좋아요 언덕이다 보니 조금 힘이 들어요,별표 4개,8년 전
김당빠 (김당빠),좋아요  밑으로 좀 걸어내려가면 개뿔커피숍있어요 레몬차가맛있네요,별표 5개,4년 전
정광호,야경이 멋있는곳. 한양도성길 2코스 중간에 위치하고 있습니다~,별표 4개,4년 전
Myeonghee Kim,대학로 야경을 한 눈에 내려다 볼 수 있어요. 그러나. 올라가는길이 약간 가파르니 하이실은 피해주세요,별표 4개,6년 전
칡뿌리,좋아요 항상 갈때마다. 주차는 너무 어렵네요,별표 5개,2년 전
이종희,날씨좋고 미세먼지가 없어서 걷기 좋아요 벚꽃이 흩날려요,별표 5개,4년 전
송현호구글,산책이나 데이트코스로 괜찮은 듯. 산이라 높은감이 있지만 버스가 다닌다.,별표 4개,6년 전
이은혜,여름에 올라가는건 비추 바람 살살 불면 행복. 올라가는 순간 야경이 예쁨,별표 5개,6년 전
일주일에한번하는 먹방,야경은 낙산공원 ^^,별표 5개,5년 전
하종인,낙산공원 성곽도 있고 야경도 좋고 주차는 힘들고 걸어올라가기에 멀진 않음,별표 4개,6년 전
wonsook jo,야경이 아름다워요 저녁에 운동하는 분들도 많습니다,별표 5개,5년 전
김일용,동대문에서 출발해서 이화마을  거쳐 낙산공원까지 걷기 좋아요,별표 5개,8년 전
이지호,밤에 다녀왔는데 생각보다 더 리얼로 분위기 갑입니다. 강추 두번 추천!,별표 5개,5년 전
장영태,쉽게 갈수있고 올라가면 경치가 아주좋음.,별표 5개,1년 전
신경수,옛 한양 도성을 잘 복원하여 가꾸어 둘레길을 걷는 일이 즐겁고 행복했습니다.,별표 5개,3년 전
이영주,산을 오른다 생각하고 해가 뜨거울 때는 피하고 해진 후에 가는게 좋음,별표 5개,6년 전
지금의 행복에감사하며,경사가 있는 구간이 조금 있지만 남녀노소 누구나산 책하기 좋은곳입니다.,별표 4개,6년 전
Oh Myoung Sik,가볍게 산책코스로 가서 야경과 북한산을 시원하게 볼수 있는 장소,별표 5개,4년 전
주석천,"밤산책하기 좋은 공원, 동대문쪽보다 한성대쪽으로 걸으면 한적하고 좋다",별표 4개,5년 전
Jae-soo Ko,야경이 좋고 드라마 촬영에도 종종 이용됨 산책하기 좋음,별표 5개,9년 전
시가소은,야경이 멋진곳이지만 주간에도 좋아요,별표 5개,5년 전
이상면,"도심에서 깨끗한 공기, 멋진 경관과 야경을 볼수있는 넘버2 장소입니다",별표 5개,6년 전
이시경,야경이 정말 최고인 야경맛집..둘레길 산책로도 정말 좋아요.,별표 5개,4년 전
임경선,해지기 직전 올라가면 멋진 야경을 감상할 수 있어요,별표 5개,5년 전
수숫,올라갈때 힘들어도 풍경은 좋아요~ 언덕이 가팔라요,별표 4개,5년 전
Daeyeon Lee,도심 가운데 의외의 작은 공원,별표 5개,4년 전
김미정,여유롭게 경치를 감상할 수 있는 곳 입니다 아주 멋있습니다,별표 5개,3년 전
dom dol,주차장 가용 댓수가 그리많지않다 공원 자체는 좋은편,별표 4개,5년 전
박상범,서울에서 점점 보기 힘든 정겨운 골목과 불이 꺼진 성벽이지만 항상 와도 게분 좋은 곳,별표 5개,4년 전
형석김,야경보며 산책하기 좋은 길  삼선교쪽으로 올라가도 좋아요,별표 5개,6년 전
Jiyun Kim,주차비가 생각보다 좀 나왔지만 맑은공기와 하늘이 참 이뻤어요.,별표 4개,4년 전
Henry Jang,야경이 너무 멋있고 사계절 내내 산책코스로 좋아요!,별표 5개,5년 전
김현우,야경과 약간의 산책하기엔 좋은장소 인것 같아요,별표 5개,4년 전
박인혜,덥다 가파르다 경치좋다ㅋㅋㅋ,별표 4개,6년 전
jonghyuk kwon,"산책과 서울 전망, 데이트코스, 야경 등등좋아요",별표 5개,6년 전
세아이맘,이동네 이마을 어렸을때  생각도 나고  좋다 다시 한번 가야지~,별표 5개,3년 전
정현순,전망이 아주좋고 아기자기 하긴한데 경사라 많이져서 올라가기가 좀 힘들어요,별표 4개,4년 전
김진주,서울의 오래된 곳을 걷는 기분~ 조금 불편하고 낡은 곳이지만 그래서 정겨운 곳~,별표 5개,4년 전
Hong Joo Kim,성북동을 둘러보고 혜화문에서 동대문으로 넘어 갑니다. 성벽이 부스러지고 튀어나와 안타깝습니다.,별표 5개,4년 전
임정한,밤이 좋아요. 야간에 데이트도 좋고 먹을거 많고..,별표 5개,수정일: 6년 전
석진경,옛모습과 현재의 모습을 모두 간직한 멋진곳이였어요,별표 5개,4년 전
최종운,도성길걷고 후식하기좋음,별표 5개,3년 전
청솔,"가을이 오는 계절, 낙엽을 밝으며 성위 전망대에서 시가지를 돌아볼 수 있어 좋았습니다",별표 5개,5년 전
이호준,종종 갑니다 서울 뷰맛집,별표 5개,2년 전
아름다운세상,가끔 운동삼아 다니는 곳입니다. 낮에도 좋지만 밤엔 더 좋습니다.,별표 5개,3년 전
Jackie3 Shin,종로를 내려다보며 유유자적 휘적휘적 걸어다닐만 합니다. 벽화마을과 이화당까지 돌아보시면 딱 좋을듯 합니다!,별표 4개,6년 전
등고래,한적하고 산책하기 좋다,별표 5개,5년 전
오정준,운동하려고 산보중!!!!,별표 3개,3년 전
김지현,조명과 뷰가 어우러져 넘 야경이 이쁩니다.. 시원한 바람은 덤 입니다,별표 5개,5년 전
이창섭,도심 가까이 가볍게 산책하기 좋은 곳이네요,별표 5개,5년 전
오혜영,산책하기좋음,별표 5개,수정일: 3년 전
이명근,차가 막혀서 길도 좁은데 세상 오지도 가지도 못하고 한 시간도  넘게 지체 되어 경치 구경도 못하고  짜증 나고 왔네요,별표 1개,4년 전
MK S,언덕위커피숖..경치좋구 아늑함니다,별표 4개,4년 전
Js K,"주차시설도 좋고, 분위기도 좋고, 자판기도 있고, 화장실시설도 좋아요^^",별표 5개,5년 전
신용복,꽂이만발하고 운동하기좋은  도심속 공원이며  연속극 찰영도  자주함니다,별표 4개,6년 전
염정은,카페도 예쁘고 날씨만좋으면 좋은데이트코스☆,별표 4개,6년 전
곱창먹고싶다,데이트 장소로 딱 이화벽화마을이랑도 가까워서 좋아요,별표 4개,5년 전
나형욱,공원 자체는 너무 좋음 주차가 너무 어려움 아랫동네에 주차장 들고 셔틀 운영했으면...,별표 2개,3년 전
김주희,말이 필요없는 서울 풍광,별표 5개,5년 전
신유희,야경맛집일거같은느낌,별표 5개,4년 전
K S,길잘못들어서 어쩌다 산타듯이 갔는데 꽤 괜찮았다 사람도 많고...근데 길을못찾아서 헤맸음,별표 4개,수정일: 5년 전
이서진,산책하기 좋으며 전망도 좋음,별표 5개,1년 전
Sungeun Lee,야경이 멋지네요,별표 5개,수정일: 2년 전
SDS C,가는데 차가 필수지만 길이 좁고 주차가 어려울수 있다,별표 4개,5년 전
Choongseok Lee,야경이 좋습니다. 주차가 매우 어려우므로 걸어서 가는 것이 좋습니다.,별표 5개,6년 전
맛평가단,산책하기 좋음 개인적으론 야경보단 노을질때 가는게 더 이쁜듯,별표 4개,5년 전
Sung woo Kim,주차 이용료 저렴하고 좋아요! 안중근기념관 꼭꼭가보세요!,별표 4개,4년 전
박덕근,최고. 밤에 날씨좋을때 가면 별도 보이고 이쁨,별표 5개,4년 전
kim알렉산더,서울중심에 서울을  내려다 볼수있는 공원이 있어서 좋아여,별표 4개,4년 전
윤태연,낙산 공원에서 바라보이는 전망이 너무 좋아서 힐링 장소로 추천합니다.,별표 5개,4년 전
김영미,야경이 너무 좋아요~산책하기에 딱,별표 5개,5년 전
오창석 (밥하는남자),"야경이 좋음, 중간에 카페에서 바라보는 서울이 굿",별표 5개,4년 전
커피농장(커피농장),노을이 예쁜 곳,별표 4개,7년 전
손동환,아주 분위기좋은 곳 입니다 연인들끼리 꼭가세요,별표 5개,6년 전
이용구,이전의 곳을 조금 더 잘 보전할 수 있도록 삶의 장소에 변화기 있기를,별표 4개,3년 전
신이슬,여름에서 가을로 넘어가거나 이미 가을인 밤에 올라가면 너무 좋은 곳.,별표 5개,7년 전
GroundP,항상 산책하러 가고싶은곳 밤야경이 예쁘다,별표 5개,6년 전
DooHyun Hwang,(2020.11.09) 동대문에서 낙산공원으로 올라가는 낙산성곽서길이 공사 중이라 길이 불편하고 보기에도 좋지않으니 참고하세요.,별표 4개,4년 전
D.J Ha,서울시내에서 가볍게 오를 수 있는 자연과 역사의 만남!,별표 5개,5년 전
송경순,낮에도 좋지만 야경이 아주 좋아요,별표 5개,3년 전
Brave Y,산책하기 아주 좋은곳! 둘레길 가다 보면 길냥이들이 방겨줌!!!,별표 4개,6년 전
정승빈,언제나 좋은 곳.,별표 4개,4년 전
romon son,서울에 20년을 살았는데 여길 처음 와보다니... 너무너무 좋다,별표 5개,3년 전
김동환,낮과밤의 풍경이 나름 멋이있는곳입니다.,별표 5개,5년 전
KWANG-HYEON LEE,서울의 경관을 볼수 있는 멋진 곳 입니다.,별표 5개,4년 전
윤기현,저녁 노을지는 풍광 보기 좋음 학생들 많아서 기 얻고 가는 곳,별표 5개,4년 전
Nahyeon Kim,갈때마다 좋은곳 야경도 최고고 성곽길도 예쁘다,별표 5개,8년 전
투더리,공기도 좋고 가벼운 산책 코스로 딱이여써요.,별표 5개,4년 전
박영근,깨끗하고 정리가 잘되어 서울조망이 좋은 곳 입니다.,별표 4개,4년 전
김하나,강아지와 산책을했음 밤에야경보면 아주좋을둣,별표 4개,2년 전
Donggirl Shin,대학로 갈 때 이용하기 좋은 주차장 다만 규모가 크지는 않음,별표 4개,5년 전
T vvq,드라마에도 많이나온 명소인만큼 혼자오면 안되요,별표 5개,6년 전
이윤주,다른 산에비해서 높지도 않고  전망도 좋아요,별표 5개,4년 전
안계환,점점 공원이 편의성 중심으로 변하는 것 같아서 너무좋음,별표 3개,3년 전
Mich Lee,사람 많아요  도심에  좋은 산책로지만  경사 좀 급해요,별표 4개,4년 전
딸국티비,서울에 이런 아름다운 뷰를 가진... 많은 곳 중에 한 곳이죠ㅎㅎ 좋아요.,별표 4개,4년 전
SM K,밤에 야경보기 좋지만 꼭 따뜻하게 가세요,별표 4개,3년 전
jisooo (jisoo720),오래된 정취가 묻은 성곽을 따라 내려가다보면 시간이 멈춘 조그마한 사람사는 마을의 풍경 그리고 사람들 :)  밤 늦게 가야 해요!,별표 5개,5년 전
Hansol Yim,해 지는 시간에 마을버스 타고 올라가니 하늘 색이 너무 예뻤다.,별표 3개,5년 전
비니빈BennyBen,일몰이랑 야경 보기 좋은 곳 편한 신발은 필수,별표 5개,6년 전
꼬북이탠탠,7080레트로느낌~벽화가더많이그려지면좋겠어요~♡,별표 5개,5년 전
박누나,선선하니 산책하기좋음 더워서 차세워놓고 영화보다옴 여름이라 매미 개시끄러움,별표 4개,6년 전
김철현,서울시내가 한눈에 ~,별표 4개,4년 전
윤양학,서울 도성을 중심으로 동쪽에 있는 주산으로 조선을 개국당시 한양도성을 정할 당시 북쪽에 북악산 남쪽으로 남산 서쪽으로 인왕산을 내사산이라 하였다 합니다.,별표 4개,6년 전
정선영,한적하니 운치있고 좋았습니다. 다음에도 또 가고 싶네요,별표 5개,3년 전
jaeho lee,다른 성벽길과 비슷. 절므니들 밤에 셀카 찍으러 바글바글. 대학로 왔다가 들리는 정도로 좋을 듯?,별표 4개,3년 전
ppioppio,산이라 오르기힘듦 그래도 대학로에서 밥먹고 산책겸 가면 좋음 야경도 나쁘지 않음,별표 4개,6년 전
Erick EUN (silverbullet194),나름의 뷰 맛집. 올라오는길이 좀 다양하긴한데 썩 편하지는 않은듯,별표 4개,4년 전
김희엽,야경이 이뻐요,별표 5개,3년 전
Seok-Jun Chang,서울 야경 더뭐가 필요한가? 걸어갈땐 혜화역에서 가면 된다!,별표 5개,6년 전
Jinyoumi Kim,조용히 낙산 공원 올랐다 대학로에서 북적이는 사람 속에서 식사하는 즐거움,별표 4개,3년 전
고아라,시설도 잘 되어있고 운동하기도 산책하기도 좋음,별표 5개,4년 전
Inbae Kim,조용하고 서울시내 뷰가 보기좋아요,별표 4개,3년 전
gwang beak,야경보고 먼길로 가면 조용해서 얘기하기도 좋음 근데 많이 걸어야함,별표 4개,6년 전
김수빈,해질녘에 너무 예뻤어요,별표 5개,6년 전
뚜룩,야경 굳 산책로도 굳,별표 4개,4년 전
LEE요니,"가족들, 연인들 산책겸 데이트겸 가기 좋은 경치 좋은 공원~",별표 5개,3년 전
LaraJean PARK,커플들 많은곳ㅋㅋ 많이 높지않고 오래올라가지않아도되서 사람도 많은곳,별표 5개,3년 전
Jason Park,서울을 조망할 수 있는 참 정감 어린 공원입니다.,별표 4개,3년 전
민뚱다뚱,서울 한복판 성과킬.좋아요.아이들이랑 걷기엔 좀 힘들어요.,별표 4개,5년 전
김희선,낮에 갔을땐 서울 근교가 다 보이니 좋았는데 밤엔 야경도 좋을꺼 같네요,별표 4개,6년 전
라오의 일상,서울 한복판의 휴식공간.,별표 5개,4년 전
