작성자,내용,별점,작성일
Yunmari (adorable),"사람들이 많지만, 건전하고 분위기 좋아서 오랜만의 야외 나들이하기 좋은 곳이네요ㅎ 다만 쓰레기 버리는 곳의 냄새들은 좀 잡아주면 더 좋을듯해요^^",별표 5개,6년 전
라디오키즈,63빌딩 바로 앞인데 한화에서 다양한 행사를 하는 곳이라 좋네요. 평범한 산책도 좋고 이벤트도 좋습니다.^^,별표 5개,6년 전
홍수진,여의도 한강공원 불꽃축제,별표 5개,1년 전
알수없음,맛난게 많아요~ 주차는 복잡,별표 5개,1년 전
최승환,"가족들 나들이, 자전거타기 좋아요",별표 4개,6년 전
지원,밤에 가도 좋은곳 사람들이 북적거려도 놀고  앉고 먹을꺼 많아요 걱정하지 말고 가세요!! 오히려 북적북적한맛에  가는거구 치맥하러가는곳 아닐까요? 너무 재밌는 경험이었어요,별표 5개,5년 전
밍밍밍구리,"위치 및 조망 굿, 그래서인지 사람이 너무 많다....",별표 4개,3년 전
진영임,더 현대서울 지하 1층 가서 맛나는거 먹고 한강으로 가서 불꽃놀이 즐김,별표 5개,10달 전
hukim,소중한 사람과 함께 쉴 수 있는 공간,별표 5개,2년 전
JAI,"5월 여의도 잔디밭 위, 피크닉 좋아요 낙지볶음 배달에 막걸리 한잔 크~~~",별표 5개,1년 전
Bosung Kang,코로나 임에도 사람 대박 미어 터집니다. 날씨만 좋으면 대기존에 통닭 대기 삼백이십명씩 있고 나갈때 주차장에서 2시간 걸려요. 근데 MBL라서 5점만점^^,별표 5개,4년 전
Sk Hwang,"말이 필요한가? 그냥 좋다, 근데 코로나 기간에는 자재들 좀 합시다. 어디선 코로나 대응 한다고 죽어나가는데 평일 여의나루 밤이고 낮이고 사람 넘쳐나더라.현타 온다 정말",별표 5개,4년 전
Jerry L.,사람 많음... 걍 분위기 좋음.. 햇빛 겁나 뜨거움.. 텐트치는곳 따로 있으니 주차 잘해야 안멈.. 이것저것 빌릴곳 많음.. 도시락은 간단히..,별표 5개,5년 전
Googil HWANG,"역시 기대에 저버리지 않는 시설,  버스킹,  먹거리, 볼거리, 또 역시 이런게 대도시인 서울에 사는 맛. 간간히 대중교통 이용해 오면 좋다.굳이 멀리 교외로 안나가더라도 어린아이 있는집은 좋을듯",별표 4개,6년 전
이상철,불꽃축제 잘 봤는데..오랫만에 해서 그런지 너무 통제가 안됨..보다가 나가려했으나 통로에도 다 사람들이 꽉차서 못나갔음..다음엔 더 나아지길 기대해봅니다..애쓰셨어요,별표 5개,2년 전
민트초코,꽃보다 사람이 더만았던 날,별표 5개,6년 전
안개,올해도 글렀나봄 최고였다ㅠㅠ 권피치 진짜ㅠㅠ🍑💕💕…,별표 5개,6년 전
Qudrl Park,서울 한강공원은 조경이 정말 잘 구성되어있습니다.,별표 5개,9달 전
Sunghoon Kim,"불꽃놀이 보러갔다. 근처에서 돗자리를 빌리자. 돗자리 렌트 업체가 많으니 굳이 집에서 챙길 필요는 없다. 팁을 주자면 1. 텐트는 소규모 인원일 경우 효율적이지만 4명 이상이라면 굉장히 불편하다. 두 명을 재외하고는 밖이 잘 보이지도 않을 뿐더러 열기때문에 덥다. 2. 짐을 최소화 하자. 굉장히 많은 사람이 몰리기 때문에 집으로 갈 때 짐 들고 움직이려면 암걸린다. 3. 낮이 좀 덥더라도 담요나 가디건을 챙기자. 은근히 쌀쌀함. 4. 주변 편의점은 거의 만석 수준이다. 줄서서 물건 사간다. 가능하면 집앞에서 맥주나 물 등을 챙겨 오는 것이 좋다. 물론, 쓰레기를 모아 버릴 봉투도. 5. 물빛공원에서 살짝 떨어진 변두리 자리가 좋다. 6.경사진 바닥을 최대한 피하자. 내가 불편한 것은 둘째치고 경사 상부에 있는 사람들이 맥주를 쏱으면 전부 당신에게 온다.",별표 5개,6년 전
Yongha Choi,"근처에서 텐트를 대여할 수 있다. 많은 먹거리가 있다. 가족, 연인 단위 나들이객이 많아서 분위기가 평화롭다. 한강을 보며 편안하게 휴식을 할 수 있다.",별표 5개,6년 전
김정기,산책하기 너무좋아요 자전거도 탈수있고 단 대여로가 조금 비싼편이며 텐트나 돗자리도 대여해줘요 가실일 있으면 돗자 리는 가져가시는게 좋아요 지저분해요,별표 4개,4년 전
전재찬,다행이도 괴물은 나오지 않았다....만!!!! 버스킹 감사해요.  선곡 좋아요~ 라면 비싸요 ~ 술도 비싸요~ 우리의 추억도 비싸요.,별표 5개,2년 전
금윤서,데이트 하기 좋고 텐트대여해서 놀 수 있어서 색다른 경험을 할 수 있다 밤에 조명들이켜지면 사진찍을 장소가 많다 중간중간 해먹도 있어서 누워서 쉬기 좋다,별표 5개,6년 전
최연주,밤도깨비 야시장 기간에 다녀왔는데 푸드트럭도 많고 재밌었어요ㅎ 밤에 돗자리깔기 괜찮아요. 공중화장실도 많아서 편리합니다!,별표 5개,7년 전
구구호서,"공기좋고 휴식공간좋고 다만 흠은 6,3빌딍근처회장실 오픈이안되어있어서~ 동절기도지났는데요~",별표 4개,4년 전
이지영,화장실을 갈 수가 없어요~~~뭐든 비싸게 팔아요~~ 장사가 너무 잘 되다보니 손님을 우습게 아는 점포도 엄청 많습니다~사람 너무 많고 지저분함. 그래도 한강 공원이 주는 느낌이 좋아서 가게 됨..,별표 3개,6년 전
정재호,근처에서 텐트 하나 빌리시면 아주 여유롭고 좋습니다. 주의점은 여름에는 텐트안에 있어도 매우 더우니 4시이후 방문을 권장드립니다,별표 5개,6년 전
황성욱,간만에 가봤으나 여전히 별로인곳 이렇게 좋은 장로를 이렇게밖에 활용하지 못하는게 안타깝다.,별표 1개,1년 전
J Brian,걷기 좋은 곳... 1시간 정도 걷다보면 발 담글 수 있는 곳이 있어서 크록스 신고 가길 추천,별표 4개,2년 전
Puzzle,2인용자전거 탔는데 삐거덕거려거 무서웠지만 재미잇었음! 경치 좋고 맛있는게 많아서 데이트하기 딱좋습니다!,별표 4개,4년 전
김예은,아직 겨울이라 강바람이 추웠지만 시설도 깨끗하고 잔잔허게 경치 즐기면서 대화하기 좋음,별표 5개,1년 전
GM Lim,언제나 한강을 걷는건 좋다. 담배피는 사람들이 제 자리만 벗어나질 않는다면 말이지. 뭐 조금의 시끄러움과 다양한 사람들의 어울림은 여기가 사람들이 살아가는 서울이 휴식처임을 알게한다.,별표 4개,5년 전
김민지 (감자도리),언제와도 좋은곳👍…,별표 5개,6년 전
현예원,나무그늘선점필수근데 나무그늘 따라서 돗자리 움직여줘야함,별표 3개,3년 전
이재웅,앉을곳도 많고 화장실 편의점 산책로 잘 되어있습니다. 방역지침 준수하면서 안전하게 이용하세요~,별표 5개,4년 전
진(별빛부는 언덕),날씨가 따뜻하면 직장인들 나와서 도시락 먹고 저녁에는 치맥 파리~~ 여의나루역에서 나오면 전단지 나눠주는 사람들 있음 배달시키면 도착 ! 술은 편의점보다 마트에서 사가는게 유리함 ㅋ,별표 5개,9년 전
이보영,여의도한강공원 한여름에 시원한물에 발담그며 더위를식히니까 좋다,별표 5개,7년 전
전수민,타지생활에 큰 힘이 되어주는 공원입니다. 물보고 싶을때 가서 맥주마시면서 강보면 기분이좋아요,별표 5개,6년 전
유홍진,가족들이나 연인끼리 휴식을 취하기 좋은 곳 이지만! 주말이나 휴일에는 너무 사람도 많고 잡상인도 많고 쓰레기도 많고...... 등등 선택은 본인이!!,별표 4개,7년 전
이용숙,날씨도 좋았고  오랫만에  좋은 추억가져갑니다,별표 1개,5년 전
김석원,주말 주차장 부족. 잔디밭에는 쓰레기들. 술 먹고 떠드는 20대. 배달 오토바이들로 위험한 도로. 그럼에도 불구하고 탁트인 전경과 시원한 강바람,별표 4개,5년 전
슈퍼파파,낮이든 밤이든 치맥하기 딱 좋은 곳,별표 5개,6년 전
키도,완전 풍경도 짱 다 오지마세요 저만 갈꺼에요,별표 5개,4년 전
광고공간,비 온 직후라 사람이 거의 없었음.,별표 5개,1년 전
Eun young Choi,여의도 공원에서 자전거 대여해서 타는데 한강으로 바로 갈 수 있는 짧은 터널이 연결되어 있다는 걸 처음 알았네요. 왜 아무도 얘기를 안해줬지.. 터널 통과한 끝에서 한강을 보니 더 시야가 탁 트이는 느낌이고 좋았습니다.,별표 5개,5년 전
AA A,다양한 볼거리 놀거리 쉴거리가 있어요.,별표 5개,6년 전
박우열,여름앤 쥐약.. 일단 주차장 2주차장에 했는데.. 헬임.. 관리안함.. 더러움 2중주차 심각함.. 등등.. 주차 여렵고.. 텐트치는곳엔 사람 바글바글 하고 남들 생각 1도 안하고 쓰레기 안가져가고 그냥 다 버림.. 그늘이 많지않아 그늘진곳에 바짝 붙음.. 10여년만에 갔는데.. 여전함.. 이래서 안감,별표 1개,4년 전
이초희,2019 여의도불꽃축제 기다립니다♡ 맛있는 음식 싸들고 가을 소풍오기 딱 좋아요ㅎ 돗자리와 담요 필수준비!! 쓰레기는 분리수거 합시다^^,별표 5개,5년 전
G. K,야경 추천합니다,별표 5개,2년 전
박상희,"방문한 날이 하필 벚꽃축제 기간이라 사람폭탄이어서 여유로운 한강의 느낌은 아니었어요. 벚꽃은 잔디밭 내려가기 전 여의나루역 3번출구 라인에 있는게 다였고, 라면자판기 꼭 먹어봐야지했는데 줄도 긴데다 사람에 치여 쏟을까 무서워서 포기했어요. 차라리 세종 호수공원이 더 나았네요.",별표 3개,6년 전
천산똥풀,"서울시가 BTS10주년 여의도공원서 행사한다는 소식 접하고 갔으나,저녁 8시50분까지 무소식. 사기당하고 집 귀가중.",별표 2개,2년 전
김륜한,"커플끼리 간다면야 더할나위없이 좋음  돗자리 대여 2,000원이고  편의점은 cu랑 미니스톱 있습니다.  먹거리로는 목살 추천드립니다.",별표 4개,7년 전
블루나인,바람이 시원하다. 특별한 이벤트가 없다면 그렇게 북적이지 않고 여유를 느낄 수 있다. 낮과 밤이 각각 좋다.,별표 4개,5년 전
권오재,서울에 사는 사람들의 문화적 특권...부럽당,별표 5개,5년 전
이비트박스 (BeatBox),정말 자유롭고 좋은 곳,별표 5개,5년 전
일단합니다[영쌤],가볍게 산책하고 자전거나 운동하기 좋은곳 의자도 많어서 간식먹는 공간이 많아서 좋아요,별표 4개,3년 전
Kyusup Kim,여름엔 너무 사람이 많아 정신이 없긴 합니다만 서울 시민의 최고의 휴식처입니다.  밤섬 건너편 쪽에서는 철새관찰할 수 있습니다. 서울 한강을 찾아온 가마우지들이 반갑네요,별표 5개,9년 전
hyunji kim,이렇게 멋진 걸 하다니..! 강변음악회 너무 좋았어요,별표 5개,6년 전
김순녀,나무 있어서 잔듸밭에 앉을 수 있고 탁 트인 강도 볼 수 있고 좋아요. 편의점에서 간식 사들고 가면 좋음.,별표 4개,4년 전
MAGU,시민의식 결여.  쓰레기.  편의점과 파출소 건물이 너무 노화됐다.  파출소는 파출소인지도 모를 지경. 관리 좀 하자. 그리고 시민들은  문화의식과 공공질서 좀 지키자.,별표 3개,4년 전
마이와쿠리,산책하면 좋아요,별표 4개,6년 전
박상연,"여의도 한강공원 접근: 여의도역,여의나루역,국회의사당역 으로 편리. 볼거리,놀거리: 여의도 공원에서 자전거 타기 한강에서 치킨 배달해 먹기 IFC Mall에서 놀기. (CGV포함) 현대백화점에서 놀기. (2020년 완공예정) 한강유람선타기. 먹거리: 여의도 콩국수, 낙지 수제비, 에슐리, 토다이, 왕돈가스, 굴국밥, 등등 숨은 맛집 많음. 안전: 여의도 공원에서 한강공원으로 연결되는곳에 경찰서 있음.",별표 5개,6년 전
1 like,정말 좋았지만 병든 비둘기와 쓰레기가 다소 아쉽습니다.,별표 4개,3년 전
J.I. Kim,"Yeo Ui Do Han river park. great to visit during autumn and Spring or even Summer for picnics, bicycle, jogging, photographs. 여의도 한강공원. 봄가을이나 여름 장마를 피해 피크닉, 사진촬영하기 좋은 곳.",별표 5개,3년 전
GWANGSU HEO,산책하기 좋고 깔끔하고 안전한곳이에요. 접근성 훌륭,별표 5개,1년 전
윤성,새벽갬성을 느낄 수 있는~~한강,별표 5개,6년 전
Leo Ruby,강을 바라보면서 야경도 볼수 있어서 가족 친구 등 함께하면 좋습니다. 코로나로 인해 멀리까지 못하지만 한강에서 보내는 것도 괜찮을 듯 합니다.,별표 5개,5년 전
doremi,한강공원 중앙에 자전거 대여소 보다는 도로변에서 따릉이를 추천합니다! 저렴하고 다른 정거장에도 반납 가능해서 편리하거든요ㅎㅎ,별표 5개,5년 전
김정부,도심에서 가까운  휴식공간,별표 5개,6년 전
정현호,짱멋있고 좋아요,별표 5개,3년 전
Jaegeun Ko (inspiredjack),말이 필요없는 최고의 힐링스팟이죠! 아름다운 한강과 잘 정돈된 둔치의 공원은 언제 들러도 마음의 평안과 즐거움을 선사합니다.,별표 5개,6년 전
서상태,"여의도한강공원 이곳은 대한민국 정치. 금융.방송의 중심지를 배후에 두고 있다. 그 옛날 백사장에는 땅콩 밭이 있었으며, 일제강점기인 1916년부터 1917년까지는 여의도비행장이 있었다. 1922년 12월 10일 안창남이 한국인 최초로 5만인파의 환호 속에 시행 비행을 펼쳤다. 서울시의 한강르네상스사업에 의해 조성된 여의도 한강공원은 한강을 향해 펼쳐진 시원한 물빛광장과 피아 노 물결, 너른 들판, 풀로팅스테이지 외에도 국제여객선 선착장과 요트 마리나를 갗추고 있다.  #행운과 기쁨을 가져다주는 서울의 상징 해치 #밤섬(율도) #숲지에 관한 람사르 협약 등록지 #누에섬  등",별표 5개,3년 전
최설화,개업때부터 다니던 고기집인데요~직원분들 넘 친절하시고 고기도 넘 부드럽고 맛있어서 늘 애용하고 있습니다^^,별표 1개,3년 전
녹차아이스크림,서울의 가장 대표적인 공원. 여름에는 각종 수상스포츠 체험도 가능하고 평상시에는 자전거를 타거나 소풍을 나온 사람들로 북적북적하다. 매년 열리는 불꽃 축제도 볼거리이다,별표 5개,7년 전
Young SouL,시원한 바람 쐬며 앉아있기도 좋고 한 번씩 걷기도 좋은 곳입니다. 행사같은 것도 많이 해서 좋고 버스킹도 하고 재밌는 곳입니다.,별표 5개,6년 전
윤영수,강바람이 너무 좋았어요.,별표 5개,6년 전
최수연,코로나 때문에 한강에는 사람들이 많이모였다.,별표 4개,3년 전
"Han Jo (안녕, 조한)",선선한 강바람과 여유가 필요하다면.,별표 4개,7년 전
박건희,한강의 야경은 언제 봐도 힐링ㅠ,별표 5개,5년 전
jongho park,"한강은 서울의 축복인듯 합니다. 날이더워 부분적으론 부폐한 쓰래기 냄새가 나는곳도 있지만 7,8월동안 열리는 퐁당축제는 다채로움에 연속이네요 이랜드 유람선 선착장근처엔 먹거리도 많으니 방문해 보세요",별표 5개,6년 전
졔라니,날씨가 좀 덥긴한데 바람도 불고 괜찮았음,별표 5개,5년 전
강승현,3월의 한강은 아직 춥네요ㅠㅠ,별표 4개,6년 전
David Choe,"주말에 사람이 좀 많긴 하지만, 쉴거리 놀거리 즐길거리가 많은 공원. 야시장 할때가면 맛난것도 많고 분위기도 좋다.",별표 4개,6년 전
JM SHIM,이제 완연한 가을을 정취를 느낄수 있네요..낙엽과 어우러진 한강은 언제나 아름답습니다,별표 5개,1년 전
윤연희,한강라면 젊은이들이 한강에서 먹는 라면으로 신기해요 잔디밭에 돗자리와 테이블에 앉아 먹으니 저절로 젊어지는 기분,별표 5개,2년 전
웅이,깨끗하고 재밋음. 무조건 연인이랑 갈것.,별표 5개,6년 전
이웅원,한여름밤 공원에서 나들이 좋아요,별표 5개,6년 전
sooho lee,따뜻한 봄날의 여의도 한강공원은 언제라도 좋으것 같습니다. 다만 예전과는 다른 미세먼지로 인한 주변경관이 잘 나타나지 못한것이 아쉽긴하네요.,별표 4개,6년 전
남Joo yong,공기 좋은날 자전거 타기 좋은 곳,별표 5개,5년 전
Pro Hong,가족과 함께 나와 즐길  수 있는 장소입니다. 여유가 되면 유람선을 타도 되고 자전거대여가 가능합니다.,별표 4개,7년 전
Jongmin Chae (Jaime),넓지만 편의점에 사람이 많다 주변에서 미리 장을 보는게 좋고 차는 안타는게 낫다 늘만원주차장임,별표 5개,3년 전
라기현,산책하기도 좋고 가족 단위로 방문하기도 좋습니다.,별표 4개,10달 전
조리바,2017년 여의도불꽃축제,별표 5개,7년 전
하야부사Delivery,"마포대교 근처 한강공원에는 가족,연인,친구들이 많이 찾는 장소라 항상 붐비고 자전거 사고등에 유의해야 한다. 쓰레기 문제도 요즘 심각함 경치는 매우 좋다",별표 5개,6년 전
KH N,주말은 역시 물반 사람반~,별표 5개,3년 전
Jaeng Jaeng,"사람이 많아서 그런지 라면, 방석 가격대가 말도 안되네요 아무리 한강특수라지만... 이럴바엔 계곡이 효율적으로 더 좋을듯",별표 3개,6년 전
ccino Cappu,편의점위에 김병만치킨이라고 있는데 그곳 비추천합니다. 그쪽주인이 비위생적으로 하고 치킨도 오래되보이더라고요. 맛도 별로없고... 몇일전에 튀겨놓은것을 다시튀겨서 파는거같이 치킨색도 이상하고 저는 그거먹고 배탈나서 지금 고생중입니다... 여러분들은 그냥 나줘주시는 전단지에서 시켜먹는것을 추천드려요...,별표 1개,7년 전
SeongKyun Park,대박입니다 새벽 세시에 오면 조용하고 좋습니다,별표 5개,5년 전
김태성님,19년 4월 6일 기준 만개가 아니라 아쉬웠고 낮보단 야경이 예쁘고 밤 도깨비 야시장 공지사항 필독하여 운영여부 확인 하시고 가세요,별표 4개,6년 전
임정현,와이파이가 잘 안되는 단점이 조금 불편,별표 5개,9달 전
한두환,"한강은 한국에서 자랑할만한 장소입니다. 강북과 강남을 잇고, 봄, 여름, 가을, 겨울 언제든 가도 새로운 모습을 보여주고 편하게 쉴 수 있는 장소입니다. 지하철역에서 나올때 전단지를 나눠주는데, 한장이라도 받으면 모든 분들이 모여서 다 주시는통에.. 한장을 받으려다 어마어마하게 받게될 수도 있습니다^^;;;",별표 5개,5년 전
JESCOM ZIP,반포보다 할거없다고 한사람 나와ㅋㅋㅋㅋㅋ 사람도 많고 포차도있고 대교자체는 반포쪽이 더 낫지만 맥주한캔 까면서 맘놓고 편하게 대화하는건 여기가 경치도 더 좋은거같네요,별표 5개,3년 전
ᄀᄀ,한낮의 더위를 식힐 곳은 다리밑이 최고다. 마포대교 밑에 가니 강바람이  에어컨보다 훨씬 시원!,별표 4개,6년 전
이서윤,봄에서 초겨울까지 가기 좋은 곳인거 같습니다. 저같은 경우에는 자전거를 타고 와서 힘들기는 하지만 한강공원 중에서는 가장 마음에 듭니다.,별표 5개,4년 전
유성식,마포대교와 원효대교 중간으로바야 할것같아요 주말이면사람이아주많아요마포대교밑에는더위를식힐수있는물수로가흐른답니다,별표 5개,수정일: 3년 전
정영아,서울 오케스트라의 수준높은 연주와 한강변의 아름다운 배경이 넘 멋진 추억을 남긴것같아요~,별표 5개,2년 전
송희정,"주차가 힘들었지만, 한강공원은 최고",별표 5개,5년 전
Tiger,"개인적으로는 사람이 북적이는곳에다 바가지요금이 존재하기에 비추천하고 싶은곳. 만약온다면 사람 많을 때, 먹거리와 돗자리혹은 소형텐트를 구비한다면 괜찮을듯. 여기서 소비하는것은 현명하지않다",별표 3개,7년 전
전종희,잔디도 넓고 배달되는 집도 많고 한강도 이쁘고 다 좋은데 단점은 날좋은 주말에 가면 사람이 너무 많다는거..,별표 4개,6년 전
꿍꾸웅,배달존있는데는 사람이 과하게 많음,별표 5개,5년 전
재윤,외국의 자전거 도로를 느낄 수 있는 곳,별표 5개,5년 전
동스,예전처럼 고즈넉 한맛은없고 사람들이 복작복작함 그것 말곤 괜찮긴 함. 나름 사람많은것 치곤 꺄끗한편이고 주차장도 있고 한강도 있으니 잠시들르기엔 좋은듯,별표 3개,6년 전
임지수,뷰가좋고 음식을 시켜먹기좋다 다만 주말에는 사람이 너~~~무많다 여의나루역 근처말고 강을 따라 쭉 걸으면 사람이 적고 여유로운 장소가 많다,별표 5개,5년 전
walyoung Lee,"불꽃 축제, 티비로 보는거랑 완전 달라요. 티비 BGM 하고 현장에서 터지는 폭죽 소리는 비교불가, 전쟁난줄. ...",별표 5개,2년 전
서건수,사람이 정말 많습니다. 먹을 것도 많습니다. 2주차장이 제일 붐비니까 다른 주차장을 이용하는 게 좋습니다.,별표 5개,3년 전
김영필,가을밤에 즐겁게 산책하기 좋은 최적의 조건. 음식판매가 너무 많은 것은 아쉬움.,별표 4개,1년 전
안순수TV,속이 뻥 뚫려요  좋네요 ㅎ,별표 5개,3년 전
김미숙,아들이랑 엄마가 멍 때리기엔 정말 좋습니다 그리고 주말엔 추워서 늦게까지 있기엔 아닌것 갔습니다  연인들이나  친구들은 좋을것 같아요,별표 5개,수정일: 3년 전
이상훈,아 분위기도좋고 날씨도좋고한데 나무좀 더심어줘요ㅠㅠㅜ그늘이 없어서 너무덥고 그리고 제발 전단지 돌리는사람 단속했음좋겠음!!!누가 전단지보고 주문하나 어플로하지..환경만 안좋게ㅠㅠ,별표 4개,6년 전
독바위역.,"외국인들한테창피해서 죽는줄 알았습니다. 간이 해먹같은게 있는데 거기 누워서는 일어날 생각을 안하고, 20대들은 술먹고 안주 그냥 바닥에 버리는 일이 빈번해서 쓰레기장 냄새가 심하게 납니다. 같은 20대인데도 창피하네요. 시끄럽고 냄새나고 참,,독특한 곳이네요 본인집이라고 생각하고 이용했으면 좋겠어요. 손님이 놀러 왔을때 쓰레기장이라고 생각했으면 좋겠나요..? 부모님뻘들이 청소하시는 곳인데 조금만 신경을 써줬으면 좋겠구요 외국인들이 눈살 찌푸리면서 지나가는데 숨고싶었네요,",별표 2개,6년 전
송우석,한강에서 여자친구 문은희랑 돗자리 깔고 데이트 했어요♥♥,별표 5개,7년 전
곽민규,중국 덕분에 미세먼지는 많지만 한강공원은 봄날에 즐기기 좋아요.,별표 5개,1년 전
오렌지,서울의 대표적인 나들이 명소입니다. 각종 먹거리도 많아 가족끼리 연인끼리 친구끼리 그냥  가도 좋아요.,별표 4개,6년 전
Daniel Oh,"너무 좋은 분위기지만, 음식물 쓰레기 냄새가 많아지고 있네요 ㅠㅠ",별표 4개,1년 전
kate k,풍뎅이 마을 미세먼지 피크닉,별표 4개,6년 전
이형규,날씨가 좋은날은 자리가 없고 사람이 너무 많은게 단점  가볍게 러닝이나 자전거를 타기도 좋고 산책하기도 좋은장소,별표 4개,3년 전
윤혜진,저녁에 사람 많음 그래서 비교적 쓰레기가 널려있음... 바람 많이부니까 저녁에는 바람막이 같은거 챙겨가면 좋음,별표 4개,4년 전
최동주,쉬어가기 좋은곳,별표 5개,3달 전
희선,가을밤 분위기 너무 좋습니다 ㅠㅠㅠb,별표 5개,5년 전
이재신,"서울여의도,에세는매년3,4월이면,63빌딩에세,한강을바라보면서,여의도을거쳐 서강대교지나,국회의사당을지나,윤중로거리지나,KBS방송국본관을지나고,여의도성모병원을지나면,바로63빌딩까지,벗꽃축제가열리고있읍니다,많이들오셔서구경하시면,좋아요,오시는길은전국에서,기차와,지하철,뻐스타고,여의도나루터역에서내리시면됩니다,63빌딩에서한바퀴도는,거리는총3,4킬로되며,걸어서,1시간30분정도걸립니다,연인과,가족나들에는,참,좋아요",별표 5개,6년 전
nimo YOO,밤도깨비 야시장등의 여러 여가요소들이 있어서 아이들과 오긴 좋을것 같다. 사람이 너무많아서 는치싸움이 중요할듯,별표 4개,5년 전
김연주,또 가고싶네용~^^,별표 4개,6년 전
최요한,언제가도 좋은 곳이에요,별표 5개,5년 전
shineui mo,첼로 MTB 구입 1개월만에 주행거리 최초로 100km 돌파(방화대교에서 하남시계 왕복).. 이제 페달링이 뭔지 조금 감이 온듯..,별표 5개,4년 전
mojo pin,사람 개많고 시끄럽고 장사꾼으로 점령된 돗대기 시장임. 한강 운치를 즐기려면 다른쪽으로 가세요. 여름해수욕장 온 느낌.,별표 2개,5년 전
안지원,"사람이 정말 많고 3-4시 이후는 피크시간대이니 피해서 가시길... 돗자리, 텐트 대여가능 노점상도 많고 배달도 잘되있다",별표 4개,6년 전
제이콥,"5월중후반 여의도 한강공원에 돗자리 펴고 간식먹으면서 즐기는 사람들이 많네요. 바람이 제법 불어서 아직은  자켓, 가디건은 필수입니다.",별표 4개,6년 전
