작성자,내용,별점,작성일
이재은,"여전히 핫한 여의나루역 앞 한강공원. 여의도 한강공원 주차장은 주말만 되면 차량 줄이 길어서 들어가기 힘듬. 휴일에는 여의도 안에 길거리 주차장(평일엔 유료임)이 무료기 때문에 이쪽에 주차하고 걸어가거나 버스 타고 여의나루로 넘어가는 것이 좋다. 아이를 데리고 한강공원에 가니 화장실이 걱정이었는데, 서울시에서 화장실을 엄청 깨끗하게 관리하는지 예전의 모습을 찾아볼 수 없을 정도로 깨끗했다. 특히 가족화장실이 있어서 쾌적하게 아이와 볼일을 볼 수 있는게 가장 좋았다. 주변에 노점상에서 길거리 음식을 많이 팔고 돗자리도 팔기 때문에 먹거리도 걱정없고 사람이 많아서 사람 구경하기도 좋고, 버스킹도 하기 때문에 귀도 즐겁다. 사람이 많은 이유가 있는 듯하다. 화장실 가족화장실이 있어서 아이와 같이 가도 걱정이 없음 피크닉 구역 사람이 많지만 쓰레기통에 먹은 것을 버리고 가시는 분들이 많아서 대체로는 깨끗하다.",별표 5개,2년 전
김현수,"텐트,돗자리2,무릎담요,트레이(베드용 크기) 렌트 종일권pm7시까지 15000원에 가성비 굿이네요",별표 4개,5년 전
김정석,공원 곳곳에 대형 쓰레기 통이 있는데 늦은 저녁에 가면 항상 쓰레기들이 넘치고 있습니다. 때문에 어딜가든 쓰레기 냄새가 납니다. 개선이 필요합니다,별표 3개,2년 전
김나경,아이들이 물놀이하기 정말 좋아요~ 대신 옷을 갈아입힐만한 적당한 장소가 없어 아쉬워요,별표 5개,2년 전
Christine Lee,내가 상상해왔던  여의도 한강공원에서의 로맨틱하고 아름다운 벚꽃놀이는 더이상 없었다. 10년 전만해도 낭만이 있었는데.. 지금은 한여름의 해운대바닷가처럼 온갖 상술의 온상지였다. 역에서 한강공원까지 길을 건너 내려가는데 20분 넘게 걸렸다. 사람과 사람이 꽉차서 움직이지도 옮겨다닐 수도 없을정도. 꽃밭에서 사진 찍는 것도 줄서서 기다려야하고.. 서글프다.. 한국이 더이상 이쁜 나라가 아님에 통탄을 금치 못하겠다.,별표 1개,6년 전
박소영,날씨도 너무좋고 잠시나마여유를 즐겼어요,별표 5개,3년 전
흥써니,주말 공휴일에 놀러갔더니 텐트빌려서 치는사람이 어마어마하게 많았음. 돗자리정도만 빌려서 노는것노 좋을듯해요. 이제 텐트존에서만 텐트칠수있고 밤7시에는 무조건 걷어야함. 평일은 사람도없고 주차장도 한가해서 텐트치고 좋을것같은데 주말은 텐트치면 주변 경관 하나도안보이고 오히려 불편하기만 한거같아요. 한강같지도않고... 주차장이 자리가없어서 차 가져가면 한참 기다려야 주차가능. 근처 아파트단지에 대면 견인되어가거나 불법주차딱지 붙어요. 절대 대지 마세요. 저는 집근처 이마트에서 치킨이랑 초밥사갔는데 정말 맛있게 잘먹었어요. (그 근처는 너무 가격이 폭탄수준) 편의점도 사람 너무많고 하나하나 돈 받으니까 나무젓가락이나 음료수정도는 미리 사가는게 나아요.,별표 4개,6년 전
황순길,벚꽃철에는 여의도가 제일 예쁜것 같다.,별표 5개,4주 전
박경환,공중으로 펴져나가는 불꽃-향연 분비는 인파들의 움직임 참말로 기분이 들썽 좋았담니다.^-^~⚘,별표 5개,5년 전
MIke Bai,걷기가 좋은 환경이라 너무 좋았어요,별표 5개,1년 전
Lucy Kim,"사람 엄청 많음 ,주말 금토 야시장 개장 시에는 주차대기 시간이 상당함 배달존도 있고 푸드트럭 이용도 재밌음",별표 5개,7년 전
우경화,야경이 너무예쁘고 맛난것도 많고 데이트하기도 예쁜장소네요 밤에는 살짝추우니깐 담요필요할듯,별표 5개,3년 전
짱똘,날씨가추울때거나 더울때여도 각자만에 매력이있어요 노을질때도예쁘고  야경은더예쁜곳이죠 모두들  음식드시고 쓰레기만잘치웁시다,별표 4개,6년 전
김진주,오랜만에 다녀왔는데 여전히 북적이고 재밌었습니당:) 공원 들어가기 전에 있는 나무는 이맘때쯤에 항상 인기만점이더라구요! 이제 날씨가 좋아졌으니 더 많이 다녀보려구요!,별표 5개,2년 전
Jack Kim,여의도 한강공원은 여의나루역에서 접근 가능한 정말 좋은공원입니다 ㅎ,별표 5개,7년 전
머니태그,"산책하기 좋은 곳입니다. 깨끗하다고는 할 수 없지만 그랗다고 매우 지저분하지는 않았습니다. 여의도의 빌딩숲을 볼 수 있는 장소이며 날씨가 맑은 날에는 남산타워도 보이는 곳입니다. 일요일 아침에 방문하여 조용해서 좋았습니다. 사이클링, 조깅을 하는 사람들이 간혹 보였습니다.",별표 3개,6년 전
영훈,"서울의 멋진 야경을 감상할 수 있는 곳. 여의도 한강 공원에서 밤도깨비야시장(주말 운영), 편의점 등 편리한 시설과 쾌적한 환경에서 도심 속 휴식을 즐길 수 있었습니다.",별표 5개,6년 전
잊쨩,"텐트를 대여하여 방문했습니다. 법이 바뀌어서 한강공원 내에 텐트를 설치할 수 있는 구역과 시간, 규칙이 정해져 있기 때문에 잘 알아보시고 가는 편이 좋아요. (오후7시까지 설치가능, 설치 시 두 면 이상 개방)",별표 3개,수정일: 6년 전
yo jo,아무 이유없이 생각없이 걷기 좋죠. 함께하는 사람이 누구냐가 중요하지 않을까요. 야경이 좋은 한강! 시간나고 여유 있으실때 한번씩 들러보세요.,별표 5개,4년 전
순댓국집,여의도한강공원이 서울에서 한번정도는 가봐야할곳같음 코로나만아니면 공원이나 벤치에서 맥주한잔하면서 노는것도 좋을것같음,별표 5개,3년 전
국님,점심먹고 잠시 쉬기 너무 좋은 날씨네요. 얼른 코로나가 없어져서 사람들 자유로이 다닐 수 있으면 좋겠어요. 지금은 강쪽으로 더이상은 들어가지 못하게 해두었네요.,별표 5개,4년 전
임성진,정말 좋습니다. 편의점에 먹거리도 다양하고 계단에 앉아서 보는 한강뷰는 일품,별표 5개,5년 전
노고지리여행객,산책하기좋은 산책로가 있어 좋았어요,별표 5개,3주 전
happy very,노을과 시원한 물놀이 하기 최고의 공원 입니다,별표 5개,2년 전
김건주,선선한 밤공기를 맞으며 산책하기 좋은 곳. 아이스크림 하나 사 먹는 게 꿀맛,별표 5개,4년 전
조아름,티몬에서 텐트 예약하고 한강을 바라보며 치맥과 함께 불꽃축제 감상 ♡,별표 5개,수정일: 2년 전
Hwancheol Park,최고의 공원,별표 5개,1달 전
sunny,몇년만에 왔는데 더좋아지고 먹을거 많고 사람많고.,별표 5개,1년 전
김남수,"자주 오는 공원이지만, 서울에서 제일 편한 장소입니다. 걸으며, 생각하며, 자연을 음미하면서 즐기는 장소입니다.",별표 5개,수정일: 1년 전
용띔,자전거타고 종종 오는곳~ 요즘같은 가을에 딱 좋아요~~~     만원이면 돗자리 텐트 (저녁7시까지)대여가능해요. 배달해먹으면서 주말보내기 넘 좋아요♡,별표 5개,5년 전
Jongtae Ahn,자전거 빌려서 타기도 좋고 경치가 너무 좋아요. 날씨 좋은 날 친구 연인 가족들과 나들이 나오면 너무 좋아요,별표 5개,5년 전
박복주,여의도하늘에 화려한불꽃으로 물들어 너무 아름답고 판타스틱해 가슴에 좋은 추억 만들고 돌아 왔습니다 그런데 인파에비해 화장실이 부족해 불편했습니다 화장실 뉴스에 100만명 이상 사람이 모인다고 했는데 화장실이 많이 부족해서 부편했습니다,별표 4개,2년 전
So-young Kim,서울 스프링 워크 참여차 방문 주차장도 잘되어있고 역에서 접근성도매우좋음,별표 5개,2년 전
Faiz Mazlan (Fazze Alan),"기쁨은 나누면 질투가 되고, 슬픔은 나누면 약점이 된다.",별표 5개,2년 전
Steve Suh,고요히 흐르는 한강의 아름다운 자태와 주변의갖가지 편의 시설과 남여노소 모두다 안전하게 힐링할수 있는 낭만과 분위기가 흐르는 삭막한 도심의 빌딩 이라는 것을 망각하게 해주는 깨끗하고 세련된 공원이 무엇인가를 느끼게 해주는 곳으로 강 추 ….!,별표 5개,2년 전
SY Jin,놀이터가 잘되어있어요 날씨가 풀려서인지 사람들이 많아요,별표 5개,4년 전
JiHoon Kim,날씨도 좋고 점심시간에 산책하기 좋네요 ㅎㅎ,별표 4개,5년 전
SJ Lee,"한강몽땅 축제에 탱고 공연  잘 보았구요, 마포대교 남단 밑에 밥차에 스파게티와 리조트 너무 맛있었어요~~ RAWKICHIN 베리굿",별표 5개,7년 전
Chris Park,산책하기 좋은 서울의 명소 벤치도 꽤 많아서 쉬어가기 좋다,별표 5개,3년 전
정재준,봄 맞이 한강 즐기기에 좋은 곳입니다. 낮도 좋고 밤도 풍경이 좋습니다.,별표 4개,1년 전
회사가기싫어 (회사가기싫어),역 근처 잡상인 빼면 깨끗하고 경치 좋고 좋았어요,별표 5개,2년 전
hyuni21 park,이보다 좋을수 없죠 모두  소중한 한강을  위해 기본 원칙을 잘 지키며 자연과 함께 하길 바래요!!,별표 5개,6년 전
손언니 (프라이빗글로벌),여의도 한강에서의 모임은 언제나 즐겁습니다  한강라면은 필수예요,별표 5개,2년 전
송용석STYLE,처음 가봤는데 사람들 진짜 많네요 커플 천국. 저같은 솔로는 마음가짐 단디하고 가야 ㅋㅋㅋ,별표 5개,6년 전
DIY김수현,여의도 한강 공원은 좋은데 관리가 잘 되지 않는 쓰레기와 너무 많은 텐트들.. 그치만 역시 풍경과함께 여유롭고 좋습니다.,별표 4개,6년 전
최준희,깨긋하고 일단 관광명소로 정말 유명한 곳입니다. 여의나루역에서 바로 우측으로 가시면 바로 한강 공원이 보입니다.  거기서 돋자리는 10000원 정도 합니다. 대여료로 여러가지 주니 패키지 잘 사서 가세요.,별표 4개,4년 전
1 Gracias,돗자리 깔고 치맥먹기좋음. 편의점 라면은 웨이팅시간이 웬만한 맛집 웨이팅시간 뺨치므로 치킨에 만족하는게 좋음. 가벼운 원터치텐트 칠수있으나 문은 개방 해두어야함 돛자리 대여료 평균 2천원에 보증금 2천원.,별표 5개,5년 전
KYUNGNAM KIM,시민들이 많이들 이용하시네요. 더 멋진 한강공원으로 재탄생하길 기대해봅니다.,별표 5개,수정일: 1년 전
박병은,볼거리가 너무 많아서 좋아요  먹을것도 많아요,별표 5개,5년 전
김문정,코로나 때문에 사람들이 많이 모여있으면 안 되는데 넘 사람들이 많다.,별표 1개,4년 전
박현윤,서울살이를 포기 못하는 이유중 하나. 언제가도 한강을 힐링의 스팟이고 마음이 편해지는 곳인것 같아요. 이쁜건 덤♡ 커플지옥이긴 하지만 누구랑 가든 혼자 가든 정말 좋은 장소인것 같아요. 낮이고 밤이고 사랑스러운 장소♡,별표 5개,5년 전
Janghee Lee,불꽃축제에 다녀왔습니다. 오랜시간 기다린 보람이 있는 멋진 불꽃놀이 였습니다.,별표 5개,1년 전
yeran choi,요즘같은 날씨에 선선하니 딱 가기 좋습니다ㅎㅎ 적당히 힐링에 도움이 되는 곳이니 다들 한번쯤은 가보시는게 좋을것같아욥,별표 4개,4년 전
JINKU LEE,"십여년만에 갔는데, 예전의 가족적이고 한적하던 곳이 젊음의 활기로 가득해져 있었다. 곳곳에 돗자리를 펴고 앉아 간단한 간식과 알콜을 펼쳐놓고, 젊음을 즐기고 있다. 매우 생소한 광경이다. 과연 이러한 곳이 있었던가. 언젠가 티비에서 한강공원에 펼친 텐트의 사방을 다 막는 것을 금지하는 규칙을 추진한다는 뉴스를 들은 기억이 난다. 왜 그러는지 알 것 같은 주말 저녁의 풍경이었다.",별표 3개,수정일: 5년 전
최재원 (hilert),멋진 서을의 야경과 금요일 토요일 저녁엔 밤도깨비 시장이 열려요. 집에서 가까워서 자주 들리는 곳이예요. 누구에게나 추천할 만한 곳이예요.,별표 4개,수정일: 6년 전
Sopapa lee,"날씨 좋은 날 가족과 연인, 친구들 잔디밭에 텐트 쳐놓고 즐거운 시간 보냄 치맥은 필수 한강공원에서 사면 비싸니 미리 음식 준비해가삼",별표 4개,7년 전
HyeounJun Ko,1. 서울 사람은 친절하다. 2. 저녁에 가면 텐트촌 없음. 여의도 근처에 텐트 대여소 있음. 3. 야경 직인다! 와! 63빌딩! (걸어서 갈 수 있음. 오래 걸림) 4. 밤중인데도 분수대에서 물 나옴. 물낭비 오진다! 5. 평일에도 버스킹 있음. 6. 편의점 있음. 7. 화장실 많음. 이용자가 많아서 위생 상태는 별로임. 8. 자전거 대여소 있음.,별표 4개,6년 전
J A,2023-12-10 한강시민마라톤대회 참가 차 방문. 널찍하고 깔끔하고 시원하고 좋다.,별표 5개,1년 전
Younjoo Kang,걷고 산짹하고 운동하기 좋습니다.가족과 아이들과 다니기가 편하고 편리했어요.도심속 일상에서 벗어나 자유로이  걸어보세요. 굳!!!,별표 5개,3년 전
임영현,좋기야 하지만 사람들이 너무 많아서 자리잡기 힘드네요.,별표 4개,1달 전
Stone White,강변공원(선유도)으로는 최고,별표 5개,1년 전
허인회,2017년 12월 야시장 개장. 볼거리보다는 먹거리가 더 눈에 띄는 곳. 다양한 푸드 트럭들이 입을 즐겁게 해줌.ㅎㅎㅎ,별표 4개,7년 전
한선우,covid-19가 있더라도 장소가 개방되고 넓어서 마스크하고 산책하기에 좋습니다.,별표 4개,4년 전
배예진,2인 자전거를 타면 참 좋습니다 연인과 오면 좋을 거 같네요 저는 친구랑 와서 좀 2인 자전거 타는데 알 수 없는 시선을 좀 받았는데 친구랑 타도 그냥 웃기고 재미있긴 해요,별표 5개,6년 전
Jeongjoo Shim,깨끗하고 푸른색 많아 맘것 걸을 수 있어 행복지수 뿜뿜!!!,별표 5개,3년 전
김유정,젊은이와 외국인 가족들이 모두 즐거운 여행지,별표 5개,10달 전
청소하는골퍼,코로나로인해 야외로 나가는일이 많고 날씨도 너무좋은요즈음.. 돗자리나 의자는 필수로 가져가시는게 좋습니다^^,별표 5개,3년 전
소금안친곰국,한강공원 야경은 말이 필요없지요 사람들도 많고 먹을것도 많고 다 좋은데 남자는 없고ㅠ,별표 5개,2년 전
Casper,숨막힌 빌딩 숲 사이 유일한 쉼터가 되어주는 곳.,별표 5개,2년 전
영이,걷기 딱 좋다 그러나 새들이 너무 많다,별표 4개,2년 전
조현선,날씨 좋을때 놀러오면 좋아요 돗자리랑 텐트로 돈주고 빌릴수 있어요 대신 온 세상 사람들이 모여있습니다^^,별표 4개,6년 전
paul jung,"오전에 비가 왔음에도 불구하고 많은 사람들이 공원에 나와 있었습니다,",별표 5개,2년 전
나쵸,벚꽃이 여의도 상부 국회의사당 인근이나 여의나루 역 인근 그리고 여의도 하부쪽에 몰려있음 여의도 하부가 만개해있고 사람도 적다,별표 4개,6년 전
서해연,금요일 늦은밤 가족과 함께 방문 했는데 사람도 없고 좋았어요.. 아이들 뛰어놀기 좋고 다만 먹거리가 편의점뿐이라..  분식 이런거 기대하고 갔는데 없드라구요ㅠㅠ 아쉬웠음..  다코야끼와 라면..  bhc치킨..전부였음.. ㅠㅠ.. 작은 조각공원...뛰어놀기 좋았으요~,별표 4개,3년 전
Juneyoung Park,"한강공원 유람선, 관광코스로는 아주좋습니다.",별표 5개,1년 전
박미선,외국부럽지않은 한강공원 너무 시원하고 버스킹 노래도 넘 좋아요 다만 맥주먹으면 화장실이 대란.. 긴 줄에 깜놀..이에요,별표 4개,6년 전
고광표,물빛공원에 발을담글수있어 좋음,별표 4개,2달 전
Jinjoo Lee,"좋아요. 코로나 조금 수그러들었다고 야시장준비하고 있네요ㅋ 편의점,화장실도 여기저기 있고. 한강들 중에 젤 좋은듯합니다ㅎㅎ",별표 5개,4년 전
김현정,재미있게 구경했어요 놀이터 추가아이주세요 화장실 추가아이주세요 반려견 동반 환경 추가아이주세요 피크닉 구역 추가아이주세요,별표 3개,4달 전
오민정,불꽃축제 참석 진짜 볼만하더라구요 공원 너무 잘 조성되어있어서 감탄했어요 아침부터 명당자리 맡는 사람들 이해가 됐습니다,별표 4개,1년 전
블루라군,서울에서 최고의 시민들의 휴식공간입니다.,별표 5개,1년 전
김규열,서울에서 주말을 맘 편히 보낼 수 있는곳입니다. 산책도 하고 즉석 라면도 먹고... 신선한 공기는 덤입니다.,별표 5개,4년 전
안준환,"10시 넘어도 많이 춥지 않으면 타코야끼도 팔고 닭꼬치도 파네요. 마실도 좋고, 자전거 타기도 좋습니다.",별표 5개,3년 전
하늘,맑은 날 자전거 타고 산책하기 좋은 곳 A great place for a bike ride on a sunny day,별표 5개,수정일: 5년 전
곽근우,숙박업소가 없습니다,별표 5개,3달 전
Albert Jeong,서울에 봄이 오니 여의도한강공원에 사람들이 많이 나왔네요. 자전거 전용도로가 있어 좋구요.. 시원한 강바람 맞으며 강만 쳐다봐도 좋았습니다 😊…,별표 5개,4년 전
sunyoung eum,아이들과 산책하기 좋은곳입니다. 물놀이 하기도 좋아요,별표 5개,3년 전
서니,공원이 넒고 산책하기좋음 야경멋있어요,별표 4개,3년 전
김영목,강변따라  자전거 전용 도로를 아들과 같이 호흡을 맞추어 달려보니 콧 노래가 절로 나오고 강바람을 가르며 달리는 기분은 정말 좋아습니다 그리고 편이점에서 라면에 시원한 맥주 한잔은 강변의 운치가 더욱 좋았습니다. 아들아 고맙다.,별표 4개,5년 전
민MIN준JUN,시간나면 자주 가는 곳.. 근데 늦은 저녁에는 중고등학생의 놀이터 느낌..,별표 5개,5년 전
tae-hwan kim,"날씨 선선할 때 가면 좋은 곳, 야경이 이뻐요",별표 5개,6년 전
박정순,당산역에서 한우고기 맛나게 먹고 여의도 한강공원 여의나루역 까지 걸으며 다른 도시에 와 있는 착각하고 힐링하고 왔네요 😀…,별표 1개,4년 전
song Lee,아직까지는 조금 지저분하지만 옛날에 비해서는 청소인력이 정말 많아진거같아요 최대한 청결유지하는거같아서 좋아요 배달음식 잘시켜먹을수있도록 배달존 활용도 정말 좋았어요,별표 4개,6년 전
Jade Kim,아무 준비도 안하고 있다가 근처에 가서 어 한강가서 놀까? 했을 때 모든 걸 대여할 수 있는 곳. 그만큼 사람도 많아요,별표 5개,2년 전
Boram Lee,너무너무 좋아요.👍👍재미있어요!😀🌺…,별표 5개,2주 전
콩이,제가 가장 좋아하기도하고 쉴곳이 많아서 좋은곳입니다.,별표 5개,6년 전
Minsu Kang,서울 반대편이 싹 다 보이는 경치.,별표 5개,5달 전
혁윤성혁,좋아요!!한강도좋구 2주차장은사람많아요!!3주차장은 한적합니다!ㅎ,별표 5개,3년 전
YES YUN HO,걷고 힐링하기 딱 좋은 곳입니다ㅎ,별표 5개,3년 전
굿하이니,바람이 날리는 날씨였지만 날씨가 좋았네요. 여의나루역쪽에서 한강에서 나가면 있는 구역이 돗자리 펴기 가장 좋습니다.,별표 4개,2년 전
이성희,마스크벗고 댕댕이랑 남편이랑 봄소풍 길거리음식도 맛나고 코로나이후 첨인듯 일상으로~~♡♡♡,별표 5개,2년 전
Ju Hyun Jin,아이들과 산책하기에 최고이네요ㅅㅅ,별표 5개,7년 전
정환권,야경하나는 기가막힙니다. 그러나 여름철에는 많이 더우니 봄가을에 오시는걸 추천합니다.,별표 5개,7년 전
KAZ82 (kAZ),많은 행사 이벤트 와 멋진 자연풍경,별표 5개,2년 전
나정민,솔로들을위한 이벤트가 진행중이였습니다 화장실 줄이 많이 길어서 20분은 기다려야 했습니다.,별표 5개,2년 전
권단독 (단독),사람들이 정말많고 피크닉장소인가?는 정말 돗자리 깔고 먹는 사람들 많음.,별표 5개,수정일: 4년 전
여의정,날이 추워서 그런지 사람 많이 없고 소풍하기에 딱 좋은것같아요~,별표 5개,5년 전
조예진,3일간  잘다녀왔습니다 주인분들이  너무친절하여  너무행복한  휴가  되였습니다 금성 민박  짱,별표 5개,3년 전
순두,바람이 생각보다 많이부니 바람막이는 챙겨가세요,별표 5개,1년 전
박보람,날씨가 좋아서 한강에서 자전거타고 사람들 구경하는데 정말 좋았어요,별표 4개,6년 전
sJoon J,개인적으로 밤에 캔맥주하나사서 물에 발담그고 야경보는것을 매우좋아합니다. 샌들이나 슬리퍼를 신으셨다면 꼭해보세요ㅎ 더운여름밤이 시원하게 바뀝니다,별표 5개,6년 전
민지영,벚꽃축제기간인데 아직 국회의사당 뒤쪽은 많이 안피고 비까지 오는 주말에 다녀왔네요,별표 4개,6년 전
주아쥬블리,"토요일,일요일 환경미화인력 늘이고,특히화장실도 늘이고 편의시설도 좀더 늘이시길 바라겠습니다.줄때매 못가고 저기위에 올라가서 상가까지 다녀와서30분걸렸답니다.한국관광객들이 특히 젊은 외국인도 밤도깨비때문인지 엄청 많은데 국가에서는 이런데 확실히 투자하시면 좋겠어어요. 그리고 한국인들도 횡당보도 초록불에 건너시고 노랑불에 멈추세요. 차들도 지나가야지요. 질서지켜주고 먹거리하시는분들 위생도 좀 관리하셔서 깨끗하고 바람직한 4월의 벚꽃나들이가 되길 노력했음 좋겠습니다.",별표 3개,6년 전
박소현,넓고 한적하고 돗자리깔고 누우면 소풍온거같아서 너무좋네요,별표 5개,3년 전
김경태 (Paul Kim),평일에 혼자 산책하기 좋은 곳입니다.,별표 5개,7년 전
레드추파,퇴근후 야유회 하기 좋네요 날씨 조오타!,별표 5개,2년 전
GYEONGJIK IM,밤에 한강바라보며 맥주 한잔하기 좋아요,별표 5개,4년 전
김미화,가족과 나들이 가기좋아요,별표 5개,1년 전
박재철,"서울시민들의 접근성 갑, 사람들북적이는거 좋아한다면 최고 나들이 장소",별표 5개,6년 전
NY,힐링장소이자 라면맛집인 한강이예요~ 가족이 함께 미세먼지없는 날씨좋은날 너무 즐거운 시간 보낼수있어 너무 좋아요❤,별표 5개,6년 전
nannan ji,언제가도좋은한강변. 9월셋째일욜이 딱 나들이하기좋은 날이었다,별표 5개,2년 전
Jay Kim (네쿠쉬네트),"밤도깨비 시장... 야시장이 열리면 푸드트럭과 스몰디자이너들의 숍이 많긴 한데 아 이거다 싶은 것은 아직 많이 보이지 않습니다. 그냥 여름에 몇 번, 날씨 좋을 때 몇번, 축제 때 한 번 갈만한 곳이죠 치맥을 하러 배달하고 받는 사람이 뒤엉키는 현장.",별표 4개,8년 전
백paikaugustine,세계 어떤 도시와 비교해도  좋은 환경을 갖춘 공원,별표 5개,수정일: 4년 전
김미희,해질녁의 한강유람선을 타니 여기가 유럽인가? 싶다 ㅎㅎㅎ 조용하게 미끄러져 가는 유람선 한강의 풍경이 평안스럽고 기분 좋다....,별표 4개,5년 전
Surin Park,야경이  멋진 ~~~ 낮에는 산책하기 좋은,별표 5개,3년 전
JG3,새들이 많네요 ^^;; 라면 국물통에서 갑자기 나와서 깜짝놀랐어요ㅋㅋ,별표 3개,1년 전
Miyoung An,산책하고 자전거타고 라면먹기에 최고의 장소입니다.,별표 5개,6년 전
Riwoomeet,강바람과 함께 좋은 사람들과 맛있는 음식을 먹으며 사간을 보내는 곳도 좋죠,별표 4개,7년 전
김하니,한강에서 텐트빌려줘서 좋음 텐트안에서 먹는 한강라면 꿀맛. 3시간에 텐트 만원이면 저렴한건가? 무튼 좋은 추억이 생김.,별표 5개,6년 전
리리,너무시원하고 가족들과함께 여유로운 한때를보내기에최적의장소입니다.,별표 5개,6년 전
홍강석,가을날씨 잘 느끼고 불꽃 축제 잘 보고 왔어요. 많은 인파로 교통이 불편했지만 눈 호강했어요. 원효대교 주변 강추,별표 4개,5년 전
Hyunsil Ku,주변에 먹을거리도 많고 쾌적하고 좋아요^^,별표 5개,1년 전
Livy K,벚꽃 축제기간입니다 4월초,별표 5개,1년 전
영선비,한강중에 사람도 많고 먹거리도많고 텐트허용구간 따로있어서 좋음 자전거타기좋음,별표 5개,4년 전
김종명,가족들하고 가기좋은 곳이네요^^,별표 5개,2년 전
배추몬,산책하기좋고 운동하기좋고 23.12.2토 시즌마감 마라톤 커플러닝함 길이 좀 좁지만 상품이 좋앗당,별표 5개,수정일: 1년 전
김륜한,휴식 공간으로 참 좋아요. 주차도 편리하고 자전거 빌려서 타기도 좋아요.,별표 5개,1년 전
Robin Kang,"좋아요^^ 사람이 이렇게 많을줄이야ㅋ 텐트부터 거의다 돋자리 챙겨와서 가족, 친구, 직장동료들끼리 즐거운 시간보내더라고요.",별표 5개,7년 전
강윤희,시원하고 벚꽃 만개하면 이쁠듯 👍 주차요금도 싸고 괜찮아요…,별표 5개,6년 전
