작성자,내용,별점,작성일
박세희 (Park Sehee),"한 바퀴 돌면 15,00보 정도는 걸을 수 있어요 ㅋㅋ 그냥 어지간하면 리프트 타고 올라가서 내려오면서 관람하는 게 편해요",별표 4개,6년 전
정찬식,서울대공원은 언제나 부담없이 가서 즐거움을 경험할 수 있는 힐링공간이죠,별표 5개,4년 전
나현경,넓고 넓은 봄에 가면 벗꽃이 반겨주는곳 미술관 도 좋아요,별표 5개,6년 전
Todd Lee,대공원 주변 둘레길과 뷰가 너무 멋집니다 봄 가을에 오면 더 좋을듯 합니다,별표 5개,5년 전
신선영,동물들이 좀더 좋은 환경에서 살수있길,별표 4개,5년 전
in seong Jang,매우 넓음으로 동물원 갔다가 놀이공원까지 가기는 무리일 가능성이 큼,별표 5개,6년 전
raw joo,가족단위로가기 좋아요 데이트하기도 좋고요 케이블카가 잘돼있어서 큰체력들이지않고 놀수있습니다,별표 5개,6년 전
김은정,아이들과는 더할나위없지요 오래걸고싶지않고 무서운거싫은사람은 서울랜드로,별표 5개,6년 전
Chan Woo Bae,아이와 나들이하기 너무 좋았습니다,별표 5개,6년 전
Dabin Lyu,방문일 공휴일 대기 시간 대기 시간 없음 예약 권장 아니요 거의 한 10년 만에 재방문한 서울대공원 날이 따뜻해서 돌아다니기 좋았음,별표 4개,7달 전
JEONGSUN BAK,방문일 공휴일 대기 시간 1시간 이상 예약 권장 예,별표 4개,2년 전
Kevin Choi,입출구에 아이언맨 호응이 젤로 좋네요~,별표 4개,3년 전
마보스(톨스),지금가도 아이들이 아주 좋아합니다,별표 4개,7년 전
신동원,산책하기 너무좋네요 청계호수한바퀴 도는데 한시간 정도 걸리구요 호수 주변에 피크닉테이블이 많아서 도시락싸와서 먹는사람 정말많아요,별표 4개,6년 전
동탄호야우니,그치만 음식점들이빈약해서 도시락싸가시는걸추천합니당,별표 4개,6년 전
Juliano Park,"벚꽃과 진달래, 개나리, 봄꽃들이 아름답습니다 방문일 주말 대기 시간 대기 시간 없음 예약 권장 아니요",별표 4개,2년 전
김은아,좋아요 이기랑 가기깨끗하고 화장실만 ㅜ,별표 5개,6년 전
상플 (상플),아직은 좀 쌀쌀한듯 방문일 주말 대기 시간 대기 시간 없음 예약 권장 모르겠음,별표 5개,1년 전
박승호 (물흐르듯이),시설이 노후된곳이 좀있음,별표 4개,6년 전
오승훈,명절당일 가족과 놀러다녀왔습니다 민속놀이랑 한복입은 캐릭터가 반겨주더라구요 즐거웠습니다,별표 5개,7년 전
김헌숙,공원 둘레길 걷기 좋아요 교통도 편리하구요,별표 5개,4년 전
수학과외선생님의 힐링##서강마이매쓰,언제나 업그레이드 되어 있는 힐링최고의 장소,별표 5개,5년 전
bin ro,날씨 좋은날 동물원 방문함 한적하고 좋았어요,별표 5개,2년 전
브레드이발소,좋네요 산책할겸 동물도보구 좋앗어요,별표 5개,4년 전
금옥권,예쁜 풍경 행복 ㆍ 힐링하고가다,별표 5개,6년 전
사월이아빠,봄철 꽃구경 + 산책으로 좋아요,별표 5개,수정일: 3년 전
Junheon kim,"가을을 보고, 나들이 하기 좋은곳",별표 5개,6년 전
이상천,벌초시즌에 겹쳐서 사람도 많지 않고 놀기 너무 좋았어요,별표 5개,6년 전
문종성,동물도 좋고 경치도 좋은데 너무 힘드네요ㅎ,별표 4개,6년 전
고gogo12,좋음 말하면 뭐하누 입아프죠ㅠ 코시국인데 마스크만 썼지ㅋㅋ 사람 정말 많아요 다음에 갈땐 평일 오전에 가려고합니다,별표 5개,3년 전
지드래곤,조경이 잘되있고 많은 동물이 살아요 방문일 주말 대기 시간 최대 10분 예약 권장 예,별표 4개,수정일: 4달 전
리얼라,아이랑 나들이 하기 좋은 동물원 가격도 저렴하고 좋으나 코로나로 인해 실내 전시관 대부분이 문을 닫음,별표 5개,4년 전
이근영,천천히 구경하면서 여유롭게 한바귀 걷기하고 왔어요♡,별표 5개,4년 전
한국사람,동물원이 동물은 많이없고 거의 다 보지못하고 낮잠자고 크게 볼게없음 그냥 사람 무지하게 많음 동물원구경아니고 사람구경하기 전부유모차에 정말 정신없음 차도 엄청밀리고 갈곳이 못됨 그냥가까운 공원가는걸 추천함 진심 방문일 공휴일 대기 시간 최대 10분 예약 권장 모르겠음,별표 1개,10달 전
윤행신 (폴피닉스),오늘은 수능날 한가하니좋다~,별표 4개,6년 전
윤려경,가격도저렴하고 동물들도 많고 관리가 잘되는것 같아요 킥보드 못들어갑니다,별표 5개,4년 전
손상우,아이들과 함께하기 좋은 장소네요,별표 4개,5년 전
한쥬니,주차장도 워낙 넓어 조금만 돌다보면 자리가 생겨요 날씨만 좋으면 하루 종일도 놀지요,별표 5개,6년 전
송광용,사실 대공원 둘레길을 다녀 왔어요 정말 좋아요,별표 5개,4년 전
Eh J,정말 오랜만에 가본 서울대공원~ 아기랑같이갔어요~ 전체적으로 시설들이 너무 낙후되있어요,별표 3개,5년 전
나은숙,동물도 보고 가을단풍도 보고 일석이조의 장소로 좋음 초이스,별표 5개,5년 전
kiyoung kim,서울에서 가까우면서도 아름다운 자연을 경험할 수 있는 곳,별표 5개,7년 전
Kilbock Lee,시야가 탁트여서 그런지 왠지모르게 더 여유로워지는 것 같습니다,별표 5개,6년 전
조민정,우리의 인생도 이렇게 꽃길을 걸을 수 있다면,별표 5개,6년 전
Sangbum Ahn,걸어다니려면 강인한 체력필,별표 4개,6년 전
Ralph Park,아이와 같이 나들이 가기에 정말 좋은 장소,별표 5개,6년 전
King Pin,볼것 많은 동물원 지방에 가두리식 사육장에 비할수도 없는 엄청 좋은 곳,별표 5개,6년 전
노마드,자연과 함께 하는 좋은곳 입니다,별표 5개,1년 전
lucy M,도심에서 가까운 쾌적하고 아름다운 공원,별표 4개,4년 전
박상욱,동물원보고 왔는데 날씨 좋은날가서 너우너무 좋았습니다,별표 5개,4년 전
정은화,단풍이 너무예쁘구 호수둘레길 댕댕이와 산책하기 좋더라구요~,별표 5개,6년 전
이인수,"여러 동물들이 있어서 좋네요 펠리칸도 있고,",별표 5개,5년 전
나라가시 (가시나라),아이들이 구경으로는 최고죠,별표 5개,4년 전
정석주,"아이들 어릴적의 추억이 듬뿍 묻어나오는 숨결공원,",별표 5개,7년 전
fighter lee,가격도 저렴하고 애기가 좋아해요,별표 5개,6년 전
5 minutes Class,기린 낲에서 기린에 대해 설명해주는 사육사 아저씨가 친절하고 좋았다 거리 조명들이 대체로 어두웠음,별표 4개,6년 전
한지은,아이들과 걷기 좋은 곳~아이들이 즐거워하는 곳 ♡,별표 5개,수정일: 6년 전
꼬하네_놀이터,코로나때문에 실내운영은 안하므로 확인하고 가시길,별표 5개,4년 전
alice kang,어른 아이 모두에게 좋은 공간입니다 넓기도 하고 테마가 다양해 사전에 방문할 곳을 정하기를 추천합니다,별표 4개,6년 전
이영민,"아이와 같이 동물원 구경을 할 거라면, 리프트 두번타고 정상까지 가서 내려오는게 편할거같아요 방문일 주말 대기 시간 최대 10분 예약 권장 예 가족나들이&연인 데이트 장소로 최고인거같아요",별표 4개,1년 전
홍재일,매일 저녁 산책하고 있습니다,별표 5개,3년 전
JINSU SHIN,사람없는 날의 대공원은 최고예요,별표 5개,6년 전
신한별 (David Shin),동물을 좋아하는 사람과 놀러가기 좋아요,별표 5개,5년 전
Park JM (JMP),언제나 쾌적하고 관리가 잘되어 있어요 시간과 체력만 된다면 많은 동물들을 볼수 있습니다 방문일 주말 대기 시간 대기 시간 없음 예약 권장 아니요,별표 5개,1년 전
안성우,조카랑재밌게놀았네요 주창장이용보다는 대중교통추천해드립니다,별표 5개,7년 전
sung hak ju,주변이 산으로 둘러쌓여 있고 공원앞쪽으론 저수지를 산책 할수있어 최적의 힐링장소로 추천함,별표 5개,수정일: 5년 전
SANGWON LEE,봄 나들이 다녀왔어요~ 좋아요~,별표 4개,수정일: 7년 전
한준우,많은 동물들이 있어서 아이들도 너무 좋아하고 즐거워했는데 비를 피할장소가 없어서 조금 아쉬웠습니다,별표 5개,5년 전
리군자,가족이 함께 산책하면 좋은장소,별표 3개,5년 전
yani,많이들 주무시고 계시지만 아이에게는 좋은ㅈ교육이 되는곳,별표 4개,6년 전
오요한,"나들이 가기 좋고, 동물 구경도 좋습니다 다만 안에서 멀 사먹기에는 품질가 높지 않고, 주말에는 주차하기가 너무 힘들어요 이왕이면 대중교통 타는것도 좋아보입니다 방문일 주말 대기 시간 10~30분 예약 권장 예",별표 4개,1년 전
쌈박s S,기린이 천막에 걸렸다가 혼자힘으로 빠져나왔는데 주변 아이들의 박수소리와 함성이 아직도 생상함,별표 5개,6년 전
김아웃브레이커,가을에 산책하며 동물들 보기에 좋았어요,별표 4개,5년 전
Yunsub Jung,"윤중로 부럽지 않은 화련한 벗꽃이 준비되어 있어요, 벗꽃놀이는 주차가 편리한 서울대공원으로",별표 5개,6년 전
Koko Hyunsoo (고씨),언제든 서울대공원은 좋습니다 그러나 관리가 조금 안된다는 느낌은 지울수가 없습니다,별표 3개,3년 전
Jeny Chu,음식은 별로에요 비쌉니다,별표 5개,6년 전
코코코,화창한 날씨에 나들이가기 정말 좋습니다,별표 5개,6년 전
지연김,미술관/식물원/테마가든/동물원/놀이동산이 함께있고 주차장이 넓어서 좋아요,별표 4개,4년 전
kyungwon Han,온라인에 리프트와 코끼리열차 치켓이 있으며 현장에서도 패키지 싱품을 판매합니다 동물들이 많으며 구경하기 좋네요 리프트로 최대한 위로 올라가서 위에서부터 걸어내려오는걸 추천합니다 방문일 주말 대기 시간 대기 시간 없음 예약 권장 예,별표 5개,1년 전
Y.,시시할줄 알았는데 의외로 너무 좋았어요,별표 5개,3년 전
이용철,아이들도 좋아하고 나들이가기 좋아요,별표 5개,수정일: 4년 전
임희주,다양한 동물을 저렴하게 볼수 있는 공원,별표 5개,6년 전
YG Song,가족이나 연인과 함께 나들이 하기 좋습니다,별표 5개,6년 전
Hyunsoo Cho,늦가을 방문한 서울대공원에는 아직 단풍이 남아 있어 산책하기에도 좋았습니다 언제 가도 좋은 곳이죠,별표 5개,3년 전
김흥록,대공원 사진가들이 많이 찾는 좋은곳 일반관람객도 연일 북적인다,별표 4개,3년 전
Chelsea ho,"동물원 입구에 유모차 대여도 해줍니다 동물원이 너무 넓어요~혹시 아기,유아들은 유모차 꼭 챙기세요",별표 4개,6년 전
영범조,정말 좋았다 좋은 추억 만들고 감,별표 5개,7년 전
Ky p.,어이 데리고 나들이하기 너무 좋아요,별표 5개,6년 전
김태우,넓고 좋아요 소풍가기 음식은맛없음,별표 4개,7년 전
김동환,몇만년만에 동물원 구경 ^^ 방문일 주말 대기 시간 대기 시간 없음 예약 권장 아니요,별표 5개,2년 전
정승우,너무 좋은시간 보낸거 같네요,별표 5개,5년 전
Hyeyoung Lee,조경이 잘 되어있다,별표 5개,7년 전
최은주,동물도 귀엽고 놀기 편하다,별표 5개,5년 전
김주범,아침 개장시간에 가면 아침먹는 동물들 구경할수 있어요,별표 5개,4년 전
최미나,"가족,연인,친구들과 나들이하기 좋아요 한번쯤은 추천요~",별표 4개,6년 전
니니,동물들이 거의 실내에 있어요 그래서 가까이서 볼수 있는건 좋았네요 사자 호랑이 늑대 곰 표범은 야외에 있었는데 언청 활발하게 뛰어다녀서 봄여름보다 보기 좋았어요 방문일 주말 대기 시간 대기 시간 없음 예약 권장 아니요,별표 5개,1년 전
붐베티,관리를 잘 해놓음 근데 짠해보이는건 어쩔수없나봄,별표 4개,6년 전
Michael Park,"꽃밭, 산새들, 신선한 공기, 동물원 여기는 지상낙원♡ 정말 좋아하는 곳입니다",별표 5개,4년 전
이점규,가을을 느끼며 힐링하는 시간을 보냈답니다,별표 4개,6년 전
임유정,산책도 하고 동물도 볼수 있어서 좋아요~,별표 5개,5년 전
이 ᆞ만라,가족 나드리에(어린아이ㆍ어르신) 좋은 장소 입니다,별표 5개,6년 전
JEEBOK지복,서울대공원 어린이들이 엄청 좋아합니다,별표 5개,6년 전
유뇨 (유뇨),볼것많고 아이들과오기좋아요 길도넓고 잘해놨어요,별표 5개,4년 전
전태호,흐리지만 기분좋은 산책을 ^-^,별표 4개,4년 전
박인원,저렴한 입장료 사람 많고 동물도 많은점은 좋다,별표 4개,6년 전
daesung choe,5살 아이와 가기 좋은곳,별표 5개,5년 전
박의환,상업적 편의가 다소 부족한 것이 아쉽지만 그래도 이만한 공간은 흔치 않다,별표 4개,수정일: 5년 전
MINJAE JANG,연간회원으로 자주 오는곳 3살부터 초딩까지 아이들과 함께하기 좋은곳,별표 5개,5년 전
에듀153,막내는 서울대공원 처음 가서 코끼리 보고 좋았나 봐요,별표 5개,7년 전
문태권,아이와 함께 나들이 하기에 좋은 장소,별표 3개,4년 전
루루비,화창한 봄날에 동물원 산책하러 가도 너무 좋아요 ㅠ,별표 5개,4년 전
김문신,"오랜만에 서울대공원 다녀왔는데 입구가 바뀌었네요 동물친구들 리프트, 코끼리열차 너무 좋았네요 방문일 주말 대기 시간 대기 시간 없음 예약 권장 아니요",별표 5개,1년 전
김정민,날씨 좋은 날 하루 보내기 좋은 곳,별표 5개,6년 전
김여림,넓고 동물들이 많아서 가족 나들이에 좋아요 방문일 주말 대기 시간 30~60분 예약 권장 예,별표 4개,3년 전
박진홍,관리가 잘 되어있고 다양한 동물들이 있어요^^,별표 5개,6년 전
범서,최소한에 동물을 배려한다고 좁은 유리벽으로만 봐야한다,별표 3개,6년 전
sy KIM,요즘 가기 딱 좋은 곳,별표 5개,3년 전
Seungwon Oh,곳곳에 휴식공간 좋음~,별표 5개,6년 전
Mh Kang,가족들끼리 간만에 단란한 추억 쌓았네요~,별표 5개,5년 전
Kang SeogWoo,4월 중순에 방문하면 멋진 벚꽃을 볼 수 있어요,별표 4개,6년 전
뉴뉴뉴,ㅎ 친구랑 가기도 좋아요 방문일 공휴일 대기 시간 최대 10분 예약 권장 아니요 아이들 데리고 온 가족 보면 엄마아빠가 많이들 고생하시는 듯,별표 5개,2년 전
이광진,수도권 다자녀(2인 이상) 가구일 경우 등본에 기재된 가족은 모두 무료예요 7월까지 3자녀 혜택이 2자녀로 변경됐어요 그래서 아이들하고 한 번씩 가고 있답니다 아이들이 너무 좋아해요 세번째 방문 했는데 드디어 호랑이를 만났네요 자주 가신다면 서울랜드 자유이용권 끊으면 코끼리열차가 무료라고 합니다 참고하세요 :),별표 5개,1년 전
taebong seo,대공원 산책길 - 꽃,별표 4개,7년 전
강의지,아이와 갈만한곳이죠ㅋㅋ 늘 올때마다 아이의 보는관점이 달라져 신기하고 새로움을 느껴요,별표 5개,6년 전
Jay Cho,가족소풍이라면 이보다 더 좋은곳이 있을까,별표 5개,수정일: 7년 전
yeonsim Yang,날씨좋은 날 가족들친구들 아이들과함께하면좋아요,별표 5개,5년 전
박상호,오랜만에 가본 서울대공원 다른 동물들 다 봤는데 코끼리만 안보이더라 둘리가 괴롭혀서 숨었나보다,별표 5개,5년 전
김명화,언제나 와도 귀여운동물도 보고 자연도보고 힐링입니다,별표 5개,6년 전
유종협 (묵상),"가족,연인,지인과 둘러보기 좋은 곳",별표 4개,7년 전
한상수,김밥들고 편안하게 가을정취 느끼러 가기 좋은 곳,별표 5개,수정일: 3년 전
Maymay오월오월,가성비좋은 즐거븐 여행이 가능합니다,별표 5개,3년 전
traveller Ritka,공기도 좋고 썸머 페스티벌 도 재미있어보였습니다,별표 5개,5년 전
김승현,아이가 너무 좋아해요 코끼리 열차는 별로고 리프트가 코스도 길고 재미있었음,별표 5개,7년 전
서재현,입장권 리프트해도 가격이 괜찮고 일단 크고 볼게 많아서 좋네요,별표 5개,2년 전
이강화,딸아이가 동물을 너무좋아해서 동물원에서 즐겁게 놀았네요,별표 4개,4년 전
박무찬,아이와의 행복한 시간 만들기 우리가족의 행복한 순간을 만드는곳,별표 5개,6년 전
ingyu Kim,다양한 동물을 볼수 있어서 좋습니다,별표 5개,7년 전
Rali Yoo,동물들이 많이 없구 산책코스로 추천,별표 3개,6년 전
Kim,오랜만에 가서 잘 놀다 옵니다~ 코로나 때문에 실내는 다 문을 닫아서 살짝 아쉽지만 산책로가 잘되어 있어 산책하기 좋고 동물들도 아주 스트레스를 받는 거 같진 않아요 하지만 어린 아이들은 마스크를 잘 안 쓰는 경우가 있어요,별표 4개,4년 전
bongsoo kim,동물원 너무 좋고 산책하기 좋아요,별표 5개,6년 전
김영근,"주말인데도 사람이 많진 않네요,, 선선하니 좋아요",별표 5개,4년 전
차영석,"동물원,놀이시설이 풍부하고 산림욕과 꽃밭이 많아요",별표 5개,6년 전
짱현대자동차,방문일 주말 대기 시간 최대 10분 예약 권장 예,별표 5개,9달 전
이관우,주차장입구에서 대공원까지 걸어가는길이 너무예쁘요,별표 4개,6년 전
Yiro,캠핑장 ㅜㅜ 좋아여 리프트경치도 굳,별표 5개,4년 전
jason.hwang,이나랑 처음 가본 서울대공원 😁 너무 좋아요,별표 5개,3년 전
김기범,충남공주 웅진식품 주변 깨끗하고 경치도좋다 공장이라는느낌이없다,별표 4개,3년 전
안재환,그래도 재미는 있다,별표 3개,3년 전
최근영,동물을 가까이서 볼 수 있어 좋았습니다,별표 5개,6년 전
Jihyun Han,추운겨울에 가서 동물원에 아가들이 많이 안 보이더라구요 모든 동물들이 한곳을 맴돌고 불안해 보이는데 좁은 우리 안에서 스트레스를 많이 받는거 같아 안쓰러웠어요,별표 4개,5년 전
신종근,리프트타고 올라가서 내려오며 볼수있어 힘도 덜들고 유모차 끌고 다니기도 좋으며 화장실도 곳곳에 있어 참 좋습니다 애들데리고 놀러갈만한곳으로 강추합니다 동물이 많고 가까이서 볼수있어 좋습니다 단지 너무넓어 전부 보기는 어려운게 단점,별표 5개,5년 전
Michaela Kim,야외 조각 미술공원 추천합니다,별표 4개,7년 전
영철곽,단풍이 한창입니다 아주 이쁩니다,별표 5개,4년 전
닥터벤데타S2사망여우응원 (꼬꼬),언제 가도 좋음ㅎ벌러덩 사자와 다리 꼬은 코끼리🦁🐘,별표 5개,6년 전
이재웅,"안내원 배치를 해주면 좋겠음 시설 내부 굉장히 관리가 잘 되있으나 안에서 돗자리 깔고 방역수칙 안지키고 모여있는 사람들 많음 꽤 힘듬) 주차장 결제시스템이 바꼈는데, 젊은 사람들은 좋을듯 (카카오 연동) 어르신들은 헷갈릴듯 오후엔 많지만 오전엔 사람 많이 없음 코끼리 열차에 유모차를 싣는게 가능하나 굉장히 힘듬 (유모차가 있는 경우 코끼리 열차를 안타면 많이 올라가야함, 안그래도 동물원도 넓은데",별표 4개,3년 전
지연,사람이 많지 않고 가격도 저렴하고 공기도 좋고 전체적으로 맘에 들어요 ㅎㅎ,별표 5개,6년 전
Youngjoo Sohn,"운영하시는 분들의 노력도 보이고, 시설도 많이 낡았지만 조금씩 개선되어가고 있는 티가 납니다 공공시설인 것 감안하면 만족스럽습니다",별표 4개,3년 전
서인경,나무도 울창하고 둘레길에 포장이 되어있고 완만한 오르막이라 힘들지도 않고 정말 최고였습니다 동물원 둘레길을 다녀왔는데 정말 좋았습니다 전날 비가 많이 왔고 당일에도 약하게 비가 내렸는더 오히려 젖은 나무향이 더 좋았어요,별표 5개,5년 전
이유진,천천히 밥먹으면서 쉬다가 보다가 하니 4시간 너무게 걸렸어요 입장권도 저렴하고 볼거리도 많고 최고예요,별표 5개,2년 전
Ho-jeong Song,방문일 주말 대기 시간 30~60분 예약 권장 모르겠음 30년만에 방문하여 옛날 추억에 잠겨 좋았습니다 아이에게 보여주기 조금 힘들었습니다,별표 4개,2년 전
튼튼아빠,사람도 많고 날씨도 너무좋았어요,별표 5개,3년 전
saejin Park,저렴하고 조용하고 넓고 유모차 끌기 좋고~ 애 딸린 유부에게 이런 곳 잘 없습니다 ㅎㅎ,별표 4개,5년 전
kihan Nam,동물도 많고 지하철 역 부근이라 오가기 좋아요,별표 4개,4년 전
정지현,코끼리 기차는 낡았고 덜컹거리지만 아이가 정말 좋아함 코로나로 인해 실내 시설은 모두 이용금지되어 있으므로 추운 날엔 갈수없음,별표 5개,4년 전
Wendy Kim,아이와 함께하기 좋은 곳,별표 5개,4년 전
권나연 (fiona),걷기좋고 편안한 산책로에요,별표 5개,7년 전
doll&me,주말에도 11시 전에 좀 부지런히 가면 주차장도 한가하고 여유롭게 즐길 수 있습니다 ㅋㅋ 오랜만에 갔는데 예전보다훨씬 좋아졌네요,별표 4개,6년 전
List to read addition,세계적인 트래킹 코스로 부상을 하는 중 방문일 평일,별표 5개,2년 전
sukyoung Yoo (써규),오랜만에 아이와 함께 나들이 갔어요 사전에 발렛 예약하고 티켓+리프트2회권 예약해서 갔어요 발렛 이용해서 아주 편했고 리프트도 타고 정상까지 올라가서 구경하면서 내려왔더니 편하고 좋았습니다 방문일 주말 대기 시간 대기 시간 없음 예약 권장 예,별표 5개,2년 전
봄날,코비드 때문에 평일에 가서 여유롭게 보고 왔어요 실내 전시는 마스크 필수 착용이라 저희는 16개월 아기가 마스크 아직 쓰질 못해서 관람을 못했어요 내부 식당 오픈하긴 했으나 가격대비 품질는 별로라 도시락 싸가는게 좋을 것 같아요 기저귀 갈 수 있는 곳도 여러곳 있었고 화장실도 관리 잘 되어있어요 다만 코비드로 동물원내 음식먹는 곳 벤치는 착석 못하게 막아뒀더라구요 ㅠㅠ,별표 5개,수정일: 5년 전
신현영,"아름다운 정원, 둘레길을 걷는 시간이 즐거워요",별표 5개,3년 전
어등산호랭이,나들이하기 좋은장소 입니다 방문일 평일 대기 시간 대기 시간 없음 예약 권장 아니요,별표 4개,수정일: 1달 전
lilysieun,"작은물놀이공간도 있고 동물구경 기본이고 화장실,매점 많아 좋구 아이 데리고 가서 놀기에도 너무 좋아요 체력만 있으면 진짜 여긴 하루도 모자랄 정도",별표 5개,4년 전
YunHa Kim,가족나들이에 좋아요 방문일 주말 대기 시간 1시간 이상,별표 5개,수정일: 1년 전
donnie kim,걷는 곳이 많아 불편하지만 가성비는 좋으며 나름 정비가 잘 된곳입니다,별표 5개,6년 전
Kevin Yu,화장실이 좀 깨끗했으면 더 좋을것 같아요 식품위생관리가 필요해요 바쁘신건 알겠지만 식품인데 바닥에 방치하는건 아닙니다,별표 4개,5년 전
허금자,산책 하기에 너무좋은곳,별표 5개,6년 전
Young Suh,도착해 주차장 입장하는데만 30분 정도 걸린 듯 합니다 주말에는 오픈시간 맞춰 도착하는걸 추천 합니다 방문일 주말 대기 시간 10~30분,별표 4개,1년 전
Misun Kim,도보로걷는거리가 엄청나지만 운동삼아 아이와 곳곳에 있는 동물들 보는 재미에 시간가는줄 몰랐어요~ 아이가 어리다면 간단한 간식거리는 보냉백에 가져가심이 좋을거같아요~ 아이와 동물원 나들이 정말 좋았습니다,별표 5개,5년 전
조경태,어린이들이 좋아하는 곳입니다,별표 3개,5년 전
bernard Jeong,나들이 가긴 좋으나 시즌 상황에 따라 실외라서 춥기도하고 동물들도 실내에 들어가있는 경우가 많아요 3월 말부터 10월 초 까지가 제일 다니기 좋을때인거 같아요,별표 4개,5년 전
서민기리아빠,걸어다니기엔 좀 피곤하지만 애들 뛰어놀고 구경하긴 참 좋음,별표 5개,6년 전
최은진,처음가본거라 리프트권이 있는데 불구하고 걸어서 올라가느라 조금 힘들었어요~ 내려가는 리프트를 탄 건 우리가족뿐이었네요^^; 그래도 날이 따뜻한날 가서 나와있는 동물들도 꽤 있었어요~ 동물 좋아하는 아들과 좋은 경험이었네요~,별표 5개,6년 전
guide man,오전에 일찍 방문했더니 야행성 동물들이 그나마 활발하게 움직이는 모습을 볼 수 있어서 좋았음 동선은 여전히 리프트 2번 타고 올라갔다가 동물원을 내려오면서 관람하는 것이 편리함,별표 5개,수정일: 4년 전
바람따라서,창경원에 있던 동물원을 서울대공원을 만들어 이전한 곳,별표 4개,8년 전
박보영,산에 둘러 쌓여서 답답하지 않고 한적히 산책하는것 같아서 아주 좋다,별표 5개,5년 전
티라노,아이들과 가기에 너무좋네요,별표 5개,7년 전
mirjiny,낙옆 밟는 소리도 너무 좋구요,별표 5개,3년 전
