작성자,내용,별점,작성일
심은미,동물원도있고요식물원도있고요코끼리열차도탈수있어요한번가보시면좋겠네요기념품파는데도있고요먹는데도많고요놀이기구도탈수있어요 방문일 평일 대기 시간 1시간 이상 예약 권장 예,별표 5개,2년 전
SONGQUE PARK,넓은 주차장에 종일 주차해도 오천원 공원내 간식거리는 비교적 있으나 식당이 많지않음 넓은 공간에 많은동물들,별표 4개,6년 전
권기준,5월13일까지 동물 환경공사 해서 몇가지동물을볼수없으니 공사끝나고 가세요 힐링,별표 4개,7년 전
Jins,공기좋고 볼것도많고 아이가 너무 좋나합니다,별표 5개,6년 전
Yoonyoung Choi,주말에 가면 항상 사람이 많지만 조금 서둘러서 출발하면 주차도 어렵지 않고 쾌적하게 구경할 수 있습니다,별표 4개,8년 전
White Saint,그리고 대공원 산책길 너무 좋습니다 동물원을 아이들과 같이 갈 때는 리프트 이용하세요 동물원이 너무 넓어서 한번에 볼 수 없습니다,별표 5개,3년 전
Weissach Dale,"그리고, 먹거리가 좀 많아지길 바랍니다 빨리 메로나가 사라져서 실내 까지 관람 할 수 있었으면 좋겠어요 동물 구경 잘 하다가 처 박혀있는 쓰레기보면 , 진짜",별표 5개,4년 전
여Khy5174@naver.con,또 호랭이를 보러감~♡ 펜자패밀리~♡ 방문일 주말 대기 시간 1시간 이상 예약 권장 예,별표 5개,수정일: 2년 전
A B,"그러나 부모와 아이들 소리지르며 여기 좀 보라며 유리창 두드리고, 주지말라는데 먹이주는 모습도 많아 시민의식 개선이 좀 더 필요하다 싶음",별표 4개,5년 전
Kim Jude,다시 매표소까지 내려오면 코끼리열차를 타고 주차장으로 이동하세요~ 안그럼 힘들어요~ 가족 나들이에 최고의 장소 코끼리열차-매표소-리프트를 통해 정상에 오른후 내려오면서 관람하면 덜 피곤합니다,별표 5개,4년 전
k.j Lee,저렴한가격에 아이들과 놀기 좋았습니다,별표 5개,7년 전
김용선,너무재밌게 잘 다녀왔어영 티주차장 할인혜택도 너무좋았구요~^^ 공사는 있었지만 출입시 교통카드 찍고 빠른 통과 센세이셔널했네영,별표 5개,3년 전
드렁크,리프트 코끼리열차 다 패키지로 끈어서 리프트로 꼭대기까지 2번타고 올라가서 내려오면서 관람 입구에서 주차장까진 코끼리열차 추천,별표 3개,4년 전
진상진,관리가 예전같지 않고 낙후 된 느낌ㆍ 돈 아까워,별표 2개,7년 전
진상호,"안내소에서 각 장소까지의 거리가 먼것은 어쩔수 가 없겠지만, 코끼리 열차 탑승지 까지 유모차도 이동가능하게 개선이 필요할 듯 들어가는 입구가 좁은데 노점상도 너무 많음",별표 3개,8년 전
육선화 Olivia,평일 오전 10시 반쯤 도착했는데 붐비지도않고 나들이 잘다녀왔어요 방문일 평일 대기 시간 대기 시간 없음 예약 권장 예,별표 5개,1년 전
JMPARKA,새롭게 공사를 하여 넓은 방사장에서 편하게 있는 동물들을 보니 좋았습니다~ 실내에서는 반사필름을 붙여 고릴라가 신경을 안쓰고 관람할수 있어 좋았다,별표 5개,6년 전
Dennis Kwon,체력 안배를 잘 해야 모두 돌아보고 올 수 있음,별표 5개,6년 전
유해정,ㅜㅜ 3세아가들 동물보려면 건대쪽 어린이대공원이 데리고다니기는 훨 동선도짧고 가까이보기 나아요,별표 5개,4년 전
이정화,편의시설(휴게실 등) 잘 되어있고 동물들도 나름 쾌적하게 관리되고 있었다 유모차 끌고 다니기 좋다,별표 4개,4년 전
김영재,길이 가깝고요 하지만 코끼리 열차와 케이블카가 늦게 왔습니다 하지만 생각보다 오래 있었네요 재미있게 놀다보니 시간이 가는줄도 모르고 놀았어요~^^,별표 4개,4년 전
류선종,항상 기대 이상인 동물원 스카이 음 뭐시기를 타고 꼭대기에서부터 내려오면서 보면 편하기도하고 재밌다 옥수수도 맛있고 쉴곳도 많다 날씨에 영향을 받긴하고 시설 자체가 낙후되어 보이긴하지만 핵심 콘텐츠인 동물에 대한건 정말 잘되어있다,별표 4개,7년 전
박진우,넓은데 동물하고 거리가 너무 멀어서 발 안보여요 너무 넓어서 아이랑 가면 힘들어요,별표 2개,7년 전
김코코,그리고 가는길에 코끼리열차를 타면 바람이 진짜 시원해요ㅎ 정말 지금은 15살이나 먹었지만 괜찮은곳입니다ㅎ,별표 5개,수정일: 7년 전
Scott Lee,"3월 17일 토요일에 방문했는데, 시설 공사 및 AI로 인한 조류사 관람중지로 많이 보지 못했습니다 관람이 불가능한 상황은 홈페이지에 충분히 공지해주는 것이 좋을 것 같습니다",별표 3개,7년 전
willow,"홈페이지에도 관련 안내가 없었는데, 결국 겨울철이라 야외에 동물이 많이 없어서 산책 많이 하고 돌아왔습니다 지난해 11월 방문했을 때 시간관계상 곤충관을 관람하지 못해서 날씨가 오랜만에 따뜻해져서 다시 찾았습니다",별표 3개,4년 전
Jason Jung,지역별 분포된 동물원의 코스는 가족이 함께하는 최고의 하루 코스입니다 둘레길이 초보등산가가 쉽게 도전할 수 있는 곳,별표 4개,6년 전
Tae-hyeong Kim (Sunny),"애가 어려서 다섯번은 올 생각인데, 호랑이나 곰이 있는곳은 괜찮은데, 시멘트 안에 있는 동물들은 좀 힘들꺼같음 동물들에게 맞는 환경조성이 필요할듯 너무 넓어서 하루에 구경은 힘든곳",별표 5개,6년 전
은하수tv,너무 좋아요 방문일 평일 대기 시간 대기 시간 없음 예약 권장 아니요,별표 5개,3년 전
Kangbae Choi,"돌고래쇼가 없어진게 아쉽기는 하지만, 동물 구색도 잘 갖춰져 있고, 적절하게 투명유리전망창을 설치하여 동물들과의 거리도 가까워짐 코키리열차, 리프트 등이 있어 접근성도 좋음 아이들이 있는 집안의 필수 방문코스임",별표 5개,5년 전
Youngjoo Cho,"기린과 코뿔소를 시작으로 호주박물관을 먼저가고 아이들 좋아하는 호랑이,사자는 가로질러가서 보고 내려올 때는 셔틀을 타는 센스발휘",별표 5개,6년 전
Kyle,산책하기 좋고 아이들 좋아하는 동물도 많음 근데 편의점은 문연곳을 찾기 힘든데 이게 생각보다 불편 함,별표 4개,6년 전
Narae Kim,오늘 많이 덥지 않은 시간에 갔는데 아이들이 활기차지 않구 아파보이는 애들두 많았어요 그리고 동양관의 수질이 너무 안좋더라구요,별표 3개,수정일: 6년 전
seung,벚꽃구경 하고왔어요~ 평일오전엔 너무 한적하고 탁트여 좋았네요 호숫가는 평화롭기 그지없네요,별표 5개,6년 전
김태식,촛대바위를 많은사람들이 기까이 갈수 있도록 환경을 마련했다,별표 5개,5년 전
seon yang,"너무너무 크기때문에 발편한 운동화 필수 더운 날이면 얼음물 2병과 모자, 양산도 있으면 좋아요",별표 4개,4년 전
OLIVIA AN,동물원안에 초입에만 편의점이있고 위쪽은 스낵바가 깨끗하게 관리되는지 의심스럽고 어린아이들 먹을 간식을 사기에 선택이 부족하다 곤돌라타고 맨꼭대기까지올라가 내려오면서 갈림길이 2개로 갈라지는데 선택해서 감상이 가능 내부가 너무 넓어서 미취학 아이데리고 하루에 다보려면 힘들다,별표 5개,5년 전
현진이,연1회 이상 다니는데 공사중이라 못보는게 많다 그리고 코로나로 실내관람도 안돼고 공사중이라 못보고 그러면 가격이라도 할인이 있어야하는거아닌가,별표 2개,4년 전
골드형,10시 이후에는 미술관주차장으로 가지마세요 1차선이라 길에서 막히면 턴이 불가해요,별표 5개,6년 전
misscat,호수 주변 산책로가 정말 좋아요 지금은 벚꽃이 만개해서 더 좋구요 현대미술관도 바로 옆에 있어 산책하다 라운지D에 가서 식사해도 너무 좋아요 힘들면 코끼리열차나 리프트 타고 내려와도 되고요,별표 5개,6년 전
배재석,날이 좋을때 방문 하시길 추천드립니다 코로나이다 보니깐 동물들도 없는 곳이 있네요 비가 간헐적으로 내려서 지붕찾기 바빴어요,별표 5개,4년 전
sh Lee,공원 한 바퀴 산책하고 리프트 타기는 좋습니다 가족 커플보다도 노인분들이 상당히 많고 무료로 즐기기에는 괜찮은 듯 합니다 안내소 자체는 불친절,별표 4개,6년 전
정지용,"때로는 가파른 길이 땀도 났지만 대체로 평탄하고 운치가 좋군요 여러번 다녀왔지만 이런 삼림욕장 코스를 만들고 가꾼분들께 고마움을 전합니다 3일 서울대공원 삼림욕장을 다녀왔어요~ 도토리, 상수리, 밤송이가 벌어지며 알맹이가 떨어지는 소리가 산행하는 7km 내내 들려요 아직 단풍은 안들었지만 가을의 정취가 마음을 풍족하게 하는군요",별표 5개,6년 전
WonSeok Cha,저렴하고 조용하고 자연에 가까워 좋아요,별표 5개,6년 전
Jae Won Kim,아이들하고 나들이하기 정말 좋은 곳,별표 5개,6년 전
Lynn Oh,아직 추울때라 대부분 실내에 있었지만 새로생긴 호랑이 우리는 굉장히 가까이서 역동적인 모습을 볼수있어 너무 좋았고 셔틀버스가 있어 힘들지않게 가족들과 관람할수 있어 좋았음,별표 4개,6년 전
YH S,동물보기와 산책은 최적의장소이나 코로나때문에 식당도거의문닫고 음식은 무조건 싸가세요 차마 사먹은 음식사진은 못올리겠습니다,별표 4개,4년 전
백창흠,버려진 생활 쓰레기와 각종 폐기물이 흉물스럽던 그곳이 지금은 시민틀의훌륭한 휴식공간과 안식처가되여 우리 곁에 있읍니다 호수와 넗은 공간은 어린아이들이 마음껐 뛰놀수있어천국이기도 합니다,별표 5개,5년 전
정경희,꽃구경가기 너무좋은 날씨네요 ^^,별표 4개,수정일: 6년 전
송상,서울대공원은 녹지시설등 자연환경등은 잘되여있으나 자연공원으로 자연스러운 맛은 잃어버린 감이 많은것 같아요,별표 4개,5년 전
김병석,눈처럼 쏟아지는 벗꽃잎을 온 몸으로 맞으며 봄을 만끽했지요 정인과 걸으면서 두고온 서름의 시간을 망각을 하고 어느듯 정인의 머리엔 벗꽃이 아름답게 피어 꽃인지 선녀인지 꿈만 같았지요,별표 5개,6년 전
김효선,동물의 편의를 배려한 쾌적한 사육장인 맹수관과 유인원관을 보면서 자주 와봐야겠다는 생각이 들었어요^^ 더~나은 시설 기대할께요,별표 4개,7년 전
YUNSANG JI,오전 일찍 오면 주차문제도 없으며 한가로운 분위기에 나들이후 점심 먹고 집에 돌아가는 가벼운 가족 데이트코스로 추천합니다 여름엔 워터파크 봄가을엔 서울대공원 겨울엔 아쿠아리움 키즈카페 등지로 가족나들이가 가능하지만 날이 선선하고 좋은 계절엔 서울대공원이 최고입니다 접근성이 떨어지는 단점이 있으나 서울수도권에서 가볍게 소풍 나들이코스로 와서 자주 즐기시기에 좋습니다,별표 5개,수정일: 5년 전
gong you,"주차후 올라갈때는 코끼리 열차나 리프트를 이용하면 편하며 입장후 가 구간부터~라 구간까지 쉬엄 쉬엄 다니면서 주변도 관찰하는 시간이 괜찮습니다 과천 서울대공원은 동물원, 테마가든, 산림욕장, 식물원 등이 있는 엄청난 규모입니다 먹거리는 직접 준비해서 가는걸 추천드립니다",별표 5개,6년 전
Ian,"서울 근처에 지하철 한 번으로 이렇게 좋은 공간에 접근할 수 있다는 건 축복이지만, 이 좋은 공간을 이렇게밖에 활용하지 못한다는 점은 되려 안타까운 곳 시대에 떨어지는 동물원은 축소하고 새로운 콘셉트의 공원으로 거듭나길",별표 3개,6년 전
박현수,"단점이라면 매점, 식당의 가성비가 너무 안 좋고 너무 넓어요 진짜 동물도 많고 유모차 밀기에도 길이 잘 되어 있어요",별표 5개,5년 전
yongche hwang,"어린이와 동반하기 좋은 장소로 주차장이 넓고, 교통이 매우 좋다 동물원, 식물원을 비롯하여 인근에 국립현대미술관과 서울랜드의 놀이공원이 가까이 있다 한국의 대공원으로서 주말이면 행락객이 많아 복잡하다",별표 5개,5년 전
호야,국가에서 관리하는 것 치고 매우 매우 관리가 잘 되어 있어 또 가고 싶은 곳 동물 종류도 매우 다양하고 동물원도 넓어 한 번 정도 더 가도 될 것 같음,별표 5개,5년 전
배츄상츄,남친이랑 데이트갔는데 날씨 좋아서 그런지 동물들이 많이 나와있었음,별표 4개,6년 전
jung alan,동물원은 동선이 너무 길어서 어린아이들은 함들 수 있음 좀 더 아기자기한 동선을 짜면 좋을듯,별표 4개,9년 전
WOORI CHO,"동물들이 관람객으로부터 받는 스트레스를 줄이려고 사육장 시설을 고치고, 관람객들이 즐길거리를 꾸준히 늘려가는 모습이 마음에 들어요 저도 제 아이도 좋아하는 곳",별표 5개,6년 전
M.D. House,동물도 그렇고 내부수리를 핑계로 폐문된곳도 있다,별표 2개,6년 전
김경숙,예쁜 봄꽃으로 예쁘게 단장도 돼있구요 주차난은 심각 했구요 벛꽃이 만발해서 너무좋았어요,별표 4개,6년 전
SungWon Hong,"주말에도 사람은 전무하고 동물들은 실내에 대부분 있었으며, 새는 조류 독감 때문에 접근 금지",별표 5개,7년 전
JK Song,"서울대공원 전체를 걸어서 둘러보시기에 힘드시다면 정문을 지나 코뿔소가 있는 곳 앞에서 출발하는 무료운행 버스를 타고 꼭대기쪽 까지 올라가 내리막길로 걸어내려오면서 찬찬히 둘러보는 방법을 추천드립니다 넓은 동물원 부지 안에 다양한 동물들이 있는데요, 꼭 동물을 관람하기 위해서가 아니라도 산책이나 데이트 코스로도 좋습니다 최근에는 호랑이 관람관을 새로 단장해서 조금 더 가깝고 편하게 호랑이를 볼 수 있습니다",별표 5개,수정일: 6년 전
Sang Hyun Lee,"청계산이 둘러싸고 있는 아름답고 넓은 지역에 소수의 등산객과 동물 구경하러 오는 어린이 들만 이용하고 있어 좋은 위치와 장소를 제대로 활용 못하고 있다 서울시에서 관리하지 말고, 민간인에게 너무겨 디즈니랜드 같은 리조트로 만드는 것이 시급하다 서울및 수도권 2천만의 위락시설이 긴급하다",별표 3개,7년 전
데이지,가격도 저렴하고 유아동이 동물원 구경하고 돌아다니기에 딱이에요 사자호랑이 곰 치타 코앞에서 볼 수 있고 너무좋아요 다만 쉴공간이 좀 많았음 좋겠어요,별표 5개,4년 전
정태용,즐거움 모두 추억꺼리 최고 국립현대미술관ㅡ지성과창의력함께꿈을꾸는곳 지하철로 이어 산책겸 도보로근접 데이트코스로도최고임 서울랜드ㅡ청소년의꿈과모험 남녀노소 모두에게 힐링을주는곳,별표 5개,5년 전
Sungmin Moon,좋은데 사람너무많음 주차전쟁,별표 3개,6년 전
박재정,음료수 살때는 매점보다는 자판기추천,별표 5개,5년 전
J Lee,조류 인플루엔자로 인해 새들은 볼 수가 없어고 실내 관람관도 못 들어가지만 슬슬 산책하며 돌아보기에 서울대공원만한 곳이 없는 것 같습니다 코로나로 대부분의 매점이 닫혀있고 인테리어 공사중이라서 방문하실때 꼭 점심을 준비해오세요,별표 5개,4년 전
정효진,아기와 동물구경하기 좋아요 깨끗하게 리노베이션되서 냄새도 않나고 좋으나 식당이 너무 맛없고 비싸고 절대 가지마세요 입장전에 KFC이용하거나 김밥 싸오시는게 좋아요,별표 4개,5년 전
은기아빠,동물이 있다 사람이 있다 우리가 있다,별표 4개,8년 전
DUSU JEONG,혼잡하기는해도 유아동반 장애인동반 어르신들 모시고 오기에 정말 좋은 곳입니다 주차도 편리하고 장소도 쾌적합니다,별표 5개,4년 전
j u,호랑이 잘안보임 악어 너무잘안보임 시설이제는 너무낙후됨,별표 1개,5년 전
ssuk,"4살, 6살 아이들이 좋아해요",별표 4개,6년 전
윤미옥,아이들과 같이 하기에 데이트하기에 너무좋죠,별표 5개,4년 전
JSCC The (Brandon 81),가격이 저렴하지만 좀더 시설이 현대적으로 바뀌면 좋겠습니다,별표 4개,6년 전
Gemma Lee,다시 한 번 숲은 사람에게 좋은 영향을 주는 존재라는 것을 느꼈습니다 방문일 평일 대기 시간 대기 시간 없음 예약 권장 아니요 7km 둘레길을 걸었습니다,별표 5개,수정일: 1년 전
김광수 (광수생각),"주차비는 무조건 5,00원 시설은 좀 낡았어도 패키지로 어른은 리프트포함 10,500원",별표 5개,6년 전
조현수,하지만 안에 시계가 없어 휴대전화나 손목시계가 없으면 시간을 판단하기 어려움,별표 3개,8년 전
황약사,좋음일것입니다 좋음일것입니다 좋음일것입니다 3좋음입니다 방문일 평일 대기 시간 대기 시간 없음 예약 권장 아니요,별표 5개,5달 전
rollin R,동물많아요 시설도 잘되어있네요,별표 5개,4년 전
yunseo Rhee,아이들이 좋아하는 장소입니다 아이들과 리프트를 타고올라가면 기쁨두배 스릴두배,별표 4개,7년 전
김퐈퐈,놀이터에 벤치가 있어서 쉴 수 있어서 좋았는데 없어져서 아쉬웠지만 이유가 있겠죠 늦게가도 주차걱정이 안돼는 곳 중 하나입니다 랫서팬더존이 새로 생겨서ㅜ좋으나 애들을 잘 볼 수 없어 아쉬웠습니다,별표 5개,6년 전
Earnest hyunsu Son,넓고 동물도 많이 보유하고 있네요 그런데 방문했을 때 더워서 그런지 동물들이 잘 안나오고 자고 있네요 특히 호랑이 곰 등등,별표 4개,7년 전
모찌난폭한,나가는 가족들 보면 애들은 계속 사달라고 졸라대며 울고ㅋㅋ엄마아빠는 싸우고 가는 모습을 많이 보게되는ㅎㅎ그래도 즐거운 서울대공원ㅎㅎ가격도 저렴해요 매년 두번씩가는 대공원ㅋㅋ걷기걷기걷기,별표 5개,4년 전
Kevin ELee,"주차는 힘드니 대중교통 추천드리고, 입구에서 동물원 패키지 파는데 코끼리열차 1 리프트 1 동물원 1 포함이라 편하게 사용할 수 있어요 시설이 좀 낡은게 단점입니다",별표 4개,5년 전
꿀쑤니 (꿀쑤니),가을풍경 동물들 너무 예쁘요,별표 5개,6년 전
Jeon Woosung,"아이있는 집은 아기 데리고 가기 좋아요 이번에는 어린이 동물원 장미원을 갔는데, 장미가 피는 가을에 방문하면 좋을 것 같아요",별표 5개,5년 전
꽃마뱀용갈,동물종류도 많고 입장권도 저렴하고 알차게 동물구경 잘하고 왔어요~ 동물관리가 잘되어있어서 보는내내 즐거웠습니다^^,별표 5개,4년 전
Luna K,"서울대공원에 가는길은 언제나 유치원 소풍가는 어린이가 된 기분이지만, 동물들이 조금이라도 더 좋은 환경에서 살 수 있으면",별표 4개,8년 전
HYUNIL KIM,주차장 매표원은 노골적으로 귀찮다는 태도 동물원 정상의 음식점은 노숙자들이라도 욕하고 돌아설 수준,별표 1개,7년 전
대박이야,벗꽃도 멋지고 리프트에서 내려다 본 풍경도 멋있네요,별표 4개,8년 전
Jihye Park,아이들이랑가면언제나좋아하는곳이랍니다 넓어서사람이많아도붐빈다는느낌은없습니다 다만주차는진짜,별표 4개,6년 전
백수정,겨울에는 많은 동물들이 안에 들어가있고 코로나때문에 실내관람은 어렵습니다 날씨가 풀리고 방문하시는것이 좋을것같습니다,별표 5개,4년 전
윤병훈 (소프트맨),코끼리 열차와 동물보기엔 좋지만,별표 3개,7년 전
이지은,어떤화장실은 갈수잇는공간이 없고 그랫어요 애기들 데리고 가기좋아요 애기들 놀이기구탈만한것도 많고 그거 빼고 놀이기구타고 구경하기에는 좋았어요,별표 5개,5년 전
Dan Choi,언제가도 아이들과 대화를 하며 걷기에 좋은 동물원,별표 5개,9년 전
김현정,ㅜ 좀 늦게 입장했어도 동물을 들어가는 시간 공지를 해줬음 하네요ㅜ동물보러 갔는데 못 본 동물들이 많 아서 아쉬웠어요,별표 3개,4년 전
Gieun Kim,가을하늘과 함께 여유로운 단풍속을 거닙니다 대공원의 가을이 너무예쁘네요 전철로 내려서 갈수 있으니 너무좋아요,별표 4개,4년 전
예다움,푸드코드는 부족하니 가벼운 간식 많이 챙기시고 아이들 있는집은 라이언카페( 제3아프리카관 사자사옆)가서 커피나 음료 (500원대)시키면 이색체험 입니다 무조건 패키지를 끊어서 코끼리열차 타고 리프트로 갈아탄 후 내려오면서 보시길 추천드립니다 피자는 시키지 마시길,별표 4개,5년 전
ha man jung,커피 한잔 들곷산책하기 너무좋아요,별표 5개,수정일: 6년 전
박김석,"뛰어야 하는 치타, 표범, 사자, 호랑이 등등이 좁은 공간에 있으니 힘이 없이 맨날 늘어져 있음",별표 1개,5년 전
SS KIM,아이와 함께 오시면 하루 잡고 오셔야됩니다,별표 5개,5년 전
튜브여니,오래만에 가족 나들이 ^^,별표 5개,6년 전
김유진,살짝 따뜻할때가서 동물들 많이 본건 좋은데 패키지(코끼리열차1회 + 리프트 + 동물원 이용권) 파는데 안경쓴 남자 직원 너무 불친절하네요,별표 1개,6년 전
임경순,서울대공원 은 정말 좋은데 제가 별을 4게 준 이유는 나무에서 애벌레가 너무 많이 떨어지네요 제 다리에도 한 마리 떨어졌어요 ㅠㅠ 방문일 평일 대기 시간 대기 시간 없음 예약 권장 모르겠음,별표 4개,1년 전
SangWoo Park,마땅한 음식점이 없어 아이와 함께인 경우 도시락을 싸가는게 좋음 식당들의 위생상태도 별로 깔끔하지않음 코끼리 열차와 리프트를 이용하여 꼭대기인 맹수관에서부터 내려오며 관람하면 유모차를 끌고도 쉽게 관람할 수 있음,별표 3개,6년 전
YEOM승현,전반적으로는 단풍나무가 많아 가을에 단풍보기에 좋으며 입구서부터 올라가는 양쪽길에는 벛꽃나무가 심어져있어 봄에 벛꽃이 활짝피면 조명을 켜서 밤벛꽃이 아름답습니다 저수지를 둘러싸고 지어져 길을따라 걸으면서 산책이나 조깅이 가능하며 샛길을 통해 저수지 근처를 돌아볼수도 있습니다 또한 서울랜드 앞에 너른 잔디밭이 있어 자리를 피고 아이들과 놀거나 구경할수도 있습니다,별표 4개,7년 전
KIHONG KIM,많이 걸어야 되니까 아이들이 있다면 스카이리프트를 이용한 후 걸어내려오면서 구경하는 것도 좋아요 아이들과 하루를 보내기에 좋은 장소입니다,별표 4개,9년 전
wonderful_john,노후화된 화장실 개선이 필요함,별표 4개,6년 전
이다연,특히 노을지는 곳을 풍경으로 찍을 수 있는 포토존도 많구요 ㅎㅎ 데이트나 친구들끼리 놀러가기 아주 좋슴당~ 서울랜드는 야외라서 놀이기구타면서 경치보기가 좋고 넓고 뚫려있어 더욱 활기찬 느낌이 듭니다,별표 5개,5년 전
김시욱,저렴한 입장료에 가성비는 세계최고 동물원임,별표 5개,6년 전
음무우어둠의,자연이 주는 기분 좋음과 잘 관리된 시설이 즐거운 시간을 보내기에 더할나위 없이 좋았다 방문일 주말 대기 시간 대기 시간 없음 예약 권장 예,별표 5개,3년 전
Suyoung Kim,"쉬는날은 주차악몽, 줄서기 악몽, 동물 보고 싶은데 멀찌감치서 보는 악몽 세가지 악몽을 즐기실 수 있음 사람 몰릴때는 걸어가는게 좋고 리프트 줄은 올라갈땐 줄 서는데 오래걸리지만 내려올땐 금방 내려가요",별표 3개,6년 전
김해니,아침에 몰래 보고 온 벚꽃길,별표 5개,수정일: 5년 전
조성준,아이들과 다니기 좋습니다~다둥이카드 있으면 무료 입장가능합니다 방문일 주말 대기 시간 최대 10분 예약 권장 아니요,별표 5개,1년 전
Timerr lee,벚꽃이 아직이라 좀 아쉬웠지만 간만에 코끼리열차도 타고 바람도 쐬고 좋았습니다,별표 4개,6년 전
김태한,언제나 아이들과 함께 즐거운 곳,별표 5개,6년 전
김미정,오랜만에 옛기억을 하며 즐거운 시간이었습니다,별표 5개,3년 전
Wonhee Lee,서울동물원의 경우 주차장 앞 코끼리열차나 스카이 리프트로도 가실 수 있습니다 1984년 서울 창경궁 복원사업의 일환으로 동물원과 놀이시설을 경기도 과천시로 이전하면서 '서울대공원'으로 개원하였습니다 1909년 11월1일 창경원에 개장한 서울대공원은 우리나라 최초의 동식물원입니다,별표 5개,2년 전
날아라아톰,"주차장도 넓고, 패키지로 동물원 내 이동수단도 같이 이용할 수 있어서 좋았어요 ^^ 주말에는 시간대별로 설명도 해주셔서 좋았어요",별표 5개,2년 전
