작성자,내용,별점,작성일
Stella Kim,랜드나 대공원 안 가고 코끼리 열차 다니는 길로 쭉 돌기만 해도 사시사철 달라지는 자연을 느낄 수 있어서 좋습니다 특히 벚꽃철엔 너무 아름다워요~ 주차비가 500원으로 올라서 놀람,별표 4개,8년 전
송미화4-9 이도재 중2-4 이송재,사자관 수리후 첫 방문이라 기대했는데 호랑이관이 더 좋네요,별표 4개,6년 전
김형준,"내려오는 길에, 동물원 앞을 지나며 잘 관리되고 있는 시설들을 보며 서울시민의 휴식 공간으로써 모자람이 없다고 생각한다 산길을 따라 거의 매봉 정상 가까이 오르며 즐긴 청계, 관악산의 멋진 자태",별표 5개,5년 전
천월란,넓고 구경할 동물이 많아요,별표 4개,5년 전
eun joo kim,컨디션에 따라 한시간코스부터~ 다양하게 코스를 짤수있어 더 멋진곳입니다~♡ 산책하기 너무 멋진 곳입니다,별표 5개,4년 전
아르미,동물 보며 산책하기 좋았어요 아이가 5살인데 혹시나 해서 유모차를 대여 했는데 잘 했다 싶었어요 아이가 걷기엔 쉽지 않은 코스였어요 그래도 자꾸 가자고 하네요,별표 5개,5년 전
Hyunjung Kim,"아이들 데리고 가기 아주 좋은 곳이죠 서울대공원에 퀵보드, 인라인스케이트를 타고 들어갈 수 없다는 사실",별표 5개,6년 전
Summer OK,좋았어여 36개월 이전인 무료지만,별표 5개,3년 전
Soyoung LEE,가을날씨라 경치도 너무 좋았어요,별표 5개,4년 전
38 bethesda,모두 둘러보실 계획이면 케이블카를 타시고 공원 최상부에서 내려오시며 둘러보시는게 지치지 않고 좋습니다 넓고 동물도 많네요,별표 5개,7년 전
seeun lee,산책길로도 유익한 장소이며 대공원을 둘러보는 재미도 덩달아 누리는 관광명소,별표 4개,4년 전
최명훈,공사하는곳도 보이고 동물 개체수도 적고 비가온다음날이라 그런지 빈곳도 보였어요 그리고 동물원 안에 식사하는곳에 가격 둘이서 돈까스먹는 가격이 3200원 경악했습니다,별표 3개,6년 전
고한결,올해의 마지막 벚꽃을 보러 다녀 왔네요,별표 5개,6년 전
김동영,놀러가기 좋아요 리프트 재밌어요 리프트 타고 올라가서 내리막길로 여유롭게 구경하면서 내려오는것을 추천 드립니다,별표 4개,5년 전
사랑스런휴이,가을까지 아이들과 나들이하기에 너무 좋아요~ 동물들도 많아서 좋고 아이들이 매번 올때마다 더 좋아해줍니다~ 산책하는 기분으로 걷다보면 행복한 하루보내게 됩니다,별표 5개,5년 전
박지영,ㅋㅋ 여기 좋은건 다 아시죠 실내가 약간 냄새가 나긴하지만 아이들 동물 접하게 해주기에 여기만한 곳이 없죠 저희 아인 좋아해요 좀 멀리서 보는게 살짝 아쉽지만,별표 5개,6년 전
로마노비치표트르,어저께 갔는데 다른 동물원보다 관리가 잘 되고 다른데보다 동물들이 편안해보이지만 식당가가 너무 멀리 떨어져 있어서 좀 힘들었습니다,별표 4개,6년 전
Chris Kang,동물들도 잘 봤네요 방문일 주말 대기 시간 대기 시간 없음 예약 권장 아니요 비 소식 때문인지 사람이 없어서 좋았어요,별표 5개,1년 전
꺌룩,동물들도 너무좋지만 숲길이 최고였어요 숲길 추천합니다😄👍,별표 5개,4년 전
박예지,"워낙 넓고 탁 트인곳이라 거리두기 하면서 다니기는 좋았다 사진은 젤 귀여웠던 프레리독 코로나+AI 때문에 동물구경은 많이 못했다(새는 홍학 제외하고는 하나도 못보고, 실내전시도 다 막혀있었다)",별표 4개,4년 전
김한희,동물원 내부에 운행하는 무료 전기 버스가 있어 걷기 어려운 분들도 폭넓게 관람할 수 있도록 한 점도 좋았습니다 곳곳에 햇빛을 피할 수 있는 구조물과 다양한 시선에서 동물들을 볼 수 있도록 배려해 놓은 점이 좋았습니다,별표 5개,6년 전
이국,"아침, 주간, 야간으로 산책하기 좋은곳",별표 5개,2년 전
로라,동물원 한바퀴돌고 벚꽃축제 한바퀴돌면 3시간 금방가고 4월 13일 기준 벚꽃이 참 예쁘게 폈습니다 주말에 사람 많으므로 오픈인 9시에 맞춰가시는게 좋습니다,별표 4개,6년 전
이민주,"날이 더워도 코끼리 열차, 리프트, 돗자리를 적절히 활용하면 아이와 쉬엄쉬엄 종일 놀기 좋아요 코끼리 식당 근처 계곡이 아이들 놀고 땀식히기 최적의 장소라 여름에는 아이와 꼭 들릅니다",별표 5개,4년 전
김영주,대공원 매점에서는 간단한 간식정도만 가능 실내 관람은 제한적이라 시간에 맞춰 입장가능 하루종일 걸으면서 구경하기 좋아요,별표 4개,4년 전
Keetae Lee,외곽 순환 산책로를 걸었는데 무더운 날씨지만 시원한 그늘길이 아주좋았습니다 저수지 물도 가득 시원하게 물을 내려보내고 있네요,별표 4개,5년 전
Suk-Kyoung Hong,"4월 벚꽃필 무렵부터 5월중순까지 꽃이 피고지고, 여린 녹색잎이 돋아나는 과천 대공원 주변 청계저수지 풍경은 유럽 명승지 못지않게 아름답다 5월초인 요즘엔 귀룽나무 흰꽃이 피고, 곧이어 5월 중순에는 산딸나무 흰꽃이 필것이다",별표 5개,6년 전
SEVEN Jeon,가족과 함께하기 아주 좋은 장소입니다 동물도 많고 입장료도 많이 저렴하고 좋인요 봄 벚꽃이 아주 이쁩니다,별표 5개,6년 전
YooJung Han,4월 5일 방문> 벚꽃이 활짝 만개해서 공원을 한바퀴 도는 내내 눈이 즐거웠다 내년 봄에도 벚꽃 필 때 생각날 곳이 될 것 같다,별표 5개,5년 전
이서하,가을정취를 잘 느낄수있는곳 둘레길은 입장료는 없으나 대공원 입구 옆에서 시작하여 미술관앞으로 나오며 오르막 중심에 5km정도 되는거리라 시간은 한시간정도 소요됩니다,별표 5개,3년 전
헌,대중교통으로도 접근성이 좋아 비교적 편하게 올 수 있는 곳이고 가족나들이나 소풍으로도 많이 오는 곳이에요 호랑이나 표범등의 사육장등이 사람들이나 동물들에게나 더 좋게 바뀌었고 예전보다 안내나 동물에 대한 설명이 좀 더 알차게 구성되어 볼거리도 더 생긴것 같습니다 참고로 몇몇 음료수는 매점보다 자판기가 더 저렴하다는 것,별표 4개,수정일: 6년 전
이세민,자연과 동물을 접하기 좋아요 오전일찍가면 더 좋아요,별표 5개,5년 전
유호준,오래 걷기좋고 가족나들이 아주좋습니다 많은 동물들을 볼수있고 넓기때문에 많은 인원이가도 붐빔이적습니다 날이 좋을때 자주가는곳입니다,별표 4개,5년 전
jonghee kim,코로나때문에 실내동물관은 금지이고 조류독감으로인해서 조류는 볼수가없어요 ㅠㅠ 그렇다보니 예전보다는 볼수있는동물은 많지않지만 그래도 곰 기린 코끼니 사자 호랑이 아이들이 애정하는동물들은 다볼수있어요 그리고 놀이터두있고 냇가가있어서 애들이 물놀이도좀 해요 그래서좋아요 아기가 초딩이하면 장미정원 이 훨씬 동선도 작고 좋아요,별표 4개,4년 전
코끼리산아래,"넓은 공간 다채로운 동물들과 즐거운 시간 보낼수 있어서 좋습니다 지하철 출입구 나와 좌판에서 파는 김밥은 정말 맛없습니다 공원내 롯데리아, 푸드코트등 먹거리 있습니다",별표 5개,6년 전
최애용,내려오는 코스로 가려고 가자마자 리프트 탔는데 첫리프트는 괜찮았는데 두번째 리프트에서 너무 오래걸렸어요 ㅠㅠ 너무 넓어서 다리아프네요 동물들은 더워서그런지 힘이 없어보여요,별표 3개,6년 전
HJ Kim,동물원 관리가 잘 되어있다고 느끼고 산책으로도 너무 좋다 사계절별로 느낌이 다른 곳 남녀노소 누구나 좋아할 만한 곳,별표 5개,6년 전
남자김정훈,"동물원 주변 둘레길 비로 폐쇄되어, 오랜만에 동물원 들어와서 걷고 있습니다 방문일 주말 대기 시간 대기 시간 없음 예약 권장 예",별표 5개,수정일: 2년 전
Min-Sang Seong,"다만 8,90년대 수준의 비싸기만 하고 형편없는 음식은 에버랜드 벤치마킹좀 하셔야 넓은 공간에 다양한 동물들이 있고, 동물들도 환경이 좋아서인지 편안해 보입니다",별표 4개,4년 전
김연우,서울시에서 운영하는 서울대공원 산책하기도 좋고 관리도 깨끗하게 잘되어 있어서 아이들하고 가는건 꼭 추천해요,별표 4개,6년 전
이진형,"날이 추워져서 동물들의 활동이 적고, 나오지 않아서 단풍 구경으로 대리만족 평일에는 한적해서 좋습니다",별표 5개,4년 전
crusera크루세라,"관리가 그닥 제대로 안된느낌, 애들이 더워서그런지 얼굴도 안보여주심,아쉬웠음, 좀더 깨끗하게 관리가 필요한거 같음",별표 3개,6년 전
Suyoung Song,겨울이라 사람들이 많지 않아서 실내만 가도 너무 좋았습니다 방문일 주말 대기 시간 대기 시간 없음 예약 권장 아니요,별표 5개,1년 전
최덕규,단 공원내 음식은 비싸니 간단한 소풍 장비와 간식을 가져가세요 서울 근교에서 아이들과 놀기 좋은 장소입니다,별표 4개,5년 전
ama a,사람들 별로 없어서 좋긴한데 매점들도 대부분 문 닫고 실내 시설 다 폐쇄해서 볼게 별로 없음,별표 3개,4년 전
ju p,"다양한 동물들을 볼 수 있고 넓은 규모의 공원이라 가족단위, 커플들이 놀러오기 좋음",별표 5개,7년 전
콩힛_YOUTUBE,교통이 혼잡하오니 대중교통 이용하셔요,별표 4개,6년 전
Hyung Jin Kim,와이프와 아들과 함께 갈 때마다 느끼지만 동물들을 가까이서 볼 수 있다는 것이 참 좋습니다,별표 4개,6년 전
임상민,비오는 날 가족끼리 동물원을 갔습니다 나름대로 비맞는 가운데 운치가 있더군요 비오는날도 추천^^,별표 5개,7년 전
허가영,"아이들이 동물 좋아해서 자주 가게 되네요 전 동물보다 경치 때문에 좋아해요^^ 한바퀴 돌면 운동도 되고, 계절마다 바뀌는 풍경 보는 즐거움이 있어요",별표 5개,4년 전
박대성,좋아요 어릴때가보고 정말 30년만에가본거지만 생각보다 관리가 잘하고있는것같아요,별표 4개,4년 전
카이달,"동물원 크고 좋은건 다 아실테고, 코로나로 실내는 closed 시대가 어느시댄데 안에서 바가지좀 안쓰웠으면",별표 4개,4년 전
DONG SOO CHAE,"가격 대비 좋습니다만, 최근 입장료 주차비가 많이 올랐네요 그래도 서울 대공원은 추천",별표 4개,수정일: 4년 전
sunhee yang,사람많았지만 날씨도 따뜻하고 좋았어요~ 킥보드 가져갔는데 입구에 자물쇠빌려줘서 잠그고 들어갔어요 나올때되니 킥보드가 어마어마 ㅎㅎ 너무 넓어서 제대로 못본게 아쉬워요 안에 다니는 무료셔틀은 간격이 30분이고 사람도 너무 많아서 주말에는 이용하기 쉽지 않을듯하네요 ㅜ,별표 4개,6년 전
유호섭,"벚꽃 페이스페인팅,엽서,책갈피,폭죽만들기 체험행사로 오랜만에 즐거운 동물원나들이",별표 5개,6년 전
그냥사람,넓고좋음~ 코끼리열차는2회필요하고 리프트권도 사놔야 발바닥에 불안남,별표 5개,6년 전
이현주,간간히 쉴수있게 돗자리도 챙기시면 좋을듯요 방문일 주말 대기 시간 10~30분 예약 권장 예 가족과 친구들 연인들끼리 놀러가기 딱 좋아요 유모차 끌고 다녔더니 손등에 햇빛 알러지가 나타났어요 두드러기,별표 4개,3년 전
함인호,호랑이 너무말라서 맘이아픔니다 사람들이 다한마디씩하네요 그리고 호랑이있는 식당 씨유 옆 가격대비 음식이 영 아닌거같습니다 전돈까스시켰는데 돈까스가 맛이업내요 얼마나 맛업으면 먹지도안고 씨유가서 도시락사먹을려고하니 도시락 안파네요 장사속 보이네요 개선필요할거같네요 서울대공원 관리자분 가서좀 드셔보세요 가격대비 맛이어떤지 가장 마음에든곳은 사자에 붙어있는 까페 너무좋았어요 사자도 가까이서볼수있어좋았고 팥빙수 음료 맛있었어요,별표 1개,6년 전
미니멀life,아이들간다면 유모차 필수 동물들 다 보려고 하지말고 걍 산책하듯 가는게 맘 편해요 간식거리 미리 챙기는게 좋구요 선선한 가을에 가는게 젤 좋은듯,별표 5개,6년 전
윤영기,벚꽃축제기간에 방문했는데 참 아름답습니다,별표 5개,6년 전
나길웅,산책하기 좋은 넓은 동물원,별표 5개,4년 전
김광희,평일날갔는데 도착1킬로 전부터 한참을 기어기어가서 평일에도 사람이 이렇게많나했더니 갈래길에서 나뉘는데 대부분이 대공원가는 차량이아닌 경마장가는 차량이더군요 저는 동물원에갔는데 동물을 제대로 만나기가힘들었네요 푯말만있고 없는동물도많고 항상올때마다 동물들은 등돌리고 누워있고 오랜만에 가봤는데 이젠 공원내 노점하시는 분들이없네요 음식물은 미리 준비하세요 공원안 상점은 상당히 가격차이납니다 곳곳에 탁자가있어 쉬어가며 간식먹기도 좋았습니다 다만 부지가 너무큰데 순환버스가 30분 간격이라 걸어가면서 구경하려니 다리와 체력의압박이,별표 4개,5년 전
isoo,특히 놀이터에 있는 미끄럼틀이 길어서 아이들(6세이상)이 너무 좋아했어요 평일에는 조용하니 동물구경하기 좋아요,별표 4개,수정일: 6년 전
godsmule (Godsmule),"너무 많은 사람들이 좋아하고 아름다운 추억을 만들 수 있기에 우리는 항상 이곳에서 기쁨을 만들게 됩니다 서울대공원은 엄마에게도 아빠에게도 할머니, 할아버지에게도 많은 추억과 기쁨을 안겨 주는 장소입니다 겨울을 제외한 모든 계절이 너무 좋기 때문에 이곳에서 모두의 행복을 만들어 볼까요^^",별표 5개,6년 전
Youri Nam,계절마다 산책하며 힐링하기 좋은곳,별표 5개,수정일: 2년 전
Jaehun Jung,"유치원, 초등생들에게 좋은 것이죠",별표 5개,3년 전
Charles Choi,아이들과 놀러 가기에는 서울랜드가 최고 입니다 코끼리 열차의 추억을 싣고 달려 보아요^^,별표 5개,6년 전
Frederic,"널찍해서 거리두기도 자연스레 되고, 볼거리도 가득, 갇혀있는 동물들은 불쌍 했지만 ㅠㅠ 한 번은 가족나들이로 꼭 가봄직한 곳이었습니다",별표 5개,4년 전
박예솔,애기랑 가기 너무너무 좋아요 방문일 평일 대기 시간 대기 시간 없음 예약 권장 아니요,별표 5개,9달 전
OFGLer,날씨상황에 따라 나와있지 않은 동물도 있지만 그래도 가족과좋은시간 보냈습니다 아이들이 어릴때는 동물원 만한곳이 없습니다,별표 5개,수정일: 4년 전
success many,아이랑 가기정말좋아요 그런데ㅎㅎ 패키지라고 꼭 싼건 아니니깐 계산잘해보고 사야겠네요ㅎㅎ 실속있게 구매할필요가 있어요,별표 5개,5년 전
Fly High Kim,주말에 차가 이렇게 막힐줄은 몰랐다 주말에 차를 가져갈꺼면 4호선 라인에 서울대공원역에서 한정거장이나 두정거장정도 떨어진 주차장에 세워놓고 지하철타고 갔다가 오는게 더 나을듯 싶다 어린이대공원 동물원은 안가봐서 모르겠는데 거긴 어떨까 동물원만 구경했는데 넓기는 엄청 넓은데 동물들은 딱히,별표 3개,6년 전
Serena -Seeun Jun,넓고 가성비좋고 아이들도 좋아하고,별표 5개,수정일: 3년 전
김별,아이들이 좋아했어요 몇번을 갔지만 호랑이가 걸어다니는건 첨 봤네요 ㅋㅋ만5세 어린이는 공짜네요 👍,별표 4개,3년 전
차롱스토리CharongStory,"대공원 둘레길 탐방,대공원역 4번 출구에서 출발 하여 리프트 타고 하산함 봄,여름,가을 더 좋은 뷰가 예상됨",별표 4개,4년 전
빵모닝,넓어서 산책하기 좋고 귀여운 동물들 관람할 수 있다 깔끔하고 시설이 잘 되어 있다,별표 4개,5년 전
최윤창,늑대와 곰 쪽 리모델링인지 깔끔하게 되어서 매우 좋음 운좋게 본 고릴라 이쁜 꽃까지 최고^^,별표 5개,6년 전
블루라군,언제가도 항상 마음편해지는 넓은 자연 공원입니다,별표 4개,수정일: 5년 전
김지영,아이들과 즐겁게 놀기 좋습니다 주말에 날씨 좋아 사람들 제법 많지만 저녁되면 쌀쌀해져서 사람들도 좀 빠지고 무대쪽 공연도 해요~ 할인카드에 따라 반값 이용 가능합니다,별표 4개,6년 전
김희은,딸래미랑 워터차크 갔다가 다음날 동물원가고싶어서 방문했어요 가족들끼리 방문하기 좋은곳이에요 새로 바뀌어섶더 좋아진것같아요 방문일 평일 대기 시간 대기 시간 없음 예약 권장 예,별표 5개,수정일: 3년 전
양파,동물원 갈때 전화하고 가심 좋을듯요,별표 5개,4년 전
호야아빠,"이날따라 날도 좋아서 그랬는지 동물들이 다 활기너무쳐서 아이 구경하기 참좋은날 이었네요ㅎㅎ 비만 안온다면 언제든지 또 가서 호랑이, 사자 보여주고 싶네요",별표 5개,5년 전
K Windrunner,"교통도 편리하고 놀거리, 볼거리 정말 많아서 좋은 곳",별표 5개,3년 전
haesim전영문,"서울대공원 모두의 힐링장소 동물원,식물원,놀이공원,테마공원 등 다양한 볼거리 탈거리~ 방문일 평일 대기 시간 대기 시간 없음 예약 권장 아니요",별표 5개,2년 전
뀨뀨TV,역시 우리나라 대표 동물원답게 깨끗하게 잘 해놨네요 중간중간에 쓰레기통이 많고 관리 매우잘됨 방문일 공휴일 대기 시간 대기 시간 없음 예약 권장 예,별표 5개,1년 전
Jiyee Kang,너무 예쁘구 조경도 잘되어있고 최근에 리뉴얼을 한것 같아요,별표 5개,7년 전
이탱,방문할때마다 늘 만족스러워요 방문일 주말 대기 시간 대기 시간 없음 예약 권장 예,별표 5개,3년 전
JOSE CHENG,교통 편리하고 얘들이 좋아하는 곳입니다,별표 4개,7년 전
David Lim (Method),나무도 많고 다양한 동물 볼것도 많고 아이들과 함께 즐기기 좋은 공원이다,별표 4개,7년 전
류인상 (1shave맨),"지난 주말 방문해서 가족들하고 정말 좋은 시간 보냈는데요, 주차장 관리를 정신나간 방식으로 해서 별 셋 뺍니다",별표 2개,3년 전
dong kim,주차장이 개선된듯 안된듯한 느낌이고 많이 개선되어 좋습니다 비인기 동물도 신경좀 써주면 좋을텐데 ㅜㅜ,별표 4개,3년 전
Yuree Hwang,20개월 아기와 같이 가서 즐거운 시간 보내고 왔습니다~ 방문일 주말 대기 시간 대기 시간 없음 예약 권장 예,별표 5개,2달 전
장병규,아주 넓어서 동물들이 지내기 좋아보였다,별표 5개,3년 전
Antonio K,혼자가도 좋고 지인과 같이가면 더욱좋다 서울사람이라면 꼭 가봐야할 곳 중하나 서울대공원 동물원은 항상 느끼는것이지만 잘가꾸어져 있는곳 같다,별표 5개,8년 전
翰森,"동물원 좋고요, 케이블카 즐거웠습니다, 단풍계절이라 쾌적하게 구경잘했습니다",별표 3개,6년 전
강성훈,"넓은 주차공간, 저렴한 입장료, 다양한 동식물, 아이들과 가기에 더할나위 없는 장소입니다",별표 5개,4년 전
sanghyuck kim,"아무튼 가족들과 마음껏 산책을 즐기면서 여유롭게 가족에게 집중하고 싶다면 서울대공원으로 놀이기구와 같은 놀이가 목적이라면 서울랜드로 가면 될듯합니다~ 저희가족 11월 나들이는 서울랜드로~ 매점들중에 저희 엘앤피튀김기로 매점을 회오리감자 등 튀겨 판매하시는 사장님들이 있어서 서울대공원, 서울랜드 매점 운영조건을 조금은 아는탓에 제품당 이정도 가격은 이해하는 입장이에요 매점들 먹거리가격이 좀 비싼감이 있지만 이정도는 이해합니다",별표 4개,5년 전
이영규,해가 너무 쨍쨍해서 그런지 너무 힘들어서 그냥 보고 왔어요 방문일 공휴일 대기 시간 대기 시간 없음 예약 권장 예,별표 3개,2달 전
이세호,코인잘되면자주갈꺼에용용 ㅎㅋㅋㅎㅋㅎㅋㅎ새로운동물들더마니아주마니돈투자해서마니데꼬와용 어떻케생겼는지도궁금하고예쁘고멋있을꺼같아용용 ㅋㅎㅋㅎㅋㅎㅎㅋㅋㅎㅋㅎ 놀이기구도더무서운거엄청무서운거더스릴있는걸로만들어주세용용 재밌게탈께용 어린이기구도덜무서운거만들어줘용용거기에먹거리도브랜드지점도몇군데에생기게공사해줘용용 기대가크네용그런데기대가클수록좋지않나용전그렇케생각하는뎅 ㅎㅎㅋㅋ제개인적인생각이죠오저두제나름대로의생각이있고이유가있고고민을안하고싶을래야싶을래도고민이될수밖에없겠더라고용용 자넨염소대장들도면양도흑염소대장도자주볼꺼입니다용용 ㅎㅎㅋㅋ메에에 방문일 공휴일 대기 시간 10~30분 예약 권장 예,별표 5개,수정일: 3달 전
경마론,"어린아이 있는 가족은 서울동물원 추천, 연인들은 서울랜드나 미술관, 어르신들은 청계산도 좋고, 동물원 뒷길 산책로도 좋음 봄에는 벚꽃보러, 여름에는 미술관 뒤 캠핑장, 가을에는 산책로랑 미술관, 겨울에는 운치 즐기러 자주 가는 곳 과천역에서 관문초를 따라 대공원 한 바퀴 산책하는 맛에 이곳을 사랑한다는",별표 5개,5년 전
박효근,풀숲 정리안되서 동물이 잘 안보임 ㅋㅋ리프트 태워주는 알바생 친구는 싸가지가 ㅋㅋ그래도 난 싼맛에 또 오고싶은데 지인들은 그냥 에버랜드가자네요 관리는 정말 서울시가 왜 저급 인줄 인정되는 수준,별표 5개,4년 전
김태윤,하지만 최신 놀이시설보다 나름 그러한 맛이 있어 좋음,별표 3개,6년 전
한상훈,가까우면 자주 산책하러 갈텐데 거주지가 영종도라는게 함정입죠~좋았습니다 꼭 동물구경을 안해도 산책로가 엄청 좋았습니다,별표 5개,4년 전
조영규,요즘 대공원에 제일 아름다운 풍경은 일반 벚꽃보다 보름정도 늦게피는 왕벚꽃이다 1907년에 다케신부가 제주도에 자생한 나무를 처음 발견했고 그후 한일간에 최초 왕벚꽃이라 서로 자랑했는데 그후 결국 서로 다른 종이라 판별이 났다고 한다 약 백그루가 정문에 들어서면 줄을 이어 한창 황홀한 자태를 보이고 있다,별표 5개,4년 전
느그적닝기적,저렴하고 종류많고 나무그늘 시원하고 음식값 비교적 저렴해서 좋아요,별표 5개,6년 전
김용환,아이들과 오기에는 최고 놀이공원도 오는길 가는길에 갌수 있는 최고의 장소임,별표 5개,5년 전
침침써늬,보기 그렇더라구요 맹금류도 좀더 자연친화적으로 바뀌면 좋을것같아요 산책하기 좋아요,별표 4개,6년 전
김은희,언제나가도 좋은 곳^^ 봄에는 벚꽃 나들이객들 많아요,별표 5개,4년 전
RIDERMIN,동물도 많고 산책하기도 좋고 넓음 가격도 6세미만 공짜,별표 5개,6년 전
Seunggu Choe,주차하고 올라오는 길 김밥은 사먹으면 후회 아이들과 나들이 오기 좋은 곳 우린 3자녀로 주차도 50% 할인,별표 5개,수정일: 1달 전
김호영 (HOZERO),아이와 함께 리프트를 타고 아이와 함께 동물을 보고 국내 최대 대공원입니다,별표 5개,5년 전
パクようこ,입구 들어가자마자 리프트타고 정상까지올라갔다가 슬슬걸어오는게 제일 편한거같아요,별표 5개,4년 전
Ir0nSN4iL,내부가 생각보다 넓은데 무료 전기셔틀버스를 이용하여 돌아볼 수 있는 것도 좋은 아이디어 같았습니다만 30분이라는 긴 배차간격이 조금 아쉬웠습니다 동물들을 가까이서 볼 수 있었기에 동물원 방문은 정말 유익한 시간이었습니다,별표 5개,6년 전
Jin Young Park,아이와 함께 가기 참 좋은곳이에요,별표 5개,6년 전
방효은,날씨는 좀 쌀쌀 했지만 간만에 나들이 하기엔 아주 좋은 곳이네요,별표 4개,4년 전
김광현,"언제가도 편안한곳 돈부담 크게들지않고, 연인이든 가족이든, 꼭 동물구경 아니더라도 산채하고 데이트하고 아이들과 놀아주기에 좋은곳~",별표 4개,6년 전
최수경,호랑이를 가까이서 볼 수 있어 좋고 동물원 안에 있는 고양이도 개냥이여서 애교 많아 좋았습니다,별표 5개,5년 전
B.J K,연인이나 가족나들이 가기 좋은곳 하지만 날좋은 주말에는 사람이 많으니 어렵더라도 평일날 한적하게 갔다와보는것도 나쁘지않음,별표 5개,6년 전
Hwakoo Kang,가을 단풍이 예쁘게 물들었어요,별표 5개,5년 전
윤근,장소도 널찍하고 입장권 가격도 부담없어 날씨좋은날 피크닉 장소로 아주 제격입니다 아이와 나들이장소로 항상 만족합니다,별표 5개,5년 전
