작성자,내용,별점,작성일
박승민,서울 남부 지구에 거의 제일큰 공원 인듯 외국인들이 굳이 방문할필요 없는 로컬공원이나 지역주민에게는 큰 복지가되는 공원,별표 4개,5년 전
HAN YUN,"공원이 넓고 깨끗하지만, 주변 공사로 인해 약간 혼잡함 주차장 들어가고 나오는 곳이 복잡",별표 4개,6년 전
남자홍승준,크고 잘해놨네요 점심먹고 산책하기 참 좋아요,별표 5개,2년 전
한순수,너무시원한 공원 입니다,별표 5개,6년 전
davis ov qu cos,가끔 가는데 걷기 운동을 하기 좋아요,별표 5개,1년 전
박정규,"트렉이(612m)있어 운동하기 좋아요, 그리고 주변에서 휴식 취하기도 괜찮습니다",별표 4개,4년 전
곽문철,공원주위 산이 더 시원하다구요 공원이라기보다 유원지 갇은느낌 사람이 너무많아서요,별표 3개,4년 전
천미숙,마음의 치유를 가져다 주는 힐링 자연 공원이 늘 깨끗하고 너무좋아요~^-^,별표 5개,5년 전
JI. K,날씨 좋을때 돋자리가지고 산책하기 딱 좋아요 아이들과 갈때는 공같은걸 꼭 챙겨가면 좋을듯,별표 5개,8년 전
정민규,편의점도 있고 이런 곳 주변에 살고싶어지네요 공원이 엄청 크고 쾌적해요,별표 5개,5년 전
계라니,"날좋을때 푸르른 공원을 구경하면서 산책하기도, 돗자리펴두고 간식을먹거나 치킨을 뜯어도 좋을 곳 :)",별표 5개,6년 전
이정창,코로나로 앉아 쉴수 있는 자리를 막아놓아 좀 불편합니다,별표 3개,4년 전
송명인,휴일이라 사람이 더더욱 많앗네요 집에서 가까와 너무 좋아요 바람도 상쾌하고,별표 4개,4년 전
JJ L,산책하기 좋지만 사람이 너무 많아서 코로나 때문에 걱정이신분들은 당분간 방문을 자제하시는게 좋을듯 합니다,별표 3개,5년 전
조외경,근데 이 좋은 계절에 너무 동시다발적으로 공사를 하는 거 같아요 역쉬 보라매 공원이네요,별표 4개,4년 전
beauty songsong,공원이 정말 조성 잘되있어서 휴식하기 딱이에요 가족단위로 오는게 좋겠네요,별표 5개,4년 전
Koonta Kim,도심 속 좋은 녹지 공간,별표 5개,4년 전
윤병희,아이들과 산책갈데도 좋고 조깅할때도 좋고 비행기 실제 사이즈 모형 보는것도 좋습니다,별표 5개,6년 전
Yong Hee Park,서울시내에서 넓은 잔디밭과 여유로움을 느낄 수 있는 곳 입니다,별표 5개,6년 전
Wonchan Park,트랙돌기좋음 이것저것 주민의의견이 반영된것들이 많음 내자전거 라이트훔쳐간놈만 없었으면 별5개,별표 4개,6년 전
MoodPino_김민준,운동시설이 굉장히 많음 벤치프레스 좀 불편하게 되어있는듯,별표 3개,2년 전
임순도,"봄바람,부는,봄입니다,세싹트는계절에,옛생각하면서,공원한바귀,돌려했는데,였날공원이,아니더군요 ^^실망,반,~ㆍ설레임반,남기구,집어로,왔네요^^",별표 1개,수정일: 6년 전
Kyusup Kim,서울에 이런 넓은 공원이 더 많았으면 합니다,별표 5개,수정일: 9년 전
KU AN,보라매병원 쪽에 음식점도 적당히 있음,별표 4개,4년 전
Dongil Kim,산책 하기 좋은 곳 다만 아는 사람은 아는 몬스터 잡는 게임 스팟이 많음,별표 3개,6년 전
허중구,공군의 역사가 숨쉬는 도심가운데 숨속을 유지관리를 잘 정돈됨,별표 5개,4년 전
이규성,"공원에 612미터 조깅트랙, 강아지 산책로, 운동시설, 놀이터 등등 상당히 잘돼있어요",별표 5개,5년 전
우데이비드,산책하기 좋은 공원이다 다만 현재 신림선 경전철 공사중이라 공원 일부가 번잡하다,별표 4개,8년 전
Brian Kim,비행기 전시하는 곳 뒷쪽에 자그만한 산이 있어 조용히 산책하면서 시간보내기 좋습니다,별표 5개,수정일: 4년 전
윤관식,주차 시설 부족 및 여름엔 그늘으 별로 없어요 개선이 필요한 공원입니다,별표 1개,7년 전
이동규,아직 공사하는 부분이 많지만 휴식을 취하기 정말 좋은 공원입니다,별표 5개,6년 전
ᅳᅳᅳᅳ,중학교 봉사활동 구역 편의점 가격 래전드인ㄷ 봉사 할거없이 깨끗하고 사람도적음(생각보다),별표 1개,4년 전
한승주 (티비플러),다만 화장실이 조금좁다 여성칸 남성칸 공용칸으로 나눠져있고 휴게실가기가 편하다,별표 4개,7년 전
김기영,장소는 좋지만 공원근처에서 보행 중 흡연자가 많아 쾌적한 공기는 기대하기 어렵습니다,별표 4개,6년 전
하얀목련,2호선 신대방역에서 가깝고 산책 하기 너무좋음 공원을 조금 지나면 안양천 자전거길로 이어짐,별표 5개,4년 전
김민선,시내에 넓은공원 아이들이 모처럼 마음놓고 뛰어놀 수 있는 곳~,별표 5개,8년 전
오호라,가족나들이로는 최고입니다 주말엔 주차가 어려우니 눈치게임하세요,별표 5개,2년 전
김시홍,아 좋습니다 숲내음 음악분수,별표 4개,7년 전
김종식,"접근성 최고, 넓은 공원, 여러가지 부대시설",별표 5개,6년 전
정정숙,집옆이라 자주 가요 철마다 꽃들이 피고 제대로 관리되고 있는 공원이예요~,별표 3개,5년 전
신승호,멀리가기 번ㄱㆍㄱ로울 때 좋아요,별표 5개,5년 전
박장호,산책하기 좋으며 공기가 맑고 남녀노소 도심속 산책 코스로서 좋았다,별표 4개,4년 전
최종권,아이들과 함께가기 좋은 공원~ 주차비는 다둥이 카드가 있으면 할인됩니다~,별표 4개,6년 전
델파이스,지하철공사중으로 조금 그렇지만 뒤쪽유아숲과 에어파크는 아이들이 좋아해요,별표 5개,5년 전
Linsey Je (Linsey),넓고 다양한 산책로가 있음,별표 5개,8년 전
페리도트,산책하고 운동하기 좋은 곳이예요 안와 보신 분들께 적극 추천합니다^^,별표 5개,5년 전
문기남,"접근성 좋음, 주변에 각종 편의시설과 근린생활시설 이용 용이함",별표 4개,5년 전
박명순,매일매일 중앙잔듸트랙을 돌고있읍니다 걷기운동하기 좋은곳이지요,별표 5개,6년 전
윤성재,주말에는 주차공간 부족,별표 5개,8년 전
박우경 (Ethan),돗자리 펴고 쉬어가기 좋네요 ~ 가운데 잔디 이용이 안되어 아쉽긴 하지만요 ^^,별표 5개,7년 전
허리굵은케인,가볍게 산책이나 운동하기 좋은곳 다만 트랙이 너무 작고 사람이 많음,별표 4개,5년 전
Miyoung An,지역주민들이 산책할만한 곳으로 일부러 찾아갈만한곳은 아닙니다 요즘은 공원일부가 한참 공사중이더군요,별표 3개,5년 전
이현주,서울최대규모였었었던 지금은 분수니 텐트니 자전거 인라인연습이니 시설쩌는공원,별표 5개,8년 전
Victoria,"낮 시간에 사람 많음, 햇살 좋음, 하지만 경전철역 공사 중이어서 별 하나 뺌",별표 4개,4년 전
Bh K,"도심지내 접근성 좋은 넓은 녹지공간으로 나들이, 산책, 운동 등등 매우 좋은곳",별표 5개,6년 전
SUN IN (가이아),보라매 공원이고 산책 운동하기 좋습니다 놀이터 어린이를 위한 놀이터가 있습니다 화장실 회장실은 곳곳에 있습니다 안내가 잘되 있어요 반려견 동반 환경 반려동물 놀이터가 따로있고 많은 사람들이 반려견과 산책을 합니다 하지만 반려견이 출입하지 못하는곳도 있어요,별표 5개,1년 전
김승호,아직 공사중이엇지만 공기도 맑고 관리도 잘되어 있어서 너무 좋다,별표 5개,5년 전
조영길 (성근이아빠),넓은 공터도 있고 호수에 분수도나오고 가족들과 산책하기 참 좋습니다,별표 5개,6년 전
HW S,"운동하거나 산책하기 좋은 장소인데 경전철 공사로 인해서 먼지, 소음, 덤프트럭 통행으로 많이 불편합니다",별표 3개,6년 전
SD “William” Wang,그래도 이만한 공원이 서울에 또 있을까 싶어요 늦은시간인데도 인파가 많아요,별표 5개,5년 전
한용철 (MPY),넓은부지에 볼것도 많고 아이들이랑 운동하고 걷기에도 좋아요,별표 5개,5년 전
최덕신,주말이면 가끔 가족과 가는데 분수도 좋고 걷기도 좋아요,별표 5개,4년 전
송윤서,산책하기도좋고 운동하기도좋고 공기도 풀내음이라 더좋아요,별표 5개,6년 전
김봉원,너무좋았어요 근데 보라매공원에 평지로 된대가 있었으면 좋겠어요,별표 4개,5년 전
lee eunseok,사람들과 반려동물이 다니기도 좋고 가족단위로 다니기도 좋은거 같아요,별표 5개,5년 전
조권목,집근처 공원이라 산책하기는 더할나위없이 좋아요,별표 5개,4년 전
Goodsol Lee,주변 공원 중에서는 손가락 안에 들 정도로 잘 해놓은 것 같다,별표 5개,7년 전
Primavera Ryu,운동하는 사람이 많다 산책하기 좋다 나무는 많이 없다,별표 4개,5년 전
박헌종,"너무 조용하고, 잔디도 많고 공기도 좋고 산책해기 너무 좋은곤이에요",별표 5개,6년 전
쁘라삐룬,이것저것 편하고 쾌적하게 바뀌어서 주말에 운동겸 오거나 가족단위로 잠깐 마실나오기 좋은것 같다,별표 5개,7년 전
김성수,오늘 오랜만에 다녀왔습니다 상쾌한 가을 하늘속에 즐거운 산책의 시간이 되었습니다,별표 4개,수정일: 2년 전
이태훈,비오는 날의 보라매 공원,별표 4개,2년 전
V 2,도심에 많이 있었으면 하는 전형적인 공원 땅이 없어 힘들겠지만 더 많아졌으면 함,별표 5개,3년 전
정수련,"자주가는 공원입니다, 동네라서~ 늘 좋은데요",별표 4개,2년 전
지아영,"나무,흙냄새 ,매연없는맑은공기 :) 갤러리를찾아가려고표지판을따라갔는데 안보여서ㅎㅎ 공원밖에있나",별표 4개,7년 전
Ch K,주차장은 밖에 공영주차장이용해야함,별표 5개,6년 전
One SPA,"공기, 조경 다 괜찮다",별표 4개,5년 전
hocheol,다 좋은데 사람들이 쓰레기 막 버리고 어르신들 엄청 모여서 장기 두는데 제재하지도 않음,별표 3개,4년 전
조한규,산책하기 좋은곳 하지만 여름에 나무가 더 푸릇푸릇하면 더 좋을거 같다,별표 4개,5년 전
문진솔,"사람이 좀 많긴하지만 넓고, 배드민턴칠곳도있어서 좋다",별표 5개,5년 전
다행이다,넓고 조용하고 편의시절과 주변시설이 좋은편이군요,별표 4개,8년 전
김기완,산책하기 좋고 구경거리도 많지만 공사땜에 좀 걸리적거리긴 함,별표 5개,8년 전
이온숙,운동하기 좋고 저녁에는 음악분수도 볼수있어요,별표 5개,3년 전
조경선 (메종드아트 커튼입니다),도심속에 휴식공간으로 맑은공기와 산책이랑 트러킹이 가능한 장소입니다,별표 5개,5년 전
상진,엄청크고 시설도잘되어있어서 좋구 다들 여의도가기도 편안,별표 5개,6년 전
이주호,"워킹트랙, 연꽃호수, 와우산 트레킹코스, 아이들 놀이설까지 있어요~ 주변 근린공원으로 최고예요",별표 5개,수정일: 5년 전
R K,넓고 다양한 시설이 많아서 힐링하기 좋은 공간이라고 생각합니다,별표 5개,5년 전
김보영,애견운동장도 있어어 너무좋았어요,별표 5개,6년 전
Eunjin Choi,코로나에 집 앞마당처럼 매일 뎅뎅이 끌고 산책할 수 있음에 너무 감사 도심 속 이만한 규모의 공원이 있음에 감사,별표 5개,5년 전
Miran Lee,"넓은 대지, 시원한 운동장, 긴 트랙 보유 가장 맘에드는건 크고 울창한 나무 가족끼리 가기에 좋습니다",별표 4개,8년 전
HM O,산책하기 좋아요 그늘도 많고 여름엔 물놀이 분수도 있어요,별표 4개,6년 전
쎄비K,깨끗하고 아름답고 예쁘게 아주 관리를 잘해주고 있는것 같다,별표 5개,수정일: 2년 전
eunyoung Lee,지금은 전철 공사로 어수선하긴 하지만 집 가까이 산책과 운동을 할 수 있고 자연을 느낄 수 있는곳,별표 5개,5년 전
스누카,요즘 공사를한다고 해서 인도가 좁아지고 없어지고 그렇다 하지만 공기는 좋고 운동하기 좋다,별표 5개,8년 전
Kyung Jin Lee,날씨 좋은날 산책하기 좋은 곳이고 가족들과도 많이 가는 곳이에요^^,별표 5개,6년 전
호석,"운동, 피크닉, 아이와의 시간 모두 완벽한 도심속 공원",별표 5개,수정일: 2년 전
뚜비뚜밤,산책로 너무좋아요 넓어서 운동하기좋내요 방문한날에 공사하는곳이 쫌 있내요,별표 4개,5년 전
고성훈 [ Andrew ],가까운데 탠트치고 놀수있는 공원 아이들 잠자리와 매미 잡아주고 분수에서 물놀이까지 최고입니다,별표 4개,5년 전
손기현,넓은 공원 시설도 잘된 편하게 산책할수 있어 좋습니다,별표 4개,6년 전
박준혁,도시내 대단지 공원으로 내부에 탁구 당구등 다채로운 시설이존재함,별표 5개,5년 전
Mark,"괜찮았던 공원중 다섯 손가락에 꼽히며, 데이트 하기 좋은 장소 여름에는 음악 분수도 운영함",별표 4개,9년 전
박양수,가족끼리도 많이 오는 곳,별표 5개,수정일: 6년 전
김이라,넓고 운동하시는분들 많아요,별표 5개,7년 전
흠래,걷기도괜찮고 공기도좋아 기분풀때가기딱좋은곳입니다,별표 4개,5년 전
Sang-eun Lee,주위 공사만 빨리 끝나면 더 좋을듯,별표 5개,5년 전
SIM (TIMO),공원 근처 주복이나 회사건물에 유료주차 추천 주말 주차가 헬이지요,별표 4개,7년 전
Chang-Sik Kim (Do-Yeon),서울도심에 이만한 공원이 또 있을까요 단연 최고의 공원입니다,별표 5개,4년 전
이맹,"각종 운동장에 놀이터, 연못, 잔디광장이 넓게 있어 가족단위나 커플들이 나들이하기좋음",별표 4개,6년 전
Hyung Joo Cheon,산책에 매우 좋은 공원,별표 5개,8년 전
Kook-Hyun Kim,산책하기도 좋고 운동하고 좋아요,별표 4개,5년 전
박창현,가족끼리가서놀만해요 아이들도놀기좋아요 공휴일에는인파가좀 많아요,별표 5개,5년 전
유동희,사무실근처에 이론 큰 공원이 있는건 엄청난 행운인것같아요 좀더 넓었으면 좋겠지만,별표 4개,9년 전
뱃살공주,운동하고 쉴수있고 여유롭고 깨끗하고 가족 또는 반려견과도 함께하기 좋다,별표 5개,6년 전
이동훈,공원에 놀 것도 많고 조깅하기 매우 편하네요,별표 5개,5년 전
정세원,운동하기 좋고 날씨 따스한날은 가족과 함께 나들이 하기도 좋습니다,별표 4개,7년 전
Apex,아침운동하기 좋아요 공원관리도,별표 5개,8년 전
함형주,졸업앨범 찍으러갔는데 풍경이 예쁘더라고요 하지만 아직 코로나조심해야되기때문에 특별한일 없으면 가지않는게 좋겠네요,별표 5개,4년 전
Jooney LIM,동네에 이런공원있으니 좋습니다,별표 5개,6년 전
wonder sky,"집근처 운동하기 트랙도 있어서 매우 좋고, 산책하기에도 좋습니다",별표 5개,3년 전
윤지은,"햇살이 좋은날,바람이 살랑이는날 산책하며 심심의 안정에 도움이 되요 ^^",별표 5개,5년 전
AI,넓은 트랙이 있어 산책하기에 좋다,별표 5개,3년 전
이석호,공원이 넓고 쾌적함 다만 주차장이 부족함 주차비는 저렴한편,별표 5개,3년 전
sharon b,산책하기 좋은 곳 화장실 화장실 많아요,별표 4개,수정일: 1달 전
박이름,구획잘되고 다양하고 깔끔^^ 어린이놀이터있는게 가장 마음에듬,별표 5개,6년 전
지혜백신,풀 냄새나고 바람도 선선하게 불어 놀기좋은곳,별표 4개,수정일: 4년 전
유영호,넓어서 여러가지 행사들과 운동도 할 수있는곳 가족 나들이에도 딱,별표 5개,6년 전
김수범,산책을 하거나 운동을 할 수 있는 매우 좋은 도심속 공원입니다,별표 4개,6년 전
Hwayeon Yu,좋아요 사람많고 평화로워요,별표 5개,9달 전
J.Y Park,도심속 공원으로 최고입니다,별표 5개,1년 전
miss kang,가을 사책하기 너무 좋아요 공사도 끝나서 새로 정비 완료,별표 5개,수정일: 2년 전
안성옥,"19년 4월 기준 경전철 공사로 혼잡하지만, 휴식하거나 운동하기에 참 좋은 공원",별표 4개,수정일: 6년 전
SoonOh Kim,마음에 평온을 받기 좋은 공원입니다,별표 5개,2년 전
봄,자주가는 공원~ 쓰레기 매립장 근처 제외한 나머지 장소는 너무 좋음,별표 4개,5년 전
최성은,언제나 좋은 보라매공원,별표 5개,4년 전
김김효선,흡연구역이나 전동기게같은것없으면더좋을것같네요 삼성역처럼여,별표 5개,6년 전
모아나,아이들과 가기좋은곳:) 단지 경전철 뚫는다고 공사해서 ㅠㅠ중간중간이 참 아쉬워요,별표 4개,5년 전
유정근,"중앙 잔디 밭 주변 걷기 위한 트랙 있음 , 음악 분수 있음 , 현재 공사중으로 건설 기계 공원 동문 쪽 근처 이용 불편",별표 3개,5년 전
성재욱,24시 편의점 1개소 정도만 입점한다면요,별표 4개,5년 전
Park whehee,동네에서 운동하기좋게끔 잘해놓아서요 분위기도괜찬아서요 봄에꽃필때다시가봐야겟서요,별표 5개,6년 전
박현철,봄에는 산책 여름에는 운동 가을에는 휴식 겨울에는 소방안전체험관ㅋㅋ 동네주민 강추 플레이스,별표 5개,7년 전
Mavillo Lee,잔디밭이 넓고 교통이 편리하며 가족 단위로 휴식하기에 좋은 장소임,별표 5개,7년 전
엄지,호수 근처에서 돗자리펴고 막걸리 마시는 아지매아저씨들이 흠,별표 4개,5년 전
Ricky Hwang,산책 하기 좋은 공원 요즘은 지하철 공사로 그닥 상태가 좋지 않음,별표 5개,4년 전
조세영,공사 중이어서 아쉽지만 벚꽃은 많았다 반려견 동반 환경 가능함둥 피크닉 구역 그냥 아무데나 돗자리 깔던데요,별표 5개,1년 전
Choi Sup,사람은 많지만 주의하기만 한다면 코로나에도 안전한 산책 가능,별표 5개,4년 전
최수잔나,"벚꽃, 배꽃, 명자꽃등이 환하게 피어있어 산책하기 좋은 공원",별표 5개,4년 전
semi seo,우리 강아지랑 파워산책할때 즐겨찾아요,별표 5개,5년 전
김김찬동,공기도 상큼하고 산수유도 피고 자몽련이 부끄러운듯 꽃 잎을 내밀고 있었고 그외의 여러 나무들이 잎을 티우려 예쁘게 올라오고 있었어요,별표 3개,7년 전
김또깡,80년대나 지금이나 변함없는 가족 공원이자 아이들 소풍장소 서울 도시내 힐링 장소로 좋음,별표 5개,6년 전
김재범 (갱이껌딱지),넓은 잔디 광장과 운동장이 있어 사람들 운동및 여가시간을 보내기 좋은 장소,별표 4개,7년 전
호태랑,지하철 공사현장때문에 좁아요,별표 4개,6년 전
Kyeong Ik Lee,체육시설도 잘 되어 있어서 좋음,별표 5개,8년 전
서미경,오늘 보라래공원 추웠어요 공원에비행기가떴어요,별표 1개,1년 전
UbestA,낮이고 밤이고 걷고싶을때 좋아요 근처 스타벅스도 좀 비싸지만 좋아요,별표 4개,6년 전
김문섭,좋은 경치와 볼거리 집앞 공원이라면 운동하기도 좋습니다,별표 5개,6년 전
렴학송,환경이 아늑하고 조경도 잘되여 바쁜여가에 휴식이 좋은 터입니다,별표 5개,5년 전
kyoungmin nam,넓어서 좋아요~주변 간식판매하는 곳이 조금 더 있었으면 좋았겠어요,별표 4개,3년 전
치즈중당추가,산책로 훌륭하고 각종 운동시설,별표 5개,5년 전
최재희,회사앞 걷기 좋음 근데 사람 너무많음,별표 3개,4년 전
멋토망고,공원 초입엔 공사중이라 놀기 불편함,별표 3개,6년 전
이다혜,꽃도 많고 산책하기 너무좋은 곳이예요 데이트장소로도,별표 5개,5년 전
ᄌᄉ,드라이브가서 산책하고 간단하게 둘러보고 간식 먹기도 너무 좋아요,별표 5개,5년 전
김륜호,운동하기 좋고 편의시설도 잘되어 있어요,별표 4개,6년 전
World Traveler,밤에도 조깅하기 좋아요 10시 이후는 노상주차가 공짜,별표 5개,7년 전
서상희,걷기 위한 트랙이 있어 코로나 시대에 운동하기 좋은 곳입니다,별표 5개,4년 전
이현욱,강아지 산책 시키기 좋은 공원,별표 5개,6년 전
박준모 (강배우),서울 5대 공원 중 한군데 다만 미아 실종 되는 경위도 많다 아이가잇다면 조심,별표 3개,5년 전
김윤,넓은 잔디밭에서 연날리고 뛰어 놀기 좋습니다,별표 4개,6년 전
한대종,공원이 산책이나 피크닉즐기기에 잘 조성되어있음,별표 5개,4년 전
Simmon Dumont,주차장이 너무 협소하고 차가 필요없는 동네 주민이면 걷고 운동하기 좋은 공원,별표 5개,5년 전
고경식,주변 경관도 좋고 근처 커피숍도 가까워요,별표 5개,5년 전
KAIROS,"시설에 놀라고, 규모에 놀라고",별표 5개,수정일: 6년 전
강진선,이것저것 구성도좋고 근데 교통이,별표 4개,6년 전
Daeseon Yang,공원이 잘 정비되어있음 다만 현재 일부구간은 공사중,별표 5개,7년 전
문도근,도심에 위치한 넓고 쾌적하며 노래 분수가 있이 운치가 좋다,별표 5개,6년 전
gyeongsoo ko,"간단히 산책을 해도좋고, 다양한 동호회를 참가해도 좋습니다",별표 5개,6년 전
Hyungjoo Lim,항상 우리 아이들에게 마음편히 잔디밭에서 뛰놀수 있는 공간입니다,별표 5개,3년 전
구선모,날씨도 좋았고 아이들이 뛰어놀수 있어서 좋아요^^,별표 3개,수정일: 3년 전
Jiyeon Moon (cindy),걷기도 좋고 아기와 산책하기도 강아지와 산책하기도 아주 좋아요,별표 5개,6년 전
jh j,다양한 시설이 있고 쉬기 좋은듯 한 공원인듯 합니다,별표 5개,7년 전
이미르대건안드레아,호수도 있고 걸으며 산책하기에 좋은 풍경,별표 5개,8년 전
마타타,산책하기두 좋고 음악분수도 좋아요,별표 5개,2년 전
뽀그리(뽀그리),공원이 집 근처라 자주 가는데 어쩌다가 한두번씩 연애인 보는 재미도 잇어서 좋아요 ㅎㅎ,별표 5개,7년 전
자상남자,집근처에 이런 공원이 있다면 너무좋겠네요 정말,별표 5개,2년 전
Rachel Park,나무도 울창하고 그늘도 곳곳에 있음 벤치도 있어 쉬어가기 좋음 단 비둘기가 너무 많아 조금 무서울 수도,별표 3개,6년 전
김미정,분위기 시설 모두 만족합니다,별표 5개,4년 전
이두부,인생은 크루징 보드를 타든 산책을 하든 자전거를 타든 뭐든 좋아요,별표 5개,6년 전
비밤,너무너무너무 좋은 공원입니다,별표 5개,6년 전
Jaehyuk Kim,주차공간이 없어서 지역 주민만 오니,별표 5개,7년 전
홍성형,사람들도 많고 산책하기 딱 조으네~^^연우랑 비눗방울 놀이 열심히했음,별표 5개,6년 전
으라찻차,운동하기 좋은 공원입니다 ~ 다들 산책하러 나오세요 ^^,별표 4개,4년 전
kyung hong Park,"동작구에 이런 공원이,있어 참 좋다",별표 4개,5년 전
석촌2 이상범선무,사람이 너모너모 많아 그만큼 좋은곳인건 인정하지만 코로나ㅜ 평일가는거 추천,별표 4개,4년 전
초록사랑,원래 조용한데 요사이는 지하철공사로 분위가 어수선하고 좀 시끄러워요,별표 4개,5년 전
YDM,도심지에서 여러가지를 즐길수 있는 좋은 공원,별표 4개,5년 전
S.H Yang,넓고 깨끗한 공원 반려동물을 위한 공간 존재 포켓스탑 다수 분포,별표 4개,8년 전
Chul,신주쿠 공원이 생각나는 알려지지않은 이쁜 공원,별표 5개,1년 전
BJ Choi,운동하고 힐링하는 장소 보라매공원입니다,별표 5개,1년 전
이중길,"이쁨 공원이, 사람도 많고",별표 5개,6년 전
이수명,아이들과 가기엔 좋아요 하지만 마스크는 쓰고 다니세요 ㅎ,별표 5개,5년 전
옹수환,근처에 먹거리도 많구요,별표 5개,6년 전
이은지,입구쪽 공사중 자전거가 들어갈수있는 공간이 매우 좁음,별표 5개,4년 전
OJe Kwon,공원내에 애견 놀이터가 있습니다,별표 5개,6년 전
kim아저씨,공원이넓고 야산에서운동하기 최고좋은곳이에요,별표 5개,7년 전
Y JRM,개와 함께 산책과 조깅하기 좋음 개놀이 공원이 있음,별표 4개,6년 전
김현식,여기는 서울에 있는 공원 중 가장 시설도 좋구 안락한 곳입니다,별표 5개,8년 전
김성수,아이들과 보내기엔 최적,별표 5개,7년 전
장지영,주변에 백화점도 있고 공차도 있고 스벅도 있고 좋아요,별표 5개,4년 전
Jinyong Park,평온하게 쉬기 좋은데 공사하는 곳이 많아 좀 어수선하긴 하네요,별표 4개,6년 전
마리네뜨,공원중에 최고라고 생각합니다,별표 5개,3년 전
비상,보라매공원은 언제 가도 운동하기 너무좋은 도심속 힐링처입니다♡♡,별표 4개,6년 전
weyoui,가족과 나들이 하기 좋은데 주말에 가면 너무 사람이 많습니다,별표 4개,4년 전
김정자,보라매공원뒷동산 비오는날멀리산에못갈때운동하기참좋아요오락내리락뱅뱅돌아 2만보 해봤어요 힘들지않고지루하지않아 좋았답니다,별표 1개,8년 전
Junho Jung,산책하기 좋고 분위기도 아늑해 산책하러 자주 나오는 곳,별표 5개,5년 전
