작성자,내용,별점,작성일
김영은,매번 마음이 아플 것 같아 발길을 선뜻 내딛지 못하던 장소 큰 맘 먹고 가족들을 이끌고 찾아간 곳 입구에서의 엄청난 혼잡함에 놀라기도 했던 이 곳 맞은 편에 임시정부기념관이 있구나 하며 간신히 안내원의 안내에 버스 주차장에 슬쩍 주차 주위를 둘러보다 수많은 수형표가 있는 공간에선 눈시울이 뜨겁더라는 바른 어른이 되고 싶으나 여전히 아직도 철부지 같아지는 공간이다 이곳은,별표 5개,1년 전
이득준,독립문과 참배할수 있는 독립관 서대문형무소 유관순 동상 서재필동상 순국선열추념탑등과 주민이 쉴 수 있는 녹지공간 뒤로는 안산자락길이라는 산이있어서 한 번 쯤 가 볼만합니다,별표 5개,1년 전
namyounglee,"역사적인 곳이고, 안산과 인왕산을 같이 하고 있어서 산책 혹은 트레킹도 좋은 곳이라 생각되요",별표 4개,3년 전
박기철,서대문형무소 가는길에 잠시 들리거나 독립문역에 오는길에 잠시 들렀던 공원 입니다,별표 5개,6년 전
Photowriter (Photowriter),"서대문형무소, 독립문과 함께 방문하기 좋다 산책길로도 훌륭하고 한국사람들에게는 의미있는 공원이다 화장실 무료 공중화장실이 있다",별표 5개,1년 전
Kevin Ko,독립문과 서대문독립공원을 지나 안산자락길은 가족들과 함께 할 수 있는 좋은 산책 코스입니다 서울구치소가 1987년 의왕시로 옮겨감에 따라 1992년 8월 15일 독립공원으로 조성하였습니다,별표 5개,7년 전
shinjohnss,일제 강점기를 다시 한번 생각해 볼수 있는 서대문 형무소가 있는 곳이다 형무소를 중심으로 공원이 조성 되어 있다 산책 할수 있고 역사를 돌이켜 볼수 있는 유일한 동네 공원 인거 같다 독립문의 우아한 자태가 아주 인상 적이며 간혹 영화 촬영도 하는 공원 이다~ 여백의 풍요 앞으로도 이런 공원이 많이 생겼으면 좋겠다 사진 올리니 함들 보셔요^^,별표 5개,4년 전
June “어리버리” H,독립공원내 유일한 유료 관람 시설이다 각종 할인 혜택도 있으니 참고 하시길~ 관람료 비싸지 않으니 절대 아깝다 생각 마시고 자주 자주 그리고 오래오래 마음으로 머물렀다 가시길 1963년 국민의 성금으로 탑골공원에 건립되었던 것을 1992년 독립공원 안으로 옮겨왔다,별표 5개,6년 전
ks shin,오늘아침 출근길은 서대문 연희숲속쉼터 에서 서대문독립공원을 거쳐 종로3가 낙원동 도착코스중에,별표 4개,2년 전
BONG,공원 경계를 따라 산책로가 마련되어있어서 빙글빙글 돌며 경사로와 평지를 반복하여 산책하기 좋다 버스 주차장 말고 일반 차량 주차장은 따로 어딨는지 매번 못 찾겠다 도로 소리가 좀 시끄러운 편이나 산책 하고 운동하기엔 불편함이 있는 정도는 아니다,별표 5개,1년 전
김상범,새롭게 바꿔 광장처럼 넓고 께끗하게 봐뀌고 독립운동가에 대한 형무소도 독립관도 있어 배울점이 많습니다 위로 한바퀴 돌다보면 도서관이 나오고 계단 으로도 네려오면 다른곳으로 둘러 볼수도 있고 지하철 타고 갈수도 있읍니다 위치 : 3호선 독립문역,별표 5개,6년 전
SA P,독립문도 좋지만 조금 더 올라가면 서대문형무소가 있음,별표 5개,6년 전
Hyun Chul Kim,서울 도심의 쉼표같은 공원,별표 5개,2년 전
TOMMY HAN,사대문 내 산책하기 좋은 곳이고 이진아 도사관은 꼭 들러보세요,별표 5개,4년 전
Chulhee Park,밤 산책 또는 데이트 코스로도 좋은 곳,별표 5개,4년 전
이젬마,역사적인 독립문이 위치해 있고 연계하여 서대문형무소도 인접해있으며 찻길을 건너면 다양한 먹걸이가 있습니다,별표 3개,5년 전
나야나,대한민국 국민이면 꼭 가봐야 할 곳 가족과 함께라면 더욱더,별표 5개,6년 전
한경훈,도심 속에 이런 친환경 공간이 있다니 귀한 곳 입니다,별표 5개,5년 전
송일범,공원 잘 구성되었고 역사교육에도 좋아요,별표 5개,6년 전
박효숙 (수기박),남녀노소 가리지않고 운동과 산책을 즐길수 있는곳이며 역사공부를 할수있는 곳이다,별표 5개,4년 전
신미영,공간도 넓고 바로 옆에 서대문 형무소 가 있어서 관람하기 편했어요 화장실 조금 멀었어요,별표 5개,10달 전
김헤레나MY,천천히 산책하기 좋아요^^,별표 5개,2년 전
햇살쨍 (햇살쨍),산책하기 좋눈 공원 이진아 도서관도 좋아요,별표 5개,4년 전
J Doya,"최근엔 안산 자락길 조성에 따라 초입으로서 등산객들이 많이 찾고 있기도 합니다 그래서 낮 시간엔 '독립문'을 보러온 사람들이 있고, 저녁 시간엔 공원에서 운동을 즐기는 사람들이 많습니다 서대문독립공원은 외부에서 멀리 찾아오는 사람들이 있다보기는 동네 주민들이 즐겨 이용하는 장소입니다",별표 5개,4년 전
K글라라,오랫만에 친구들과 만나 점심먹고 산책하기 참좋은장소 복잡한 찻집보다는 한두시간 산책하며 돌기좋은것같해요 도심속에 이런 공원 있다는것도좋고 조금 여유를 가지고 ᆢ,별표 5개,5년 전
Gregory P.,역사적 의미도 있고 시설도 좋아요,별표 5개,4년 전
푸드북TV,데크가 잘 조성돼 있어서 산책길로 최고예요,별표 5개,5년 전
WY Han,"인근 안산자락길을 따라 산책로가 조성되어 가족과 함께 부담없는 야외활동을 할 수 있다 우리나라 근대사의 살아있는 현장으로 독립문, 서대문형무소(경성감옥) 등이 있던 자리이며 형무소가 이전 한 후(1992년) 서대문독립공원으로 조성되었다 특히 학생들에게 우리나라의 힘겨웠던 역사를 되돌아보는데 좋은 장소이다",별표 5개,5년 전
Jisu Jeong,가벼운 산책으로 좋습니다 안산으로 가는 길이 잘 정돈되어있습니다,별표 5개,6년 전
박종서,31절 815에는 무료입장 화장실 깨긋 반려견 동반 환경 편하게 산책가능 편의점 1개 있고 서대문형무소 교육차 관람하면 좋습니다,별표 5개,2년 전
Heehwan Roh,산책로도 좋고 트랙킹코스로도 좋습니다 영천시장엔 간단한 먹거리도 있습니다,별표 5개,4년 전
김규민,한국역사를 알고자 하는 분들은 꼭 찾아가보길,별표 5개,6년 전
Jong Min Park,독립문과 구 서대문형무소가 있어서 중국 제국주의에 대한 경각심과 일제강점기 시절 독립운동가 선생님들의 투철한 애국심을 느낄 수 있어서 좋았다,별표 5개,2년 전
gyuan lee,대한민국의 역사를 배울수 있다,별표 5개,5년 전
Hyeongki Hahm,혼자 돌아보기에 좋은 시간이었어요,별표 4개,5년 전
해결자,한국사람이라면 가보시고 선현의 거룩한 뜻을 새기시길 덤으로 영천시장에 들러 꽈배기도 드시면 좋겠지요,별표 5개,4년 전
이영순,안산 둘레길 입구에 독립공원 있다 많은 인파가 몰리는곳 참좋은경험 할것 확신한다 안산 둘레길 정말 멋있게 해 놓았다♡♡,별표 5개,6년 전
권세진,"고등학교 때 만난 첫사랑과 행복한 시간을 보냈던 곳이며, 지금은 비록 떨어져있지만 그 시간은 항상 제 기억속에 행복한 모습으로 자리잡아 있을 것입니다 공원의 이름에서도 알 수 있듯이, 서대문 독립공원은 과거 일제강점기 시절 수많은 한국인들이 착취당하고 고문당하였으며, 사형당하였던 슬픈 장소입니다 잠시 그녀에 대해 묵념하는 시간을 갖도록하겠습니다",별표 4개,7년 전
백경기,"아베와 쥐어봐야 한줌도 안되는 일본 우익들이 야스쿠니 위령소에 갈 때, 우리는 이곳 독립공원 내, 독립관에서 독립운동가와 호국 영령을 기린다 서울 지하철 3호선 독립문역",별표 5개,6년 전
한CO,산책하기 좋은 공원이며 운동기기가 설치되어 있어 체력단련에도 도움이 되고 도시속 공원으론 👍,별표 5개,4년 전
김종석,코로나 때문에 조용하답니다,별표 4개,5년 전
고미영 (밍밍),이곳엔 먹먹함이 남아있다,별표 4개,5년 전
Byeongjae Kim,"역사적인 의미도 있지만, 산책하기에 좋은 곳 광복절과 현충일에는 서대문형무소 견학 인파가 몰려서 사람이 많음",별표 5개,6년 전
Esther Park,"가족 나들이, 데이트, 반려동물 산책 등 다양한 시민들을 만날 수 있는 곳 날씨까지 좋다면 금상첨화",별표 5개,5년 전
Eric Kim,어정대는 비둘기와 똥 썩은물이 고인 분수 길가를 지나는 차들이 일으키는 분진 그럼에도 불구하고 열심히 뛰노는 아이들 그 아이들을 웃으며 바라보시는 느릿한 노인들 과거 현재 미래의 공존을 편하게 바라볼 수 있는 곳,별표 5개,6년 전
유진오,민족의 아푼 역사이지만 살아있는 역사의 유물이기도 함 도서관도 있어서 가족 역사여행지로 추천,별표 4개,6년 전
HAN YUN,"주차공간이 멀고, 어느때는 주차불가인 경우가 많음",별표 3개,6년 전
치르치르,많은 사람들이 찾아왔으면 좋겠다,별표 5개,3년 전
김주영,아이에게 광복의 의미와 얼마나 많은 독립운동가 들이 희생과 업적을 한눈에 볼수 있는 좋은기회,별표 4개,4년 전
Smee,호젓한 한때를 보낼 수 있은 곳이었지만 여러 단체 관람객들과 도슨트들의 안내 멘트로 쉴 곳이 많이 줄어들어 우울해짐,별표 5개,수정일: 5년 전
이우근,도심에있고 주변에 서대문 형무소등 역사적 가치가 있는 곳이 같은장소에 있어 관람하면서 가족과 함께하는 시간을 보내기 좋은곳,별표 4개,6년 전
현재호,"시내한복판에 위치한 역사공원이죠, 한적한주말 가족과함께하는 시간을보내기 좋은곳이죠",별표 5개,5년 전
Test Dna,시내에서 산책및 운동하기도 좋아요,별표 4개,9년 전
SY J,교차로에 있는 공원으로 독립문이 있습니다,별표 5개,6년 전
전지훈,깔끔하고 크고 공원인데 볼것도 많아욤 화장실도 세개 ㅎㅎ,별표 5개,1년 전
오세욱,독립문이 대장처럼 멀리서 이웃하고 있으며 3호선으로 독립문역 4번 출구에서 우회전시 접근성이 좋습니다,별표 4개,5년 전
우형준,서대문형무소도 볼 수 있고 안산 둘레길 성곽둘레길도 갈 수 있어서 좋아요,별표 5개,6년 전
작은구름,아이들과 함께 대한민국 독립을 기념하는 뜻깊은 장소가 되었습니다,별표 5개,수정일: 6년 전
잡고기명인,근처에 영천시장 먹거리 좋네요,별표 4개,5년 전
윤수연,나무가 우거져서 풍경이 너무예뻐요 가족들 나들이 하기 좋은 장소입니다,별표 5개,4년 전
Red Milan,작은 공원 서쪽 터널 지나면 연대 동쪽으로는 광화문 북쪽으로는 연신내 남쪽 으로는 서울역 위치 독립문이 바로 옆에 있다,별표 3개,9년 전
2두구든뜬,독립문 사진스팟/ 걷기좋은 둘레길/ 서대문형무소/ 넓고 잘조성된 공원,별표 5개,5년 전
최수영,데이트하기 딱 좋은 분위기에 의자도 많고 넓직해서 놀기 좋음,별표 5개,5년 전
David Kwon,안산 자락길도 가까워서 안산자락길 들어가기 좋은 공원 주변에 산책하기 좋습니다,별표 4개,8년 전
Inho Sung,도심속 공원이지만 나무많고 잠시 가족쉼테에 좋음,별표 4개,5년 전
백산,잊지못할 수용시설 잘 보존해서 후손에게,별표 5개,6년 전
임영준,독립운동 관련 공원인데 좀은 미흡하다는 생각,별표 3개,1년 전
막걸Lee,공원인데 여기저기 구석구석 잘해놨네요 구경거리가 많아요,별표 4개,5년 전
SCOTT HowToView,존재 자체로 의미가 있지만 주변이 어수선하고 시설물 관리에 조금만 신경을 더 써 주길,별표 5개,6년 전
박석주,민족의 역사의 일부분을 체험하며 좋은 시간 보내고 왔어요,별표 5개,5년 전
추성웅,서대문형무소 관람과 함께 방문하기 참 좋습니다,별표 4개,5년 전
미스터굴착기,오래된 공원이라 나무가 울창해서 산책하기 좋아요,별표 5개,4년 전
Mario J,"안산자락길을 오를수 있고, 독립문을 볼수 있으며, 서대문 형무소를 둘러볼수 있고 이진아 도서관도 갈수 있지",별표 5개,5년 전
양준영,걷기좋고 반련견 운동시키기도아주좋습니다,별표 5개,4년 전
Ryu Sang Hoon,한국이 독립하게 된 배경에 알려지지 않은 많은 사람들의 고통이 있다는걸 알려주고 싶다,별표 5개,6년 전
정진현,아이들 자전거 퀵보드만 서로 안부딪히게 조심하면 좋을 것 같습니다,별표 4개,5년 전
주종은,산책코스 안산둘레길 인왕산둘레길(하늘다리) 이진아도서관 서대문형무소 영천시장,별표 5개,4년 전
지환훈,내 삶의 터전엔 앞선이의 숨길이 늘 있다,별표 4개,6년 전
caz cat,인근 안산 자락길도 강추,별표 4개,6년 전
Young-Ung Lee,민족의 역사현장이라고하기엔 나이드신분들이 점령해 관리가 안되는 인상,별표 2개,5년 전
Sungjin Cho,산책하기 좋고 역사적으로 의미있음,별표 5개,5년 전
2사오정,안산 올라가는 길에 있습니다,별표 4개,4년 전
녹색걷기,독립문 역 엘리베이터 이용하면 바로입구 서대문형무소역사관 및 안산 자락길 연결,별표 3개,4년 전
happyon,"어둠이 내리기 전 형무소 빨강벽돌과 안산과 인왕산의 실루엣 그리고 가족, 연인들",별표 5개,6년 전
NUMBER1 CHOICE,한국인에게 의미있고 산책하기 좋은 공원,별표 5개,5년 전
조인경,아이들이 뛰어 놀기 좋으나 비행기 장난감 날리기에는 적합하지 않은 듯,별표 4개,6년 전
황은영,아이들과 꼭 들려보아야 할 곳입니다,별표 5개,5년 전
꿀잼예준배틀그라운드,역사가 오래된 공원이어서 멋있는 것 같아요,별표 4개,9년 전
김영아,강아지 산책하러 자주가요 좋아요,별표 4개,4년 전
배병선,푸르른 식물들이 함께하는 자연공원 그리고 역사공원,별표 5개,5년 전
임성원,넓고 조용하고 힐링하시기 좋아요,별표 4개,6년 전
Chang Kim,잊혀져가는역사의 뒤안길을 새삼기억나게 했으며 감회로웠습니다,별표 5개,6년 전
박승인,청소 해주세으면 합니다 관리 너무 않되요,별표 2개,4년 전
박재희,좋은데 사람이 좀 많아요 밤엔 무서워요,별표 4개,5년 전
김동영,아담하지만 있을 건 다 있는 조용한 공원,별표 5개,4년 전
Simon LEE,아이와 함께 한국의 아픈 역사를 공감할 수 있는 장소,별표 5개,6년 전
라푼타,근현대 역사를 배울 수 있는 좋은 공간이다,별표 5개,8년 전
Kim James,강아지 데리고 산책하기 좋은곳,별표 5개,5년 전
kim jay,코로나로 출입이 불가능한 서대문형무소 ㅡ 조용 합니다,별표 4개,5년 전
Sung-Sam SON,공원을 산책하고 서대문형무소 역사관을 돌아보세요,별표 5개,6년 전
World Traveler,아이들과 오기 좋아요 ^^,별표 5개,4년 전
엄재필,재미있게 구경하고 했다❤,별표 5개,5년 전
Youngtae Ko,나무가 더 많았으면 좋겠네요,별표 4개,9년 전
JONG-IK KIM,도심 속에서 산책하고 싶은 곳,별표 3개,9년 전
Ji-hwang Kim,도심속 최고의 공원,별표 5개,5년 전
jsy432 Jsy,시민들의 자유로운 놀이터,별표 3개,4년 전
Hyuk Kim (김아맛),역사적인 가치 있음,별표 5개,6년 전
Victor Wang,"교도소 본관을 방문하기 좋은 곳이지만, 주변에는 시간을 보내기 좋은 산책로가 많이 있습니다",별표 5개,2달 전
Scott Ward,그림처럼 아름답고 사진을 찍을 기회가 많습니다 서대문형무소 개원을 기다리며 공원을 방문했습니다(토요일 오전 9시 30분) 서대문형무소 투어와 결합하면 가장 좋습니다,별표 4개,2년 전
Steven Wiltrout,공용 주차장과 화장실을 이용하실 수 있습니다 한국의 과거와 현재 독립 투쟁에 대해 알아볼 수 있는 좋은 곳입니다 도보로 약 2시간 정도 둘러보실 수 있습니다,별표 5개,5년 전
Magno Neves,이곳은 너무 아름다운 곳이고 여기서 시간을 좀 보낼 수 있습니다 연세대와 이화여대가 바로 그것이다,별표 5개,6년 전
Chris Klepper,가을에 방문하면 다채로운 단풍을 감상할 수 있는 아름다운 공원입니다,별표 4개,4년 전
Quynh Anh Dinh,넓고 깨끗하고 예뻐요,별표 5개,5년 전
E S,긴 산책 후 휴식을 취하기 좋은 곳입니다,별표 4개,5년 전
suzume yagi,역사를 느끼게 하는 문이 있는 공원,별표 3개,7년 전
JH LEE,휴식과 역사 학습을 모두 즐길 수 있는 멋진 공원입니다,별표 4개,5년 전
Ornwara Tritrakarn,날씨가 좋은 날에는 가족 나들이나 가볍게 산책하기에도 적합합니다 아름답고 활기찬 공원,별표 5개,6년 전
刘伟,"그림 같은 풍경, 산책과 운동에 좋은 곳",별표 5개,4년 전
ปัจเจกชน คนสันโดด,조용하고 그늘진 곳입니다,별표 4개,3년 전
Will Kim,산책하기 좋은 곳이자 역사적인 장소,별표 5개,6년 전
Abida Batool,가족과 함께 즐기세요,별표 5개,2년 전
