작성자,내용,별점,작성일
이용재,서울시내 산책하기 좋은 곳,별표 4개,7년 전
miron,"도심속 부족한 공원 확보라는 취지에는 적극 공감하지만, 아직 미완성인것 같습니다",별표 3개,6년 전
쿠로사키이츠코 (쿠로),정말정말 좋아요 꽃또 있고 나무도 있어 괜찮아요 피아노도 있어 피아노을 칠수도있어요 산책 하기 좋을뜻 ㅎㅎ,별표 5개,4년 전
Sangwan KOO,뭐 그닥 새롭거나 엄청난건 없네요 과거에 차로 지났던 길을 걸으니 재미있긴 합니다,별표 3개,5년 전
김명환,삭막한도시에서 하늘을것는 느낌의 멎진 산책로였으며 최근에 서울역과연결되는 옥상공원이 생겨 더욱빛을발휘한 서울의명소가 되지않을까,별표 4개,4년 전
Hye-Young Shin,편안하게 걷기 좋고 차들과 상관없어 산책로로 분위기 좋습니다,별표 4개,4년 전
jeong jiu (지우),도심의 고가도로를 산책로로 재생했다는 것에 의의가 있습니다 도심 한가운데에 산책로가 생긴 것은 반가운일입니다,별표 4개,7년 전
손오공,"도심속에서 색다른 산책로~ 단, 통행로가 좁은편",별표 4개,4년 전
양정원,시간이 남아 잠시 구경하긴했지만 이런공간이 있다는게 참 좋았습니다 한낮에 보면 더 좋을것 같드라구요,별표 4개,5년 전
파이팅맨 (파이팅맨),많은 시민들이 역사를 알게되고 주변 도심과의 복잡함속에서 여유로움을 느낄수 있는 장소인듯합니다^^,별표 4개,5년 전
라현아,신기한 식물도 많고 이쁜 식물도 많아서 천천히 구경하다 보면 시간 개잘 감,별표 5개,4년 전
구르는돌,서울로 점심때 산책 하기 딱이죠 다양한 식물들 볼 수 있어 좋아요,별표 4개,4년 전
손희경,밤엔 밤대루 낮엔 낮대루 운동하기도 좋구 완전 최고,별표 5개,3년 전
슈파슈파,더운 여름날인 시원한 가을엔 좋습니다,별표 4개,1년 전
채희도,마케팅한거에 비해는 실망했지만 저녁에 산책하기 좋은 곳 중 하나,별표 3개,5년 전
타임스케치,고가를 공원으로 만든건 좋은데 밑에는 자동차가 많이 다녀서 신선한공기가 아닌 매연으로별로예요,별표 3개,수정일: 2년 전
가을바람DJ,서울시내 최고의 공중 산책길입니다,별표 4개,1년 전
미미내사랑,다양한 문화활동이 공존하는 곳이되었으면 좋겠습니다,별표 5개,5년 전
김광림,서울 한복판에서 여유를 느낄수 있는 곳인것 같아요~,별표 4개,6년 전
kihwan jung,구름이 약간끼어 다니기 좋았습니다,별표 4개,2년 전
전기호,힐링이나 감동은 전혀 느낄수없다 쓸데없는데 세금 낭비한 느낌이다,별표 1개,6년 전
Taewon Kang,하지만 높은지대는 볼 나무도 많고 뷰도 좋음,별표 4개,6년 전
Sungkyu Oh,옛 차량고가도로를 폐쇄하고 사람들 보행로로 너무 아름답게 꾸며놨네요,별표 4개,3년 전
이을식,서울서부역과 남대문시장 연결된 서울로7017 공원조성이 잘되었으며 한번쯤 찿을수있는곳,별표 4개,7년 전
김민정,서울 도심에 이런공간이 생겨 좋았어요,별표 4개,6년 전
이학철,서울역 서부지역과 서울중구와 남대문시장을 도보로 이어주는 편의시설,별표 5개,수정일: 4년 전
성준기,깔끔하게 잘 되어 있기는 하지만 굳이 교통 혼잡한 동네에 만들어야 했을까 라는 생각이 든다,별표 4개,3년 전
Yongkwon Kim,연계해서 볼만한 장소가 있었으면 좋겠어요 예쁘게 잘 꾸며놨네요,별표 4개,6년 전
강기원,누구나 한번은 가봐야할 곳이며 우리나라 에 이런곳도 있다는게 알아야 한다고 생각하머 특히 가족과 함께 가볼만합니다,별표 5개,6년 전
오뚜기,고가 철거하지 않고 공원으로 탈바꿈 하였네요 많이 이용해주세요 감사합니다,별표 5개,7년 전
차만성,봄에 와서도 화초가 활짝 피었습니다 보기만해도 기분이 정말 좋더라구요,별표 4개,수정일: 5년 전
jeehee nam,깨끗하고 볼것 많고 예쁜거리입니다 강추예요,별표 5개,2년 전
뿌이뿌이,매연걱정했지만 심하지않았고 곳곳에서 음악소리가 들려서 좋았음,별표 4개,5년 전
잘했두,고가공원 처음엔 왜만드나했는데 날씨좋고 선선할때 올라가보니 참 좋네영 ㅎㅎ 산책하기도 좋고 경치도 좋아오,별표 5개,6년 전
ABC株式会社,멀쩡한 고가도로를 차 못다니게 바꾸고 공원이라면서 녹지가 하나도 없음,별표 1개,7년 전
Fred Kang,밤 기차 기다리는 시간에 내려가볼만함,별표 4개,7년 전
서종원,박원순 시장님의 시민 사랑이 보이는 장소이고 내국인은 물론 외국인 에게도 추천할만한 장소이다,별표 5개,5년 전
박현우,식물의 종류도 다양하고 고가차도에서 서울을 전망할 수 있어서 좋음,별표 5개,5년 전
NamJin Kim,가볍게 도심속에서 산책할 수 있어 좋습니다 지금은 장미 꽃이 예쁘네요,별표 4개,6년 전
왕영상,서울역 고가도로를 공원으로 만들어 서울시민의 휴식공간으로 만들어 좋았다7,별표 4개,6년 전
YUNA CHUNG,최악의 장소예요 사람도 별루 안가고 아스팔트위에 나무 몇그로 도대체 무슨 생각으로 지은건지 교통방해에 잘 쓰던 고가도로를 쓰레기로 만들었네요 좋아진건 옆건물 장사만 도게했네요,별표 1개,6년 전
THE BRANDON,초여름 밤에 거닐면 분위기 깡페인곳 데이트하기 딱 좋은 그런곳^^,별표 4개,4년 전
머쓱타드,거리에 나무도 많이 심어져있어서 연인끼리 걸어다니기 좋습니다,별표 5개,4년 전
댕이,밤에 선선할때 걷기좋은곳이에요,별표 5개,2년 전
김병우,너무좋았는데요 그늘이 부족한게 아쉬웠답니다,별표 4개,4년 전
박선규,낮에는 덥지만 밤에는 시원한게 갈만해요 가끔 버스킹 공연도 볼수있고,별표 3개,수정일: 7년 전
Yeonjong Kang,음료 한잔하며 얘기하기 좋으나 차들이 오가는게보이고 시끄러운편이라 정신없다,별표 3개,5년 전
Kim HyeongSu,나의 출퇴근길은 지켜주는 아름다운 거리 매달 컨셉이 바뀌는 컨셉로드,별표 5개,4년 전
Ohwoong Kwon,도심을 가로 지르던 고가도로를 철거하여 도심 속 산책로로 리모델링 하였습니다 서울의 랜드마크로 거듭 태워나길 바래 봅니다,별표 4개,수정일: 1년 전
이맹,낮에도 좋지만 선선한 가을에 야경구경하기 좋은 곳,별표 5개,7년 전
임희정,"피아노도 있고, 다양한 나무들, 예쁜 조명, 자꾸만 걸어보고 싶은 길",별표 5개,6년 전
김선태,다리 위에 올라가서 보면 서울의 경치가 한눈에 들어와서 아주 좋아요,별표 5개,2년 전
이교훈,너무 인위적이고 시멘트밖에 볼거없어요 아래 차도에서 올라오는 매연은 어텋 합니까 왜 이걸 만들었지,별표 1개,5년 전
유은섭,장점은 높은 위치에서 서울역 근방을 내려다 볼 수 있다는 점 뿐,별표 3개,6년 전
Judy Oh,아이들이 저녁에 불빛반짝반짝이는 걸 좋아합니다 중간중간 쉼터도 있고 좋아여,별표 4개,5년 전
최메리,구경거리도 많고 산책하기 좋아서 자주 이용하고 있어요:),별표 5개,6년 전
Kyle Yeon,"서울로 정말 좋아하는데, 올 겨울은 코로나 때문인지 사람도 없고 스산하네요 서울로는 봄에 가장 좋은듯해요",별표 4개,수정일: 4년 전
이세준,걷기에좋고 화분이 많아요 키치적이라서 더 좋은거같아요,별표 5개,4년 전
리건,서울 고가도로를 산책로로 만든 장소입니다,별표 5개,6년 전
지브리명관,"좋네요 길이좀 좁지만 산책,데이트하기 좋은 길이네요",별표 4개,5년 전
MINKYEONG SON,"서울로 생기고선 산책하기도 좋고, 가끔 공연도 하는 감성공간이에요~",별표 5개,7년 전
신신성용,관리유지앞으로가관건인데 점점좋아질것에 좋은점수드려도될겄입니다,별표 5개,6년 전
STEVE YANG,"원숭이 좆밥쇄키가 만들어 놨는데, 공사비는 어디다 떼어먹었는지 구조물은 허접하고 산책하기에 접근성도 별로다",별표 1개,5년 전
Jukyung Sung,"산책하기 정말 좋은곳, 기분전환겸 걸으면 좋다",별표 5개,6년 전
마루쉐,아직 날씨가 따뜻하진 않아서 볼거리는 없는데 걷기 좋네요,별표 4개,6년 전
박성용,공원에 위치한 커피집 대박 가격100원,별표 5개,4년 전
이아라,좋은 사람들과 걷기에 아주 좋은장소 입니다 멋진 야경과 아름다운 정원,별표 5개,6년 전
na noname,왜 막아놓고 공원으로 만들었는지 모르겠음 야간에 야경으론 예쁘서 별두개,별표 2개,7년 전
김소담 (소다미),야경보면서 산책하기좋아요 피아노도 있고 수목도많아요,별표 5개,4년 전
Eun-ji LEE,"남대문시장 쪽 에서 서울역까지 걸었는데, 야경도 예쁘고 조경도 오밀조밀하게 잘 한 것 같았음",별표 4개,7년 전
Jaye,여름에 뜨겁긴한데 엘레베이터도있고 위에서보는 풍경이 좋습니다,별표 5개,7년 전
pill red,서울로7017을 걷기엔 봄: 미세먼지 많아요 여름: 더워요 가을: 잠깐 좋아요 겨울: 추워요,별표 1개,수정일: 5년 전
Chungrea Cho,불쌍한 거리에서 지내시는 분들 마음 편하게 돌아다니게 도움주셔서 감사해요^^ 일하는 분들 앉을 자리 마련해 주세요,별표 1개,6년 전
정민혁 (mona),관리가 잘되고 서울역 지붕으로 길을내서 역을 이용하기가 좋아요,별표 5개,4년 전
Kjy신양,"걷기좋음, 피아노가 있는데 행인들이 연주하는게 인상적이었음",별표 4개,5년 전
강양숙 (아이럽버터),서울의 야경도 멋지게 볼 수 있는 멋진 산책코스입니다,별표 5개,5년 전
박태목,오랜 세월 지났지만 옛날보담 많이 깨끗해 졌다는 느낌과 시민 의식이 향상된 느낌이라 좋았음,별표 5개,6년 전
박현수,출근 버스 잠 들어서 정거장 지나쳤을 때 산책하면서 출근하기 좋은 곳^^,별표 5개,4년 전
장장혜영,낭만이 있어요 바람불어도 추워서 차한잔 마시구 싶으면 바로 카페로 하지만 지금은 갈수가 없어요 ㅎㅎ 슬프네요 빨리 봄이 오면 좋겠네요,별표 5개,4년 전
Grant Bahk,교통흐름을 원활하게 하는 다리의 재설치가 더 나은 선택같다,별표 2개,3년 전
Philip Son,도심에서 산책이 쉽지 않은데 잘 조성되어 있어서 좋았어요,별표 5개,5년 전
박승우,"산책로서의 미관이 뛰어나고, 서울역과 남대문까지 명소를 두루 볼 수 있어, 짧은 시간에 관광이 가능합니다",별표 5개,6년 전
유주현,"다양한 식물 구경을 하며, 조용히 산책하기 좋음",별표 4개,5년 전
양주동 (phlanetes),산책하기 좋고 야경보기도 좋을 겁니다,별표 4개,6년 전
Seniez,이름은 거창한데 되게 뭐가 없다 도로 재활용 취지는 좋았으나ㆍㆍ 걷기엔 좋다ㅇㅇ,별표 3개,5년 전
Sang yeop Lee,고가도로 위에서 본 서울역과 인왕산쪽은 너무 멋지다,별표 5개,5년 전
JY L,"서울역을 한 눈에 볼수 있고, 교차로에 차들이 오가는 광경이 예쁘요",별표 5개,3년 전
신현경,별루요 온통 시멘트 바닥이구 더운 여름에는 올라가기가 더 힘드네요ㅠ 굳이 세금으로 이걸 만드는게 좋았는지 의문입니다ㅠ 처음에 생각했던것과는 많이 달라 실망이 더 크네요ㅠ,별표 1개,4년 전
Wonsik Lee,간단히 즐기는 시내 산책로로 최적 특히 역동적인 서울 야경이 좋음,별표 4개,7년 전
Jiyeon Moon,도심한복판에서 숲을 느낄수있는곳,별표 5개,5년 전
Seacastle,밤에 산책하기 좋은곳ᆢ 애완견과 함께해도 더 좋음,별표 4개,5년 전
JS Cho,산책하기 좋음 다양한 식물을 만날 수 있음,별표 4개,5년 전
3sonspapa,더웠는데 다양한 방법으로 더위를 식혀주려는 노력을 보여주었으며 걷기에 지루하지 않았다,별표 5개,7년 전
k garby,인근 직장인들에겐 점심식사 후 산책하기에 딱 좋은 코스다,별표 4개,6년 전
김봉진,날씨도 좋고 도심속에 이쁜정원 너무나 좋으네용^^,별표 4개,5년 전
Youngrong Lee,남산도 가까워서 가볍게 등산하기 좋음 도심속에 예쁜 산책로,별표 5개,5년 전
엄계연,라이브로 귀를 호강하고 걷기를 하면서 건강도 지키면서 일거양득 이다,별표 4개,5년 전
Yunoh Gwon,점심 식사후 가볍게 도심 한가운데서 산책할수있어서 좋아요,별표 4개,6년 전
최귀남,남대문시장 상인임 퇴근시간때 교통이 아주 불편함 뻐스 차로에 택시 기타 차들때문 불편하게 승하차 함 인도에 상인들 물건 진열때문 방문객에게 나뿐 인상줌 현장에 요셔서 지도바랍니다,별표 3개,6년 전
Jiho Bae,생각보다 별로 나무들도 관리가 덜되고있구요,별표 3개,5년 전
군만두,음 노숙자들이 술마뉴안먹었으면 좋아요,별표 5개,5년 전
동효삼,괜찮은거 같아요 중간에 화장실이 하나쯤 있으면 더 좋았을것 같습니다,별표 4개,4년 전
MJ Kim,서울역에서 남대문까지 걸어갈수 있어서 편하고 차신경쓸 필요없이 산책할수있어요,별표 5개,6년 전
백성욱,정말 걷기 좋은 고가공원으로 사진 찍기 좋습니다,별표 5개,5년 전
레이크루이스,남대문시장 서울역하고 연결되어 있는 산책로 입니다 낯에도 좋지만 저녁에 방문하는것을 추천합니다,별표 4개,6년 전
샤논,서울 도심때 관광코스 중 하나 추천 서울역사 배경으로 사진 찍기 좋아요,별표 4개,5년 전
金步城,공원으로 리모델링을 하여 안전에 많이 신경을 쓴것 같습니다,별표 5개,5년 전
Lee Seok-jun,아기자기하게 잘 꾸며놓고 중간중간 볼거리가 많아 가족끼리 가기 좋은 곳,별표 4개,5년 전
휴가휴가,도심 속에 숲 서울의 경치를 한 눈에 볼 수있고 깨끗하고 좋아요,별표 4개,6년 전
이경석,이곳만 산책하긴 짧지만 그래도 색다른 기분이네요,별표 4개,7년 전
박근덕,"숲 냄새가 날 정도로 나무가 많고, 서울의 야경을 볼 수 있습니다",별표 5개,6년 전
jaewon lee,서울의 중심부 서울역에서 이런 산책하기 좋은 길이 있다는게 좋습니다,별표 5개,6년 전
DC Eie,찻길로만 지나다녔던 고가도의 기억을 보행도로로 변화시킨 특별함이 돋보임,별표 4개,6년 전
byeongkwon moon,서울역 지나실때 잠깐 들렸다가심 좋을듯,별표 4개,6년 전
Hyun Han,걸을때마다 언제냐좋아요 기분좋게 남대문시장가는길,별표 5개,5년 전
as one,막상 가서 걸어보면 기대보다 괜찮습니다,별표 4개,수정일: 7년 전
PintGlass Yellow,초기 부족한게 많아 아쉬움이 많았다면 현재 꾸준히 개선되어 많이 좋아진 점이 장점,별표 3개,6년 전
한충석,이젠사람도 많이 모이지않고 서울역뷰가 좋습니다,별표 4개,5년 전
고독한미식가,복잡한 남대문-서울역 구간을 여유롭게 내려다보며 산책할 수 있는 도심 공원,별표 4개,5년 전
hikasiru,"걷기 좋고, 피아노 연주, 공연을 볼 수 있음",별표 4개,6년 전
신상윤,길 잘 만들어놨던데 근데 거기 사과가 있다던데 누가 다 따먹음,별표 4개,5년 전
율무,서울로 자체는 아이디어 좋다고 생각듭니다,별표 3개,5년 전
쓰준,그냥 길이면 더 좋겠다,별표 1개,4년 전
JW,산책하기 좋지만 그늘이 없다는 것이 아쉬움,별표 3개,7년 전
Ho Bro,천천히 걸으면서 역사적 가치가 있는 서울역탐방하기 좋음 서울로 또한 역사적 가치가있음,별표 5개,7년 전
ohck55,"주변에 먹거리, 볼거리도 취약",별표 3개,5년 전
Hyerim Lee,가을에 걷기 좋은 곳,별표 5개,6년 전
최현주,"올만에 갔는데, 곳곳에 피아노가 생겨서 너무좋았어요~",별표 5개,수정일: 6년 전
맘스돈터치,예쁜 꽃들과 서울역 근처를 내려다 볼수 있는 다리가 맘에 들었습니다,별표 4개,6년 전
손양임,7017 다리 아주 좋은곳운동도 되고 하초도 꽃나무도 많으면서 매우 좋타요,별표 5개,5년 전
luka hong,멋진 공중위 공원 노을질적 걸으면 더 멋짐,별표 5개,6년 전
Yongjae Lee,서울로 주변 카페로 바로 이어지는 점도 좋다,별표 4개,7년 전
황온유,"좋았어요, 울 아들 회사도 한 눈에 훤히 다 보이궁~",별표 5개,수정일: 4년 전
영이촐혹,빨리 없애길 관리도 안되면서 낭비가 심한 전형적인 원순행정,별표 1개,5년 전
권훈,탁상행정의 전형적인 시설,별표 2개,6년 전
Jong Ha Lee,밥넉고 산책하기 좋죠,별표 5개,5년 전
김대경,모든 시민들 자유롭게 이용하고 행복해 할 수있는 공원이기때문~^^,별표 4개,7년 전
찐 민채,"생각보다 좋았습니다^^ 낮에는 엄청 더울거 같지만, 오후에 가니 선선하고 예쁘고 좋더라고요^^",별표 5개,6년 전
정학근,오늘 날씨가 걷기에 너무좋아서 서울역에서 부터 회현역까지 걸어보았다,별표 4개,5년 전
오하,요즘 같은 날씨에 산책하기 딱 좋아요,별표 5개,6년 전
그섬에가고싶다(매싸이),위에서 내려다 보는 서울역 전경,별표 5개,6년 전
Jang Tomas,좋은 조경 멋진 다리 그러나 시위현장을 자주봐야하는,별표 4개,6년 전
YS KIM,시민들이 잠시 쉬며 구경하기 좋은곳이라 생각함,별표 4개,3년 전
민트새싹,간단하게 도심에서 짧게 산책하기 좋아요,별표 4개,4년 전
최대호,몇 번을 가도 좋아요 도심에서 느끼는 즐거움,별표 5개,4년 전
ki chul Kim,산책하기 좋고 풍경감상에도 좋습니다,별표 4개,6년 전
포세이머니,도심에 있지만 가볍게 산책하기 좋아요,별표 4개,4년 전
선창훈,산책으로 아주 좋아요 야경도 멋져요,별표 5개,6년 전
Eunah Rhee,콘크리트 환경에 비가와도 불편하고 출입구계단도 불편하고요,별표 1개,6년 전
박상우,너무 좋았어요 하루종일 앉아만있어도 좋더라고요,별표 5개,4년 전
빡졔빡졔,처음가봤는데 관광객들 데리고 가기 좋은 거 가타용,별표 4개,6년 전
kyungwon min,도심속에서 편안한 휴식을 즐길 수 있는 곳,별표 4개,6년 전
홍영기,화단이 많아 보행에 지장을 주는것이외 산책코스로 무난함,별표 4개,6년 전
김희호,빵집 앞이 사진 찍는 베스트 포인트,별표 3개,7년 전
Hun L.,그냥 철거를 하지 왜 공원을 만들겠다고 무리수를 이게 무슨 공원인지,별표 2개,5년 전
이재준,별건 없는데 예쁘다,별표 3개,6년 전
자연인,점심먹고 30분 정도 산책하기 좋은 도심공원,별표 3개,6년 전
가브리오,고가른 활용해서 서울중심에 낮이든 밤이든 뷰가좋아요,별표 4개,6년 전
이계훈,생각보다는 좀 허접하지만 향후 더 좋은 방향으로 모색할수있는 여지는 많음,별표 3개,2년 전
유한나,지금날씨에 커피한잔들고 걸어볼만한길인듯하다,별표 4개,5년 전
윤성덕,"낮 보다는 밤에, 봄여름가을에 좋아요",별표 3개,5년 전
김도연,가까운 서울 도시에 산책과 이야기 나눌수있는 장소가 있다는것에 감사를 드리고 만족한 하루여습니다,별표 5개,4년 전
쾀세옹쥰,안타깝다 도로로 사용하는게 더 나을듯 전형적으로 잘못계획된 사례 공무원들의 감각을 엿볼수있다,별표 1개,5년 전
김영환,걷기좋고 볼꺼 많고,별표 4개,7년 전
huisu Gim,해질녘 하루를 마무리하며 차 한잔하기 좋은 곳입니다,별표 4개,6년 전
G S,처음 갔을 때에는 흥미있을 지 모르나 대기질이 안 좋고 볼 것은 생각보다 없음,별표 3개,6년 전
Rome_w,날좋은 저녁 서울역에서부터 남대문까지 걸을 때마다 잔잔한 행복을 느낄 수 있었음,별표 5개,6년 전
오종혁,별로 좋은 점을 찾을 수가 없었습니다,별표 2개,6년 전
여김수정,갈대를 배경으로사진찍으니 진짜 갈대 숲에 온 기분 해지는 모습이 아름다워요,별표 3개,6년 전
사회복지학과박현순,사방을 볼수가 있어 처음 온분들은 구경하기 괜찮아요,별표 4개,6년 전
Suhwan Jung,밤에 산보가기에 너무 좋음 서울의 야경은 덤으로,별표 5개,2년 전
박정도,선선할때 느긋하게 산책하기 좋아요,별표 5개,5년 전
Sung IL CHOI,날씨 좋은 날 공원은 언제나 좋음이죠,별표 4개,5년 전
신수민,해질무렵 가면 너무 좋아요 서울로 7017 위에 불이 켜질때가 너무 이쁩니당,별표 5개,5년 전
신화tv,고가를 공원으로~ 산책하기 좋네요~,별표 5개,5년 전
나현경,요즘 같은날은 쏘쏘 공기좋을때 걷기좋은 곳,별표 4개,6년 전
정승현,산책하기에는 좋으나 단조롭다는 느낌이 있네요,별표 3개,수정일: 5년 전
조인호,길 단장 깔끔하게 잘해 놓았어요 뷰도 좋구요,별표 5개,6년 전
JAE-YES,가족나들이 나름 괜찮은 장소 서울역 근처 올 일있으면 가보길 추천,별표 4개,6년 전
Ju Ahn,도보로 남대문까지 횡단보도없이 편하게 갈 수 있어서 좋아요,별표 4개,6년 전
유성주,점심시간에는 근처 직장인들 많습니다 점심시간은 피해서 가시기를,별표 4개,6년 전
Jong Min Park,서울역 주변에 산책할만한 곳이 없었는데 이런 곳이 생겨서 괜찮다,별표 5개,5년 전
김용석,옛날엔 자동차 도로엿지만 지금은 새로운 공원으로 탄생,별표 5개,3년 전
KY Kim,석양질 무렵 뷰는 괜찮음,별표 1개,5년 전
신성자,어제 도당산은 가을같은 바람도불고 너무 좋아서요,별표 4개,5년 전
M,가을에는 걷기 좋은 곳 (여름엔 그늘이 없어 힘들지 않을까 ),별표 4개,7년 전
Euicheon,나름의 문화가 자리잡고 있는 것 같아 좋네요,별표 4개,6년 전
키친 드링커,밤이 아름다운곳 산책하기 좋아요,별표 5개,5년 전
황상용,도심의 공원이란 특이점이 있으나,별표 3개,5년 전
산유수유,서울역 주변을 관망하기에 적합하나 거리가 너무 협소하고 거리가 짧아 산보하기에는 적합하지 않음,별표 3개,6년 전
정산,가볍게 산책하기 좋은곳입니다,별표 5개,3년 전
knitnature,개설이후 나무들이 울창해져서 산책하고 휴식하기 쉬운 그늘이 생겼어요,별표 4개,4년 전
이봉섭,서울엔이런문화공간이있어서참좋겠어요 문화와 쉼 너무좋아요,별표 5개,7년 전
Heon Lee,"별로 볼것도 없고, 서울역광장에서 시위대들이 스피커를 너무 크게 틀어놔서 소음공해가 심해 다시 안갈겁니다",별표 2개,5년 전
문은영,저녁에 노을도 보고 야경도 보려고 갔는데 코로나때문인지 조성된지 오래되지 않아서 인지 약간 썰렁했다,별표 3개,4년 전
박형근,저녁에 멋있어요 운동삼아서 걷기도 좋고요,별표 4개,3년 전
Yong Suk Lee,"서울역, 남대문, 서소문 야경보며 산책",별표 5개,3년 전
김병화,"아름답게 꾸며 좋았고, 옛날 생각하면서 서울역 근처를 살펴보았어요",별표 4개,5년 전
김용완,만든지 좀되었는데 오늘에서야 올라가 봤습니다,별표 4개,6년 전
BiiOnHoo,좀 썰렁한 겨울말고 나무 풀 많이 자라는 봄 여름이 좋을것같아요,별표 4개,6년 전
sj choi,볼거리도 많고 데이트장소로 좋을것 같아요,별표 5개,5년 전
손묘경,밤에 푸르딩딩한 불빛땜에 눈깔 아프지만 밥먹고 휘휘 산책하기 좋음,별표 4개,4년 전
김정호,접근성이 좀 떨어지지만 언제가도 좋은 곳입니다,별표 4개,6년 전
Yoon Jaehyun,딱히볼건없고 지나갈때 잠깐둘러보면 좋은 곳,별표 4개,4년 전
Wonsang Kim,좀만 더 길었으면 좋겠다고 느껴질 정도로 편한 공간,별표 4개,5년 전
임동식,"서울로7017 가족, 연인들이 함께 가면 좋은 주억을 만들수 있는 곳 같습니다",별표 4개,4년 전
조동흥 Freddy,"뭐가뭐지 도대체 이해가 안가는곳, 하늘공원",별표 1개,6년 전
CJE TouR !,저녁에 가볍게 산책하며 둘러보기 좋았던 장소,별표 4개,7년 전
김완수,선선한 가을 저녁에 연인과 거닐기 좋은 곳,별표 5개,5년 전
사재숙,도시속에 여유라할까요 가끔씩 둘러보면서 쉬어 갈만해요,별표 4개,4년 전
Ehne 엔.튜브,나름 예쁘게 하려한 노력은 보이는데 동선 신경좀 쓰징,별표 4개,7년 전
김재성,그러나 그닥 볼거리는 없는 곳 도심속 여유로운 공간,별표 4개,4년 전
저녁은고기!,많은 변화가 있었지만 결국에는 예쁘게 꾸며놓았네요,별표 3개,5년 전
숟2,낮에 가서 그런지 예쁜건 못느꼈음,별표 3개,5년 전
이성용,고가 공원이 넓고 아름다운모습입니다,별표 5개,6년 전
정가야,서울역 전경보면서 피아노치기 좋아요,별표 4개,6년 전
김용구,다양한 식물들과 깨끗한 관리 훌륭합니다,별표 5개,4년 전
hwang aiden,피아노 음질이 생각보다 괜찮은것 같아요,별표 4개,5년 전
