작성자,내용,별점,작성일
heather baek,많은 시민들이 잠시 삶의 여유를 갖고 휴식을 가질수있는 공간으로 거듭나길 바래봅니다 하지만 그것도 잠시 걷기힘든 시멘트 바닥에 한여름 햇볕을 피할 그늘이 없어 나중엔 잠시 시원한 그늘밑에 앉아 쉬고싶다는 생각이 드는곳 예쁜 꽃 과 나무를 보면 마음이 편안하고 여유가 생깁니다,별표 3개,5년 전
이은령,도심한가운데를 관통해 고가로 걸어다니면서 서울역 주변의 화려한 야경과 아름답게 가꾸어진 꽃과 나무들 사이를 걷는것 건물들과 연결되어 맛집 카페등도 자유로이 갈수있고 그것은 정말 도시속에의 힐링,별표 5개,6년 전
김재철,휴식공간과 서울역에서 남대문까지 이어지는 길이 좋네요,별표 4개,5년 전
이병훈 (쿨가이),근처에 일보러 왔다가 다음스케줄 시간이 남아서 서울로7017에 올라와봤네요^^ 어제부터 날씨가 많이 쌀쌀했지만 그래도 개나리가 활짝 폈네요♡♡/ 공기도 하늘도 너무 맑아서 기분이 정말 좋네요^^ 멀리 남산타워도 깨끗하게 보여서 3월 마지막주도 잘 마무리가 될듯 합니다 4월에는 서울역에서 기차타고 지방가려는데~ 그때 다시 올라가봐야겠네요^^ 3월 잘 마무리하시고 4월은 더 많이 웃어서 행복하고 건강한 하루하루보내세요,별표 5개,4년 전
Go Paju,은하수 합성 사진 입니다 ㅋ,별표 5개,수정일: 4년 전
이상건,야경이 더 아름다운곳 낮에 보면 살짝 심심하다,별표 5개,4년 전
박원규,"근처에 화장실 이용이 기능하고, 중간중간에 물을 마실 수 있는 쉼터도 있어 괜찮음",별표 4개,6년 전
sungchul park,근처 호텔에 투숙한다면 저녁에 야경을 즐기기에 좋을것 같다 서울도심의 상공을 여유롭게 걸을 수 있는곳 겨울보다는 봄 가을이 좋다,별표 5개,수정일: 7년 전
하동욱,"낮에 산책하기 좋고, 야경 뷰가 500% 좋은곳 거리 공연까지 하면 더욱 좋을곳 깨끗하고 친절한 관리자~",별표 4개,6년 전
박윤하,"저는 이 길을 걷는것 보다 등산이 훨씬 나은것 같아요 산책하러 부모님과 들렀는데, 별로 기대하지 않았어요 바닥도 벽돌로 새로 깔고, 울타리도 새로 세우고 식물들도 더 많이심으면 훨씬 좋을것 같다는 생각이 드네요",별표 2개,5년 전
j. hoon kim (k33179),"매주 주말 집회가 교통체증을 유발하고 있는 태극기, 성조기 부대",별표 3개,6년 전
HyunJoo Choi,간단히 서울역 남대문의 모습을 보기 좋았습니다,별표 5개,5년 전
백성진,참 좋은 산책로가 생겨서 좋았습니다,별표 5개,6년 전
SungHa Kim,그늘만 있다면 낭만적인 곳,별표 5개,6년 전
룰루랄라,식물들이 다양하게 있고 낮과 밤이 모두 예쁘다,별표 5개,5년 전
김경임,진짜 예쁘게 만들수 있을 것 같았는데 그냥 콘크리트 덩어리일뿐,별표 1개,5년 전
콜롬비아 암염에너지,아울러 관리에 현장에서 일하시는 분들께 고맙고요 육교를 이용하여 공원으로 만들어낸 도심속에서 나무와 식물 그리고 꽃향기를 맡으며 마음의 행복을 느꼈습니다,별표 5개,5년 전
Paul Cho,여러가지 식물들의 이름을 알 수 있고 아기자기한 사진들을 찍을 수 있는 장소들이 있습니다 서울역 앞의 거리를 한눈에 볼 수 있습니다,별표 5개,5년 전
Murian Song (Murian),남대문 시장에서 충정로로 사람이 이렇게 편하게 이동할 수 있는 길이 생긴건 좋은데 전체적인 느낌은 거대한 분재원 깉다,별표 3개,8년 전
기도혀,사람이 딱 5명 정도 있었는데 이렇게 밤 아주 늦게도 안전요원들이 근무하십니다,별표 5개,5년 전
gongshan Park,도시의 공중을 걷는다 빌딩숲 사이로 심어진 나무보며 단풍진 고로쇠 나무곁을 지나,별표 3개,4년 전
옥탑던전,저녁에 식후 소화할겸 걷기 좋네요~,별표 5개,4년 전
zoony,다양한 나무와 풀들이 심어져있고 밤에는 조명시설도 잘 갖춰져 있어 도심 한가운데임에도 한가롭게 산책하기 좋은 장소입니다,별표 4개,6년 전
릴루이,중간에 에어콘 빵빵한 조용한 쉼터도 괜찮음 중간중간 유리바닥으로 도로를 지나는 차들도 볼수 있고 그새 많이 자란 큰 화분속 식물들로 인해 자연속 공원 걷는 느낌도 받을수 있던곳 부산스러운 느낌은 좀 덜받게 구조 짜줬음 더 좋았을껄 하는 아쉬움이,별표 2개,5년 전
마이댕기,처음엔 시멘트다리이니 엄청 디스글이 있었고 여름엔 덥도 뎌울엔 추워서 다리위 식물들이 걱정이 되었지만 지금은 서울역에 많은 분들이 구경오고 행사도 많이 하는 것 같아 핫스팟에 되어가요 철마다 꽃이 피고 지고 새로운 나무가 생기고 열차 지나 가는 것도 보고 피아노 연주도 듣고 방방이도 타고 로즈광장에서 다양한 장미도 보고 밤에는 보라와 파란 라이트 쇼도 보고 가끔 서울역 광장 시위하는 분들 구경도 하고 서울역버스환승센터랑 버스 구경도 하고 열쇠고리도 걸고 거북이도 보고 나름 멋진 추억을 만들 수 있어요,별표 4개,5년 전
김ys,"이곳은 운동삼아 산책도하며 남대문시장이나 남산을갈때 가는곳입니다 처음 공원화할땐 탐탁치 않았는데 지금은 저에겐 좋은장소랍니다 계절마다 조금씩 환경을 바꾸어 놓아서좋아요 (꽃나무,작은공연,소상공인들의판매,조그만행사)서울역에서 가까워요",별표 4개,5년 전
박하,봄에 사진찍으러 다시 와야겠어요 ㅎㅎ,별표 5개,5년 전
Edwin Eugin,회현동에서 만리동까지 ㄱ~ㅎ 순으로 나무 종류를 배치해서 식물 좋아하는 분이 아니라도 한번 방문하는 것 추천,별표 4개,5년 전
박창래,눈온뒤의 서울로가 너무 아름답습니다,별표 5개,4년 전
김성훈,서울역에서 인근 중림동이나 만리동 또는 지하철역 충정로역이나 회현역으로 도보로 이동하기에는 좋습니다,별표 3개,5년 전
Sungmin Woo,산책로 들어가는 길도 좁고 불편함 녹색보다는 삭막한 회색빛 콘크리트로만 이루어진 산책로 다만 위에서 볼 수 있는 주변 경치는 좋음,별표 2개,5년 전
H K,"서울역에서 차 기다리는 시간 많이 남았다면, 복잡 답답한 대합실보다 여기서 살짝 걸으며 낯선 도심의 여유를 맛보기를 추천드려요",별표 4개,1년 전
Angela Ki (Ifeoma),추운 날씨이긴 하지만 걸으면 기분이 좋아집니다,별표 5개,4년 전
Dong Sub Lee (hipmasta),서울역 근처의 훌륭한 산책로 차가다니던 고가에 형성하여 길 중간중간 볼거리 쉴거리가 많습니다,별표 5개,6년 전
JB,관광객이 많이 찾아오는 장소입니다만 보도가 콘크리트로 돼어 있어 산책로로 좋다고 보기는 어렵습니다 또한 매 계절마다 나무와 꽃을 바꾸는데 보기에는 좋지만 다소 세금 낭비라고 생각됩니다 피아노를 설치해 둔 것은 좋은 아이디어라고 생각합니다,별표 3개,수정일: 6년 전
sun lee,예전 회현 고가도로를 개량하고 정비해서 만든 보행로인데 주변에 볼 거리가 많고 관리가 잘되어 있습니다,별표 5개,4년 전
hj Lee,평소 출퇴근시 공원변경으로 차선도 복잡해지고 길이 많이 막혀서 찾아볼 생각이 없었는데 최근 기회가 되어 저녁 7시경 산책해봤어요 곳곳에 볼거리와 다양한 식물들이 조성되어 있고 서울역의 풍경도 위에서 바라볼 수 있어 좋은것 같습니다 서울역위의 고가차도를 공원으로 변경한 곳이구요,별표 4개,5년 전
Do Hyun Kim,식당 상점 카페등 접근 통로 조성된것은 장점임 봄 가을 직장인들 점심먹고 한적하게 산책하기 좋은 정도 가끔 문화 전시나 작은 행사 등도 있어 볼거리 제공하기도 함,별표 3개,4년 전
SHIN PD 신피디 (신피디),차라리 공영 주차공간으로 활용하고 한켠에 잠시 쉬어가는 고가도카페를 공모해서 운영하는게 낫지 않았을까 싶다 하지만 그덕에 더 복잡해지고 꽉 막혀버린 교통체증에 대한 성과는 제로,별표 3개,6년 전
최유신,점심 먹구 걷기에 좋습니다,별표 4개,6년 전
김진수,"서울, 그 중에서도 중심지에 있는 도심의 높은 빌딩과 매우 많은 버스가 지나다니는 버스환승센터, 밤이 되면 빛나는 대우빌딩 등이 인상적입니다",별표 4개,2년 전
지혜의무길이되길,한적해서 다니며 구경하기 좋았음,별표 5개,4년 전
Dowon Yoon,야경도 예쁘고 롯데마트도 돌아오는길에 들르기 좋음 저녁 산책하기 좋은곳,별표 4개,2년 전
한석주,밤에 식사하고 가볍게 걷기 좋아요,별표 4개,6년 전
김영희,밤9시 쯤 갔는데 서울에 살면서도 이런 한갖지고 멋진 곳이 있다는 것이 정말 좋았고 옛 서울역 지붕을 내려다 보는것도 신기 합니다 큰 건물과연결되어 있어 외국에 온게 아닌가 싶어요잠시 시간내서 여유를 가져보실 강추합니다~,별표 5개,4년 전
양병남,"여름에는 나무와 꽃, 지금 겨울은 짚풀로 씌워논 커다란 화분도 좋은 볼거리입니다 서울역에서 남대문을 아무 방해없이 여유있게 걸을 수 있습니다",별표 5개,4년 전
HYUNYONG HWANG,접근성도 좋고~ 서울역에서 남대문시장쪽 갈때,별표 5개,수정일: 1년 전
김승기,남대문과 서울역 뒤편을 잇는 지름길이지만 여름에는 덥고 겨울에는 추움,별표 4개,2년 전
Byunggoo Jang,다리워에 공원을 만들었다는자체가 전망도 좋고 또한 식물도있고 또 시원한 족욕을할수있어 피로도 날려버릴수있고 사람들과 대화도 좋았던 좋은기억 좋은추억 만들려면 7017로 오시면 되요,별표 5개,6년 전
Chris Park,하지만 외부 인테리어만 보고 갔다간 맛없고 비싼 음식을 먹을수 있으니 조심 특히 옥상정원에서 보는 기차길과 시청 남대문 빌딩의 스카이라인은 백미다 서부역쪽 진입로 근처에는 힙한 식당들이 많이 있다,별표 5개,수정일: 4년 전
Eun Hye Baek,서울역에 자주가게되는데 서울로를 통해 남대문시장과 명동으로 가는 길목이 좋아져서 좋습니다 큰공원은 아니여도 도심속에 나무들도 있고 신책하는 기분을 느낄 수 있는 공간이예요,별표 4개,6년 전
이상곤,감탄할 시설이 있는데 좀더 볼거리가 많아졌으면 좋겠고 안전도가 좀 미흡합니다 난간이 유리라서 시설 점검도 필요합니다 그리고 비가올때 중간 에 피할수 있는 시설도 있어으면 합니다 또 바람 막는 시설도요 좀 많이 추울수도 있어요 더운 나라에서 오는 사람들도 그렇고 현지 사람들도 그렇습니다 보안도 필요 하구요,별표 5개,6년 전
Ong K,새벽에 출발하려면 저녁에 다 씻어야해서 아침에 씻는 분들은 불편함이 있을 수 있습니다,별표 4개,1년 전
jaeyoung Park,남대문에 핫한 산책로~^^,별표 5개,수정일: 7년 전
TL,서울역 고가도로를 철거하고 만든 도로위 공원입니다,별표 5개,2년 전
JoonHyeok Kim,"좋게 말하면 남대문, 서울역 사진찍기좋은 포토스팟 / 나쁘게 말하면 그냥 풀 좀 심어놓은 육교 뭔가 있는듯이 광고는 엄청 했지만, 딱히 대단한 관광거리가 있진 않다",별표 3개,4년 전
최영배,사람들이 많지않아 좋았습니다 그런데 미국 맨해탄 의 철길을 개조해서 만든 High line 을 보고 만들었다는데 정서적으로 많이 틀림 그곳에는 바닥이 나무로 되어있고 자연생 풀이 많이 있었음 우리도 유명한 작가들의 손을 빌려서 해야 좋은 작품이 나오는데 ᆢㅉ ㅉ,별표 3개,6년 전
이승철,"안내원과 경비원이 있어서,늦은 시간에도 안심하고 다닐수 있어요 고가공원 위에는 라이브카페도 있고,각종 희귀나무,인공연못등이 있고 30미터 아래 바닥이 훤히보이는 강화유리 바닥도 있어요 재작년 즈음에 서부역에서 서울역을 관통하여,남대문까지 이르는 고가 공원이 완성됐어요",별표 5개,7년 전
Inkeun Lee,"겨울에는 황량했지만 봄,가을의 날 좋은 밤은 좋을듯",별표 3개,6년 전
eunyoung Lee,걷기 좋은 계절의 날씨에 가서 괜찮았어요 피아노가 많이 있길래 뭐지,별표 3개,6년 전
Hyunmin Lee,천천히 둘러보며 즐기면서 걷기보다는 그저 통과하게 됩니다,별표 3개,5년 전
Alex Park,산책로 중간부분은 서울역과 철길을 촬영할 수 있는 포토스팟이 있습니다 서계동(청파동)에서 회현동을 잇는 산책로입니다,별표 5개,2년 전
이애라,직거래장터도좋았구요 남대문시장도 좋았어요 쇼핑 억수로 하고왔어요,별표 5개,수정일: 3년 전
이성기,1970년부터 2017년까지 있었던 서울역앞 고가 차도가 시민들의 휴식 공간으로 맹글었는데 아주 넓은 공원이라기 보다 조금만한 산책로라기 보다 그냥 잠시 쉬어가는 휴식공간으로 아쉬운 점이 있지만 가까이 있다면 가 볼만한 곳 정도,별표 5개,4년 전
김미경,도시의 다른 모습이 좋았어요,별표 5개,5년 전
박홍준,"도심속 고가 위에는 다양한 식물들과 분수대, 간단한 음료를 살 수 있는 작은 카페, 가끔 운이 좋으면 언더그라운드 뮤지션들의 라이브공연도 즐길 수 있습니다",별표 5개,5년 전
harry Kim (harry63),고가도로였던곳을 개방하여 산책로로 나무등 식물을 테마별로 거리를 조성하였으며 남대문에서 서울역까지 연결되어 있고 또한 지하철역등으로 연결되는 엘리베이터도 있어 편리하게 접근이 가능합니다 롯데마트를 비롯한 쇼핑과 식당가가 있고 서울역을 통해 각지방을 통하는 길목이라 교통,별표 5개,3년 전
Ildanach,공원+전망대 한번쯤은 올만한곳,별표 4개,6년 전
정데일리,걷기 좋은장소입니다 다양한 식물도 구경할수 있어좋습니다 전체 길이를 명동까지만이라도 연결하면 더욱좋을꺼 같습니다,별표 4개,5년 전
이채민,차가 다녔던 옛 고가다리를 나무들을 조성해 여유롭게 걸으며 지나다닐수 있다 한여름이었던 지금은 아직 나무들이 다 자라지 않아 마치 커다란 화분을 군데군데 놓여져 있는듯한 느낌이었지만 나무들이 크게 자라 숲을 형성해 준다면 한여름 뙤약볕은 피할수 있을듯해 걷기가 훨씬 좋을듯 하다,별표 3개,수정일: 5년 전
이상윤,뉴욕의 하이라인을 본따 만든 것 같은 서울로 7017 조금 부족한 감이 있지만 그래도 서울에 이런 산책로가 있는 것은 좋은 일인것 같다 나무마다 주인이 있는 경우가 있는게 그 의미가 매우 아름다웠다 천천히 둘러보면 40분정도는 구경했던 것 같다,별표 4개,6년 전
Gang Kim,식물들의 관리가 잘되어있네요 더운한여름밤이었지만 생각보다 한적하고 시원했어요 도심한가운데 하늘을가르는 정원 좋음^^,별표 5개,6년 전
Pine Fore,"서울역에서 시간 여유가 있으면 산책 삼아 둘러보면 좋은 곳~ 맑은 날이면 고가 위 가로정원에서 탁트인 시내 전망을 바라볼 수 있고, 잠시 머무르며 쉬어갈 수 있는 곳입니다",별표 4개,4년 전
윤옥련 (하얀나비),저녁 노을이 너무 아름답게 보여 기억에 오랫동안 남네요 예쁜 꽃이며 분위기있게 피아노두 곳곳에 비치되어 클래식한 분위기며 서울역을 배경하여 사진 찍어보니 새롭더군요 (구 )대우빌딩 역시 노을빛에 더욱 아름답게 보고왔습니다,별표 5개,6년 전
THeO Sohn,여름엔 너무 뜨겁고 세금으로 물뿌리고 양산나눠주고 화분관리하느니 철거해서 길이나 넓혀줬음 좋겠어요 그 아래 교통체증 너무 심해요 날씨 좋을때 산책 한번 갈만해요 야경이 좀 더 낫구요 그러나 굳이 찾아갈만한건 아닌듯,별표 3개,6년 전
청산고,마포를 잇는 차도 육교를 차없는 하늘정원으로 만들어 많은 사람들이 걸으며 이야기 꽃을 피울 수 있게 조성된 공원입니다 다음 사람을 위해 쓰고 반납하는 세련된 시민이 되시면 좋을 듯 박원시장님께서 만든 서울역차도공원,별표 5개,수정일: 3년 전
신성용,점심 후에 산책하기 좋은 곳으로 추천합니다,별표 4개,1년 전
김준희,남대문 시장 거리도 깨끗하고 외국인 길안내 도우미 분들도 친절하신거 같내요 그외는 대체로 좋았습니다,별표 5개,6년 전
멋진창창,다시 차도로 환원시켜 교통을 해소하는 도로의 기능으로 만들어야함,별표 5개,수정일: 1년 전
이종헌,서울역과 남대문 시장을 오가며 산책하고 볼것도 많음,별표 5개,5년 전
CHOI윤관,"미쿡 뉴욕을 가 본 집사람은 한국에도 이런 곳이 있냐며 여기가 미쿡 뉴욕의 그곳보다 더 깨끗하고 멋지다며 놀라던데 미쿡을 안 가 본 저는 별 감흥이 없네요 그래도 발 아래 분주히 오기는 자동차와 기차들, 머리 위로는 마천루들이 굽어 보는 곳에 이런 별천지 같은 곳이 있다니 멋지네요^^ 예전에 버스를 타고 명동엘 가던 고가도로였는데 직접 와서 보니 와~우",별표 4개,4년 전
이좋은날,서울한복판을 가로지르는 고가를 산책하며 갖가지 나무를 보는 재미도 좋고 잠시 앉아 쉬기도 좋다 남대문상인들이 길이 막힌다고 결사 반대했지만 지금은 서울로 2017로 인해 시장을 찾는 사람들이 더 많아졌다 아직은 나무가 덜자랐지만 울창해지면 해를 피할 수 있는 그늘이 만들어 지길 기대한다,별표 4개,7년 전
서민주,고가위라 매연을 직접 맡을 필요두 없고~ 남산공원까지도 갈수 있어 서울의 진가를 정말 제대로 알수 있게 해준다 다양한 식물들을 보며 서울 한복판을 걸을수 있다,별표 5개,4년 전
Minsuk Kim,전 개인적으로 이길을 참 좋아해요 시내에 잠시라도 걸으면서 생각에도 잠길수도 있고 잠시여유도 찾고 건강도 챙기고 한가지 요청사항이 있다면 잔잔한 클래식이나 듣기좋은 가요라도 틀어주시면 더 좋을듯 싶네요 개인적인 바램이지만 서울에 명소가 되길 바래요,별표 5개,수정일: 6년 전
김한경,"음식을 선택하기에도 편리하고 남대문시장, 남산공원 어디고 갈 수 있습니다",별표 5개,4년 전
윤도원,"산책하다가 롯데마트 가서 떨이 상품 주워오면 딱임 서울역 야경도 멋지고, 최근에는 도킹서울 전시도 생김",별표 4개,2년 전
JONGWON PARK,"도시 공원으로써의 역할을 훌륭히 해내진 못합니다 '아직'은요 콘크리트로만 조성돼 있는점이 도시와 어우러지지 못하는 가장 큰 요소라고 느꼈어요, 그래도 산책하기엔 좋습니다",별표 3개,6년 전
Youngmo Je,불편함을 내주고 얻은 뷰,별표 5개,6년 전
diana J,근데 바닥이며 플랜트 박스를 죄다 콘크리트 색으로 통일시켜놓음 그리고 플랜트 박스 배치도 별로임 길을 따라 움직인다는 느낌이 아니라 플랜트 박스를 피해다니는 느낌 그리고 프롬나드 플랑테랑 하이라인을 벤치마킹 했다는데 젤 중요한 녹지면적은 얘네들에 비해서 압도적으로 부족함,별표 2개,수정일: 7년 전
Sunny ins Kim,필요없다던가 오래되어 없애는 경우를 생각의 전환을 잘활용하여 시민의 안락한공간 도심과 자연의 조화가 잘 되어좋습니다 중간중간부분에 고온을 대비하여 수분분사시설을 갖추면 좋겠습니다 아리수도시설도요,별표 5개,6년 전
장재우,서울역과 서울역 버스 환승센터를 한눈에 내려다보는 경치가 아주 좋다 피아노도 3대나 있어서 좋은 것 같다 더울때는 분무기처럼 물이 나오는 곳도 있고 연못도 있다,별표 5개,7년 전
양정선,잘자라고 편안히 산책할수있는 공원으로 조성되었습니다 남대문로와 만리동을 잇는공원으로 2년이지난지금,별표 4개,6년 전
박기철,산책하기도 좋고 데이트 하기에도 아주 좋습니다 한겨울에는 연인끼리 밀착해서 한여름엔 친구끼리 멀찍이 ㅎㅎ 대로위를 관통하는 코스라서 아주 멋집니다 특히 서울역사를 내려다 보면서 사진은 필수 쌜카도 필수 인증샷도 필수 입니다,별표 5개,5년 전
SOMIN OH,공중산책로 색다른 경험 보행로가 좁아 불편,별표 4개,6년 전
신경아,서울중심에 고가로된 산책로가 있으니 좋네요 옛 추억을 떠올리기에도 좋구요,별표 4개,5년 전
김효진,서울역 도심에 산책길이 있어서 좋다 고가도로라 더운날엔 땡볕이 되는곳이라 살짝 별하나를 빼본다~ 요즘은 초록 우산을 대여해주는 서비스를 하는것같다 날씨가 더운날엔 썬크림을바르고 모자랑 양산을 준비해가면 좋을것같다 ^^ 아이가 있다면 중간에 아이들 트렘플린이 2개있는데 키140센티이상이면 못탄다고한다 키가 더 크기전에 점프하며 서울로를 보는 추억하나를 아이에게 선물해보는건 어떨까,별표 4개,6년 전
복숭아토끼,주말에 가니 공연도하고 생각보다 괜찮았음,별표 4개,6년 전
luth an (LUTH),꾸준히 관리도 잘 되고 있고 복잡한 서울역 앞 도로를 지나기에 서울로가 더 좋은거 같아요~ 길만 잘 찾아 간다면 신호를 기다릴 필요 없이 주변 구경도 하면서 이동할 수 있으니까요,별표 4개,4년 전
포리포리,어린아이들과 걷긴 좀 힘든데 혼자나 연인끼리 걷긴 좋은듯 해요 가는 길목마다 피아노가 있어 누구나 칠수있게끔 되어있고 가는 길목마다 나무이름과 풀이름이 쓰여있어서 보는 재미도 있엇음,별표 4개,6년 전
Jung Eric,저녜마다 운동 및 산책 삼아 가는곳으로 전경이 아름답고 매우 안전한 곳이다 힘들거나 지칠때 잠시 쉴수 있는 공간 벤치가 있어 좋다,별표 5개,4년 전
T Park,그 좋은 자리에 마트와 아울렛이라니 다리를 올라갔을때와 내려왔을때 풍경과 감정이 연결되지 않는다,별표 2개,7년 전
Chanju Kim,날씨 좋은 날 저녁 무렵에 산책하기 좋습니다,별표 5개,수정일: 6년 전
Kyungsook Lee,높은 위치에서 옛 서울역을 내려다보는건 색다른 경험입니다,별표 4개,3년 전
최환석 (Stanley),서울역까지 걸을 수 있어서 좋아요,별표 5개,6년 전
이상규,지인들의 혹평과 달리 조용히 걷고 운좋으면 버스킹도 만날 수 있는 산책에 좋은곳,별표 4개,6년 전
김태완 (wani),다만 나무 서식환경에는 좋지 못한지 나무건강상태는 좋지 못한것 같습니다,별표 3개,5년 전
jai joon Yoo,노을도 멋있고 깔끔한 길위도 아름답다,별표 5개,6년 전
sang-Mok Lee,서울역 고가공원 밤에도 더 좋다 항상 낮시간 이용하다 밤 시간에 다가서니 첫 만남이 설레는 조명으로 야경명소로 등록 하고 싶네요,별표 4개,수정일: 6년 전
김보경,"아이디어 자체는 나쁘지 않았는데, 좀 더 정성을 들였다면",별표 3개,3년 전
여윤호,"봄,가을에 걷기 좋을듯 해요 여름에 걷기엔 그늘이 없어서 불편해요",별표 3개,2년 전
kidjeong (벼리봄),역광장에서 하는 행사들을 볼 수도 있고 꽃나무들을 잘 관리해 쉬어가기 좋은 공원입니다 서울역이 바로 내려다보이고 남대문 쪽으로 펼쳐진 길을 볼 수 있는 곳입니다,별표 4개,6년 전
하나의한국 (하나의한국),뉴욕의 하늘공원 (High Line Park) 처럼 조경도 잘 되어 있는 곳 요즘은 날씨가 좋아 야경모습이 더 좋으니 해질녘에 산책 강,별표 4개,수정일: 6년 전
천&김커플일기,전체적으로 ~ 공원으로 바뀐후에 청결해진거 같아요 스타벅스만 이용해도 주차2시간 무료에요 서울로테라스 (대우재단빌딩) 에 주차를 한답니다,별표 4개,6년 전
신해철,듬성듬성한 식물 딱딱한 바닥 하지만 서울에 산책로가 생겨 걸으며 이야기할 공간이 있음에 좋음,별표 2개,5년 전
노정산,차한잔들고 돌아보면좋겠지만 얼마되지않아 여름엔 너무 뜨거울듯요,별표 3개,7년 전
Sunny Jo,가을 날씨도 좋고 서울야경도 멋있고 걷기에 너무 좋았습니다 저녁에 갔더니 더 아름답네요,별표 5개,5년 전
박주연,서울역에서 회현역까지 걸어갈 수 있게 되어있고 무엇보다 식물들이 좌우로 있어 산책하기 좋은 곳 같아요~^^ ⛰,별표 5개,5년 전
정종근,추억을 더듬으면서 산책하기 좋은 곳이었다,별표 5개,5년 전
