작성자,내용,별점,작성일
박현진 (Hyunjin Park),편의시설두 잘 돼잇구 데이트하기 좋아요,별표 4개,5년 전
JINA KIM,신랑과 야라 즐기고 라면 때렸어요~ 운동하는사람 많고 시원하고 야경도 예뻐서 힐링하고 갑니다❤️,별표 5개,2년 전
crebtive,자전거 타고 자주 들리는데 강도 보면서 휴식하기 너무 좋습니다,별표 5개,1년 전
박도,가족 끼리 와서 놀기에 참 좋은 곳입니다 ^^ 바로 앞에 먹을거 파는 편의점과 카페도 있어서 참 좋아요,별표 5개,5년 전
Peter,"1주차장 주변은 돗자리 펼곳이 없도 2,3주차장으로 오면 근처에 많이 있다",별표 4개,3년 전
JS JUNG,한강자도 옆에 위치하여 일몰뷰는 장관입니다,별표 5개,1년 전
cache,자전거 타기 좋고 해질때 가면 사진찍기 좋음,별표 5개,11달 전
Livy K,"주말 사람많음, 주차 거의 어려움",별표 3개,10달 전
정정종혁,지금 이시간 벚꽃이 만개 운동 코스로는 최상 인듯 합니다,별표 5개,수정일: 4년 전
WAN BA,"근처 망원시장 맛집에서 식사후에 한강공원 산책하세요~너무 좋아요 자전거(따릉이)대여소도 근처에 많이 있어서 라이딩 즐기기에도 좋고, 반려견들도 주인이랑 많이 보입니다 미세먼지 없는 좋은날에는 망원한강공원을 추천합니다",별표 5개,6년 전
Minnng Ming,심하지않을때 잠깐 갔엇는데 너무 좋았음 석양도 그렇고 물흘러가는 소리도 그렇고 언젠가 좋아지면 다시또 갈것,별표 5개,4년 전
happyon,오전 일찍 걷기 시작하여 망원한강공원에서 한강 쳐다보며 바람 맞으며 먹는 라면 한번쯤 느껴보세요,별표 5개,수정일: 11달 전
송송이,경치도 좋고 산보하기 좋으나 자전거길 때문에 산보길이 좁아서 위험할때도 있어요,별표 3개,수정일: 3년 전
송영태,시원한 바람^ 억새의 흔들림~ 걷기에 단연 최고 입니다,별표 5개,5년 전
KOO K,행주대교쪽에서 성산대교방향으로 한강북단 자전거길 편의점 두곳은 문을 닫아서 성산대교북단에 편의점을 이용하러 갔네요,별표 5개,3년 전
김경실,가족나들이 여인과 데이트 라이딩 산책 다좋아요 분수광장 예뻐요,별표 5개,수정일: 3년 전
난나야나,스타벅스 한강공원망원점 갔었는데 음청좋았음 좋은사람들과함께라서,별표 5개,1년 전
Sehyeon Lyu,"한강쪽으로 들어가기 전 주변 근처에는 치킨집이 많았고, 강 주변으로는 편의점 하나가 있었습니다 간단히 맥주 한잔 하기에 좋은곳",별표 5개,5년 전
진한규,"편의점과 화장실이 인근에 위치해 편리하기는 하나,많은 사람들이 이용하다보니 화장실 위생상태는 불량임",별표 3개,4년 전
Haekyoung Seo,자전거도로는 괜찮았는데 한강변에 앉을데도 없고 사람은 많고 물에서 비릿한 냄새도 남,별표 3개,3년 전
류하미,강변에 새로운 마포인트라는 유리빌딩이 새워져서 멋지고 그안에 스타벅스와 이마트가 있어서 강변을 보면서 담소도 나누기 좋다,별표 5개,수정일: 3년 전
김미선,한강이 정말 좋다 야경이며 시설이며 놀공간으로도 만족 다만 보행자인도가 좁다,별표 5개,5년 전
Jedd Lee,"참 좋음 공중화장실, 놀이터, 편의점 근처에 있어서 크게 불편한거 없음 가족끼리 텐트 치고 한강바람 맞기",별표 5개,6년 전
Osung Kwon,고즈넉한 한강을 바라보면서 연인이던 친구들간이던 이야기하기에 너무 좋은 이 곳,별표 5개,4년 전
이회장님,참좋습니다 운동기구까지 잇서서 개가많고 개똥이 가끔잇서 싫습니다 개출입금지가 안될까요,별표 5개,7년 전
이유미,아이들이 즐길수있는 놀이공간이랑 있어서 좋아요,별표 4개,4년 전
Sam Nam,썬셋과 야경이 멋진 낭만있는 한강공원,별표 5개,수정일: 1년 전
유재빈,한강뷰 야경이 아주 멋진 곳이 있다 성산대교 조명이 너무 예쁘죠,별표 5개,2년 전
Kid Cozyboy,강을 바라보고 랜드마크인 서울함좌측으로 양화대교 우측은 성산대교인데 성산대교의 야경은 황홀하고 좋은사람과 맥주를 곁들인다면 금상첨화,별표 5개,6년 전
eaeyu,산책하기 좋고 다리에 불들어오면 분위기도 좋음,별표 5개,3년 전
Min-ho Sung (코브라이언),망원한강공원 스타벅스에서 바라보는 한강 뷰가 좋음 햇살이 강물에 비치는 모습이 멋있음,별표 5개,1년 전
Motungyi,망원지구에 큰금계국 군이 조성되어 있네요,별표 4개,5년 전
최성치,공기도 좋고 산책하기 종은곳임니다,별표 5개,4년 전
rg,요즘 같이 집콕 중이다가 야경 보고 오기 좋은 곳입니다:-) 날씨도 너무좋아요~ 선선한 가을 날씨♡,별표 5개,4년 전
bjay moon,날씨가 더워 지는데 그늘이 부족해서 조금 아쉬우나 해가지는 시간대의 야외활동 장소로는 으뜸,별표 4개,5년 전
Kong Kwak,시원한 바람 맞으며 라면 먹기 좋아요,별표 5개,2년 전
이해광,접근성 주차공간이 좋다,별표 4개,2년 전
권봉현,한강 강바랑 여유와 레져를 다 느낄 수 있는 망원한강 공원입니다,별표 4개,4년 전
Sancho Morgan,"기족단위 접근성이 좋고 가벼운 산책과 운둥,데이트하기 좋음",별표 3개,5년 전
김은희,작년에 리모델링하고 깨끗해서 너무 좋아요,별표 5개,3년 전
kc k,접근성도 좋고 다른 한강공원에 비해 비교적 한가한 내 최애 장소,별표 5개,1년 전
차니웃는거에기절,"쉴수있는 공간이 많아서 좋고, 성산대교 노을 좋아요",별표 5개,6년 전
한창희,많은 사람들이 즐기고 해너무이와 노을이 예쁘네요,별표 4개,3년 전
서정일,망원시장에서 먹거리 사서 들고가도되고 편의점도 골고루 팔고 테이블 벤치 와 화장실도 시설은 잘 구축되어있음 좋은 자리는 오전부터 빠르게 가서 섭렴해야 함 평일 오전부터 각종 텐트 및 캠핑용품 설치해서 즐기는 사람들이 많음 여유로워서 좋고 5월 지금 낮잠자기도 좋음,별표 5개,1년 전
피쉬보이,접근선좋고 주차근교에 편의점 두군데와 써브웨이도 있어 좋았습니다 화장실 생각보다 잘 관리되고 있습니다 반려견 동반 환경 주변에 나무와 식물도 많고 그늘도 있어 좋았습니다 피크닉 구역 산책 코스도 다양하고 벤치도 있고 주변 편의점과 써브웨이도 있습니다,별표 3개,2년 전
heem,화장실도 깨끗하고 쾌적합니당 그늘도 적당히있고 텐트는 저녁7시까지 이용가능해요,별표 3개,6년 전
백동호,야간에 너무쉬원하고 좋은공원입니다,별표 5개,5년 전
Matthew Hwang,한강공용주차장 바로 앞에 위치해있어 주차 편하고 뷰도 좋네요~,별표 5개,1년 전
엄석대18학번,성산대교뷰 야경 맛집 사람은 꽤 많아요 근처에 스벅과 음식점들 좀 있어요,별표 4개,2년 전
sarang yoon,"예전의 한강보다 훨씬 활동적이고 살아있는 느낌을 주는 망원 한강공원이다 놀이터 놀이터 되게 신기한거 많다 앞에 망원지구에서 유입되는 젊은친구들이 한강을 즐기는 모습, 그리고 주민들이 열심히 운동을 하는 모습 특히 요새 런닝을 즐기는 모습이 인상적이다",별표 5개,11달 전
s moon,지금 당장 가세요 바람좋고 날씨좋을때,별표 5개,6년 전
godsyj J,"산책을 할 수 있고, 자전거를 타고 한강을 볼 수 있어요",별표 5개,5년 전
조형기,노을이 끝내주는 망원지구한강공원,별표 5개,11달 전
최철호,하루 차안과 돗자리 깔고 피자 시켜먹고 휴식시간 가져보는것도 주차요금 그다지 비싸지 않아요,별표 4개,4년 전
레드,날씨 좋은날응 좋네요,별표 4개,4년 전
정지훈,날씨가 깨끗한 날에 와서 좋아요 ㅎㅎ 미세먼지 때문에 여기에 오는 것도 제약이 있네요 ㅜ,별표 5개,6년 전
팡팡,편의점에서 먹을거 사서 앉아쉬기 좋은곳 11시 좀 너무으니 다리 조명이 꺼져서 아쉬웠다,별표 5개,2년 전
Sungsoo Kim,늘 즐거운곳 놀이터가 좋아요~,별표 5개,6년 전
Happyfilm,오후 늦게 돗자리 챙겨가서 치맥했는데 너무 좋았어요,별표 5개,3년 전
Grace Choi,한강 보며 라면먹고 쉬기 좋음 시원함,별표 4개,1년 전
강예빈,여의도 한강공원보다 덜 붐비고 색다른 분위기,별표 5개,2년 전
Hh Cho,11시쯤 도착했는데 사람이별로 없었으나 2시되니 바글바글 아이와 놀기좋아요 근데 비둘기가 좀 날라다님,별표 5개,4년 전
전지혜,근처 망원시장에서 맛있는 음식들 포장해 와서 시간 보내면 너무좋아요 주변에 예쁜 음식점들도 정말많고 낭만적인곳임♡,별표 5개,6년 전
pill red,장점: 한강은 서울의 좋은 관광 자원이에요 단점: 디자인 서울 정책이 좋았어요,별표 5개,수정일: 5년 전
최은정,낮에 가본 한강 스벅도 좋았어요,별표 4개,1년 전
DongWook Ahn,넓은 잔디밭에 돗자리 깔고 놀기 좋아요,별표 5개,수정일: 6년 전
DAHUN YANG,"가벼운 피크닉, 자전거타기, 조깅, 걷기 등 한강을 바라보며 즐길수있는곳입니다",별표 5개,1년 전
군만두,자전거 타기도 좋고 한강 바람 쏘이기도 좋은 곳,별표 4개,4년 전
명주,가족끼리 산책하고 간식 먹기 좋아요~,별표 4개,2년 전
eunju shin,조명켜지면 다리가 예뻐요 사람이 많아 북적대지만 편의점도 잇고 좋아요,별표 5개,4년 전
올리브마크라메,가까이서 한강의 강물을 바라볼 수 있다는게 정말 큰 장점이죠,별표 5개,3년 전
Jenis jenisjeong@naver.com,스타벅스방문했어요 9:10분 오픈후 십분지났어도 사람이 어마어마 기본음료인 아이스 라떼는 불호예요 커피가 지나간 물섞은 우유맛,별표 5개,1년 전
Ju-Yong Choi,참 걷기 좋아요 다만 길이 좀 좁아서 아쉬운 부분이 있습니다,별표 4개,3년 전
마을이장,4월초라서 날씨가 좋와 야간에도 사람이 많아요 편의점이 근처에 있어서 바람쐬기 너무 좋아요 돗자리는 입구에 대여하는곳이 있어 편해요,별표 4개,1년 전
Sam,그러나 옛날 감성이 더 좋았음,별표 4개,4년 전
kiho jin,자전거타고 편하게 가서 한강보고 야경 보기에 좋아요,별표 5개,4년 전
정부자,좋은공뭔입니다 아이들과함께 하면 조을거갇씁니다,별표 4개,수정일: 6년 전
엽기토끼,가을엔 억새가 더불어 일몰이 아름다운곳이죠,별표 3개,6년 전
myungkun kim,군함도 구경할수있는 한강망원공원 가족놀이 환경도 좋은곳 야경이 멋집니다,별표 5개,3년 전
SangMin Kim,도심 속 한강 공원 여름철 돗자리 깔고 치맥 먹기 좋은 날씨지만 사람이 좀 붐빔,별표 4개,7년 전
조규용,성산대교 공사도 끝나고 깨끗해요 그리고 스벅이 대교아래옆에 생김,별표 5개,3년 전
Ryun Paul Suh,망원동이라 이어지고 잔디밭이 넓어 자주가게되는,별표 5개,5년 전
minyoung kim,자전거타거나 돗자리가지고 소풍가기 좋음,별표 4개,5년 전
김지성,"다만 다른 지구보다 뷰가 엄청 예쁘진 않고, 주차가 너무 어려움 나름대로 그늘이 있고, 쓰레기 분리 수거도 편하게 되어 있음",별표 4개,1년 전
Hyuna Lim,화장실도 깨끗하도 관리가 잘 되어있어요 한강공원 순찰하시는 어르신들이 원터치 텐트도 접어주시고 친절합니다,별표 5개,1년 전
아이스골드,"다양한 견종들로 눈호강 공원가기전 입구에서 커피테이크아웃하는게 좋음 9번버스타면 망원시장,홍대,신촌 한바퀴코스 운동,휴식,데이트등등 새벽에 와도,밤에 와도 나름의 분위기가 다 다름",별표 5개,1년 전
김학진,15년전부터 오던곳인데 조금씩 더 개선되고 있다 오랜만에 오니 스벅 서브웨이가 있다,별표 5개,2년 전
신선옥,"깔끔하고 좋아묘 스벅,서브웨이,편의점 있어요",별표 5개,2년 전
Sophie Park,피크닉 즐기기 좋은곳 날씨가 좋아 사람이 많아서 주차하기 힘들었지만 소박한 피크닉 즐기기 좋았음,별표 4개,4년 전
완사마 어드벤쳐,"플로팅 데크에서 음식도 먹을 수 있고, 심심하면 정박되어 있는 서울함 구경 슥 해봐도 좋고",별표 4개,8달 전
나진수,저녁에 가족 혹은 지인들과 잠시다녀오기 좋은곳 ^^,별표 5개,2년 전
문건희,평일 오후 완벽한힐링 저녁은아직좀춥네요,별표 5개,4년 전
금싸대기,중간중간 쉴 공간도 많음 반려견 동반 환경 자전거 반댓길로 가면 안전하고 흙길걸을수 있음,별표 5개,2년 전
LaraJean PARK,요즘 날씨는 그렇게 춥지않아서 더 좋은듯,별표 5개,3년 전
따끄니,성산대교와 여의도 야경을 감상하기에 좋습니다,별표 5개,5년 전
조환희,뷰가 좋고 편의점 카페 다 있음 충분히 넓직하게 앉아서 감상가능,별표 5개,4년 전
유유,오랫만에 왔더니 구경거리가 생겼다 어른3천원 중고생2천원 이하 천원 유치원까지 무료,별표 5개,6년 전
이당선,날이 더워서 그런지 사람들이 많이 나왔네요,별표 4개,1년 전
Taigun Eom,조금 차소리로 시끄럽지만 피크닉으로는 최고,별표 4개,4년 전
권수연,한강공원은 운동으로 종종 가기도 하고 한강 안에서 먹는 라면이 너무맛있어요 스타벅스 커피집도 있어서 너무좋아요,별표 5개,1년 전
추호진,이곳도 가성비 있는 야외 한강에서 쉴만한 공간입니다,별표 4개,1년 전
EunSun Choe,"늦은밤 가볍게 바람쐬고 야식도 먹고, 물멍 하기좋은👍",별표 5개,3년 전
오상준,날씨는 흐릿 했지만 좋았어요,별표 5개,3년 전
Misong Sung (치코),코로나인데도 사람들 바글바글 ㅠㅠ 야경은 언제나 예쁘지만,별표 5개,4년 전
K EN,단점은 성산대교쪽이 아직도 공사중이라 주차장이 협소 합니다 스타벅스에서 보는 한강뷰도 멋지고요,별표 5개,수정일: 1년 전
허재환,"한강을 바로 옆에 두고 커피를 마신다는건 동네에서 마시는 것과는 분명한 차이가 있는듯~ 거기에 조금 더 다양한 빵이 있다는 것이 매우 좋고, 더불어 분위기 역시 구~웃^^",별표 5개,1년 전
ssin Kim,더운 저녁에 산책하기 너무 좋은 곳입니다,별표 4개,2년 전
Kwang Su Lee,"연인과 함께오거나 취미생활(낚시, 사이클 등) 하러 오기 참 좋아요",별표 4개,5년 전
박종인소장의소마tv,쉼과 여유가 있는 곳 시민들을 위해 이러한 공간들이 있다는 것도 큰 축복이 아닌가 싶다,별표 5개,5년 전
박선희,아이들 데리고 바람쐬러 다녀왔네요~ 좋았어요,별표 5개,2년 전
Casper,시시각각 변하는 얼굴을 가진 한강공원,별표 4개,1년 전
woori ko,따릉이를 이용해 한강변을 구경하던중 접근성이 좋은곳이라 여겨져 미니캠핑을 즐겼습니다 한가로이 즐기기 좋습니다,별표 4개,1년 전
상암동김새로이,자주 볼수없는 해군함을 볼수있어서 가족끼리 오기 좋은곳임,별표 4개,5년 전
렬토끼,"개천길을 따라 자전거 타고 방문하기 좋은 곳입니다 빨리 인근 공사들이 마무리 되어서, 예전처럼 쾌적한 환경으로 빨리 되돌아오길 바랍니다",별표 5개,2년 전
전남GO,야경도 예쁘고 데이트하기 좋아요,별표 5개,4년 전
DH lee,다른 한강공원에 비해 녹지가 약간 부족한거 같긴 하지만 그래도 한강공원이라 좋다,별표 4개,수정일: 5년 전
BYUNG HO KIM (기술정보공유),아이와 애기엄마가 가자구해서 망원동 갔다 한강공원과 망원사장 다녀왔습니다,별표 5개,3년 전
Daewon Kim,석식 후 산책 코스로 망원시장 연결 추천 준비한 음식 없어도 근처 편의점 메뉴 구입가능(좀비싸다) 가족 연인 단위 방문객 다수,별표 4개,1년 전
Hye Ryun Ryu,아이들과 물고기와 새들도 보고 운동도 하고 이쁜 꽃들은 덤이고,별표 4개,6년 전
theslavetothememories,5월부터 10월까지 그늘막텐트 가능 좋네요,별표 5개,4년 전
미아,봄날씨 같았던 날 ♡ 한강공원 산책했어요 멋진 야경바라보며 한강라면에 맥주한캔 소소한 일상의 즐거움을 느끼고왔답니다,별표 5개,1년 전
Mai Trinh,저녁뷰가 앞에 오리타기 다 가려서 잘 보이지 못하는 점 아쉽네요,별표 3개,수정일: 1년 전
야채호빵,근처에 시장도 있고 공원도 있어서 피크닉 하기에 정말 좋읍니다,별표 4개,1년 전
Jung Seo Park,외길에서 추월은 기본이고 합류 지점에서도 속도 안 줄인다 경치좋고 운동도 되지만 일부 자라니 놈들이 문제다,별표 4개,2년 전
서미란,해질녘에 가면 너무예쁘요,별표 5개,3년 전
최은주,이곳에서 식사도 돈독히 하시기를 권합니당~ ~ 여자분들은 애교가 절로 나와용~ ~ 아름다운 이곳 오늘 저는 저의 교회분들과 아주 특별하게 더욱이 분위기 있게 행복했답니당~ ~ 그리고 이곳에서 소원 비세요 아름다운 나무와 그에 따른 자연의 세심함이 엳보이는 장대한 그 많은 그늘들 ~ 사람을 힘들지 않게 해주는 예쁘고 시원한 강이다,별표 5개,3년 전
장근동,뷰도 좋고 오가는 자전거 동호인 그리고 삼삼오오 연인들의 데이트장소로도 손색이 없을듯 하네요,별표 5개,2년 전
호떡냠,항상 좋아여 여의도와는 다른 느낌,별표 5개,5년 전
jiung chang,흡연구역 방향 표지판이라도 좀 세워주면 좋겠다 가기전엔 갈생각 없는곳인데 가서는 계속 기억이 좋다,별표 5개,2년 전
한해피,좋아요 항상 갈때마다~ 텐트가 2면이상 개방이고 정해진곳에서만 또 저녁7시되면 걷어야되고 안지키면 과태료부과한다고 여러번 방송함~ 사실 그전에 조금 눈살찌푸릴일도 있긴했는데 많이 분위기가 바낀듯해요~ 서로서로 배려하는마음으로 즐건 가족과 친구와 연인과의 시간을보냈음하는 마음이었어요,별표 5개,6년 전
건니콘,따스한 어느겨울 그녀와 함께 다녀온 곳 뭘해도 예쁘보인다,별표 5개,4년 전
태구,근처에 있는 편의점 사장님이 정말 친절하세요 덕분에 기분좋은 추억 안고 갑니다 공용화장실에도 화장지가 다 비치되어 있었어요,별표 5개,2년 전
즌이jeuni,비싸지만 너무 좋아요❤ 좋은뷰 맛있는 음식ㅎㅎ 사랑하는사람 라면에 맥주❣🙆‍♀️🙆‍♀️,별표 5개,6년 전
김현아,"친정이 망원지구에 위치해서 종종 꼬맹이 데리고 한강나들이 하는데 서울함공원도 좋고, 한강 시절 정비 후 더 좋아졌네요^^ 놀이터도 전보다 훨씬 넓어졌고 놀이시설도 늘고 일단 모래놀이터로 바뀌었는데 참 반가웠어요~요즘 모래놀이터는 많이 없어서^^; 어린 꼬맹이부터 초등학생들까지 모래로 열심히 자기만의 작품도 만들고, 모여서 모래놀이도하고, 옷 더러워지는거 상관 안하고 뛰고 들어눕고 하더라구요ㅋㅋ 물론 시국이 이래서 마스크들 착용하고 놀지만 익숙한듯 잘 하고있고 놀이터에서 신나게 노는 아이들 답답한 시국 근처로 바람쏘이러 나온 가족,연인들 모두 참 좋아보였어요 거리두기 안내 방송도 수시로 나와서 안심되고 좋았구요",별표 5개,4년 전
G_won Play,망원1한강매점이 있어 한강라면 맛집이라는 놀이터 깔끔하고 잘되있음 화장실 깨끗하고 넓고 좋아요 피크닉 구역 넓직한 평탄화되어있어 좋아요,별표 5개,1년 전
ssoo bong,사람이 굉장히 많음 난지가 사람이 훨씬 적음 주차하기도 빡쎔,별표 4개,5년 전
ks shin,한강 걷기중 잠시 쉬어갑니다,별표 5개,2년 전
쫑텐더 :술과음식,"산책, 운동, 치맥, 다양한 문화를 경험해보세요",별표 4개,5년 전
박댕댕,자전거타고 와서 잠시 앉아서 멍때리다가 가기 매우 좋음,별표 5개,수정일: 1년 전
불꽃의초롱이,"접근성이 좋은 망원한강공원입니다 지하철 망원역에서는 거리가 좀 있습니다 도보보다는 버스를 이용해서 방문하면 좋습니다 휴일, 주말에는 외지에서 방문하는 사람들로 항상 북적입니다 망원한강공원 근처에 텐트, 캠핑의자, 돗자리, 테이블 등을 대여하는 곳이 많아서 빈 손으로 와도 제대로된 한강 피크닉을 즐길수 있습니다 배달음식도 배달이 되어서 편리합니다 한강 주변 편의점에는 라면기계가 있어서 일반 라면을 보다 맛있게 즐길수 있습니다 한강 라면을 먹으면서 한강을 즐기는 것도 추천드립니다 특히 해가 질때 바라보는 한강이 멋집니다 해가 밝을 때도 매력이 있지만 보다 분위기 있는 한강을 즐기고 싶은 분들은 일몰시간을 고려해서 방문하면 더 좋습니다 여러명이서 피크닉 올때는 망원시장을 들려서 먹거리를 구입하면 좋습니다 망원역에…",별표 5개,3년 전
Jaeyong Shin,아이들과 놀기좋은 서울함,별표 5개,4달 전
로로,화장실 화장실은 무료이고 깨끗합니다 피크닉 구역 잔디밭처럼 있는데 여러사람이 돗자리(편의점에서 대여가능)를 펴고 피크닉을 합니다 정비도 잘 되어있어 피크닉하기에도 좋고 여름에는 열대야를 이기러 오기에도 좋은 곳입니다,별표 5개,2년 전
조지임 (조지),"해질녘에 가면 더 좋고, 글램핑도 좋고, 걸어다녀도 좋음",별표 5개,4년 전
박영민,한쪽은 자전거 한쪽은 산책,별표 4개,4년 전
이준엽,좋아요 스타벅스도 생기고~ 날씨 좋네요,별표 5개,3년 전
진교성 (Ashburn),자동차로 집에 가던 중 소변이 급하여 공중화장실을 이용하려고 공원주차장에 차 대고 일 보고 나오니 100원 결제해야했음 밤 10시 가까이 됐길래 무료일줄 알았음,별표 5개,2년 전
김일중,아주좋아요 말이필여없고 자전거는 필여해요 ㅎㅎ,별표 5개,6년 전
윰윤율 (Rachel),놀이터가 있어서 아이들이 놀기 편하고 야경이 좋다,별표 5개,5년 전
Rosa Woo,화장실도 자주 보이고 주차장도 좋다 자전거길이 있으며 구간별 공원테마도 조금씩 틀리다 한강변의 산책로가 잘 되어있다,별표 5개,3년 전
정혁준,"물위에 떠있는 스타벅스와 편의점 즉석라면, 태양전기 오리배까지 즐길거리가 많아졌습니다 봄부터 가을까지 망원주민의 저녁시간을 책임지는 한강공원",별표 5개,2년 전
윤세언,"가족단위로 친구들과도 여유롭게 잔디밭에 앉아 소풍즐기기 좋은장소👍 한강바람이 시원하고 주변 편의점도 2군데있고 간이카페도 있고 함상공원도 있어 아이들 데리고 오기 좋은편 공중화장실도 잘되있고 무엇보다 저녁 낙조는 정말 아름다움😁😁 마포인트 해상건물이 생겼는데 그곳에 스타벅스와 24이마트편의점 그리고 피자,치킨바베큐집이 입점 또하나의 명소👍👍",별표 4개,수정일: 3년 전
Chae Young Lim,요즘 꽃구경 가기 좋은 근교,별표 5개,4년 전
전현필,배율 좋은 망원렌즈가 있다면 더 좋다,별표 5개,5년 전
Hyun Brian,"산책하기 너무 좋다, 데이트코스로 안성맞춤 하지만 집에서 도어투도어로 시간이 생각보다 오래걸려서 놀랐던 곳 교통편이 좀더 편리했다면 어땠을까 생각이 든다",별표 5개,2년 전
정윤호,시원한 강바람에 편의점 라면~최고예요~,별표 4개,6년 전
이승복,"접근성이 좋고 갖가지 볼거리, 즐길거리, 맛볼거리 등 여가활동과 운동하기 좋은환경이라 매우 굳",별표 4개,1년 전
Yoon Hee Cho,그래도 애들이 집에만 있는건 답답하다고 아우성처서 미디어시티역에서 망원한강공원까지 걸어봤어요 저하고 아이들이 간만에 원없이 걸어서,별표 5개,4년 전
Ill Song (Happy SONG),산책로 싸이클링 가족동반 좋아요,별표 4개,6년 전
Watercolour,뭐 여기 편의점도 여타 한강 편의점과 마찬가지로 비싸고 불친절은 덤입니다,별표 5개,4년 전
임정국,선산하니 바람 쐬기 좋네요 다만 사람 무지 많습니다,별표 3개,3년 전
김보연,망원한강공원 산책하기 좋아요ㅎㅎ 피크닉 하기도 좋고 운동하기도 좋아요,별표 5개,2년 전
Kenneth Kim,자전거 타고 돌아다니기 좋은 곳이에요~,별표 4개,5년 전
소민수,오전에 조금 이르게 움직이면 좋은 그늘 자리에서 여유로운 시간 보낼 수 있습니다,별표 5개,5년 전
