작성자,내용,별점,작성일
seongman kim,산책하기 좋은 장소로 오전 중 아내와 함께 산책하였습니다,별표 5개,4년 전
엄정원,한강매점 인기많아요 2가 더 한가해요 화장실 깨끗하고좋아요,별표 5개,2년 전
Victor Nam,"서울함과 잠수함도 볼 수 있고, 전망 좋고 시원하고 주변 맛집 많음",별표 5개,6년 전
강태용,한강을 끼고있어서 봄 여름 가을 겨을 언제나 아름다운 서울이명소,별표 3개,3년 전
한창범,선착장처럼 내리막길이 운치 있네요 가기전 편의점에서 박스주워가세요 ㅋ,별표 5개,6년 전
이현희,망원시장에서 저녁을 먹고 망원한강공원에서 돗자리 깔고 시원하게 맥주한잔,별표 5개,5년 전
Mancheol Kim,서울에 있는 동안 산책을 즐긴 곳 강바람이 선선하고 좋다~^^,별표 4개,4년 전
Jon Jen,오리배도 있고 망원시장 가깝고 좋음,별표 5개,2년 전
류지니,보기만해도 있기만해도 힐링,별표 5개,3년 전
김동희,여긴 공사중 아우 공사 왜하는거야 수영장도 뿌시고 제발 멀정한거 뿌시지말고 세금 낭비하지 마라,별표 1개,4년 전
최에스더,교통이 편리해 접근성이좋은 야외수영장과 넓은주차장,별표 5개,8년 전
할로우,한강 야경보면서 맥주한잔하기 딱 좋은곳,별표 5개,2년 전
Steve Kim,우울한 도시에 그래도 맘 편하게 바람쐬며 힐링할 수 있는 몇 개 안되는 힙 플레이스 잊니가,별표 4개,수정일: 3년 전
최상유,"봄부터 가을까지 휴식,운동공간으로 좋아요",별표 4개,6년 전
하성지,한강이 조음 카페 앉아 강을 볼수 잇는게 조음요^,별표 1개,1년 전
이슬기,"산책하기도 좋고, 라이딩하기도 좋고, 돗자리깔고 치맥먹기도 좋습니다:)",별표 5개,6년 전
Jukyung Yoo,무난합니다 ㅎ 딱히 어메이징한 건 없어요 ㅎ 망원동 먹방하고 산책했어요 ㅎ,별표 3개,3년 전
신광수,흐르는 강을 보고 있으면 잡념이 생겨 일에 집중하게 된다,별표 5개,5년 전
ᄋᄋ,성산대교 공사중이라 주변이 시끄럽고 편의점도 영업하지않아 별로 좋지않았어요,별표 3개,6년 전
HYUNSEOK CHOI (BEN),그치만 화장실이 너무 적어요,별표 4개,7년 전
김은순,날씨도 좋고 시설도 깨끗 서울함이라는 군함이 있음,별표 5개,4년 전
MS L,"월드컵공원,하늘공원,코스로 걷기 좋아요",별표 5개,1년 전
DA HYO PARK,뷰 맛집인데 코시국이라 슬쩍 자전거 타면서 보는걸로 만족,별표 5개,4년 전
Junhyuk Ko,벚꽃이 예쁘게 피어있어요,별표 5개,1년 전
홍성순,자주가는 곳인데 쉴곳 구경할것도 좋아요,별표 5개,4년 전
Sunny Sunny,쾌적한 주변시설과 아름다운야경,별표 5개,6년 전
mustler Oh,"조깅이나 자전거, 할 일 없을 때 가도 무조건 좋은곳",별표 5개,4년 전
von duke kyeon,봄여름 가을 가족 연인과 거닐거나 쉬러가기 좋은곳 겨울은,별표 5개,5년 전
성덕지,가끔 가는데 야외에서 운동할때 기분 좋음,별표 5개,5년 전
G Tour,평일오후시간 사람이 없고 한적하니 좋음,별표 5개,2년 전
김정엽,개와 늑대의 시간이 아름다운 곳 노을을 즐기기 좋은 곳,별표 5개,4년 전
챙이슬이,그만큼 뷰도 좋습니다,별표 5개,4년 전
Hun Park (Gre),"가족적인 분위기가 매력적인, 한강공원",별표 5개,1년 전
bboy jin,야경도 예쁘고 망원동에 맛집고 많고 주차빼고 괞찮음,별표 5개,6년 전
김대발,잔디밭에 자리깔고 한강을 보며 잠시 휴식하기 좋은곳,별표 4개,5년 전
황하영,아주 재미있고 신기한게 많다 잠수함과 군배와 해군의 역사를 알수있다,별표 5개,4년 전
Jin Seok,전망좋은 커피숍과 볼거리들이 있어요,별표 4개,2년 전
Jin Heun Jeung,사람들이 여유를 갖고 한강을 바라보며 즐길 수 있는 장소입니다,별표 5개,6년 전
이정칠,즐길거리와 휴식거리가 함께있는 좋은 장소입니다,별표 4개,7년 전
이유진,한강공원도 예쁘도 가림막있는 한강라면 먹기도 좋은곳,별표 5개,2년 전
보선,"간단히 한강뷰로 앉아서 담소, 캔맥하기 좋은 곳",별표 4개,4년 전
Yoonhee Song,좋아요 대신 텐트치고 한강경치구경은 쫌 어려워요 이것저것에 가려져서 ㅋㅋ,별표 4개,5년 전
이수아,날씨가좋아서인지 늦은시간에도 사람들이 엄청많아요,별표 5개,7년 전
하일규,산책 및 운동하기 좋은 것 같습니다,별표 5개,2년 전
쭈오,스타벅스가 한강 위에 떠있다,별표 5개,3년 전
최예름,먹거리가 많거나 한건 아니지만 그래서 조용하니 좋아요,별표 4개,6년 전
유현태,여자친구랑 바람쐬러 잠시다녀왔는데 좋았던곳이고 깨끗하고 좋더라구요,별표 5개,5년 전
청심,주말 저녁에 아들 딸 같이 다녀왔는되 야경도보구 좋았음,별표 2개,4년 전
Andrew Kim,자전거를 타면서 주변에 국회의사당과 63빌딩이 보이는데 아주 진풍경이다,별표 5개,6년 전
Sylar lee,가끔 힐링을 주는곳,별표 5개,4년 전
Seunghyun Jung,한강 하단에서 양화대교로 건너서 가기엔 매우불편하다,별표 5개,5년 전
박박,좋아요 스타벅스가있어요 경치좋아요,별표 4개,1년 전
YeongHwan Choi,시간보내기 적당해요 서울함 구경 추천드려요,별표 5개,3년 전
알스,밤에 가면 사진찍기 좋은 포인트임 놀이터 모래놀이 가능한 놀이터 있음,별표 4개,수정일: 1년 전
simba,너무 과하게 복작이지 않는 한강공원,별표 4개,4년 전
소정,야경이 아주예쁘고 신원하고 주말이라 사람이 많았다,별표 5개,5년 전
최원규,잔차로 자주가는곳 노을 하늘공원 들렀다 내려와 한강공원에서 쉬다 집으로 옮,별표 5개,수정일: 2년 전
김상준,서울함도 있고 사람도 많지않아서 조용하고 편하게 쉴수있는,별표 5개,7년 전
이우진 (LEOSUN),편하게 쉴 수 있는 곳,별표 5개,5년 전
김혜연,차타고 잠깐 들리기 좋네요,별표 4개,5년 전
방지거사,저녁에 김포 방향을 바라보며 석양을 볼 수 있어 좋아요,별표 4개,5년 전
Lee Holysilver,놀이터도 있고 군함도 있어 아이들과 함께가기 좋음,별표 5개,4년 전
HS KIM,"전망이 좋고, 주변 환경도 좋아요 ~ 😀",별표 4개,수정일: 2년 전
Eun Hye Baek,망원시장에서 먹을거리 사가지고 소풍오기 참 좋은 장소입니다,별표 4개,6년 전
박종필,가족 및 지인분들과 휴식하기 좋은 곳입니다,별표 4개,7년 전
YS IM,"조용하고, 깔끔해서 생각이 많을때 애용해요",별표 5개,4년 전
K신수동엉터리,한강공원중에는 제일 좋은거 같다,별표 5개,5년 전
Dongjun Lee,주차장은 항상 맡기지만 분위기는 정말 좋아요,별표 4개,5년 전
심재윤,가족단위 여름저녁 보내기 좋네요,별표 5개,2년 전
Doohyun Baek,도심에 가깝고 나무도 많고 강도 볼 수 있습니다,별표 5개,5년 전
윤상구,애들고 뛰놀기 좋고 가까운곳에 망원시장도 좋아요,별표 5개,6년 전
Joseph Kim,돗자리가 있으면 편히 쉬거나 책을 읽을 수 있다,별표 5개,5년 전
Min Heo,그밖의 편의 시설은,별표 4개,3년 전
장윤석,일단 중국인이 너무 많아요 뒤쪽에 갈대밭은 사진찍기 조음 물은 똥물 ㅇㅅㅇ soso합니당,별표 3개,6년 전
요녀석,잘 정비된 공원 주변 시장 및 갈만한 식당도 많다,별표 5개,6년 전
이성숙,한적하고 인근에 망원시장의 먹거리와 아주 좋은 한팀입니다,별표 5개,5년 전
명둥이,좋아요 편의점도 가깝고 그런데 뒤편 스테이지에서 트로트 노래좀 그만 불렀으면,별표 3개,5년 전
홍철삼,시원하고 줄거운 시간을 보내고 왔네요,별표 5개,3년 전
이순재,양화대교에서 공연장사이 숲이우거져 인적이 적을때 무서움,별표 2개,7년 전
in A,가족이나 연인이랑 같이 가기 좋다,별표 5개,2년 전
김동현,서울 이곳은 산책하기 좋음 라면도 맛있다구요,별표 4개,5년 전
이민수 (겨울바다),음식종류도 다양하고 가격대비 괜찮은 것 같습니다,별표 4개,6년 전
신승혜,옆사람들이 너무 시끄럽지 않다면 피크닉하기 좋은 장소임,별표 5개,7년 전
nahyun cho,이곳은 항상 좋음 저녁때는 좀 추우니 외투챙겨가셔요들,별표 5개,6년 전
도현석,도보 로산책및망원한강공원에캠핑및여러가지가족 나들이하기좋음,별표 4개,6년 전
hi j,깨끗하고 좋습니다 하지만 비오는 날엔 가지마세요,별표 5개,5년 전
강진주,자전거타고 지나가는 길 같은 느낌이에요 돗자리 펴고 놀 자리는 아니에요,별표 3개,5년 전
안녕,다른 한강공원들에 비해 협소하지만 한강을 보며 피크닉을 하기에는 나쁘지않다,별표 4개,5년 전
정석종,자전거타기 좋고 뭔가 생각하기 좋은장소 였다,별표 5개,수정일: 4년 전
장경준,특히 스타벅스에서의 전망이 좋아요,별표 5개,3년 전
릴리빈트,밤에 가기 좋고 먹을때 많아서 좋아요,별표 5개,4년 전
DW Jeong,한강 공원 중에서 조금 낙후된느낌이다 개선이 필요할듯 싶다,별표 3개,5년 전
ROGEL ‘,밤에 돗자리피고 누워서 노래듣기 좋음,별표 5개,1년 전
Joungil Ahn,그냥 한강공원 왜 핫플인지 잘모르겠음,별표 3개,2년 전
한요섭,바람쌔기 좋아요 강도보고 걷기도하고,별표 4개,5년 전
박정호,석양때 맞춰서 갔어요 다리에 걸친 해를 보며 잠시 힐링하고 갑니다,별표 5개,4년 전
이주호,강가를 걷고 싶거나 뛰고 싶을 때 너무 좋은 곳,별표 4개,5년 전
h g,산책이나 강물을보며 쉬기 좋지만 잔디쪽 뒤에 시끄러운 공연을 오래해서 분위기가 깨졌다,별표 4개,5년 전
손민우,요즘 날씨에 가면 힘듬 야경은 좋음,별표 4개,4년 전
김찬일,난지공원은 한가해서 강쥐하고 산책하기 좋아요,별표 3개,4년 전
minky k (minky),좋아여 한강공원중에 제일 자전거타기좋은곳,별표 5개,5년 전
이로운,수영장이 3곳이라 넓고 간식거리 판매해요,별표 3개,8년 전
김길현,편의점에서 먹는 라면이 엄청 맛있어요,별표 5개,4년 전
AARON,더러운화장실 협소한 주차공간,별표 1개,5년 전
깸또리,좀 썰렁하고 주차하기 힘든거 빼면,별표 4개,3년 전
로드초보,야경 너무 예쁘고 무료 공연이 자주 있네요,별표 5개,5년 전
조은산,맛있고 분위기 좋은 곳입니다~^^,별표 5개,2년 전
김캐빈,새롭게 각광받고 있거나 이미 청춘들에게 주목받고 있는 한강 공원,별표 4개,5년 전
박성제,코로나가 아니라면 치킨먹기ㅠ너무 좋은 공원입니다,별표 5개,4년 전
참치맛오이,이 더운날에도 운동하는 사람들 많은 곳 걷기 좋음,별표 5개,3년 전
Korean World,주중낮에 가서 한적하게 산책하기 짱,별표 5개,7년 전
김희정,자전거도 타고 걷기에도 좋아요 ~^^,별표 5개,3년 전
doldolma,차가지고 주말에 올거면 11시전까지는 와야함 주차못함,별표 5개,4년 전
윤철호,시원한 강바람과 맥주한잔 즐길수있는 힐링죤~,별표 5개,5년 전
Y H,자전거가 많아서 좀 위험했지만 쉬기에는 좋았어요,별표 4개,4년 전
Yang피터펜,해군 잠수함과 해군 군함도 볼수있어 너무좋다,별표 4개,5년 전
J EUN,지금가기딱좋아요 저녁에는 쌀쌀하니 담요챙겨야해요,별표 4개,5년 전
sanghyun ko,주말에 힐링할수 있는 좋은 장소 입니다,별표 5개,4년 전
강기현,저녁의 노을과 주의에 야간 조명 좋습니다,별표 3개,4년 전
kyungil kim,한강을 가까이서 볼 수 있고 망리단길도 가깝고 좋아요,별표 5개,4년 전
Gyver Choi,한강공원 나드리 사기 정말 좋은 날들이다,별표 5개,2년 전
김나경,도심속에 살면서 강을 봐라볼수 있어서 좋습니다,별표 5개,5년 전
Younghak Han,가족들과 산책하기 좋은 곳 입니다,별표 5개,6년 전
Kim Jae Hwan,강바람 쐬기 좋네요 근처엔 먹거리도 많고,별표 3개,5년 전
kyoungae seo,경치도 너무 좋고 운동하기 좋은 안전한 공원,별표 5개,5년 전
jeeeun park,밤에 보면 다 예쁘다ㅎ,별표 4개,2년 전
신주현,함상 공원도 있고 피크닉을 즐기기 좋은 곳입니다,별표 4개,4년 전
maro,산책하기 아주 좋은 곳,별표 5개,1년 전
전형,한밤 중 맥주 마시면서 안전하게(,별표 5개,수정일: 6년 전
최미경,멋지지요 한강 라면,별표 5개,5년 전
SungBin Cho,망원지구가 참 좋긴하죠,별표 5개,5년 전
Taejoo Yoon,괜찮은 공원이나 접근성이 좋지는 않습니다,별표 4개,6년 전
Byoungdae Kim,코로나시대에 살짝 다녀오면 재밌습니다 한강 산책중에 덤,별표 4개,4년 전
김규백,평일엔 사람도 많지 않고 딱 좋습니다,별표 4개,5년 전
dohee kim,약간 내려가는 곳에 물과 다리의 야경을 바라보면서 맛있는 음식을 먹을 수 있어요,별표 4개,5년 전
Yh Jang,야경이 좋음 사람은 많아서 좀 불편,별표 4개,5년 전
김퍄퍄 (김퍄퍄),여유ㅡ근데 비둘기 많음,별표 4개,6년 전
삼삼이,다른 한강공원보다 화장실이 나쁘지않아서 좋아요,별표 5개,5년 전
고두현,산책하기 어마어마하게 좋아요~ 좋음,별표 5개,4년 전
박응수,망원 한강공원 - 스벅 개꿀,별표 5개,2년 전
김정훈,편의점과 화장실이 있고 산책하기 좋음,별표 3개,5년 전
연제숙,코로나 걱정없이 그늘막 치고 음식 먹는것이 불안했어요,별표 3개,4년 전
kappaoppa,망리단길 망원시장 구경후 한강 가볼것 서울함공원도 생겼다고함,별표 5개,수정일: 4년 전
drav,예쁘요~ 요샌 근데 사람이 너무 많네요 ㅠㅠ,별표 5개,5년 전
Hyeonkyeong Kim,성산대교에서 보는 경치가 참좋아요,별표 5개,5년 전
김진석,"여유롭게 가족끼리,연인끼리 걸기 좋은곳",별표 4개,6년 전
Jung Seyoon,여의도 만큼 안붐벼서 좋다 망원역에서 멀지만 매려적인곳,별표 4개,6년 전
Song송숙현,편의점 2군데 있습니다 성산대교가까이에 1군데 망원나들목쪽에 1군데 있습니다,별표 4개,6년 전
코지,한강공원치곤 사람이 적어요 대신 덜 예뻐요,별표 5개,3년 전
김송이,자전거 타고 주변에서 접근성도 좋다,별표 5개,4년 전
js moon,분위기 좋고 날씨도 좋고 텐트치기 딱 좋고,별표 5개,4년 전
DaeKyu Kim,성수대교가 공사중이라 어수선하긴 하지만 그래도 여전히 좋은 곳,별표 4개,6년 전
김동균,시원하고 산채과 생맥하기 좋은곳,별표 4개,3년 전
Shin Hyeok Kwon,1단계되고 텐트가지고 가기 좋아요,별표 5개,4년 전
아메,공원은 좋은데 화장실이 멀어요,별표 3개,2년 전
정병철,요즘 매일 가는데 운동하러 나가기 좋음,별표 3개,6년 전
꼬등어,누구나 다 아는 한강공원 좋다^^,별표 5개,2년 전
탑골노숙자,장마기간 후 쓰레기와 뻘청소 해주세요,별표 4개,2년 전
오혜숙,망원한강공원은 시민들이 휴식하기 좋은 장노입니다,별표 1개,6년 전
pearl Lee,여름이라 많이 북적이지만 언제나 아름다운 한강,별표 4개,6년 전
종발,장사 좀 된다고 1+1하나도 없음,별표 1개,3년 전
민병윤,"군함정 구경, 강변 경치가 좋습니다",별표 1개,3년 전
임정운,날씨좋고 사람도 없고 좋았슴 근데 편의점 개더럽던,별표 4개,4년 전
최상일,가을 저녁에 걷기하기 딱 좋아요,별표 5개,3년 전
막살자,야경 좋음 망원시장이 근처라 먹을거 많음,별표 5개,6년 전
불꽃맹구,그늘까지가기가 먼느낌 ㅋ 다리밑까지 거리가 ㅠ,별표 4개,5년 전
김아무게,쉬어가기 좋은곳 하지만 현재 성산대교 공사로 좀 복잡,별표 4개,7년 전
jiae Kim,다좋은데 사람에 깔려죽겠네요,별표 5개,6년 전
송영란,밤에 야경 보면 엄청 예쁘요,별표 5개,6년 전
so yeon park,강을 두고 여유를 갖고자 하시는 분 강추,별표 5개,7년 전
kenny jinkey,야간에 휴식하기 좋아요 ㅡ,별표 3개,6년 전
주승현,강아지 산책시키기 완전 좋네요ㅋ,별표 5개,6년 전
푸른햇살,한강을 끼고 운동할 수 있는 길과 연결되어 있음,별표 5개,7년 전
Sangyoung Park,그늘막 텐트 칠 수 있어 좋았어요,별표 4개,6년 전
푸쩡,다른한강공원과 비슷한데 배와 놀이터는 인상적이네요,별표 4개,5년 전
그랑죠,"주차하기 편하고 별다방, 편의점",별표 5개,2년 전
박이령,꽃이 예쁘고 경치가 좋다,별표 5개,6년 전
North West,"한강공원, 대중교통은 불편하지만 자전거 자차로 접근성이 아주 좋다",별표 5개,6년 전
RAGON D,자전거타기좋습니다 주변공사로 불편함은 있습니다,별표 4개,4년 전
김병오,좋음 망원 시장도 가깝고 쉬기 좋은곳,별표 5개,2년 전
이주연,로맨틱 편의점 치킨 최고 노래분수 선곡 갑분싸,별표 4개,7년 전
별동별,운동 하기 좋은 한강 저녁 노을 이쁨니다,별표 5개,3년 전
P효효,"운동하기 좋고, 동네도 좋아지고있다",별표 5개,6년 전
김기은,"사람 적고, 노을 지는 거 보기 좋음",별표 4개,4년 전
변근영,아이들 놀이터에서 신나게 뛰어놀았네요,별표 4개,6년 전
돼람단 (쇼리숑숑),단순 한강공원이 아닌,별표 4개,7년 전
HY NJ (varamizota),좋은데 사람이 느므느므 많으다 ㅜㅜ,별표 4개,6년 전
최써니,주차하기 편리하고 한강조망하기 좋아요,별표 5개,4년 전
JJ J,여름 저녁 밤바람이 기분 좋은 장소,별표 5개,4년 전
박선국,운동은 물론 산책하기엔 안성맞춤이에요~,별표 4개,5년 전
Kwang Suk Oh,서울 중심에서 평화롭게 여유를 즐길수 있는곳,별표 5개,8년 전
최현진,다 좋은데 비둘기가 좀 많아요,별표 3개,4년 전
진태범,야간에 구경하기 좋은곳입니다,별표 5개,4년 전
Hong Phillip Hoonki,국회의사당이 보이는 한강변의 의외의 좋음 플레이스,별표 3개,6년 전
김성훈,여유롭게 잡념 지우기에 딱 좋은 곳,별표 4개,6년 전
Junsub Song,주말 1시전에는 가야 주차하기 편해요,별표 4개,6년 전
Sangwook Seo,주차장과 가까운 시설들 그리고 안락한 잔디밭,별표 5개,5년 전
Wonhee lee,봄이랑 초여름 한강공원 활기차고 너무 좋네요,별표 5개,6년 전
강대성,운동하기 좋고 힐링하기도 좋은 장소,별표 5개,5년 전
Lss Harry,반포 여의도보다 비교적 한적해서 좋습니다,별표 4개,6년 전
김연우,산책하기 좋고 뷰는 덤,별표 5개,4년 전
용한이,이곳에서 있으면 힐링이 잘 되는 곳,별표 5개,6년 전
김청민,좀더 세련되게 조성하고 냄새만 없었으면,별표 4개,5년 전
손형주,놀이터가 잘 되있어요~,별표 5개,5년 전
이종진,강가를 보라 웅성웅성 반전이다,별표 5개,4년 전
최재훈,한강이다 모기많고 날파리많고,별표 4개,7년 전
song sunnybn,외국도시락 사서 가세요~맥주 안주로 좋음,별표 5개,7년 전
bamba yun,차타고 가서 쭈구려있다가 오기 좋은 곳,별표 5개,5년 전
정창석,운동시설완비 쉴장소 많아요,별표 5개,6년 전
박순이,주변을 다 가려서 한강을 볼수없고 다리 밑에 있다옴,별표 1개,4년 전
용문플러스학원,삼삼오오 모여서 맛있는 것 먹으면서 놀기 좋은 곳,별표 5개,6년 전
정의성,서울에 있는 한강중 제일 좋아하는 곳,별표 5개,4년 전
Boknam Keon,남녀노소 즐기기좋은 장소입니다,별표 5개,2년 전
찐가상현실,좋음 어린이 짚라인 좋고 연도 날리고^^,별표 4개,5년 전
배은상,운동하고 산책하기 정말 좋습니다,별표 5개,3년 전
김태우,그냥 그렇다 풍경은 좋으나 자전거 가게가 닫음,별표 4개,4년 전
이지은,지혜랑 분위기냈어요 아주좋았어요,별표 5개,4년 전
ropi cru,언제가도 즐겁게 즐길 수 있는 곳,별표 5개,4년 전
HaYoung Park (피어나라),여유로운 시간을 보낼 수 있어요,별표 4개,4년 전
MM AA,혼자 가서 사람들 구경하기 좋아요,별표 5개,4년 전
마이네임,한강공원중 탑3 안에 들어감,별표 5개,5년 전
김현진,한강 역시 아름다움,별표 4개,5년 전
새벽호랑이,야경도 좋고 둘레길도 좋네요,별표 5개,6년 전
박완명,운동하고 산책하고 정말 좋은 곳이죠,별표 5개,6년 전
John lee,그늘막 치고 놀기 좋지만 일요일에도 주차비를 받음,별표 3개,6년 전
박지수 (꿈꾸는아해),산책코스 좋음 나들이 좋음 돗자리 필수~,별표 4개,7년 전
오망훈,서울시 꿀명소 사람도 많이 없고 진짜 좋았음,별표 5개,5년 전
youngsoo chung,편하게 즐기고 힐링까지 가능한 공원,별표 5개,수정일: 5년 전
조경진,뻥 뚫리는 뷰가 맘에 드네요,별표 3개,4년 전
홍종인,야경꾼이 되기 딱 좋은 야경 좋음플,별표 5개,수정일: 4년 전
신수,다 좋은데 택시가 잘 안옴,별표 5개,6년 전
D' Gold,자전거타고 놀기 딱이지요~ 화장실 깨끗함,별표 5개,1년 전
Brooky Tae,정비가 완벽하진 않지만 나름 경치가 좋다,별표 3개,9년 전
James Heo,여유러운 공간 강물보면 마음이 평온해질껄~♡,별표 4개,5년 전
Yong Sang An,좋죠 단 사람도 그만큼 많죠,별표 4개,3년 전
Hongsik Chun,다른 곳보다는 조금 못하지만 그래도 좋음,별표 4개,4년 전
견훤청담,야경이 매우 아름다운 곳입니다,별표 5개,6년 전
문비비안나,분위기가 좋아요 피크닉 구역 편의점에서 사발면끓여먹는게 좋았어요,별표 5개,1년 전
박산하,망원한강공원의 야경은 외국인 관광지로 등록해야함,별표 5개,6년 전
정해민,자전거 및 산책하기 좋은곳,별표 4개,5년 전
Inkyu Yang,너무좋은데 사람이 너무쳐나네요,별표 5개,6년 전
Prince toad,지금이 딱 좋다 더워지기전에,별표 5개,6년 전
권영인,깨끗하다 좋은공기 연인과함께 가족나들이,별표 3개,5년 전
조군,친구들과 좋은추억쌓기 좋은곳,별표 5개,3년 전
Eric Choi,경치는 좋은데 편의점이 없음,별표 2개,6년 전
Seung-jin Kim,조용하고 시원한 공원이에요,별표 4개,4년 전
이영선,망원지구 자전거타기 딱좋습니다,별표 5개,2년 전
박월서,좋아용 시원하고 사람 많아요,별표 5개,3년 전
Hogun Ryu,한강 공원 중 가장 아름다운 다리가 있는 장소,별표 5개,5년 전
장보일,산책하기 너무 좋은 데이트 코스^^,별표 5개,6년 전
Myeong Rae Lee,분위기도 좋고 청결해요,별표 5개,6년 전
류송열,강가에 휴식이 있는 멋진 공원,별표 5개,5년 전
김여행,너무 기분히 좋고 한강이 멋져요,별표 5개,4년 전
우코치치와 아이들,기분전환 하기 정말 좋은곳,별표 5개,4년 전
king아더,잔디 개방에 모든 음식 배달까지~ 좋음뜨,별표 4개,6년 전
김용길,그늘 많아 좋지만 사람이 너무 많다,별표 4개,7년 전
Lệ Ngọc Trần,공간좋긴한데 자리 좀 적네요,별표 3개,3년 전
서석미,고즈넉하고 좋음 아직은 야외연습장가느라ㅠㅠ,별표 4개,6년 전
RAUL KIM,공사중이라 주차가 협소해요 ㅜㅡㅜ,별표 3개,5년 전
kyungmook choi,관광지가격 혼자가서는 먹을게없다,별표 3개,3년 전
JW Oh,운동하고 데이트하기 좋은 곳,별표 5개,6년 전
kook hwan Moon,오늘은 공기가 좋아요~,별표 5개,7년 전
안재옥,언제가도 한강은 참 좋으네요~,별표 5개,3년 전
김꼬북,성산대교 야경 예쁘요,별표 5개,6년 전
김진관,늘상 다니던 길이라 항상 좋아요,별표 2개,5년 전
이상협,한적하고 친구와 둘이 맥주먹기 딱 좋아뇨,별표 5개,7년 전
이랑이랑,조용하고 운동하기 좋은곳,별표 5개,5년 전
우행부,주말에 망원시장에서 먹을거리 사서 한강공원으로^^,별표 5개,수정일: 7년 전
안토니오깨를로스,나들이가기좋은 곳 사람이너무많아 ㅜㅜ,별표 4개,5년 전
강병길,망리단과 상수동 카페골목이 가까워요,별표 4개,6년 전
JINWOO OH,잔디관리만 좀더 잘하면 베스트,별표 4개,6년 전
to life,저녁과 밤이 아름다운곳,별표 5개,4년 전
탁송거북이,주차가죽음인동네유 ㅜㅜ차없이 자자구로가인함,별표 3개,6년 전
정창규,가깝고 시원하고 배달도 잘됨,별표 5개,6년 전
어리굴젓,편의점의 폭리만 뺄 수 있다면 만점임,별표 4개,5년 전
왕진상,낚시를 할 수 있어서 좋았습니다,별표 5개,5년 전
crom,홍수전에는 최고의 산책 코스,별표 4개,4년 전
Daewoo Hong,답답할때 한강보며 힐링 성산대교 야경 예쁨,별표 5개,5년 전
KyungHeon Kim,운동과 산챽하기 좋은 장소,별표 2개,5년 전
jeeye lee,근처에서 텐트 대여해서 놀기 좋아여,별표 5개,6년 전
김영회,"폐 ""군함""을 전시하여 ""함공원""이라 한다",별표 5개,6년 전
yj k,산책하기 딱 좋은 코스 홍제천 한강,별표 4개,4년 전
