작성자,내용,별점,작성일
이상훈,가족들 및 친구들과 술한잔하면서 여유있게 보낼수 있고 배달음식도 가능 합니다 차량으로 오시는분들은 주차장이 있으나 휴가철 및 날씨좋은 주말에는 자리가 없을수도 있습니다 대중교통 이용해서 오시는 분들은 합정역에서 내리신 다음에 1번 출구로 나오시면 16번 마을버스 정거장 있습니다 한강공원 입구까지 버스가 운행하니 망원역까지 오셔서 힘들게 걸어오지 마세요,별표 5개,6년 전
김득구,식당들 이용하기도 좋고 편의점 및 카페도 있어서 산책이나 데이트 하기도 좋음입니다 ㅎㅎ 날풀리면 돗자리 깔고 피치맥도 좋아요 가깝고 좋아요 주차하고 뒤에,별표 5개,2년 전
에도라울프,자전거코스 일산에서~망원한가로임,별표 4개,수정일: 4년 전
홍승서,편의시설 정비도 잘 되어 있어 가족 나들이나 산책 가벼운 운동 등에 어울리는 곳입니다,별표 5개,5년 전
Seungjoo Lim,"서쪽으로는 불광천, 홍제천이 한강과 합류하는 마포구청쪽 길과 연결되어 있으며 동쪽으로는 합정역 쪽 양화대교까지 이어집니다 한강 물 바로 앞까지도 갈 수 있는데다가 조용해서 강물이 흐르는 소리도 들을 수 있어요 부산스러운 서울에서 꽤나 조용히 하루를 마무리 할 수 있는 공간이라고 생각해요",별표 4개,6년 전
Yoo우담 (雨潭),코로나로 답답할 때 가족끼리 피크닉 적합한 곳,별표 5개,4년 전
hj Kim,개인적으로 여의도 한강공원보다 좋았다 또한 주변에 텐트나 돗자리를 빌려주는곳이 많으니 빌려서 가는것도 좋다,별표 5개,5년 전
Clitcher Ashford,그래도 넓직하니 좋다,별표 5개,수정일: 2년 전
그저.보는 중,적당히 산책하기 좋은곳 사람구경 할겸 바람쐬고싶으면 추천 조용한 풍경을 보고싶다면 비추 한강라면 너무 비싸졌다,별표 4개,1년 전
블랜차드 리더십코리아 (Blanchard Korea),한강을 바라보며 망중한을 즐길 수 있는 멋진 곳,별표 5개,4년 전
박준혁,온갖 편의시설및 운동 과 힐링이가능,별표 5개,6년 전
남승연,"저녁에 산책으로도, 커피 한잔 하기도, 치맥이나 피맥하기도 좋다 집 근처에 이런 곳이 있다는 건 너무 행복한 일이다",별표 5개,2년 전
Byong Kuk Jeong,"산책하기 좋음, 좀 험하게 타는 자라니들이 좀 있으니 도보시 살짝 조심히 다녀야 합니다",별표 3개,6년 전
박송이,진짜 너어어혀어어무 너무너무 좋아요ㅠㅠ 돗자리챙겨가서 맥주한잔하면 걍기절임,별표 5개,4년 전
이남주,"편의점, 화장실등 편의시설 잘 되어있고 자전거 대여가능, 비정기적으로 공연관람 가능, 그늘막텐트, 돗자리 사용 가능 강변 특별한 이유없이 좋죠",별표 5개,5년 전
남진경,밤에 야경이 그만입니다 수영장도 있고 선착장 식당도 있고 시원한 강바람 맞으며 산책하기 좋습니다 낚시 하시는 분들도 계시더라구요 무엇을 원하시나요 산책 수영 식사 라이딩 걱정없습니다,별표 5개,6년 전
오준영,넓은휴식공간을 가지고 물과 나무가 조화를이룬 휴식공간이며 주차장과잔디가 오가는발길에 쉼터가되기도한다 몸이건강하면 나와 다니면서 힐링하는 장소로도 권할만하다,별표 4개,4년 전
Orange Road,"이렇게 멋진 추억을 안고 가게 해주신 서울시장님과 마포구청장님과 공무원 여러분, 서울시설관리공단 임직원 여러분께 감사드립니다 가슴 풋풋한 좋은 추억 만들고 갑니다",별표 5개,3년 전
MALVO SALON,개인적으로 붐비는 한강은 좋아하지 않는 편이라 망원 혹은 양화를 자주 찾는 편인데 아무래도 그중에 조금 더 접근성이 좋은건 양화지만 공원에서 시간을 보낸뒤에 번화가를 찾는다면 망원이 더 낫다는 생각을 한다 주관적이지만 편한 주차 주말임에도 너무치지 않는 사람들 날이 풀린 초 봄에 시간을 보내기에는 더할나위없이 좋은 곳이었다 가족단위의 오붓한 시간이나 친구들과의 여가에 좋은 공간이라 생각한다,별표 5개,5년 전
TY,해질무렵 한강공원은 어디라도 좋다,별표 4개,7년 전
김명진,역시 한강엔 편의점이지 Feat,별표 5개,수정일: 1년 전
gee Lee,한밤중에는 오히려 창이 비쳐서 한강이 보이지 않습니다(이중창)그리고 끝나는 시간이 9시라 좀 그래요 좋아요 장소도 넓고,별표 4개,2년 전
Amy Han,저렴한 가격의 야외수영장,별표 4개,8년 전
김태훈,주말에 드라이브해서 나들이 가기 좋은 곳,별표 4개,3년 전
beach wing,그리고 성산대교 아래 편의점 쉼터가 있는데 그곳역시 뷰가 좋다,별표 4개,2년 전
남색난방,앉을 수 있는곳이 많아 좋았어요 주변에 따릉이도 있거 자전거타기 좋어요,별표 5개,1년 전
해피캔서,장마철 한강 성산대교밑의 사진이네요 예년 같으면 텐트에 가족 혹은 연인끼리 나온 사람들이 많을텐데 사진속 분위기같이 음산하니 안타깝네요 빨리 장마가 끝나고 쾌적한 날이 오길 바랍니다,별표 4개,5년 전
Shanice,산책하기 좋은 것이에요,별표 5개,2년 전
seung-ick noh,하지만 간단히 쉬고 가긴 좋습니다 한강변 공원치곤 작고 볼품없음,별표 3개,8년 전
편미숙,자전거로 한강변을 다녀왔어요 비온뒤에 맑은 공가와 따뜻한 햇살이 좋은 았습니다 오르막과 내리막이 있어 지루한 감 없이 즐겁게 다녀왔어요^^,별표 5개,5년 전
Hyogen An,물에 들어갈 수 있음 개인 미니보트 카약 같은거 탈 수 있음 몰리는 시간을 빼면 주차 공간은 비교적 많음 대중교통으로 이용하기는 좀 불편함 편의점 가격이 너무 비쌈 다른 한강 공원에 비해 돗자리깔고 있읗 자리가 조금 협소함,별표 3개,5년 전
true kang,자정 밤 12시 전인데 불이 꺼져 있어 아쉬웠지만 선선한 날씨에 사람들도 많았고 역시나 편의 점 뽀글이 와 함께 하니,별표 4개,5년 전
크자,한강바람에 기분좋게 앉아 이야기 나누기 좋아요~,별표 5개,7년 전
tae young kim,라이딩하다 잠시 쉬기 좋은곳,별표 4개,4년 전
DynamiteKorean,공간은 좋은데 접근성이 좀 떨어지네요 대중교통으로 쉽게 가기는 어려워요,별표 4개,6년 전
조수아,"산책로가 잘 정돈되어있고, 넋놓고 한강을 바라볼 수 있는 좋은 곳입니다 트랙이 잘 마련되어 있어서 자전거 타기에도 좋고, 달리기에도 좋습니다",별표 5개,4년 전
Seokjae Jeong,"일요일에 가족들과 함께 간이텐트와 돗자리를 가지고 여유로운 시간을 보냈습니다 주차하는데 삼십분정도 시간이 소요 되었지만, 그 이후에는 불편한 부분은 없었습니다 시설이 아주깔끔하지는 않았지만 화장실도 이용할 수 있었습니다",별표 5개,수정일: 6년 전
Bo Seok Kim,편의점도 치킨가게도 있고 서울함에 들어가볼수 있습니다 망원시장에서 마을버스로 2정거장 정도입니다,별표 5개,1년 전
Richard Kim,한강북서쪽 위치한 망원한강공원은 가족단위 친구또는 연인들이 데이트 즐기기에는 더할나위없는 멋진장소로 한강뷰와 주변 먹거리또한 최척한된 공원입니다,별표 5개,2년 전
Randy Rhoads,선선한 강바람을 맞으며 성산대교 너머를 바라보거나 의사당이 보이는 쪽의 야경도 훌륭해서 강가에 앉아 맥주나 커피 한 잔 때리기도 좋읍니다 돌아갈때에는 본인 쓰레기는 꼭 치우고 가는 문화시민이 됩시다,별표 5개,5년 전
JB SHIM,"화장실도 깨끗한 편이고, 휴지도 비치 되어 있음 성산대교 야경도 좋고, 한강 산책하기 좋음",별표 4개,수정일: 4년 전
Junsik Kim,초저녁 해가 질 무렵의 뷰가 끝내줍니다,별표 5개,6년 전
최광호,한강 이마트 24시 정말 잘 되어 있네요~ 쾌적하고 분위기도 좋아요,별표 4개,3년 전
김필홍,제발 인데 먹고 놀고 간 자리는 깨끗하게 치우고 가시고 쓰레기는 제발 쓰레기 통에 버려 주시면 감사하겠습니다 자연 그대로 보면 무척 좋은곳 이지만 이곳을 찾는 사람들의 정신 상태가 싫을 뿐 입니다,별표 1개,5년 전
코크니,운치는 좋으나 가성비가 영 별로인 곳 멀리가지 않고 캠핑하는 분위기 내는덴 좋아요,별표 3개,4년 전
멋토망고,성산대교 뷰가 너무너무 멋지고,별표 5개,2년 전
Todd,살아가면서 느끼지만 어느 곳이든 공원은 많을 수록 좋다 사람이 많아지니 접근도 더 좋아지고 상업시설도 많아지고 있다 우울해진 마음조차 날아갈 것 같아 좋다,별표 5개,수정일: 2년 전
YEON JUNG,주변에 군함 공원도 조성되어 있어 볼거리는 많습니다 가볍게 강변을 산책하기에 좋습니다 가족 단위나 연인끼리 방문하기에 좋은 장소입니다,별표 5개,5년 전
바람따라서,"망원동에 있는 한강공원, 수영장도 있다",별표 4개,수정일: 8년 전
채형석,편의점에서 라면 끓여먹으면 좋아요 자전거타고 쉬기는 좋은데 성산대교가 공사를 한,별표 4개,5년 전
목딴다,근처서 피자 사다가 망원한강공원에서 피맥했지요 좋음,별표 5개,5년 전
김희숙,여러가지 준비필요없이 간단하게 예약하구 대여해서가니 편하구 좋으넹‥ 피크닉 109 망원본점 추천드리구 한강공원 나들이 함 다녀들오셔요 피크닉109에서 그늘세트 대여해서 다녀온 한강공원 나들이 답답한 일상에서 벗어나 기분전환 잘 하구왔어요,별표 5개,4년 전
윤지은,풀밭에서 강을 배경삼아 작은 텐트치고 앉아서 놀기 좋은 곳,별표 4개,7년 전
스피드웨권,역시 서울함공원처럼 다른 곳보다 그나마 조용해서 편안하게 쉬시거나 테니스장 등의 운동시설을 즐기거나 하기에 아주 좋아요 그 외에 걷다보면 꽤 특이하게 생긴 휴식공간들도 있는데 무대형태로 지어진 탁자들이나 계단형태의 벤치들이 있어서 사진도 찍고 쉬어가시기에 아주 좋아요 바로 옆인 서울함 공원과 이어져있기 때문에 산책을 하시거나 라이딩 하시면서 지나치게 되어있는 곳입니다,별표 5개,5년 전
angela lee,편의점도 가까이있고 주차도 가능합니다 자전거를 타고 오가는사람들과 여름엔 강을 바라보며 돗자리펴고 맥주한캔 즐기기 좋은장소에요,별표 4개,5년 전
남인웅,바람이 좋아서 피크닉하기 좋아요,별표 4개,5년 전
Ha Neul Kim,편의점도 있고 화장실도 있습니다 23 주차장 공사중입니다 한강공원이 다 사람이 많지만 자리만 잘잡으면 경치도 좋고 바람도 잘불고 좋아요,별표 5개,수정일: 6년 전
Sejin Park,아이들 놀이터가 잘 구성되어있어서 때때로 놀러가기에 좋습니다,별표 4개,5년 전
Sh C,강바람 시원해요 가족끼리와서 라면끓여먹고 치맥하기 좋아요 스타벅스도 있어서 종일 놀기좋아요,별표 5개,2년 전
권영준,성산대교 야경이 멋있네요~ 바로 앞에 편의점이 있어서 간단하게 맥주 한잔하기도 좋아요~,별표 5개,3년 전
최지호,언젠가 제가 다시 갔을때 없으면 리뷰를 수정하겠습니다 그러니 봄이나 여름에 가시는게 좋습니다,별표 4개,6년 전
hong joong park,아이들과 가족과 연인과 산책하기 좋음 오래전부타 산책하러 자주가던곳,별표 5개,5년 전
박Wg,한강공원에서 운동하기좋고 최고죠 그런데 공원에 개 델고다니는분들 개똥처리좀 잘하고 목줄좀 짧게쥐고 다닙시다 관리소는 관리좀 신경써주시고,별표 4개,5년 전
Love Tree (사랑),캐시워크 앱에서 5월 한달 서울 주요 지역방문인증시 캐시백 1만원을 주네요~망원한강공원도 그 방문인증지중 하나~^^,별표 5개,3년 전
김문정,너무 좋았습니다 해질때랑 야경이 너무좋아요,별표 5개,5년 전
박현철,"편의점앞에 꽃, 식욕을 샘솟게한다",별표 5개,5년 전
민주,낮과 밤이 분위기가 달라 어느때고 산책하기 좋음,별표 5개,1년 전
Kathleen Yi,여기는 한강공원중에 보트가 내려가는 길에 돗자리를 펴고 한강물과 가장가까이있으면서 건너편 여의도의 경치도 감상할 수 있는 명당이라고 생각합니다 여러번 갔는데 한번은 떠내려온 쥐 시체도 볼 정도로 강물과 가까움,별표 4개,5년 전
최종하,여름에는 정말 많이들 찾으시죠 망리단길이 알려지면서 더 많이들 찾으시는것 같아요 비교적 깨끗하게 관리된다 생각합니다 서울에서도 이렇게 넓은 고수부지는 많지않습니다,별표 5개,6년 전
Sangwon Ahn,너무 예쁜 경치와 산책하기 좋은 길이 준비되어 있습니다 주변에 망원시장 망리단길이 있어서 먹을것도 많구요,별표 5개,6년 전
빈터의 삶의 여정,산책이나 자전거타 좋습니다,별표 5개,수정일: 2년 전
김명숙,장애인은 밤에 망원공원 주차해택도 못받게 하시면 어떻게 하자는검니까 늦은시간에도 시스템이원할하게 해주시면안될까요 저는 장애인 차주로서 복지활인을 받으려했는데 복자활인 받을수있는시스템 되어있으나 늦은시간에는 안되고호출을 해도 계속 기다리라는 멘트만 나오고 뒷차는 빵빵 되며 빨리나가라 소리지르고 성질급한사람은 복지해택도 못받고 카드결재하고나와야 함니까,별표 1개,7년 전
Sehyeon J,여의도쪽은 사람이 많아서 자리도 별로 없고 했는데(벛꽃축제 기간이라 그럴수도있음) 강북쪽이라 확실히 조용하고 분위기 있었음 비교적 조용한 분위기 좋아한다면 개추,별표 4개,6년 전
전승만,그늘막 텐트는 된다,별표 5개,3년 전
백두현,"넓은 잔디밭과 편의시설(화장실,급수대,편의점 등), 나무들이 편안한 느낌을 주고 수상스포츠(요트, 제트스키, 카약, 보트) 가능 한강 조망과 서울의 강변 Skyline 보기 좋음",별표 5개,7년 전
hyo ji,다 좋은데 조류가 너무 많다 특히 비둘기 조류공포증있는분은 조심하세요 돗자리깔고 누워있다 깜짝놀램 글구 주말에 가면 사람 너무 많음,별표 3개,4년 전
뭉뭉하다,여의도 만큼 정비되어 있지 않지만 고즈넉하고 한적한 여유 즐기기 가능 여의도 한강공원은 질리고 사람많은 곳이 싫다 하면 추천추천,별표 4개,6년 전
청과공장,산책후 가벼운 식사하기가 좋습니다 가벼운 산책하기 정말 좋습니다 앞으로 나오면 망리단길 연결되어 있습니다,별표 4개,5년 전
JMPARKA,시원한 바람과 함께 산책을 하거나 라이딩을 하기 좋은곳 최근엔 구축함을 전시해 볼거리도 충분하고 백미는 역시 성산대교의 야경~,별표 5개,6년 전
유근복,여기는 테니스를 레슨 받을수도 있고 자전거를 타거나 걸으면서 산책도 할 수 있고 배고프면 간단하게 식사도 되고 각종 배달 음식도 가능하며 커피 한잔 마시면서 야경도 즐길수 있는 장소 입니다 주차요금도 저렴 합니다,별표 5개,6년 전
joonwoo ahn,주차 조금 좁지만 편의잠도 2개있고 놀이터도 있고 정비가 잘 되어있어 좋아요,별표 5개,4년 전
jooyeon kim,주차장 차단기 있고 매점 있고 제트스키 선착장 있음 강변북로 탓다가 배가 아파서 티멥으로 공중화장실로 검색하니 찾아줌,별표 4개,5년 전
황인영,좋다 스타벅스도있고 주말에 망원에 오신다면 12시전에 공영주차장에 주차하곺나가세요 망원에 주차못합니다,별표 5개,1년 전
jaebum chay,사람이 많으니 간격이 좁네요,별표 3개,5년 전
모니카님 1호팬,편의점에서 라면 맥주 커피 저렴하게 최고의 한강 뷰를 즐길수있어요,별표 5개,수정일: 2년 전
Auto Wogen KOREA & THAILAND,주차장이 좁아서 주말엔 입차까지 오래 기다려야 한다,별표 4개,1년 전
Yunji Jeong,한강을 정말 가까이서 즐길 수 있는 곳 망원에서 이촌까지 자전거로 달리면 참 좋음 지하철 지상구간 다닐때 간혹 한강에서 보트타는 분들이 계신데 다 여기에 차 대놓고 보트 즐기시는 거였음,별표 5개,4년 전
김은령,밤에 방문해보니 멋지네요,별표 5개,4년 전
hahoho ha,"평일은 한산하고 바람도 좋고, 여유롭게 있다가 왔어요~ 아쉬운건 화장실쪽이나 강쪽에 안전요원이 있었으면 좋겠다는 생각이 들었어요",별표 4개,3년 전
마루한,놀이터도 있고 배도 볼수 있어서 아이들과 아주 알차게 다녀 왔습니다 단점은 아이들이 잘 놀아서 너어무 오래 있엇다는거죠 ㅎㅎ 놀이터 짚라인도 있고 모래놀이를 할수 있어서 참 좋아요 아이들만 풀어놔도 잘 놀아요 화장실 한강공원이라 여러곳 잇어서 좋아요 한군데가 수리중이었는데 그래도 다른 화장실 이용할 수 잇었어요 피크닉 구역 숲에 돗자리 깔면 소풍 기분입니다,별표 4개,2년 전
이석원,홍제천에서 출발하여 따릉이 타고 성산대교 서강대교 양화대교 마포대교 원효대교 한강대교까지 하이킹 강바람이 좋았고 강을 보니 좋았다,별표 4개,3년 전
Minsu Choi,망원역부터 망원시장 들려 한강공원까지 둘러보는 코스는 정말 최고의 나들이,별표 5개,1년 전
Machine high tech Tom Chang,서울에서 공기좋은 오직한곳 코러내자가격리 걱정없는 장소익도하다 자전거타기 인라인등 요즘에 갇혀있다가 일요일을 강변에나오니 좀숨통이 트이잔어,별표 3개,4년 전
고독한미식가,산책하기나 자전거 타기에는 여전히 좋으며 다리 밑에서 사진찍기에도 좋습니다,별표 4개,5년 전
정은길 건축사,화물트럭이 주차공간을 활용하고 있어 일반승용차 주차에 어려움이 있다,별표 3개,1년 전
김일도,공원에 전투함이 ㅎㅎ 볼거리도 있네요,별표 5개,수정일: 6년 전
Admodzen Jang,"자전거길과 운동하는 인파, 돗자리펴고 치맥하는 사람들, 연인들이 주를 이루고, 서울함공원이 있으며, 밤에 야경은 더욱 매혹적이다 언제나 붐비는 곳이다",별표 5개,3년 전
OH_91,망원시장서 음식사서 가서 먹으면 꿀맛,별표 4개,4년 전
Love in Truth,라면과 화장실과 성산대교 뷰만 있으면 그냥 끝난거 아님 돗자리 깔고 컵라면 먹으면서 노닥대기 딱 좋음,별표 4개,5년 전
코코윰,가을을 가까이서 느낄수 있는곳 평일에 가니 한산하니 좋습니다 스타벅스에서 한강과 오리배쳐다 보며 커멍하기 좋다는^--^,별표 5개,2년 전
신광균,한강에 위치한 한강공원으로 지역마다 많은 한강공원이 있는데 자유로 건너편에는 하늘공원과 노을공원이 위치한 공원으로써 나름대로는 산과 강이 있는 공원 낮이나 방이나 평안함과 휴식과 운동조건이 존재하는 곳 주차공간도 아주 자유로운 곳,별표 5개,4년 전
It's me Lucky,걷기 좋은 날씨 노을도 좋음~,별표 4개,수정일: 3년 전
김동오,다른 한강공원에 비해 작고 주차장도 작네요 시설이 조금 아쉽지만 있을건 다있고 괜찬아요,별표 4개,4년 전
Eun-Young CHOI,주변 전경도 좋고 구경거리도 있고 쾌적하고 지루하지 않아요 좋아요~ 편안한 느낌,별표 4개,4년 전
카인,뷰 자체도 좋지만 주변에 선상 레스토링과 카페 등도 있어서 더욱 마음에 들었습니다^^,별표 5개,2년 전
황정미,카페나음식을 먹을수있는곳이생겨서 편하게이용할수있을거같아요 그런데 스벅은운영시간이너무짧은듯해요ㅜㅜ,별표 3개,2년 전
baek cheolhoon,망원시장들렀다가 돗자리하나 들고가서 먹고 딩굴거리기좋음,별표 5개,5년 전
kyoungil kim,"한강의 뷰가 멋지고, 한강공원에서 자전거타기 또는 전동 퀵보드로 운동도 가능하고, 돗자리만 있으면 음식과 담소로 즐길 수 있는 좋은 장소이다",별표 5개,4년 전
Enter StarNews,"가볼만한곳 사진찍기좋은곳 데이트코스 드라이브코스 힐링하기좋은곳 야경구경하기좋은곳 Places to visit, places to take pictures, dating courses, driving courses, places to heal, places to see the night view,",별표 5개,3년 전
양재호,라이딩 필수 코스인건 다들 알죠,별표 4개,2년 전
월드프러스,가을을 맞아 방문한 한강공원은 참 아름답습니다,별표 5개,4년 전
Anco Kang,"사람이 많지만, 빵이 있어 좋고 자리도 금방 나요",별표 5개,1년 전
황춘선,한강변에 산책로 자전거도로의 시민들의 휴식 공간이 자리하고 있습니다 한강물과 서울의 경치가 으뜸 입니다,별표 5개,4년 전
김진수,비둘기와 함께하는 특별한시간 음식에 꽃가루가 흩날리지만 반짝이는 강물과 풍경이 너무모 좋아요,별표 5개,4년 전
선자,망원 근처에 오실 있으면 식사 후 산책겸 가서 앉아 있다 오시는거 추천 아 물론 커플이나 썸이라면 더 좋겠쥬,별표 5개,5년 전
진무치,개인적으론 난지가 훨씬좋네요,별표 3개,6년 전
최창길,"성산대교 아래에 있는 시민공원으로 한강이 바로 옆이라 강바람이 선선히 불어오고, 공원에 있는 GS25 편의점은 오가는 사람들에 쉼터입니다",별표 4개,1년 전
Jaehong Zoo,주로 자전거가 통행 시에 고속 주행을 할 수 없는 방향으로 시설물/도로 등을 약간 손 보는 것이 어떨까 싶습니다,별표 3개,3년 전
EUGENE LEE,스벅에서 커피 한 잔 편의점에서 사발면 구스아일랜드에서 맥주 한잔 그 어떤 선택도 맘에 들어요,별표 5개,2년 전
조수강,성산대교 선유도 여의도 보는 경치 괜찮고 홍제천 난지공원 월드컵공원 연결되어 운동산책 실컷 할수있다 잔디밭이 줄어들고 뭔가 시설을 자꾸 설치해서 아쉽다,별표 4개,7년 전
신혜정,서울의 멋진 산책 장소,별표 5개,5년 전
배상길,주차장에 차 세워두고 잔잔한 노래 틀어놓고 멍때리다보면 한두시간은 후딱,별표 5개,5년 전
원유창,텐트치고 누워있으면 정말 좋다,별표 4개,6년 전
TH Kim,망원동에서 접근이 쉽고 주변에 돗자리 렌탈부터 다양한 편의시설이 있고,별표 5개,5년 전
다락방 이야기1026,가을을 한가하게 맞이하기 좋다 편의점이나 화장실 같은 편의시설이 잘 되어있다,별표 4개,3년 전
김재준,"편의점에서 라면도 먹고 바로 앞에 놀이터, 텐트 칠 수 도 있어서 아이들도 놀기 좋고 어른들도 놀기 좋고",별표 5개,2년 전
박상수,해군 퇴역함선 공원 추가되어 볼거리가 늘어 좋네요,별표 4개,1년 전
뮤.,요즘 선선할 때 나들이나오기좋은곳이에요 사람들많아요,별표 5개,4년 전
김유진,요즘 비가 끊임없이 내리고 있어서 한강 물이 많이 차있었고 흙탕물에 쓰레기 더미까지 떠밀려와서 안타까웠습니다ㅠㅠ 비가 와서 매점 2층에 있는 카페를 갔는데 전망도 좋고 무지개 크레이프도 맛있었어요😁,별표 4개,5년 전
BECHA J,"여의도,반포보다 상대적으로 사람도 적고 근방에 망원시장이 있어서 오며가며 먹거리들을 살 수있고 화장실,편의점이 근방에 있어서 아쥬 좋다",별표 5개,6년 전
rossi valentino,망원시장에서 식사 및 쇼핑을 하고 한강을 배걍삼아 걸으니 좋네요 사람도 적당하고 좋습니다만 약간의 냄새도,별표 4개,5년 전
김HS,"주차장 문제 심각수준 이상 주말에 차량 가지고 가는 순간, 그냥 길바닥에 돈뿌려야합니다",별표 1개,2년 전
june non,"편의점도 가깝고 입구에 커피숍,화장실 있어서 이용하기 편해요",별표 5개,7년 전
김미숙,날씨는 추웠으나 상쾌함을 느꼈어요 시원하니,별표 5개,1년 전
루키,친구들과 잔디밭에서 치맥하기 좋음,별표 5개,3년 전
Rin Jay,한강공원은 언제나 좋습니다 오늘은 비가와서 오래 있지 못하고 철수했지만 멍멍이는 비오는 넓은 풀밭이 좋은가봅니다,별표 5개,5년 전
Hyunil Cho,뷰가 쟇아요 특히 한강 조망의 스타벅스가 있어 너무 좋아요 화장실 깨끗해요,별표 5개,1년 전
김은희,잔디밭 그늘도 많고 망원동과 연결되는 곳에 돗자리 등 피크닉 용품 대여도 되니 너무좋다,별표 5개,3년 전
유무희,날씨도 따뜻하고 아이들과 뛰놀기 아주 좋아요 커플들이 많이 왔네요,별표 5개,2년 전
Sla Bla,그쪽방향 편의점도 2군데 모두 정리하심 참고하세요,별표 4개,6년 전
나스닥코스닥,조용해서 좋았는데 사람이 너무 많아짐,별표 2개,5년 전
한금희,넓은 잔디밭과 한강이 어우러져 있는 피크닉 장소 특히 저녁 석양이 아름다운 곳 입니다,별표 5개,2년 전
