작성자,내용,별점,작성일
INcLine Museum_인클,"놀이터 관리가 잘 되어 있음 화장실 최소 3곳 있음 반려견 동반 환경 아주 좋음 피크닉 구역 잔디밭에서 피크닉 가능합니다 1층에는 한강라면 먹을 수 있는 공간도 있어요 한강공원에서는 돗자리 피고 앉아 배달음식을 받아볼 수 있어요 근처에 서울함 공원이 있고, 스타벅스 망원한강공원점에서 커피와 함께 카페를 이용할 수 있습니다",별표 5개,4달 전
모아스토리,"저도 자주 찾는 곳이구요 😍 놀이터 놀이터 있어요 화장실 화장실 많구요 반려견 동반 환경 반려견도 좋아하는 곳이에요 자동차로 가거나 걸어서, 자전거로도 갈 수 있는 망원한강공원이에요~ 서울함공원과 야구장, 노을 스팟이 있어 많은 사람들이 애정하는 곳이에요",별표 4개,4달 전
Jungki Hong,야경이 멋드러진 망원한강공원 산책하기 좋고 스벅&써브웨이 있어서 산책하고 간단하게 식사하기 좋아요 물론 한강하면 라면이 빠질수 없지만요~,별표 5개,1달 전
B K,이따금 답답할때 자전거타고 오면 탁트인 공간을 볼수있어 좋은곳 이곳에 방문하기 시작한지 10년도 더 되었지만 언제와도 좋다,별표 5개,수정일: 6달 전
Bella Rhie,반려견 동반 환경 반려견 데리고 산책하기 좋아요 한강공원 근처 망원시장에서 먹거리를 사서 한강공원에 돗자리 펴고 여유롭게 먹을 수 있습니다 ㅋ 화장실 공중화장실이 깨끗합니다,별표 5개,1달 전
김득환,합정역 8번출구에서 처음 나올때에는 이정표가 있어서 쉽게 찾아갈수 있을것으로 생각 하였는데 조금 걸으니 표지판이 없어서 물어서 찾아간 곳이다 합정역8번출구에서 공원까지는 34분이 걸렸다 한강에서 낚시가 가능한 곳이 몇군데 있는데 망원 한강공원은 도크로 되어있는곳에서 40여명이 낚시가 가능하다고 소개가 되어 있어 찾아가본 곳이다,별표 5개,1년 전
쥬츠꾱,예쁘요 날이 좋으면 훨씬 더,별표 5개,2주 전
박선영,1층에는 편의점이 있고 2층에는 스타벅스가 있어 간식거리를 구입하지 못했어도 충분히 즐길거리가 있는 곳이에요 선선한 가을에 간식거리 사들고 가면 기가막힌 추억의 장소가 되네요 바람이 시원하게 불고 야경이 좋아 최근들어 최고의 여행지였어요,별표 5개,1년 전
김숭호 (퓨처),공영주차장이면서 망원시장에 도보로 15분 정도면 가능해서 괜찮은 장소 입니다 주변에 편의점 2개와 스타벅스 서브웨이 맟 바른통닭이 있네요,별표 5개,1년 전
YO LEE,"마포인트나루라는 건물이 수상에 깨끗하게 만들어져있어 스타벅스부터 편의점 음식점까지 영업중이네요 아직은 낮시간이라 그런지 사람이 많지는 않았지만, 운동하는 사람이며, 강아지랑 산책하는 사람, 한강을 보며 앉아있는 연인들까지 평화로운 공원의 모습입니다 망원동 맛집 방문차 왔다가 약속시간이 남아 잠시 방문하게 되었습니다",별표 5개,2년 전
TED NAM,"하지만, 산책, 휴식, 자전거 라이딩, 아이와 놀이 등 여가를 즐기려고 나오는 사람들이 많아 사람이 너무많고, 유료 주차장도 있지만 차가 많아 주차도 힘들고 교통체증도 심하다 아이들이 좋아하는 전투함이라서, 내부를 호기심을 가지고 보느라 시간가는줄 모른다 서울함 주변으로 아이들 놀이터와 쉴만한 공간이 많아서 사람들이 많이 찾는다",별표 4개,수정일: 4년 전
다윤서윤 스토리,"텐트 설치 구역이 있어좋아요 망원 시장에 걸어서 가기 좋네요 시장에서 호떡, 닭강정, 치킨, 김밥, 아이스크림마시멜로 맛있게 먹었습니다 아이들 좋아합니다",별표 4개,2년 전
DAEWOO RYU,멋진 야경을 가진 산책코스가 있네요 오랫만에 근처에 망원시장 구경도 하고 붕어빵도 사먹고 식사도 하고 좋은 하루였습니다,별표 5개,2년 전
오영옥,한강변에 앉아서 성산대교나 강을 보는것도 좋고 편의시설이 있으니 먹고 마시고가 즐거운곳이에요,별표 4개,수정일: 1년 전
냥이 사랑,이 시간에 왠 사람들이 이리 많은건지ㅋㅋ 시원한 강 바람이 너무 좋았음 주차비 내려했더니 무료네요 걸으면서 데이트 하기 좋네요 12월 25일 새벽 3시,별표 5개,수정일: 1년 전
James Kang,"먹거리와 커피사서 넓은 한강공원 잔디밭에서 강을 바라보며 여유를 느낄 수 있는 곳 치킨이랑 피자도 시켜먹을 수 있고 편의점에서 라면도 끓여먹고 플로팅 별다방에서 즐거운 시간을 보낼 수 있는 곳 서울함상공원에서 3천톤급 군함과 잠수함을 구경할 수 있는 곳 밤에는 성산대교와 한강에 반사되는 달빛과 불빛이 알흠다운 야경이 있는 곳 주말에 차를 타고 간다면 헬게이트를 열게 될 것이야 갈수록 핫해지는 망원동과 망원시장, 월드컵시장의 수많은 먹거리들",별표 5개,3년 전
Lang Lang,강아지랑 산책하기 좋고 배달음식도 받을수있어서 좋습니다 입구 근처에 편의점2개있어서 편해요,별표 5개,1년 전
김덕진,"나무그늘 밑이 집보다 시원하고 좋아요 자전거 라이딩, 런닝, 산책, 휴식이 공존하는곳 우린 라면먹고 쉬다 갑니다~",별표 5개,11달 전
Stella,"ㅎㅎ 반려견 동반 환경 반려견을 데리고, 산책하기 좋아요 돗자리 깔고, 라면에 맥주 or 배달음식 시켜서 먹어도 좋을거 같아요 편의점에서 맥주한캔씩 마시면서 대화하니 선선하고, 너무 좋았어요",별표 4개,수정일: 1년 전
이순이,"새벽부터 많은 사람들의 발길을 반갑게 맞아주며 싱그러움을 가득안은 아름다움이 강을따라 너무실대다가 밤이되면 또 다른 도시의 모습을 보듬고 드넓은 온 강을 화려하게 수 놓아 일렁이는 물결따라 춤을추듯 반짝이는 불빛들이 어느새 말없이 넉을놓고 조용히 감상에 빠져들게 만드는 마성의 매력이 공존하는 곳입니다 도심 가까이에 숲과 강이 어우러진 휴식공간이 힐링공간이라고 생각됩니다 요즘 멀리가는것도 부담스럽고 소확행, 또는 잔잔한일상만으로 감사함을 느끼게 되는데요 도심 가까이에 이런곳이 있어서 너무 좋고 행복하고 또한 감사하는 마음이 저절로 생깁니다",별표 5개,5년 전
정윤재,음식 배달은 당연히 되면 여의도 한강공원보다 가까운 사람들은 여기를 추천한다 둘 다 똑같이 한강이 아름답다 화장실 공용화장실 있음 반려견 동반 환경 강아지 데려올 수 있음 피크닉 구역 텐트존 따로 있는 걸로 아는데 텐트 핀 사람 많으면 거기다 합정에서 가까운 한강공원 근처에는 음식점 돗자리 원터치 텐트 담요 빌리는 곳이 구비되어 있고 원터치는 2면인가 3면을 열어놔야하고 저녁 7시 이후는 텐트는 접어야한다,별표 5개,1년 전
유민재,5월이라 그런지 날씨도 선선해서 여자친구하고 자전거 타기 너무 좋았다 특히 라면에 맥주가,별표 4개,3년 전
racheal Kim,중간중간 편의점 있어서 필요할 때 이용할 수 있어서 좋구요 마음껏 숨쉴수 있는 곳이라 생각돼요^^ 자전거 타고 가면 바람도 시원하고 좋아요 마음을 가라앉히고 싶을때 가면 좋은것같아요^^,별표 5개,4년 전
이재호,"날도 좋고, 아둘도 좋아하고, 편의점음식도 맛있고 주차비도 나름 저렴하고 다들 행복해 보이네요 ^^ 놀이터 오랜만에 보는 모래(흙) 놀이터",별표 5개,2년 전
딸국티비,"퇴역군함으로 전시된 공간도 매력적이고, 날이 좋아져 잔디밭에 가림텐트로 즐거운 시간 보내는 사람들도 여유로워 보여 좋네요 그런데 몰리는 사람들보다 좁은 주차장은 개선이 조금 필요할 것 같습니다 서울함 공원이 된지 꽤 지났죠",별표 4개,6년 전
YOUNG SEO Kwon,군함 구경하는 곳도 있고 작은 공원도 있고 거닐고 자전거 타고 캠핑할 공간도 있고 너무 좋은 듯,별표 5개,수정일: 2년 전
Mil Lee (이번여름),"접근성이 좋고 주차장이 넓고 가격도 저렴하다 전망좋고 산책하기 좋다 )이 있고, 각종 편의시설이 있다",별표 5개,1년 전
SHIN PD 신피디 (신피디),"북적거리는 지금보다 옛 친구들과 어울리던 공터가 그립지만, 우울할때도 기쁠때에도 변함없이 찾게되는 공원이다",별표 4개,수정일: 1년 전
Younghee Gam,야경이 정말 아름다운 곳이고 날씨가 좋으면 공원에 많은 사람들이 산책도 하고 나들이하는 곳이다 옆에는 서울군함공원도 있다 이곳은 한강의 성수대교가 보이고 한강 수영장이 인접한 곳이다,별표 4개,6년 전
Inseok Kim,자전거 이용이 좀 불편하다는 것 외에는 괜찮은 편입니다,별표 3개,수정일: 1년 전
yunee Jeong,날씨좋은날 너무멋진곳입니다 스타벅스나 편의점라면 또는 다른음식점도 많아요,별표 5개,수정일: 1년 전
이도윤,그래도 가격대비 맛과 양 괜찮았음 ㅋ고기와 부추무침 무말랭이 이렇게 나왔다 맛도 괜찮은듯 아구찜은 시간이 걸리는듯 수육부터 나왔는데,별표 3개,6년 전
매력,잠깐 들린거라 편의점에서 한강라면 먹으면서 대화한게 전부지만 돗자리 펴고 도란도란 얘기하다가 책도 읽고 배고파지면 편의점에서 한강라면 먹고 치킨 시켜서 맥주 한잔해도 좋을거 같아요,별표 5개,1년 전
Dowon Yoon,월드컵공원에 주차하고 자전거 빌려서 너무어가면 딱임 공원자체는 월드컵공원이 더 쉬기 좋음 햇살 좋은날 자전거타기 제격인곳,별표 4개,2년 전
SeongKee Moon,"주차, 식사, 끽다, 산책 등 다양한 여가 활동이 가능한 시민공원",별표 5개,1년 전
HAKSOO HAN,"그래도 들어오기 전 캠핑 장비도 대여할 수 있고, 날씨가 오늘처럼 좋은 날, 즐겁게 피크닉을 즐길 수 있어요~",별표 3개,5년 전
삼순이,해지면 옆 잠두봉선착장에서 고기구워 먹기도 하고 서울이 좋아질때네요,별표 5개,4년 전
강한민,이곳은 주변에 망원공원 월드컵 상암공원 하늘공원 노을공원등 여러개 잊어서 다양하게즐길수 있씀니다,별표 5개,수정일: 2년 전
Yongcia (Summer Dragon),"한강변 자전거도로와 산책로가 잘 되어 있어서 주간이나 야간에 다니기가 편하고 휴게소가 있어서 물과 라면, 간식 하기가 너무좋습니다",별표 4개,5년 전
김기수,산책로도 잘 되어 있고 주차장 바로 옆에 시설좋은 아이들 놀이터고 있어서 아이들과 함께 하기도 좋은 곳 서울함 공원과스타벅스가 있어서 조용히 시간 보내기 좋다,별표 5개,3년 전
Changhan Lee,근처 마을버스 정류장도 있어 접근성도 좋아요 날씨가 화창하고 선선한 바람이 부는 날에 커피 한 잔 걸치며 산책하기 좋아요,별표 5개,1년 전
행운의귀똘이,조용조용 이어폰으로 음악 준비해오세요 멀리 sunset구경 갈 필요없어요,별표 5개,1년 전
BH J (Zivel),2021년 12월 현재 기존의 편의점업체(711)가 모두 폐점 후 빠졌고 별도의 부유시설을 갖춰서 이마트24를 위시한 SSG 계통 점포들로 채워져 있습니다 특히 라면같은경우엔 인덕션 조리용기와 기계이용료까지 포함된 가격(평균 2500원)이기 때문에 주의를 요합니다 서울 서북부 지역 한강공원중엔 제일 인지도가 높은 곳입니다,별표 4개,3년 전
vavi Lee,마린복도 착한가격에 모자까지 3천원대여해서 입고 체험해볼수있어서 너무 좋았죠~시간맞춰 가면 야전식량도 먹어볼수 있어요~여러번 둘러볼수있고 바로 앞에 폭신한잔디와 나무그늘밑에 돗자리하나면 이 보다 좋은 휴식은 없을듯해요 장교가 꿈인 아이를 데리고 한번쯤을 가보면 좋을듯해요 서울함에 있는 잠수정까지 대령으로 퇴역하신분의 훌륭한 도슨트~ 자세한 설명과 체험가짓수가 많아서 넉넉히 시간을 갖고 미리 둘러보고 들으면 머리에 쏙쏙들어오는 해설,별표 5개,5년 전
매젠틀,한강유원지가 여러곳에있지만 상암동 월드컵공원과연결되어 접근하기도쉽고 넓은잔디공원 체육시설과 공연장과 캠핑장은 너무좋아요,별표 5개,5년 전
EDWARD HWANG,"한강공원 까지 쾌적한 산책길과, 행복한 휴식을 취할수 있는곳 꾸준히 걷거나 뛰다보면 건강이 아주 좋아집니다",별표 4개,수정일: 2년 전
아라,스타벅스에서 커피마시고 공원도 산책하고 좋았어요 ^^,별표 5개,1년 전
trip camper78 (Riu J),강아지들하고 산책하기 너무좋아요,별표 5개,3년 전
KIUP KWON,아이들이 엄청 좋아합니다^^ 입장료 싸고 유치원 무료 수도권에선 강력추천합니다~학교나 유치원 모두 가성비 최고인듯,별표 5개,6년 전
이세정,걷기 좋고 자전거 타기 좋은 곳 하늘이 아름답고 휴식공간이나 운동기구들이 잘 되어있다 나무들도많아서 소풍하기딱 좋은곳,별표 5개,5년 전
루잔,제가 가본 한강공원은 여러곳이지만 망원 한강공원은 사람들도 많지않고 그냥 여유롭게 산책하기 좋았어요,별표 5개,5년 전
JIN',아주좋아요♡ 오늘은 사람이 많이없어서 편하게 잘쉬다가왔네요 더불어 하트모양 해까지,별표 5개,4년 전
김동석,도심 한가운데 이런 시설 조성이 되어있다는건 큰 장점,별표 5개,4년 전
예온,날씨 끝내줄 때 꼭 가세요 카페 peak 옆에 대여점에서 텐트랑 이것저것 대여해서 갔습니다 화장실도 깨끗하고 편의점도 가깝고 너무 좋아요,별표 5개,2년 전
김가은,오오랜만에 만난 친구들이랑 간 망원한강공원ㅋㅋ코로나 따위는 무섭지 않다 마스크 항상 꼈으니까ㅋㅋ 망원역에서 걸어간다면 걷다가 굴다리를 지나 한강이 보이면 매점옆 화장실 뒤에 사람들 많이 앉아있는데 있는데 거기 자리는 솔직히 좋지않다 까치인지 까마귀인지 하여튼 새가 나무위에 앉아서 응아도 싸고 음식을 노린다ㄷㄷ 그래서 우리는 무슨 함장모형과 농구장 옆에 있는 갈색빛 잔디밭으로 자리를 옮겼는데 거기가 완전 좋다 강바람도 솔솔 불고 햇살도 잘들었다ㅋㅋ 흑흑 얼마만의 피크닉이여ㅠㅠ 또 가서 치킨과 피자와 라면과 과자를 먹고싶다 진짜 맛있게 잘먹을 자신있다ㅋㅋ,별표 4개,5년 전
여행자Dewey,"날씨가 좋을때 더 좋은 장소 운동하는 사람, 산책하는 사람 많음 가서 한강도 구경하고 한낮의 휴식을 만끽하시길",별표 5개,4년 전
David Kim,현재는 공사중이라 막힌곳이 많지만 그래도 저녁에 운동하며 여유를 즐기기엔 좋습니다,별표 4개,1년 전
regi Kim,집에서 한강공원까지 걸어서 한시간 살이 너무쪄서 걷기 시작 사람들이 그리 많은지 몰랐어요 5kg 감량을 위해,별표 5개,2년 전
SAN_GOK,사람은 좀 많지만 해질녘 뷰가 너무 좋은 곳,별표 5개,1년 전
LUCIA KIM,스타벅스때문에 갔다가 앉을 자리가 없어 그냥 한바퀴 돌다 왔는데 좋았다 날씨가 좋은게 한몫했다,별표 5개,2년 전
Hyun Chul Kim,연세 있으신 어르신들이 꽤 많이 오셔서 공원이 반반으로 나뉘어 가족/커플 존과 어르신 존으로 나뉘는것 같습니다 공연장이 공원 내에 있는데 코로나 때문에 조용했다가 얼마 전부터 주말마다 트로트 공연을 하네요 망원시장이 가깝고 군함도 볼수 있어 좋네요,별표 5개,2년 전
Insang Kauh,그리고 이 위치에서 보는 한강은 더 웅장하고 아름답습니다,별표 5개,1년 전
풍류남아,여느 한강공원중 깨끗하게 유지 관리가 되는거같다 아이들도 모래놀이터가 있어서 좋아한다 주차장 차는 많지만 질서는 잘지키는편,별표 4개,2년 전
Lion Daddy,^_^ 단 장비는 본인이 가지고 지참하고 한강시설공사홈페이지에서 예약한 후에 사용가능합니다 아이들과 즐거운 야구연습을 할 수 있었네요,별표 5개,6년 전
소소한한라봉 (소소),한강공원에서 앉아서 치맥이 버킷이었는데 분위기 좋았어요 기분도 좋고 즐겁고 시간가는지 몰랐어요,별표 5개,4년 전
ddolai97,대한민국이 정말 살기 좋은 곳이야 돈만 있으면ㅋ,별표 5개,9달 전
정Sue,주문처리속도가ㅠ 화장실뷰가 좋음,별표 4개,3년 전
김용길,운동하기에 너무최적의장소이기에추천합니다 경치가 짱이예요~매일매일이 새로운 느낌을주는망원한강공원에서 건강한몸으로 즐거운 생활 누리세요~^^,별표 5개,수정일: 3년 전
백희정,"늦겍까지 돗자리 피고 쉬기 좋습니다 함께 나들이 하기 좋은 장소입니다 저녁 가족들과, 친구와",별표 5개,2년 전
박정은,추석 다음날이라 한강시민공원 주차는 무료였습니다 날씨가 흐린 날은 햇빛으로 인한 눈뽕은 없어 좋네요 한강뷰는 날씨에 영향을 많이 받을 듯,별표 5개,2년 전
몽이맘,시원한강바람~ 요즘 즐겨찾는 핫한곳ㅎ 잔디에 앉아서 음악도듣고 휴식하기좋은곳♡,별표 5개,5년 전
김승현 (SeuKim),망원한강공원 산책하기 좋으네요 2023년10월14일,별표 5개,1년 전
Richard Kim,"망원유수지공원은 주변 여타 한강공원보다 인프라가 발전되어있고 경관도 수려하며 양화,성산대교 야경과 산책로또한 너무좋습니다",별표 5개,2년 전
Ghost Leon,자전거 시즌이 시작되어 늘어나는 라이더들과 따릉이나 킥보드 데이트족들 ㅎㅎ 역시 망원한강공원만의 운치~,별표 5개,4년 전
MARA LEE,스타벅스도 생기고 밑에 이마트편의점도 생겨서 좋아요 근데 스벅이 너무일찍닫네요ㅋ 겨울에 편의점 밖에 앉아있기는 추운데 ㄷㄷ,별표 4개,3년 전
레오,그리고 편의점 라면 최고였습니다,별표 5개,2년 전
Stan,날씨 좋은날 자전거 타고 쏘기에 참 좋아요,별표 5개,6년 전
이순이,야경 사진이라도 같이 보시고 우리모두 화이팅해요 ^^ 집 근처라 잠시 운동 나왔다가 사진올립니다,별표 5개,수정일: 5년 전
황종각,숲과강이 어울어지는 한강공원 잠시 피곤한 몸을 위로받는 휴식 공간이네 요 낮에나 밤에나 이른 새벽에도 많은 사람들이 거니는 모습이 너무너무 좋아요,별표 4개,4년 전
Being Bright,"탁 트여서 너무 마음이 힐링이 되고 산책도 하기 좋고, 운동장도 있어서 축구나 농구, 배드민턴 등 다양한 활동을 할 수 있습니다 서울함 박물관도 있고 강이랑 맞닿아있는 곳에서 앉아서 다리 보는 것도 힐링됩니다",별표 5개,5년 전
Sunny kim,갠적으로 망원한강공원보다는 난지한강공원이 좀 더 여유있고 좋았습니다 망원한강공원에서 난지한강공원과 여의도쪽으로 자전거 탔는데요,별표 5개,1년 전
백승지,가족 단위로 텐트치고 노시는 분들이 많았는데 그런 식으로 노시면 좋을거 같긴해요 휴일에 가서 그런지 사람도 엄청 많았고 강아지들도 엄청 많았어요 하지만 다음엔 다른 한강공원으로 갈거 같습니다 다른 한강공원들과 비교해 엄청 작더라고요,별표 3개,6년 전
김나현,"사람 완전 많고 분위기 좋아요 저녁때 바람불어서 쌀쌀해서 가벼운 담요, 바람막이외투 필요해용",별표 4개,3년 전
한주영,군함 시설도 잘되어있고 자리 펴고 쉴수 있는 공간이 많아서 아이와 같이 가기 너무 좋았어여~,별표 5개,4년 전
배상길,퍼온 사진이지만 너무좋아서 올려봅니다 우리나라에 밤야경이 좋을줄은,별표 5개,5년 전
youngcheor kim,5월에 한강공원 은 환상적인 야경과 시원한바람 가까운 최고의 힐링 장소,별표 4개,3년 전
카약오딧세이KAYAK ODYSSEY,카약 과 캠핑의 서울 놀이터,별표 4개,5년 전
김현식,여기 한강공원중 강추요 한적하니 아주 뷰도 좋구망원시장 장보구 먹방찍으러 오기좋습니다^^,별표 5개,7년 전
jisoo kim,여의도만큼 넓진 않지만 망원만의 감성이 있음 집에서 가까운 곳이라 런닝하러 자주 가는데 너무너무 좋고 낭만있는 곳 치킨도 쉽게 가까운 곳에서 시켜먹을 수 있다,별표 5개,1년 전
박주호,요트가 있고 맛있는 음식점이있는 아름다운곳,별표 5개,1년 전
받아받아,한강에 운동하기도 좋고 편의점도 잘 되어있어서 라면은 필수 코스입니다 ㅎ ㅎㅎ,별표 5개,1년 전
홍동철 (troitroi),탁트인 한강공원과 한강야경이 멋진 스타벅스까지 주말은 사람구경 평일은 경치구경 에너지 충전하기 좋은 곳 걷기도 자전거타기도 좋음,별표 5개,3년 전
감성카르텔 (감성카르텔),야경이 죽이는 한강라면 순삭맛있게먹었어요 분위기좋음,별표 5개,수정일: 1년 전
JONGHO KIM,"야경이 아주 멋있고, 군함도 볼 수 있어 좋았어요",별표 5개,3년 전
Momo Mo,주차장 요금도 저렴한 편이어서 2시간 너무게 있었을때 2천원 정도 나왔다 적당한 거리에 한강편의점이 위치하고 많은 사람들이 강가에 모여 앉아 봄밤을 즐기는 모습을 볼 수 있다 5월에 딱 걷기 좋다,별표 5개,6년 전
PAUL SHIN,강변북로를 따라 마포구에서 조성한 한강변길은 최근 몇년사이 나무숲으로 변했다 주변의 아름다운꽃과 잔디를 보면 더없이 상쾌한데 여의도쪽에 있는 국회 의사당만 보면 짜증난다,별표 5개,4년 전
Changho lee,배타는곳 풀밭위에서 자리 펴고 여유를 가질 수 있어 좋았다,별표 5개,3달 전
Hyundae Jo,자리 하나 들고가서 나무 아래 잔듸밭에 깔고 책 보다가 멍 때리다가 산책 좀 하다가 음악도 듣기에 너무 좋은 곳 주말에는 사람들이 많으니 그늘에 자리잡으려면 일찍 가시기를 그늘막 텐트는 5월에서 10 월까지 아침 9시부터 저녁 7시까지 설치할 수 있어요,별표 4개,5년 전
정봉재,자전거 도로와 자전거 대여소가 있고 편의점에서 텐트도 대여를 해주더군요,별표 3개,4년 전
Jinny Jinny K,예쁜 강물과 다리가 있는 뷰가 멋진 망원지구 배도 멋지고 ᆢ,별표 5개,5년 전
임성빈,공원에 앉아서 저녁해지는 풍경은 정말 아름다워요,별표 5개,1년 전
ᆞ꼬꼬마초,"귀여운강아지들도볼수있고 한국에서 외국같은 여유로움느끼고갑니다 젊고예쁜대학생들이 즐겁게이야기하는소리, 오랜만에만난동창들과 대화하는소리 그사이에서 즐거웠어요 다음에또오려구요 텐트나돗자리빌리는곳도많고 예약하는게꿀이득입니다 밤되면전구있는게 분위기쩔어요 쓰레기는 꼭챙깁시다",별표 5개,5년 전
Min,편의점라면도 먹고 오리배도 타고 아주 즐거운경험이였습니다,별표 5개,2년 전
jung-in Andrea kang,날씨 좋을 때 가면 좋아요 한강 라면 짱,별표 4개,4년 전
에보루스터,경치좋고 이용시설 많고,별표 5개,1년 전
육효진 (May),애완토끼가 망원 한강공원에 출몰,별표 5개,6년 전
염경수,"뷰가 좋지만, 뭔가 새로운 생각을 해야겠다는 다짐이 생길때 가보면, 다리의 불빛이나 가끔 노을등 변화가 좋음",별표 4개,3년 전
맛집탐방가은설푸디 (리얼먹방),오랜만에 다녀왔고 힐링하러 다녀왔는데~너무 좋았습니다,별표 5개,2년 전
유연,망원한강공원 입구에 텐트 설치 가능한 구역이라 놀기에 너무 좋다 저녁에 사람도 많고 선선하니 지금 즐기기에 가장 좋음 2022년에도 좋음,별표 5개,수정일: 3년 전
안Somi,날씨 좋은 날 제대로 놀고 갑니다 남녀노소 다양한 세대가 함께하는 공원이에요,별표 5개,2년 전
Ryan Shin,"석양이 아름답고 전망이 좋은 곳이며, 운동하기 딱 좋은 곳이죠 먼저 집과 가깝고 주로 강아지 산책을 하는 곳",별표 5개,4년 전
DJ맘,화장실도 나름 깨끗합니다~ 화장실 깨끗해요 더워서 사람은 많지 않아요~ 편의점은 시원하니 좋습니다~ 안에서 음료한잔하시고 더위식히세요,별표 5개,2년 전
박종채,어제도 산책갔다 산수유와 매화가 꽃을 피기 시작하여 사진 몇장 남깁니다^^ 이제 봄이 와군요^^ 집에서 산책하로 자주 가는 공원입니다,별표 5개,3년 전
허진하,강바람이 시원하고 한강의 뷰가 해질 저녁노을 부터 야경이 아주 멋지다,별표 5개,3년 전
강강민지,밤에 오니 야경도 예쁘고~ 편의점 라면도 너무좋아용 ㅋ너무추워서 한강이 얼었네요,별표 5개,2년 전
Daehyun Kim,날씨도 무척좋고 사람들도 많고 산책하기 너무 좋습니다,별표 5개,6년 전
MIEKO MATSUI,자전거 타기 좋은 곳 운동하면서 마음이 평안해져요^^,별표 5개,4년 전
